,url,price,title,distance,description,location,time_offset,retreived
1513131778,/v-printers-scanners-fax/city-of-toronto/hp-photosmart-a310-compact-photo-printer/1513131778,50.0,HP Photosmart A310 Compact Photo Printer,,Brand new compact photo printer in original sealed packaging. Print 4x6 photos without PC computer. Print from any pick- bridge enabled camera. Automatic red eye removal. Includes sealed ink ...,City of Toronto,13/09/2020,2020-10-06 12:28:39.392201
1513133756,/v-printers-scanners-fax/city-of-toronto/canon-selphy-cp-730-cp720-compact-photo-printer/1513133756,50.0,Canon Selphy CP 730/CP720 Compact Photo Printer,,Compact photo printer which can print from a memory stick or an SD memory card or compact flash card. Alternatively can connect to canon digital camera that has a Print/Share button. Can include ...,City of Toronto,13/09/2020,2020-10-06 12:28:39.392779
1513011561,/v-printers-scanners-fax/city-of-toronto/hp-printer-scanner-psc1510-all-in-one/1513011561,10.0,"HP printer, scanner PSC1510 ALL IN ONE",,"HP SCANNER, IN GOOD CONDITION PSC1510 ALL IN ONE ASK FOR $10 TEXT ME",City of Toronto,12/09/2020,2020-10-06 12:28:39.393833
1523688590,/v-printers-scanners-fax/city-of-toronto/canon-mx-printer-ink/1523688590,10.0,CANON MX PRINTER INK,,226 BK 226 Y 226 M 221 BK 221 Y ALL BRAND NEW IN PACKAGE,City of Toronto,12/09/2020,2020-10-06 12:28:39.394334
1523681017,/v-printers-scanners-fax/city-of-toronto/hp-45-black-ink-cartridge-retails-for-78-99/1523681017,40.0,HP 45 Black Ink Cartridge Retails for $78.99,,"New, Box Opened Colour: Black Cartridge yield (approx.): 930 pages HP Printer compatibility: HP Deskjet 1000, 1120, 1600, 815, 830, 832, 855, 9300, 930, 932, 960, 980. HP Officejet g55, g85, k80. HP ...",City of Toronto,12/09/2020,2020-10-06 12:28:39.394847
1507995261,/v-printers-scanners-fax/city-of-toronto/brother-printer-mfc-j650dw-not-working/1507995261,25.0,Brother printer MFC-J650DW (NOT WORKING),,Brother printer MFC-J650DW (NOT WORKING) Printer doesn't power on. New ink cartridges. For parts or repair. PICKUP ONLY,City of Toronto,12/09/2020,2020-10-06 12:28:39.395342
1513014141,/v-printers-scanners-fax/city-of-toronto/brother-lc-101-printer-ink-carriage/1513014141,45.0,Brother LC 101 printer ink carriage,,Yellow / black/ magenta Pick up only at Broadview & Gerrard Cash only If you see this ad. Its available,City of Toronto,12/09/2020,2020-10-06 12:28:39.395845
1523648996,/v-printers-scanners-fax/city-of-toronto/original-hp-122a-toner-cartridge-black/1523648996,60.0,Original HP 122A Toner Cartridge - Black,,OEM HP Toner - 122A Black Q3960A Only $60,City of Toronto,12/09/2020,2020-10-06 12:28:39.396343
1523648301,/v-printers-scanners-fax/city-of-toronto/original-hp-24x-high-yield-toner-cartridge/1523648301,60.0,Original HP 24X high yield toner Cartridge,,OEM 24X Toner for HP 1150 printer Q2624X - high yield Only $60,City of Toronto,12/09/2020,2020-10-06 12:28:39.396843
1523647449,/v-printers-scanners-fax/city-of-toronto/original-hp-toner-cartridge-12a/1523647449,60.0,Original HP Toner Cartridge - 12A,,OEM Laser Toner Cartridge Black - 12A - Q2612A Staples - $120 Selling - $60 Half price,City of Toronto,12/09/2020,2020-10-06 12:28:39.397341
1523645853,/v-printers-scanners-fax/city-of-toronto/samsung-laser-printer-scanner-fax/1523645853,99.0,"Samsung Laser Printer, Scanner & Fax",,Very good quality flat bed laser printer Must go Best offer will be considered,City of Toronto,12/09/2020,2020-10-06 12:28:39.397858
1523645415,/v-printers-scanners-fax/city-of-toronto/toner-cartridge-for-laserjet-1300-q2613a/1523645415,20.0,Toner cartridge for LaserJet 1300(Q2613A),,"Toner cartridge for LaserJet 1300(Q2613A). New, sealed, never open. $20.00 firm.",City of Toronto,12/09/2020,2020-10-06 12:28:39.398395
1523644965,/v-printers-scanners-fax/city-of-toronto/okipage-16n-ol-1200-genuine-black-toner-cartridge-kit/1523644965,20.0,OKIPAGE 16n/OL 1200 GENUINE BLACK TONER CARTRIDGE KIT,,OKIPAGE 16n/OL 1200 GENUINE BLACK TONER CARTRIDGE KIT 52109201.,City of Toronto,12/09/2020,2020-10-06 12:28:39.398910
1523644536,/v-printers-scanners-fax/city-of-toronto/ol-1200-okipage-16-series-genuine-black-image-drum-kit/1523644536,50.0,OL 1200 & OKIPAGE 16 Series GENUINE BLACK IMAGE DRUM KIT,,"New, OL 1200 & OKIPAGE 16 Series GENUINE BLACK IMAGE DRUM KIT(56118801, Type 4).",City of Toronto,12/09/2020,2020-10-06 12:28:39.399401
1523643451,/v-printers-scanners-fax/city-of-toronto/canon-printer-pixma-tr7520-wireless-home-office-all-in-one/1523643451,50.0,Canon Printer - PIXMA TR7520 Wireless Home Office All-In-One,,"Regular prices $199.99 Wireless Inkjet All-In-One home printer - Includes remaining black and colour ink (black over half full) -Up to 4800 x 1200 dpi -Black: Approx. 15.0 ipm, Colour: Approx. 10.0 ...",City of Toronto,12/09/2020,2020-10-06 12:28:39.399892
1523640051,/v-printers-scanners-fax/city-of-toronto/fuser-film-sleeve-hp-laserjet-1000-1200-1300-3020-3300-etc/1523640051,5.0,"Fuser Film Sleeve HP LaserJet 1000, 1200 1300, 3020, 3300, etc.",,"Compatibility: HP LaserJet 1000, 1010, 1012, 1015, 1020, 1050, 1022, 1150, 1160, 1200, 1220, 1300, 1320, 3015, 3020, 3030, 3050, 3300, 3330. Part Number: RG9-1493 $5.00/ea.",City of Toronto,12/09/2020,2020-10-06 12:28:39.400383
1523639565,/v-printers-scanners-fax/city-of-toronto/toner-cartridge-for-laserjet-series-lllsi-4si-4simx-printers/1523639565,20.0,"Toner Cartridge for LaserJet Series lllSi, 4Si & 4SiMx Printers",,"Toner Cartridge for LaserJet Series lllSi, 4Si & 4SiMx Printers. HP P/N 92291A $20.00",City of Toronto,12/09/2020,2020-10-06 12:28:39.401302
1523639137,/v-printers-scanners-fax/city-of-toronto/lexmark-optra-c710-print-ctridge-black/1523639137,30.0,Lexmark Optra C710 Print Ctridge(black),,NEW Lexmark Optra C710 Print Cartridge(black) $30.00,City of Toronto,12/09/2020,2020-10-06 12:28:39.401836
1523636576,/v-printers-scanners-fax/city-of-toronto/toner-cartridge-for-laserjet-1320-etc/1523636576,20.0,Toner Cartridge for LaserJet 1320 & etc.,,New sealed and never open Toner Cartridge Q5949(49A)/Q7553A(53A) for : LaserJet 1160 LaserJet 1320 LaserJet 3390 LaserJet 3392 LaserJet M2727 mfp LaserJet P2014 LaserJet P2015,City of Toronto,12/09/2020,2020-10-06 12:28:39.402339
1523618541,/v-printers-scanners-fax/city-of-toronto/brother-mfc-495cw-colour-inkjet-printer/1523618541,50.0,Brother MFC 495CW Colour Inkjet Printer,,"Cones with: Cable, CD, Manual Location: Scarborough",City of Toronto,12/09/2020,2020-10-06 12:28:39.402841
1453719697,/v-printers-scanners-fax/city-of-toronto/epson-t664120-t664220-t664320-t664420-compatible-ink-bottle/1453719697,5.0,"Epson T664120, T664220, T664320, T664420, Compatible Ink Bottle",,"Epson T664120, T664220, T664320, T664420, Compatible Ink Bottle , price is $5.00/70ml/each bottle/each color. 1L(1000ml), price is $45.00/each bottle/each color Compatible Printer: Epson WorkForce ...",City of Toronto,12/09/2020,2020-10-06 12:28:39.403332
1523607223,/v-printers-scanners-fax/city-of-toronto/epson-model-m129h-tm-t88iv-thermal-printer/1523607223,120.0,Epson Model M129H/TM-T88IV THERMAL Printer,,"6 x Epson Model M129H / TM-T88IV THERMAL Printer USED $120 EACH or best offer Pickup only near Royal York & Queensway Etobicoke, ON M8Y 1E8",City of Toronto,12/09/2020,2020-10-06 12:28:41.598478
1523605826,/v-printers-scanners-fax/city-of-toronto/epson-m188b-tm-u220b-impact-printer/1523605826,150.0,Epson M188B/TM-U220B Impact Printer,,"3 x Epson M188B / TM-U220B IMPACT Printer $150 EACH or best offer Pickup only near Royal York & Queensway Etobicoke, ON M8Y 1E8",City of Toronto,12/09/2020,2020-10-06 12:28:41.598998
1314245632,/v-printers-scanners-fax/city-of-toronto/canon-selphy-cp720-compact-photo-printer/1314245632,85.0,Canon Selphy CP720 Compact Photo Printer,,"Canon Selphy CP720 Compact Photo Printer, New in Box With All Accessories--- $85, Dye-Sublimation Thermal Print Method With Protective Overcoating, Create Lab-Quality 4""X6"" Photos That Last Up to 100 ...",City of Toronto,12/09/2020,2020-10-06 12:28:41.599520
1523590910,/v-printers-scanners-fax/city-of-toronto/kodak-canon-inkjet-photo-paper/1523590910,2.5,Kodak Canon Inkjet Photo Paper,,"Kodak Premium Unopened 50 Pack, 8.5"" x 11"". Compatible with all inkjet style printers - $25 Canon Photo Paper Plus Glossy II, 2 packs, 4"" x 6"". Over 100 sheets - $2.50 each.",City of Toronto,12/09/2020,2020-10-06 12:28:41.600014
1523582764,/v-printers-scanners-fax/city-of-toronto/portable-color-scanner-epson-ds30/1523582764,30.0,PORTABLE COLOR SCANNER - EPSON DS30,,"https://epson.ca/For-Home/Scanners/Document-Scanners/Epson-WorkForce-DS-30-Colour-Portable-Scanner/p/B11B206201 Scan, save and send important data wherever your business takes you with the WorkForce ...",City of Toronto,12/09/2020,2020-10-06 12:28:41.600509
1512705632,/v-printers-scanners-fax/city-of-toronto/epson-stylus-nx430-wireless-allinone-colorinkjet-printer-copier/1512705632,70.0,"Epson Stylus NX430 Wireless AllInOne ColorInkjet Printer, Copier",,"Epson Stylus NX430 Wireless All-in-One Color Inkjet Printer, Copier, Scanner. In like-new condition. Just out of ink. Pick up - High Park. - Small-in-One - space-saving design, great performance, ...",City of Toronto,12/09/2020,2020-10-06 12:28:41.601160
1512943523,/v-printers-scanners-fax/city-of-toronto/scanner-canon-pixma-mg2220/1512943523,9.0,Scanner Canon Pixma MG2220,,"Complimentary cables, completed with original CD driver and manuals. P.S. It's last job included printing, but now it won't roll paper in.",City of Toronto,12/09/2020,2020-10-06 12:28:41.601964
1523546303,/v-printers-scanners-fax/city-of-toronto/printer/1523546303,30.0,Printer!,,"It worked last time I used it, a year or two ago. With colour ink cartridges that should still be good. Pick up today only",City of Toronto,12/09/2020,2020-10-06 12:28:41.602478
1523515251,/v-printers-scanners-fax/city-of-toronto/lexmark-e210-printer/1523515251,40.0,Lexmark E210 Printer,,"Manual, installation CD are included",City of Toronto,12/09/2020,2020-10-06 12:28:41.603001
1523493917,/v-printers-scanners-fax/city-of-toronto/ricoh-fax-printer/1523493917,300.0,RICOH Fax Printer,,"Selling a good condition RICOH Fax Printer, model 5510L, with a rolling cabinet. Asking $300.",City of Toronto,12/09/2020,2020-10-06 12:28:41.603697
1512962773,/v-printers-scanners-fax/city-of-toronto/samsung-multifunction-wifi-printer-copier-scanner-fax-negotiabl/1512962773,195.0,"Samsung Multifunction wifi printer,copier, Scanner,Fax,negotiabl",,"Negotiable, Samsung Multifunction Xpress printer, copier, Scanner and Fax, Mono Laser Multifunction, with new Toner . Used few times , the top cover hinges are broken but everything else are in ...",City of Toronto,11/09/2020,2020-10-06 12:28:41.604402
1442634111,/v-printers-scanners-fax/city-of-toronto/deskjet-d4360-printer/1442634111,100.0,Deskjet D4360 Printer,,Like NEW! Never opened. Kept in the box.,City of Toronto,11/09/2020,2020-10-06 12:28:41.605051
1502592971,/v-printers-scanners-fax/city-of-toronto/lexmark-x4690-all-in-one-printer/1502592971,10.0,Lexmark X4690 All-in-One Printer,,YOU BUY USED PRINTER Cartridges for Lexmark X4690 Printer BUT NO INK IF YOU BUY PLEASE BUY INK MY PRINTER OLD BUT WORK 100% OLD PRINTER BUT GOOD Lexmark 4 18C1974 Black and Lexmark 5 18C1960 ...,City of Toronto,11/09/2020,2020-10-06 12:28:41.605711
1485108149,/v-printers-scanners-fax/city-of-toronto/hp-deskjet-2600-all-in-one-printer-series/1485108149,15.0,HP DeskJet 2600 All-in-One Printer series,,YOU BUY USED HP DeskJet 2600 All-in-One Printer series IN VERY GOOD WORK CONDITION YOU BUY PRINTER ALONE NO INK I BUY MY PRINTER IN 2018 BEFORE BOXDAY BUT NOW I NEED BUY INK GOING COST ME BLACK IN ...,City of Toronto,11/09/2020,2020-10-06 12:28:41.606312
1523427394,/v-printers-scanners-fax/city-of-toronto/brother-tn-223bk-toner-cartridge-black/1523427394,50.0,Brother TN-223BK Toner Cartridge - Black,,Brand new Brother TN-223BK black toner cartridge Purchased wrong model of toner and was unable to return Will let go for $50 $90 original retail,City of Toronto,11/09/2020,2020-10-06 12:28:41.607041
1523424208,/v-printers-scanners-fax/city-of-toronto/oki-c110-laser-colour-printer-new-sealed/1523424208,175.0,OKI C110 LASER COLOUR PRINTER - NEW/SEALED,,new in factory sealed box pickup in the Weston and Lawrence area (see map),City of Toronto,11/09/2020,2020-10-06 12:28:41.607540
1523415900,/v-printers-scanners-fax/city-of-toronto/canon-ink-cartridges-cli-221-black-7-yellow-1/1523415900,7.0,Canon Ink Cartridges CLI -221  Black -7 Yellow -1,,7 Black ink printer cartridges CLI-221 for Cannon printer 1 Yellow CLI-221 ink cartridge Brand new still in cellophane wrapping Had to buy a new printer and these don't fit. Over $20 each at staples. ...,City of Toronto,11/09/2020,2020-10-06 12:28:41.608073
1523404978,/v-printers-scanners-fax/city-of-toronto/office-printer-kyocera/1523404978,450.0,Office Printer Kyocera,,"In perfectly fine working condition. We don't print as much as we used to and we replaced this printer with smaller one. This printer prints both regular and legal size, scans, internet connection, ...",City of Toronto,11/09/2020,2020-10-06 12:28:41.608570
1402164834,/v-printers-scanners-fax/city-of-toronto/laser-printer-toner-cartridge-104-128-137-tn660/1402164834,14.98,Laser Printer Toner Cartridge 104 128 137 TN660,,Black Laser Toner Cartridge for sale Canon104 128 Brother TN660 $14.98 Tel: 416-871-8336 Web: A-32.COM,City of Toronto,11/09/2020,2020-10-06 12:28:41.609060
1475593839,/v-printers-scanners-fax/city-of-toronto/samsung-printer-toner-cartridge-d101s-d104s-d111s-d103l-d119s/1475593839,19.98,Samsung Printer Toner Cartridge D101S D104S D111S D103L D119S,,"Black Laser Toner Cartridge for sale Samsung MLT-D101S, MLT-D104S, MLT-D111S, MLT-D119S, MLT-D103L HP-CE505A, Brother TN760 $19.99 & up Tel: 416-871-8336 Web: A-32.COM",City of Toronto,11/09/2020,2020-10-06 12:28:41.609552
1523365340,/v-printers-scanners-fax/city-of-toronto/epson-stylus-photo-r3000-with-photo-paper-ink/1523365340,380.0,Epson Stylus Photo R3000. With Photo Paper & Ink!,,Brand new. Bought then never used. Moving so need to sell. I will also include photo paper (2pk) and ink (7 types). Accepting best offer.,City of Toronto,11/09/2020,2020-10-06 12:28:41.610045
1523357265,/v-printers-scanners-fax/city-of-toronto/cannon-imageclass-mf4770n-black-and-white-printer/1523357265,90.0,Cannon ImageCLASS MF4770N black and white printer,,"Hello, I am selling my Cannon ImageCLASS MF4770N black and white laser printer, all-in-one, copy, print scan and fax. It works well. but I don't know how much toner left, please contact me if you are ...",City of Toronto,11/09/2020,2020-10-06 12:28:41.610537
1523322843,/v-printers-scanners-fax/city-of-toronto/laser-printer/1523322843,75.0,Laser printer,,Brother all in one,City of Toronto,11/09/2020,2020-10-06 12:28:41.611041
1523305856,/v-printers-scanners-fax/city-of-toronto/epson-stylus-nx420/1523305856,60.0,Epson Stylus NX420,,- Comes with cartridge and ink set - Good working condition - Easy to store- great for WFH,City of Toronto,10/09/2020,2020-10-06 12:28:41.611534
1512079663,/v-printers-scanners-fax/city-of-toronto/5-remanufactured-288xl-ink-cartridge-compatible-for-use-in-epson/1512079663,30.0,5 Remanufactured 288XL Ink Cartridge Compatible for use in Epson,,"Brand New. sealed. Compatible for use in Epson Expression Home XP-330, XP-340, XP-430 XP-440 XP-434 XP-446 Printers (5 Black) Contents: Remanufactured ink cartridge replacements for T288XL High ...",City of Toronto,10/09/2020,2020-10-06 12:28:41.612055
1494168538,/v-printers-scanners-fax/city-of-toronto/all-in-one-printer-scanner-fax-brother-mfc-295cn/1494168538,95.0,All-In-One Printer/Scanner/Fax - Brother MFC-295CN,,This item is used but tested and in working condition. Thanks for visiting and if you have time please check out many more items I have listed here!,City of Toronto,10/09/2020,2020-10-06 12:28:41.612551
1273218791,/v-printers-scanners-fax/city-of-toronto/compatible-for:-hp-ce278a-ce285a-cf283a-cb435a-cb436a-cf279a/1273218791,14.0,"Compatible for: HP CE278A, CE285A,CF283A,CB435A,CB436A,CF279A",,Compatible for HP CE278A $14 each CE285A $14 each CF283A $14 each Q2612A $14 each CF279A $19.99/ea CE505A $20/ea CE505X $22/ea CF280A $20/ea CF280X $22/ea CF226A $44/ea CF226X $65/ea CF281A $60/ea ...,City of Toronto,10/09/2020,2020-10-06 12:28:41.613055
1273218920,/v-printers-scanners-fax/city-of-toronto/compatible-for:-samsung-mlt-d101s-mlt-d111s-mlt-d104s-mlt-d103l/1273218920,19.99,"Compatible for: Samsung MLT-D101S,MLT-D111S,MLT-D104S,MLT-D103L",,"MLT-D101S, $19.99/each MLT-D111S $23.95/each ,MLT-D104S $21/each ,MLT-D103L $25/each MLT-D105L $21/each MLT-D108L $21/each MLT-D109L $21/each MLT-D203L $35/each MLT-D205L $29.50/each MLT-D209L ...",City of Toronto,10/09/2020,2020-10-06 12:28:41.613548
1273227611,/v-printers-scanners-fax/city-of-toronto/compatible-for:-canon-131-toner-hp-cf210x-cb540a-cc530a-cf380x/1273227611,25.99,"Compatible for: Canon 131 Toner, HP CF210X,CB540A,CC530A,CF380X",,Compatible with Color Toner Cartridges: Canon 131 set Toner $75.99/each CB540A/CB541A/CB542A/CB543A set $75.99/each CF210X/CF211A/CF212A/CF213A Set $75.99/each CF380X/CF381A/CF382A/CF383A Set ...,City of Toronto,10/09/2020,2020-10-06 12:28:41.614049
1475197327,/v-printers-scanners-fax/city-of-toronto/lexmark-x2650-3-in-1-color-printer/1475197327,10.0,Lexmark X2650 3-in-1 Color Printer,,"Selling a used Lexmark X2650 3-in-1 Color Printer, has no ink, comes with the printer and power cord only. Selling for $10, as is, bring whatever you need to test. Text for a faster response, thanks. ...",City of Toronto,10/09/2020,2020-10-06 12:28:41.614818
1523276355,/v-printers-scanners-fax/city-of-toronto/brother-j875dw-printer-fax-scanner-duplex/1523276355,10.0,Brother j875dw printer fax  scanner duplex,,"Was in full working condition, but ink dried up due to lack of use. requires cleanup with some alcohol (you can YouTube it. ). Pickup for 10 dollars. Has extra new ink cartridges. Scanner fax etc ...",City of Toronto,10/09/2020,2020-10-06 12:28:41.615502
1523255184,/v-printers-scanners-fax/city-of-toronto/brother-tn-430-printer-toner-brand-new-and-sealed/1523255184,30.0,Brother TN-430 Printer Toner - Brand NEW and Sealed,,Brand new sealed in wrapper and box. 3000 pages. 401 and Victoria Park for pickup,City of Toronto,10/09/2020,2020-10-06 12:28:41.616013
1523244244,/v-printers-scanners-fax/city-of-toronto/4-m-plus-printer-for-free/1523244244,0.0,4 m plus printer for free,,"4m plus network monochrome printer, working, decent toner left. Already set up with IP and functioning. Got a new mfc unit, don't need this backup",City of Toronto,10/09/2020,2020-10-06 12:28:41.616503
1523240430,/v-printers-scanners-fax/city-of-toronto/hp-laserjet-91a-print-cartridge-series-iiisi-4si-92291a/1523240430,20.0,HP LaserJet (91A) Print Cartridge - Series IIISi 4Si - 92291A,,HP LaserJet (91A) Print Cartridge - Series IIISi 4Si - 92291A - Brand New,City of Toronto,10/09/2020,2020-10-06 12:28:41.616995
1523240343,/v-printers-scanners-fax/city-of-toronto/like-new-hp-deskjet-3755-ultra-compact-wireless-3-in-1-printer/1523240343,69.99,LIKE NEW! HP DESKJET 3755 ULTRA-COMPACT WIRELESS 3 in 1 PRINTER!,,"*If ad is up, unit is still available* Like Brand New/Mint Condition. Comes w/power cord only. Retails for $102. Print, copy, scan Print speed: Up to 15 ppm black, up to 5 colour Built-in WiFi, ...",City of Toronto,10/09/2020,2020-10-06 12:28:43.261847
1523239573,/v-printers-scanners-fax/city-of-toronto/hp-laserjet-95a-print-cartridge-series-ii-iii-92295a/1523239573,40.0,HP LaserJet (95A) Print Cartridge - SERIES II - III 92295A,,HP LaserJet (95A) Print Cartridge - SERIES II - III 92295A - Brand New,City of Toronto,10/09/2020,2020-10-06 12:28:43.262367
1523237993,/v-printers-scanners-fax/city-of-toronto/canon-gpr-26-toner-cyan/1523237993,30.0,Canon GPR-26 Toner - Cyan,,Genuine Canon GPR-26 Toner Cartridge - Cyan- Brand New IMAGERUNNER C5068/C5058/iR C6880/C5880/C6800/C6870/C5800/C5870,City of Toronto,10/09/2020,2020-10-06 12:28:43.262903
1523236016,/v-printers-scanners-fax/city-of-toronto/lexmark-12a6865-print-cartridge/1523236016,30.0,Lexmark 12A6865 Print Cartridge,,Genuine Lexmark 12A6865 High Yield Toner Cartridge T620 T622 X620. Brand New,City of Toronto,10/09/2020,2020-10-06 12:28:43.263400
1523235165,/v-printers-scanners-fax/city-of-toronto/hp-laserjet-305x-ce410xd/1523235165,40.0,HP LaserJet 305x - CE410XD,,HP LaserJet 305x - CE410XD - Black Open Box but toner is sealed in wrapping,City of Toronto,10/09/2020,2020-10-06 12:28:43.263906
1523232820,/v-printers-scanners-fax/city-of-toronto/samsung-sf-550d3-toner-cartridge/1523232820,30.0,Samsung SF-550D3 Toner Cartridge,,Samsung SF-550D3 Toner Cartridge. Brand New,City of Toronto,10/09/2020,2020-10-06 12:28:43.264402
1523224922,/v-printers-scanners-fax/city-of-toronto/hp-laserjet-m5035-mfp/1523224922,500.0,HP LaserJet M5035 MFP,,Refurbished HP LaserJet M5035 MFP Printer Monochrome Copier/Fax/Printer/Scanner,City of Toronto,10/09/2020,2020-10-06 12:28:43.264895
1523217446,/v-printers-scanners-fax/city-of-toronto/lexmark-mfp-mx810de/1523217446,800.0,Lexmark MFP MX810de,,Refurbished Lexmark MFP MX810de Printer Monochrome Copier/Fax/Printer/Scanner Low sheet count,City of Toronto,10/09/2020,2020-10-06 12:28:43.265391
1523205536,/v-printers-scanners-fax/city-of-toronto/hp-printer-ink-cc-643w-hp-60/1523205536,15.0,HP Printer Ink  CC 643W HP 60,,"Hi, I'm selling a Tri-color HP ink, it's part of the combo pack. I have used the black and white ink and I have an unused tri-color ink left. I can't use it anymore because I bought a new printer. ...",City of Toronto,10/09/2020,2020-10-06 12:28:43.265906
1523202472,/v-printers-scanners-fax/city-of-toronto/hp-c3906a-black-toner-cartridge-06a-genuine-new-sealed/1523202472,15.0,HP C3906A Black Toner Cartridge 06A Genuine NEW Sealed,,HP C3906A Black Toner Cartridge 06A Genuine NEW Sealed,City of Toronto,10/09/2020,2020-10-06 12:28:43.266773
1523194524,/v-printers-scanners-fax/city-of-toronto/brother-mfc-j6530dw-business-smart-pro-colour-inkjet-printer/1523194524,175.0,Brother MFC-J6530DW Business Smart Pro Colour Inkjet Printer,,NEW NOT IN ORIGINAL BOX Product Details Get everything you need for small business functionality in one machine with the Brother MFC-J6530DW Business Smart Pro Colour Inkjet Printer. This printer can ...,City of Toronto,10/09/2020,2020-10-06 12:28:43.267270
1523191788,/v-printers-scanners-fax/city-of-toronto/original-brother-tn360-high-yield-black-toner-cartridge/1523191788,40.0,Original Brother TN360 High Yield Black Toner Cartridge,,"Brother genuine inks, toners, and drums ensure quality professional prints and peace of mind. All Brother supplies are designed as part of an entire printing system and tested to ensure your optimal ...",City of Toronto,10/09/2020,2020-10-06 12:28:43.267776
1523162716,/v-printers-scanners-fax/city-of-toronto/like-new-hp-colour-laserjet-m277dw-multi-function-mfp-toners/1523162716,265.0,Like new HP colour laserjet M277dw multi function - MFP & toners,,Like new condition HP colour laser-jet M277dw comes with an extra high yield magenta toner in package plus the toners in the printer as well: 265.00 Alex@647-261-8975 >>>>>> General Information ...,City of Toronto,10/09/2020,2020-10-06 12:28:43.268278
1512458411,/v-printers-scanners-fax/city-of-toronto/brand-new-in-factory-sealed-box-hp-laserjet-pro-m102w-printer/1512458411,125.0,BRAND NEW IN FACTORY SEALED BOX-HP LASERJET PRO M102w PRINTER,,PRICE IS FIRM!!! BRAND NEW IN FACTORY SEALED BOX-HP LASERJET PRO M102w WIRELESS PRINTER COLOUR: WHITE Images are just true photos. BRAND NEW IN FACTORY SEALED BOX!!! PRICE IS FIRM NO TAXES!!! PLEASE ...,City of Toronto,09/09/2020,2020-10-06 12:28:43.268984
1523114648,/v-printers-scanners-fax/city-of-toronto/epson-t88v-high-speed-receipt-printer-thermal-printer/1523114648,179.99,Epson T88V HIGH SPEED  Receipt printer  Thermal printer,,Epson High speed receipt printer in very good working condition. Three month warranty. POS system weekly special,City of Toronto,09/09/2020,2020-10-06 12:28:43.269496
1523067248,/v-printers-scanners-fax/city-of-toronto/printer-for-sale/1523067248,150.0,Printer for sale,,"Brother printer MFC-J265W Printer, scanner, copy, fax. Fully working brand new ink installed as well as a new 2 pack of black ink. Wireless or hardwire connection. No more use for it as I am moving ...",City of Toronto,09/09/2020,2020-10-06 12:28:43.270282
1523066438,/v-printers-scanners-fax/city-of-toronto/brother-mfc-685cw-printer/1523066438,30.0,Brother MFC-685CW Printer,,"Still works, just got a new one.",City of Toronto,09/09/2020,2020-10-06 12:28:43.270850
1508229164,/v-printers-scanners-fax/city-of-toronto/lexmark-x5690-inkjet-multifunction-printer/1508229164,20.0,Lexmark X5690 Inkjet Multifunction Printer,,"4 in 1 , like new in box,Work great need ink cartridge.",City of Toronto,09/09/2020,2020-10-06 12:28:43.271582
1523065066,/v-printers-scanners-fax/city-of-toronto/kyocera-ecosys-fs-1370dn-3820n-workgroup-laser-printer-s/1523065066,400.0,Kyocera Ecosys FS-1370DN 3820N Workgroup Laser Printer s,,"Two Kyocera Office Workgroup Printers for sale: 1. Kyocera Ecosys FS 1370DN 37PPM - $400. Comparables selling for around $1,000 2. Kyocera FS 3820N 29PPM - $600. Comparables selling for around $1300. ...",City of Toronto,09/09/2020,2020-10-06 12:28:43.272093
1523050803,/v-printers-scanners-fax/city-of-toronto/hp-deskjet-3050-wireless-printer-like-new/1523050803,20.0,Hp deskjet 3050 wireless printer like new,,Just like new. It was just stored after 2 times used. No scratch not even on any mark Need hp 61 ink Comes with cd and instructions booklet I have laser printer. That's why i never used Pick up only ...,City of Toronto,09/09/2020,2020-10-06 12:28:43.272599
