,url,price,title,distance,description,location,time_offset,retreived
1510362178,/v-hot-tub-pool/city-of-toronto/submersible-pool-spa-cover-drainer-fp0s1790pca-8-5-amps/1510362178,150.0,"Submersible Pool/Spa Cover Drainer - FP0S1790PCA, 8.5 Amps",,"Submersible Pool/Spa Cover Drainer - FP0S1790PCA, 8.5 Amps. Hose not included.",City of Toronto,02/09/2020,2020-10-07 17:19:40.803629
1521407101,/v-hot-tub-pool/city-of-toronto/intex-bull-float/1521407101,90.0,Intex bull float,,Brand new. Inflated size is 94 x 77 x 32 inches (2.39 x 1.96 x 0.81 metres),City of Toronto,01/09/2020,2020-10-07 17:19:40.804501
1521356110,/v-hot-tub-pool/city-of-toronto/hayward-sand-filter/1521356110,360.0,Hayward Sand Filter,,"Model number: S220TC Selling a Hayward Sand filter 22"". Was used for a half a season. In excellent condition (almost brand new).",City of Toronto,31/08/2020,2020-10-07 17:19:40.804982
1521352366,/v-hot-tub-pool/city-of-toronto/jacuzzi-pool-ladder/1521352366,100.0,Jacuzzi Pool Ladder,,Selling a jacuzzi brand three step pool ladder for in ground pools. Ladder is full stainless steel with rubber end caps to protect pool vinyl.,City of Toronto,31/08/2020,2020-10-07 17:19:40.805506
1521206603,/v-hot-tub-pool/city-of-toronto/pool/1521206603,150.0,Pool,,6X4 Hard shell plastic pool. Great for 2 adults or kids. $150,City of Toronto,31/08/2020,2020-10-07 17:19:40.806227
1521134288,/v-hot-tub-pool/city-of-toronto/garden-water-pump-shallow-well-pressurized/1521134288,150.0,Garden Water Pump Shallow Well Pressurized,,high quality water pump is perfect for transferring water from wells or water reservoirs to upper stories of building. It gives homes several times more pressure in their water pipes for better ...,City of Toronto,30/08/2020,2020-10-07 17:19:40.806709
1521088419,/v-hot-tub-pool/city-of-toronto/bnib-skee-toss-pool-game-and-floaty-lounger/1521088419,20.0,BNIB. Skee Toss Pool Game and floaty lounger,,BNIB. Skee Toss Pool Game and floaty lounger. Brand new in box Banzai 2-in-1 pool float lounger + pool game Bring the arcade to your pool with a fun game of Skee Toss Pool Game! Toss the plastic ...,City of Toronto,30/08/2020,2020-10-07 17:19:40.807194
1521018274,/v-hot-tub-pool/city-of-toronto/hayward-ac-power-supply-for-aquavac-tigershark/1521018274,175.0,Hayward AC Power Supply for Aquavac Tigershark,,Used Hayward AC Power Supply for TigerShark/Plus Robotic Cleaner Models. The accompanying cleaner broke down but the power supply is in perfect working order. Downtown Toronto pick up. Still ...,City of Toronto,30/08/2020,2020-10-07 17:19:40.807689
1521000886,/v-hot-tub-pool/city-of-toronto/hayward-super-pump/1521000886,200.0,Hayward super pump,,1 h/p Hayward supper pump Very good condition $200 or best offer,City of Toronto,30/08/2020,2020-10-07 17:19:42.712481
1520931853,/v-hot-tub-pool/city-of-toronto/swimming-pool-steps-stairs-for-sale/1520931853,50.0,Swimming pool steps / stairs for sale,,The item in great condition,City of Toronto,29/08/2020,2020-10-07 17:19:42.712972
1520873811,/v-hot-tub-pool/city-of-toronto/a-steal-brand-new-alligator-spray-pool/1520873811,20.0,A STEAL!! Brand New Alligator Spray Pool,,•Over 7 feet (213 cm) long •Banzai pool •Great for hot sunny days •Includes sorta sprinkler •Never been taken out of the box,City of Toronto,29/08/2020,2020-10-07 17:19:42.713458
1520849121,/v-hot-tub-pool/city-of-toronto/the-little-mermaid-flounder-float/1520849121,50.0,The Little Mermaid Flounder Float,,"Brand new never been used or opened. Price is firm, paid a lot more.",City of Toronto,29/08/2020,2020-10-07 17:19:42.713943
1510262535,/v-hot-tub-pool/city-of-toronto/swimming-pool-motor-new-price/1510262535,45.0,Swimming pool motor! (NEW PRICE),,"I have a 1/3 horse power Franklin motor for an above ground pool pump. ( NOTE NOT PUMP JUST MOTOR) It comes with a 25 foot cord attached to the motor. The shaft is 5/8"" with a slot for the key! It ...",City of Toronto,28/08/2020,2020-10-07 17:19:42.714427
1413458761,/v-hot-tub-pool/city-of-toronto/pool-clarifier/1413458761,12.0,Pool clarifier,,2 bottles - used to clarify pool water and won't affect pH of water. Each bought for $10 from Rona with price tag still on.,City of Toronto,27/08/2020,2020-10-07 17:19:42.714908
1520433178,/v-hot-tub-pool/city-of-toronto/inflatable-pool/1520433178,180.0,Inflatable Pool,,The pool only. No filter. 8 feet by 30 inch,City of Toronto,27/08/2020,2020-10-07 17:19:42.715469
1520385143,/v-hot-tub-pool/city-of-toronto/above-ground-pool-cover-18ft-round-brand-new-in-box/1520385143,95.0,Above ground Pool Cover 18ft Round. BRAND NEW IN BOX,,BNIB NEVER USED SEALED High Quality Pool Cover for Above Ground 18ft Round Pool Colour = Silver Price: $95 obo I also have clips for sale to attach the cover to the pool pls see other ads. Trades may ...,City of Toronto,26/08/2020,2020-10-07 17:19:42.716359
1465067031,/v-hot-tub-pool/city-of-toronto/hayward-idxl2bkp1930-bezel-and-keypad-assembly-replacement-for/1465067031,195.0,Hayward IDXL2BKP1930 Bezel and Keypad Assembly Replacement for,,"Hayward IDXL2BKP1930 Bezel and Keypad Assembly Replacement for Select Hayward H-Series Heater new Fits hayward universal h-series low nox heater models h350fdp, h350fdp Also fits hayward universal ...",City of Toronto,26/08/2020,2020-10-07 17:19:42.716847
1520270699,/v-hot-tub-pool/city-of-toronto/pool-filter-a-c-type/1520270699,30.0,Pool filter “A” “C” type,,One for 30 or three for 75.,City of Toronto,26/08/2020,2020-10-07 17:19:42.717333
1520161815,/v-hot-tub-pool/city-of-toronto/above-ground-pool-ladder/1520161815,50.0,Above ground pool ladder,,Used above ground pool ladder. Good shape. $50,City of Toronto,25/08/2020,2020-10-07 17:19:42.718009
1520120131,/v-hot-tub-pool/city-of-toronto/pentair-1-5-6-position-top-mount-filter-valve/1520120131,75.0,"Pentair 1.5"" 6 Position Top Mount Filter Valve",,"Pentair 1.5"" MPT Hi Flo 6 Position Top Mount Filter Valve for Tagelus, Sand Dollar and CF II (262506) AS NEW Buttress thread 1 month old- decided to go to a whole different system Pentair multivalve ...",City of Toronto,25/08/2020,2020-10-07 17:19:42.718493
1367005981,/v-hot-tub-pool/city-of-toronto/swimming-pool-motor-with-timer/1367005981,250.0,Swimming Pool motor with timer,,Selling swimming pool motor with timer to save on your electricity bills.,City of Toronto,25/08/2020,2020-10-07 17:19:42.718976
1519983752,/v-hot-tub-pool/city-of-toronto/hayward-pool-pump/1519983752,200.0,Hayward Pool Pump,,"Hayward Pool Pump In very good shape, runs when plugged in. Model SP 2175 CSA $200 Southeast Scarborough Thanks!",City of Toronto,24/08/2020,2020-10-07 17:19:42.719470
1519944549,/v-hot-tub-pool/city-of-toronto/36-pool-ladder-60-still-in-box/1519944549,60.0,"36"" Pool Ladder - $60 - Still in Box!",,"36"" Pool Ladder, still in box! $60. retail is $69 but sold out months ago!",City of Toronto,24/08/2020,2020-10-07 17:19:42.720376
1519888405,/v-hot-tub-pool/city-of-toronto/summer-waves-8-ft-x-26-in-pool-with-filter-pump/1519888405,195.0,Summer Waves 8 ft x 26 in Pool with Filter + Pump,,* Set up this easy and convenient Summer Waves Pool for a fun and relaxing Summer * Constructed from 95% PVC and 5% plastic * Ideal for 2 adults and 2 children * 350 GPH water flow with a RP350 pump ...,City of Toronto,24/08/2020,2020-10-07 17:19:42.721058
1519804945,/v-hot-tub-pool/city-of-toronto/outdoor-shower/1519804945,300.0,Outdoor shower,,"New in box Pool central outdoor shower with hot and cold settings, solar heated, just hooks onto a garden hose! Retails for 489 plus tax.",City of Toronto,24/08/2020,2020-10-07 17:19:42.721540
1519803182,/v-hot-tub-pool/city-of-toronto/taylor-r004-ph-indicator-box-set-12/1519803182,60.0,Taylor R004 pH Indicator Box Set (12),,Reagent 0004 pH Indicator Box (12) There are 12 Reagents in 1 Box. Used to get PH readings for pools and Spas,City of Toronto,24/08/2020,2020-10-07 17:19:42.722021
1519802872,/v-hot-tub-pool/city-of-toronto/taylor-r0011la-calcium-box-set-12/1519802872,60.0,Taylor R0011LA Calcium Box Set (12),,1 Box - 12 R-0011L Calcium Reagents Used for Pool's and Spa's,City of Toronto,24/08/2020,2020-10-07 17:19:42.722503
1519799667,/v-hot-tub-pool/city-of-toronto/polygroup-pool-12-sand-filter-from-cp2000-s/1519799667,50.0,"Polygroup pool 12"" sand filter (from CP2000-S)",,"Replacement 12"" sand filter for someone who needs. Includes 50lbs of sand inside. This comes with the pump but it doesn't work. And the pressure gauge doesn't provide readings properly (but it can be ...",City of Toronto,23/08/2020,2020-10-07 17:19:42.722983
1519798618,/v-hot-tub-pool/city-of-toronto/new-h2o-go-inflatable-8-7ft-rectangular-family-pool/1519798618,60.0,NEW H2O GO! Inflatable 8.7ft Rectangular Family Pool,,Measures 8ft 7in x 69in x 20 in/ 2.62m x 1.75m x 51cm Designed water capacity fo 778L (206 gal) Pick up in South Etobicoke close to Sherway Gardens Mall.,City of Toronto,23/08/2020,2020-10-07 17:19:42.723474
1519784913,/v-hot-tub-pool/city-of-toronto/hayward-salt-pool-system/1519784913,500.0,Hayward salt pool system,,"7 years old system. Still in working condition, even though t cell is now 7 years old. You may need to buy a new t cell for it to work like new, even though the t cell was working when last in use. ...",City of Toronto,23/08/2020,2020-10-07 17:19:42.723956
1519711915,/v-hot-tub-pool/city-of-toronto/heysplash-inflatable-swim-ring/1519711915,10.0,HeySplash Inflatable Swim Ring,,"NEVER USED - has glitter, flower shaped, rose gold - float lounger tube, water fun beach party - light weight",City of Toronto,23/08/2020,2020-10-07 17:19:42.724753
1379473996,/v-hot-tub-pool/city-of-toronto/ph-up-for-pool-use/1379473996,40.0,pH up - for pool use,,"1kg bucket - now reduced. bought last summer & never used. Pool now demolished. Compare with $88/10 lbs, this is a bargain",City of Toronto,23/08/2020,2020-10-07 17:19:42.725280
1519609265,/v-hot-tub-pool/city-of-toronto/flowxtreme-3-4-hp-in-ground-pool-pump/1519609265,280.0,FlowXtreme 3/4 HP in ground pool pump,,"Brand new in the box , in ground pool pump Special ordered the wrong pump for our application 2100-4400 GPH Asking $280 Call or text 4166762734 if interested No email communications",City of Toronto,23/08/2020,2020-10-07 17:19:42.725842
1519588243,/v-hot-tub-pool/city-of-toronto/pool-ladder/1519588243,180.0,Pool ladder,,"Good Pool ladder. Posted in home - outdoor, garden, hot tubs, pools in City of Toronto. August 22, 2020",City of Toronto,22/08/2020,2020-10-07 17:19:42.726333
1379473429,/v-hot-tub-pool/city-of-toronto/ph-down-for-pool/1379473429,40.0,PH down - for pool,,Now reduced again ! Had pool demolished this year. Never used and 1 kg. Compare with $88/10lbs this is a bargain,City of Toronto,22/08/2020,2020-10-07 17:19:42.727003
1519495943,/v-hot-tub-pool/city-of-toronto/balboa-spa-pack-controller/1519495943,125.0,balboa spa pack controller,,7 button balboa spa pack controller In mint condition in gazebo since new,City of Toronto,22/08/2020,2020-10-07 17:19:42.727498
1519348476,/v-hot-tub-pool/city-of-toronto/above-ground-auto-inflatable-swimming-pool-with-sunshade-new/1519348476,250.0,Above Ground Auto Inflatable Swimming Pool with Sunshade (NEW),,"Summer fun is here with the easy and convenient Quick Set® Rectangle Auto-Inflatable Pool for the best Lounging experience. Designed with premium Auto Inflation technology , the pool rises as it ...",City of Toronto,21/08/2020,2020-10-07 17:19:51.545367
1519341669,/v-hot-tub-pool/city-of-toronto/above-ground-pool-ladder-steps/1519341669,30.0,Above ground pool ladder steps,,Above ground pool ladder. For pools up to 108 cm in height.,City of Toronto,21/08/2020,2020-10-07 17:19:51.545858
1519322698,/v-hot-tub-pool/city-of-toronto/inflatable-pool/1519322698,250.0,Inflatable Pool,,"Inflatable pool with pump in good condition. Comes with extra filter for pump, water conditioner, water sanitizer to shock, frog floating temperature, floating puck dispenser and cover for pool .",City of Toronto,21/08/2020,2020-10-07 17:19:51.546336
1419038501,/v-hot-tub-pool/city-of-toronto/3-step-economy-ladder-with-white-high-impact-plastic-tread/1419038501,160.0,3 Step Economy Ladder with White High Impact Plastic Tread,,"3 Step Economy Ladder is BRAND NEW, NEVER USED If ad is up, item is available Please view my other ads The Inter-Fab three step economy ladder with white High Impact Plastic (HIP) treads is one of ...",City of Toronto,21/08/2020,2020-10-07 17:19:51.546819
1519206877,/v-hot-tub-pool/city-of-toronto/garden-leisure-premium-hot-tub-7899/1519206877,7899.0,Garden leisure premium hot tub $7899,,"Top of the line garden leisure hot tub . 65 jets powered by 2 full size pump motors . Led lights , stereo , 7x7 ft . Can fit 6 people comfortably . Delivery , hook up and tub training available for ...",City of Toronto,20/08/2020,2020-10-07 17:19:51.547517
1519106693,/v-hot-tub-pool/city-of-toronto/inflatable-pool-lounger-blue-wave-drift-escape-brand-new/1519106693,80.0,Inflatable Pool Lounger BLUE WAVE Drift + Escape / BRAND NEW,,****************** PLEASE READ THE AD BEFORE ASKING ANY QUESTIONS ****************** BRAND NEW IN SEALED MFG PACKAGING / NEVER USED / NEVER INFLATED/ NEVER TAKEN OUT OF BOX ($80.00) – NO NEGOTIATIONS ...,City of Toronto,20/08/2020,2020-10-07 17:19:51.547999
1519030116,/v-hot-tub-pool/city-of-toronto/backyard-pool-set/1519030116,270.0,Backyard pool set,,Got 5 boxes still available 12ft by 30inch $270 each Firm price,City of Toronto,19/08/2020,2020-10-07 17:19:51.548484
1519003861,/v-hot-tub-pool/city-of-toronto/little-pool-for-kids/1519003861,50.0,Little pool for kids!!!,,"Cute little blue pool for kids.This pool is great, color does not wear of, doesn't get affected by harsh weather.You can wash it very easily without any problems,normal dish soap would do if ...",City of Toronto,19/08/2020,2020-10-07 17:19:51.548967
1518924871,/v-hot-tub-pool/city-of-toronto/12-foot-above-ground-pool/1518924871,350.0,12 Foot Above Ground Pool,,"Comes with pump, ladder, cover, solar cover, metal railings all parts, patch kits, vaccum, test strips, and all other plugs and hoses.",City of Toronto,19/08/2020,2020-10-07 17:19:51.549605
1518875972,/v-hot-tub-pool/city-of-toronto/summer-waves-inflatable-8ft-pool/1518875972,120.0,Summer Waves inflatable 8ft pool,,"Brand New Summer Waves 8ft Inflatable Quick Set Swimming Pool (Sold out everywhere) for $120 Purchased from Walmart, receipt available! Summer fun is here with the easy and convenient Summer Waves ...",City of Toronto,19/08/2020,2020-10-07 17:19:51.550320
1518718609,/v-hot-tub-pool/city-of-toronto/hayward-ultra-pro-lx-pump/1518718609,300.0,Hayward Ultra-Pro LX Pump,,Hayward Ultra-Pro LX Pump for sale. Used for less than a year in my lobster shop before I retired but has since been in storage (dust needs to be wiped off of it of course).,City of Toronto,18/08/2020,2020-10-07 17:19:51.550821
1518701622,/v-hot-tub-pool/city-of-toronto/winter-inground-pool-cover/1518701622,125.0,Winter inground pool cover,,"Brand new winter cover ' Supreme - 10 year warranty ""Rip Stop "" 15 x 30",City of Toronto,18/08/2020,2020-10-07 17:19:51.551322
1518582409,/v-hot-tub-pool/city-of-toronto/hayward-aquavac-rc9726-charger/1518582409,150.0,Hayward AquaVac RC9726 Charger,,Used to charge AquaVac Text is preferred,City of Toronto,17/08/2020,2020-10-07 17:19:51.552013
1455703576,/v-hot-tub-pool/city-of-toronto/beige-wrap-style-summer-bathing-suit-small-size-set/1455703576,45.0,Beige Wrap Style Summer Bathing Suit Small Size Set,,Beige Wrap Style Summer Bathing Suit Small Size Set,City of Toronto,17/08/2020,2020-10-07 17:19:51.552501
1518498256,/v-hot-tub-pool/city-of-toronto/jacuzzi-1-2-hp/1518498256,75.0,Jacuzzi 1/2 hp,,Runs good $75,City of Toronto,17/08/2020,2020-10-07 17:19:51.552987
1518493633,/v-hot-tub-pool/city-of-toronto/intex-inflatable-pool-for-kids/1518493633,0.0,Intex inflatable pool for kids,,Free. Needs a good cleaning but inflates properly. Pick up from street island adjacent to southbound lanes on oriole parkway just north of tranmer (northwest corner). If you don’t see it it’s gone. ...,City of Toronto,17/08/2020,2020-10-07 17:19:51.553442
1518426470,/v-hot-tub-pool/city-of-toronto/available-brand-new-120vac-2hp-111gpm-swimming-pool-pump/1518426470,200.0,Available. Brand New 120VAC 2HP 111GPM Swimming Pool Pump,,Description AVAILABLE. I will take down ad when I don't have any. BRAND NEW in original shipping box with owners manual and hose adapters. Price is NOT negotiable. so pls don't ask. I can meet in ...,City of Toronto,16/08/2020,2020-10-07 17:19:51.553927
1518198533,/v-hot-tub-pool/city-of-toronto/intex-swimming-pool/1518198533,375.0,Intex swimming pool,,Priced for quick sale! Underground pool going in next summer. Comes with salter and pool and entire pool including ladder. Cost over $1200 new. Selling for $375 all included.,City of Toronto,15/08/2020,2020-10-07 17:19:51.554411
1518185287,/v-hot-tub-pool/city-of-toronto/bestway-18-x-9-above-ground-pool/1518185287,900.0,BESTWAY 18 x 9 Above Ground Pool,,Used for one week bought this year $900,City of Toronto,15/08/2020,2020-10-07 17:19:51.554891
1518078905,/v-hot-tub-pool/city-of-toronto/going-fast-type-a-c-pool-filters-2-pack/1518078905,50.0,**GOING FAST** TYPE A & C POOL FILTERS 2-PACK,,You know what they are if you have a pool that requires this type of filter.... Price is firm,City of Toronto,14/08/2020,2020-10-07 17:19:51.555383
1518075699,/v-hot-tub-pool/city-of-toronto/pool-and-spa-filter/1518075699,10.0,Pool and spa filter,,"Pack of two Sealed See pic for details please TEXT ONLY for quick response Dimensions: inches 2"" internal diameter 4-12"" external diameter 7-3/4"" height",City of Toronto,14/08/2020,2020-10-07 17:19:51.555869
1507663008,/v-hot-tub-pool/city-of-toronto/hot-tub-22-led-multi-colour-light/1507663008,80.0,Hot tub 22 LED multi-colour light,,"New LED replacement light. Came from my Marquis spa and was used 1 season. Has 100,000 hour life so its basically brand new. Over $100 new. Made by ColorGlo : ...",City of Toronto,14/08/2020,2020-10-07 17:19:51.556351
1518051433,/v-hot-tub-pool/city-of-toronto/pool-or-dock-ladder/1518051433,100.0,Pool or dock ladder,,Great condition,City of Toronto,14/08/2020,2020-10-07 17:19:51.556835
1517879602,/v-hot-tub-pool/city-of-toronto/16-x-32-14-mil-sun-cover-blanket-for-rectangular-swimming-pool/1517879602,150.0,16 x 32  14 mil Sun Cover(Blanket) for Rectangular Swimming Pool,,This is a brand new boxed solar cover. I bought it without knowing that the company that built my pool was going to provide me with one. Here is the website of the company that sold me the cover: ...,City of Toronto,13/08/2020,2020-10-07 17:19:51.557323
1517854898,/v-hot-tub-pool/city-of-toronto/bleach-12-sodium-hypochlorite/1517854898,14.0,Bleach 12% sodium hypochlorite,,"5 litre Lavo 12 bleach. Great for swimming pools, laundry and household use. Never opened. Expires 2023. A substitute for Clorox Javex 12. Two for $26. One for $14.",City of Toronto,13/08/2020,2020-10-07 17:19:51.557805
1517721154,/v-hot-tub-pool/city-of-toronto/above-ground-swimming-pool-summer-waves/1517721154,2000.0,Above ground swimming pool - Summer Waves!!,,"Summer waves above ground swimming pool. Diameter is 18feet. Included is a sand pump, chlorine, a skimmer and a solar blanket.",City of Toronto,12/08/2020,2020-10-07 17:19:51.558677
1517717901,/v-hot-tub-pool/city-of-toronto/pool-spa-heater-coates/1517717901,1200.0,Pool & spa heater Coates,,Brand new never used.,City of Toronto,12/08/2020,2020-10-07 17:19:51.559157
1517687754,/v-hot-tub-pool/city-of-toronto/summer-waves-pool/1517687754,275.0,Summer Waves Pool,,"Summer waves Pool, used a few times this summer. Not suitable for my backyard. Will add, cholorine pucks as well. Asking, $275.00 obo. Thank you.",City of Toronto,12/08/2020,2020-10-07 17:19:51.559635
1517579858,/v-hot-tub-pool/city-of-toronto/pentair-intellichlor-ic40-replacement-salt-cell/1517579858,950.0,*** Pentair IntelliChlor IC40 Replacement Salt Cell ***,,New in box never used Pentair IntelliChlor IC40 Replacement Salt Cell retails for over $1000.00+HST selling for $950 cash,City of Toronto,12/08/2020,2020-10-07 17:19:51.560115
1517569107,/v-hot-tub-pool/city-of-toronto/brand-new-in-box-summer-waves-8-ft-x-26-in-pool-pump/1517569107,215.0,Brand New in Box Summer Waves 8 ft x 26 in Pool + Pump,,"This pool is brand new, comes sealed in the box. * Set up this easy and convenient Summer Waves Pool for a fun and relaxing Summer * Constructed from 95% PVC and 5% plastic * Ideal for 2 adults and 2 ...",City of Toronto,12/08/2020,2020-10-07 17:19:51.560636
1507087125,/v-hot-tub-pool/city-of-toronto/pool-pump/1507087125,150.0,Pool pump,,"Hi,i have a pool pump for sale.it works fine i just changed to variable speed,dont need this anymore.its been wired 110 v.call me if interested.thanks((647-772-2756))",City of Toronto,11/08/2020,2020-10-07 17:19:51.561128
