,url,price,title,distance,description,location,time_offset,retreived
1525515863,/v-snowboard/city-of-toronto/153cm-sims-infinity-snowboard-with-burton-contour-bindings-50/1525515863,50.0,"153cm Sims Infinity snowboard with Burton Contour bindings, $50",,"I'm selling a 153cm Sims Infinity snowboard with Burton Contour bindings in good condition. Originally bought mid-2000s, but hasn't been used in maybe a decade. Could use a tune-up, but no major ...",City of Toronto,22/09/2020,2020-10-06 12:14:42.211984
1525510496,/v-snowboard/city-of-toronto/dakine-ski-snowboard-backpack-20l/1525510496,40.0,Dakine ski/snowboard backpack (20L),,"20 L Vertical snowboard carry Diagonal ski carry Fleece lined goggle pocket Laptop sleeve fits most 15"" laptops Dual zippered side pockets for boots Stowable waist belt Adjustable sternum strap Top ...",City of Toronto,22/09/2020,2020-10-06 12:14:42.212488
1525494647,/v-snowboard/city-of-toronto/burton-boarding-boots-size-7/1525494647,120.0,BURTON boarding boots SIZE 7,,"Great condition, no laces just pull to tighten tech. These are comfortable and warm. Barely used for a few seasons. $120 obo ❄ If the ad is still up it's available ❄",City of Toronto,22/09/2020,2020-10-06 12:14:42.212995
1525491196,/v-snowboard/city-of-toronto/von-zipper-limited-edition-space-glaze-goggles/1525491196,120.0,VON ZIPPER LIMITED EDITION SPACE GLAZE GOGGLES,,"$120 obo These are in mint condition, no scratches and the night/yellow visor still has the original plastic film on it. ❄ they are a beaut! I just don't snowboard anymore. Selling all my stuff (see ...",City of Toronto,22/09/2020,2020-10-06 12:14:42.213490
1525471481,/v-snowboard/city-of-toronto/snowboard/1525471481,120.0,Snowboard,,"For sale what’s in photo. No trades, firm price. Check out my other ads",City of Toronto,22/09/2020,2020-10-06 12:14:42.213989
1525429562,/v-snowboard/city-of-toronto/ride-snowboard-with-bindings-high-quality/1525429562,200.0,Ride Snowboard with Bindings (High quality),,"High quality Ride brand snowboard with brand name bindings. Board is used but in good condition without many major scratches. Board works as a Men's or Unisex model, and measures around 5'4"" long. ...",City of Toronto,21/09/2020,2020-10-06 12:14:42.214484
1525405927,/v-snowboard/city-of-toronto/153-snowboard-with-binding/1525405927,200.0,153 snowboard with binding,,binding is medium and one side of the edge is broke a bit snowboarding and binding $200,City of Toronto,21/09/2020,2020-10-06 12:14:42.214986
1525401684,/v-snowboard/city-of-toronto/snowboard-170cm/1525401684,150.0,Snowboard (170cm),,170 cm Atomic snowboard with Ride bindings. Ride bindings are much newer than the board. This is a great board for big carves.,City of Toronto,21/09/2020,2020-10-06 12:14:42.216039
1525391189,/v-snowboard/city-of-toronto/snowboard-boots-mens-size-9/1525391189,40.0,Snowboard Boots Men's Size 9,,"Thirtytwo Men's Size 9 snowboard boots (US 9.0, Euro 42.0, UK8.0). Blue and White. Excellent condition.",City of Toronto,21/09/2020,2020-10-06 12:14:42.217718
1525333666,/v-snowboard/city-of-toronto/sunice-stormpack-snow-pant/1525333666,45.0,Sunice Stormpack Snow Pant,,"Sunice Stormpack Snow Pant Size : L/G Code : 1043610 Oakwood Pawn Shop 1958 Eglinton Ave West, Toronto, ON, M6E2J8 You can call me, for questions 647 282 15 49",City of Toronto,21/09/2020,2020-10-06 12:14:42.219272
1525324483,/v-snowboard/city-of-toronto/ride-womens-binding-size-medium/1525324483,175.0,Ride - Women's Binding Size Medium,,Barely used snowboard bindings. Cotton candy colour. Included with all original screws and attachments.,City of Toronto,21/09/2020,2020-10-06 12:14:42.220916
1495277899,/v-snowboard/city-of-toronto/avenger-163-snowboard/1495277899,100.0,Avenger 163  Snowboard,,Good shape complete with bindings 64 inches . Hardly used...,City of Toronto,21/09/2020,2020-10-06 12:14:42.222965
1525289368,/v-snowboard/city-of-toronto/hangtime-snowboard-wall-mount/1525289368,15.0,HangTime Snowboard Wall Mount,,"Pick up only Location: downtown Toronto, one block south of the CN Tower. Main intersections: Spadina and Front; Harbourfront Centre and Queens Quay W Link: ...",City of Toronto,21/09/2020,2020-10-06 12:14:42.224653
1525276210,/v-snowboard/city-of-toronto/smith-ski-snowboard-goggles/1525276210,15.0,Smith Ski/snowboard Goggles,,"Worn once, great condition!",City of Toronto,21/09/2020,2020-10-06 12:14:42.225341
1525259464,/v-snowboard/city-of-toronto/snowboard-boots-size-11/1525259464,175.0,Snowboard boots size 11,,"Thirty two, JP Walker, limited series. Worn twice, were light.",City of Toronto,20/09/2020,2020-10-06 12:14:42.225875
1525220099,/v-snowboard/city-of-toronto/salomon-dialog-snowboard-boots/1525220099,45.0,Salomon Dialog Snowboard Boots,,"Used only a couple times. Practically new. Size 11.5 mens. Best offer takes them. Originally paid $350 for them, but that was quite a while ago and they've been sitting in storage.",City of Toronto,20/09/2020,2020-10-06 12:14:42.226382
1525212948,/v-snowboard/city-of-toronto/ride-dose-156cm-snowboard/1525212948,100.0,Ride Dose 156cm Snowboard,,"Selling my snowboard - Ride Dose 156cm - comes with the bag. Great condition, just needs a tune before you head out. Pick up only",City of Toronto,20/09/2020,2020-10-06 12:14:42.226907
1525207859,/v-snowboard/city-of-toronto/salomon-snowboard-159/1525207859,120.0,Salomon snowboard 159,,"Salomon snowboard, great functioning condition. Does not come with binders. The binders shown in the picture are broken and need to be replaced. 120 obo",City of Toronto,20/09/2020,2020-10-06 12:14:42.227471
1525204699,/v-snowboard/city-of-toronto/used-snowboard-starter-set-board-bindings-boots/1525204699,350.0,"Used snowboard starter set (board, bindings, boots)",,"I'm selling my used snowboard set that I learned how to ride on ~ 10 yrs ago. For someone that doesnt want to spend alot on new gear, it might be a great way to start off and still get some good life ...",City of Toronto,20/09/2020,2020-10-06 12:14:42.228048
1525200159,/v-snowboard/city-of-toronto/ride-deadbolt-mens-snowboard-boots-size-10-5/1525200159,200.0,Ride Deadbolt Men's Snowboard Boots Size 10.5,,I'm selling a pair of lightly used snowboard boots that I bought at the 2019 snowboard show. The boots have been used only a few times during the 2019 / 2020 season. I bought a new pair of boots and ...,City of Toronto,20/09/2020,2020-10-06 12:14:42.228712
1525193840,/v-snowboard/city-of-toronto/mens-firefly-snowboard-boots-size-11/1525193840,60.0,MENS FIREFLY SNOWBOARD BOOTS (Size 11),,Brand new Firefly snowboard boots. Worn once but they don't fit me properly. $60 OBO,City of Toronto,20/09/2020,2020-10-06 12:14:42.229440
1525146131,/v-snowboard/city-of-toronto/quicksilver-mens-snowboard-pants-size-m/1525146131,60.0,QUICKSILVER Men's Snowboard Pants - Size M,,"Brand New ! QUICKSILVER Men's Snowboard Pants Size Medium, Regular Fit Brand New - Never Worn - Original Tags Still Attached Retail: $134.99",City of Toronto,20/09/2020,2020-10-06 12:14:42.230307
1525124495,/v-snowboard/city-of-toronto/rossignol-snowboard-with-burton-bindings-for-sale-150/1525124495,150.0,Rossignol Snowboard with Burton Bindings For Sale $150,,Rossignol Snowboard with Burton Bindings For Sale $150 - size 158cm,City of Toronto,20/09/2020,2020-10-06 12:14:42.230885
1525119208,/v-snowboard/city-of-toronto/2019-salomon-huck-knife-155cm-snowboard-used-6-times/1525119208,325.0,2019 Salomon Huck Knife 155cm Snowboard ---Used 6 times,,"Used the board for a month and loved it! It had great flex, a good style of camber and it really could go anywhere on the mountain(especially the terrain park). I then decided to stop and switch to ...",City of Toronto,20/09/2020,2020-10-06 12:14:42.231377
1525117470,/v-snowboard/city-of-toronto/firefly-junior-snowboard-boots-21-5/1525117470,30.0,Firefly junior snowboard boots 21.5,,"Size 3, 21.5 mondo As seen here: ...",City of Toronto,20/09/2020,2020-10-06 12:14:42.231898
1525073601,/v-snowboard/city-of-toronto/five-forty-kids-snowboard-144cm/1525073601,100.0,five forty kids snowboard 144cm,,great beginner board for kids. 144cm high and in pretty decent condition. All stickered up and looking really good for the mountain,City of Toronto,20/09/2020,2020-10-06 12:14:42.232427
1494993605,/v-snowboard/city-of-toronto/ride-control-mens-snowboard-2017-18-board-only-bindings-not/1494993605,180.0,Ride Control Men's Snowboard 2017/18 (BOARD ONLY - BINDINGS NOT,,Ride Control Men's Snowboard 2017/18 (BOARD ONLY - BINDINGS NOT INCLUDED) SIZE 152CM LIGHT USAGE: 1 Season (about 9 days of Snowboarding in 2019/2020) CONDITION: 9.5/10 Minor scuffs from typical ...,City of Toronto,19/09/2020,2020-10-06 12:14:42.233280
1525025510,/v-snowboard/city-of-toronto/used-snowboard-bindings/1525025510,50.0,USED SNOWBOARD & BINDINGS,,Great CHEAP starter snowboard. 149cm Limited board with fusion bindings. Well used. All it needs is a tune up and will work great.,City of Toronto,19/09/2020,2020-10-06 12:14:43.830661
1525021214,/v-snowboard/city-of-toronto/snowboard-boots-burton/1525021214,50.0,Snowboard boots - BURTON,,Good conditions Size 10,City of Toronto,19/09/2020,2020-10-06 12:14:43.831171
1525020311,/v-snowboard/city-of-toronto/snowboard-with-bindings/1525020311,120.0,Snowboard with bindings,,Decent conditions Good for youth/adult Bindings size - M Board size - 138 cm,City of Toronto,19/09/2020,2020-10-06 12:14:43.831664
1524918717,/v-snowboard/city-of-toronto/ride-ex-snowboard-bindings-size-mens-medium-8-11-80/1524918717,80.0,Ride EX Snowboard Bindings Size Mens Medium (8-11) - $80,,Used 2-3 times in total. Great condition. Pickup or nearby dropoff option available.,City of Toronto,19/09/2020,2020-10-06 12:14:43.832356
1524914591,/v-snowboard/city-of-toronto/nomad-snowboard-with-k2-bindings/1524914591,100.0,Nomad snowboard with K2 bindings,,"FAQ: Yes it’s still available, no the price is not flexible, and I am unable to deliver but can meet up somewhere public downtown. Used snowboard, a bit banged up, but not abused(no tricks, half ...",City of Toronto,19/09/2020,2020-10-06 12:14:43.832895
1524912693,/v-snowboard/city-of-toronto/snowboard-goggles-excellent-conditions/1524912693,65.0,Snowboard goggles -excellent conditions,,Brand spy With extra lens (night/day) Only used 2/3 times Original price is 150,City of Toronto,19/09/2020,2020-10-06 12:14:43.833401
1503753263,/v-snowboard/city-of-toronto/vision-snowboard/1503753263,120.0,Vision snowboard,,Used vision snowboards in good condition. 155cm with bindings. $120or bo.,City of Toronto,18/09/2020,2020-10-06 12:14:43.833894
1524793001,/v-snowboard/city-of-toronto/burton-women-s-snowboard-jacket-size-m/1524793001,50.0,"Burton - women’s snowboard jacket, size M",,"Excellent condition, olive coloured. Arm and back vents, hooded, light/thin.",City of Toronto,18/09/2020,2020-10-06 12:14:43.834598
1489514771,/v-snowboard/city-of-toronto/snowboard-package/1489514771,350.0,Snowboard Package,,"* Burton Size 11 Snowboard Boots, Brand New, Never Been Worn * Snowboard Bag, Brand New * Salomon Bindings, Excellent Condition * M3 Snowboard, In Great Shape....Used 5 Years ago, Sharpened, and ...",City of Toronto,18/09/2020,2020-10-06 12:14:43.835242
1503805016,/v-snowboard/city-of-toronto/snowboard-airhead-snow-ryder-130cm-hardwood-beginner-brand-new/1503805016,50.0,Snowboard Airhead Snow Ryder 130cm Hardwood Beginner / BRAND NEW,,BRAND NEW IN PLASTIC PACKAGING / NEVER EVER USED / NEVER SEEN SNOW ($50.00) – NO NEGOTIATIONS or DISCUSSIONS - PRICE IS FIRM PLEASE REPLY WITH YOUR CONTACT PHONE NUMBER FOR SPEEDIER RESPONSE PICK UP ...,City of Toronto,18/09/2020,2020-10-06 12:14:43.835807
1486150535,/v-snowboard/city-of-toronto/bolle-duchess-aurora-small-medium/1486150535,65.0,Bolle Duchess Aurora Small/Medium,,"Hi, Bought as a gift to my girlfriend but does not fit to her nose.",City of Toronto,18/09/2020,2020-10-06 12:14:43.836410
1524659544,/v-snowboard/city-of-toronto/148-ride-saturday-snowboard-with-binding/1524659544,300.0,148 RIDE SATURDAY snowboard with binding,,binding is small size snowboard is SATURDAY RIDE,City of Toronto,17/09/2020,2020-10-06 12:14:43.836940
1514098985,/v-snowboard/city-of-toronto/cheap-used-snowboards-boots/1514098985,40.0,CHEAP & USED Snowboards & Boots,,Got a couple of banged/scratched up snowboards with bindings that we used a while back. Not the best conditions but some new wax and will work just fine! Hoping someone will get a few more seasons ...,City of Toronto,17/09/2020,2020-10-06 12:14:43.837440
1408945562,/v-snowboard/city-of-toronto/boarding-boots/1408945562,50.0,Boarding Boots,,Girls youth Burton Boarding Boots,City of Toronto,17/09/2020,2020-10-06 12:14:43.837931
1524607718,/v-snowboard/city-of-toronto/snowboard-with-boots/1524607718,350.0,Snowboard with boots,,Snowboard with boots size 5. Good for around 160cm for girls and boys,City of Toronto,17/09/2020,2020-10-06 12:14:43.838421
1524594917,/v-snowboard/city-of-toronto/must-go-soon-salomon-divine-ski-snowboard-helmet/1524594917,50.0,MUST GO SOON! Salomon Divine Ski/Snowboard Helmet,,"Salomon Divine helmet for snow sports, or other sports where possible. The helmet is in excellent condition, it's practically brand new. Padding and ear cups are pristine and all the strapping and ...",City of Toronto,17/09/2020,2020-10-06 12:14:43.838926
1524569641,/v-snowboard/city-of-toronto/ride-snowboard-boots-and-bindings/1524569641,375.0,"Ride Snowboard, Boots and Bindings",,"Great Condition Ride Snowboard 150 for only $375 for entire set. Ride boots size US 8.5 or European 39.5 Bindings included All is in good condition, board has a little imperfection on the top, which ...",City of Toronto,17/09/2020,2020-10-06 12:14:43.839445
1524332997,/v-snowboard/city-of-toronto/snowboard-and-boots-wanted-gone-asap/1524332997,140.0,Snowboard and boots wanted gone ASAP,,Board in good condition other than a few scratches. May need wax and sharpen but good board. One boot has a tear in the side but it doesn’t let in any water. Boots size 10.5-11. $140 or best offer.,City of Toronto,16/09/2020,2020-10-06 12:14:43.840158
1524401918,/v-snowboard/city-of-toronto/burton-love-snowboard/1524401918,270.0,BURTON LOVE snowboard,,"This has been in its bag for 8 years. Great shape, fun design. Pictures say it. Have some size 9 air walk boots too.",City of Toronto,16/09/2020,2020-10-06 12:14:43.840652
1524393540,/v-snowboard/city-of-toronto/salomon-synapse-snowboard-boots-size-9/1524393540,30.0,"Salomon Synapse snowboard boots, Size 9",,"Salomon Synapse snowboard boots, Size 9, in good condition.",City of Toronto,16/09/2020,2020-10-06 12:14:43.841140
1524371393,/v-snowboard/city-of-toronto/snowboard-women/1524371393,200.0,Snowboard Women,,"Women’s/girls Ride snowboard - 5ft K2 Bindings - Medium US 6-10 Good condition, mountain ready!",City of Toronto,16/09/2020,2020-10-06 12:14:43.841648
1524357248,/v-snowboard/city-of-toronto/burton-snowboard-boots-shaun-white-8-5/1524357248,125.0,BURTON SNOWBOARD BOOTS Shaun White 8.5,,Nearly new Shaun White Burton Snowboard Boots. Mens size 8.5.Nitro Board available as well. Text/ call to arrange viewing/ fitting. Same boots new on ebay if available $250 plus shipping and tax. ...,City of Toronto,16/09/2020,2020-10-06 12:14:43.842137
1524332642,/v-snowboard/city-of-toronto/k2-cinch-ts-bindings/1524332642,150.0,K2 Cinch TS Bindings,,K2 Cinch TS Large Used 4 times Can be used as rear entry or normal strap in $150,City of Toronto,16/09/2020,2020-10-06 12:14:43.842713
1486315336,/v-snowboard/city-of-toronto/o-neill-ski-snowboard-jacket-youth-size-164/1486315336,45.0,O’Neill Ski/Snowboard Jacket - youth size 164,,"In excellent condition! I’m a womens xs/s and it fits me fine with plenty of room! 10Kmm waterproof rating, 2 layer shell.",City of Toronto,15/09/2020,2020-10-06 12:14:43.843303
1524240671,/v-snowboard/city-of-toronto/powderidge-30-crest-snowshoes-k2-brand-new-aluminum/1524240671,75.0,Powderidge 30 CREST snowshoes K2 BRAND NEW Aluminum,,"Men'S or Women'S Specific Snowshoes With 6000 Series Aluminum Frame, Durable Polyurethane Deck, Aluminum Cleat, Easy To Use & Secure Binding System With Rotating Toe Cord Suspension. retail you will ...",City of Toronto,15/09/2020,2020-10-06 12:14:43.843839
1524200384,/v-snowboard/city-of-toronto/snowboarding-kit/1524200384,350.0,SNOWBOARDING KIT,,"Rossignol Reserve 148 snowboard (5' - 5'5ft) DAKINE BAG Burton boots size US 7 true fit (no laces, just pull to tighten) Burton Citizen bindings true fit ❄ $350 for the kit obo ❄ All in v good ...",City of Toronto,15/09/2020,2020-10-06 12:14:43.844592
1509965227,/v-snowboard/city-of-toronto/complete-snowboard-bindings-boots-like-new/1509965227,300.0,Complete Snowboard/Bindings/Boots (Like New),,"The snowboard set includes a Nitro Prime Agent snowboard (2010/11) with Salomon snowboard boots which are size 13.5, with Raiden quick release bindings, Oakley goggles and a Sanction board bag with 2 ...",City of Toronto,15/09/2020,2020-10-06 12:14:43.845092
1511789315,/v-snowboard/city-of-toronto/complete-roof-rack-system-w-bike-snowboard-attachments/1511789315,850.0,COMPLETE Roof Rack System w/ Bike & Snowboard Attachments,,"This is a COMPLETE Yakima Roof Rack System w/ ONE full rack set (front and back, including the towers and bars) TWO bike attachments and ONE PowderHound ski/snowboard attachment. I also have FOUR ...",City of Toronto,15/09/2020,2020-10-06 12:14:43.845587
1524048072,/v-snowboard/city-of-toronto/women-snowboard-jacket/1524048072,20.0,Women Snowboard Jacket,,Beige Jacket for Sport Ski or Snowboard - Contains many pockets. Has some worns on the sleeves. Besides that is in overall good condition.,City of Toronto,14/09/2020,2020-10-06 12:14:43.846088
1524041484,/v-snowboard/city-of-toronto/ski-snowboard-goggles/1524041484,15.0,Ski/Snowboard Goggles,,"Scott Clear Lens Goggle $15 Uvex Tinted Goggle $15 Kranked Dark Lens Goggle $15 No Scratches, Good Condition",City of Toronto,14/09/2020,2020-10-06 12:14:43.846592
1524031485,/v-snowboard/city-of-toronto/fortrus-snowskate-brand-new/1524031485,100.0,Fortrus Snowskate BRAND NEW,,"The Fortrus Snowskate is brand new and has never been used. This board is ideal for local hills, backyard or backcountry use. - Molded polymer deck. - Grip top is a soft grip with a yellow/black ...",City of Toronto,14/09/2020,2020-10-06 12:14:43.847120
1524025281,/v-snowboard/city-of-toronto/gilaffe-snowboard-deck/1524025281,400.0,Gilaffe Snowboard Deck,,"Selling my gilaffe snowboard deck, still in plastic, never been risen before. Purpose for selling is because it’s a bit to short for my liking. Six bolt binding pattern. Considered a low rider camber ...",City of Toronto,14/09/2020,2020-10-06 12:14:43.847616
1524009269,/v-snowboard/city-of-toronto/snowboard-and-boots-wanted-gone-asap/1524009269,140.0,Snowboard and boots wanted gone asap,,Board in good condition other than a few scratches. One boot has a tear in the side but it doesn’t let in any water. Boots size 10.5-11. $140 or best offer.,City of Toronto,14/09/2020,2020-10-06 12:14:43.848139
1487620031,/v-snowboard/city-of-toronto/brand-new-dragon-alliance-black-deer-ski-snowboard-goggles/1487620031,70.0,Brand New Dragon Alliance Black/Deer ski/snowboard goggles,,"Tags: hunting Oakley Scott smith spy snowmobile bike snowboarding, skiing, vonzipper downhill anon, spider, spyder, atomic, volkl, Lange, mod 3, 5, prizm, woman, children, youth, man, canopy, mx, ...",City of Toronto,14/09/2020,2020-10-06 12:14:43.848647
1467684812,/v-snowboard/city-of-toronto/brand-new-burton-mission-est-bindings-medium-size/1467684812,220.0,Brand new Burton Mission EST bindings - MEDIUM SIZE,,Brand new sets of bindings for EST snowboards. Hard to find colours. Medium size fits US size 8-11,City of Toronto,14/09/2020,2020-10-06 12:14:43.849136
1502993448,/v-snowboard/city-of-toronto/ladies-northwave-vintage-snowboarding-boots/1502993448,70.0,LADIES NORTHWAVE VINTAGE SNOWBOARDING BOOTS,,"USED, IN GOOD SHAPE SIZE 36.5",City of Toronto,13/09/2020,2020-10-06 12:14:43.849634
1502992868,/v-snowboard/city-of-toronto/new-mens-burton-moto-snowboard-boots/1502992868,155.0,NEW MENS BURTON MOTO SNOWBOARD BOOTS,,"NEVER USED, PERFECT SHAPE SIZE 11",City of Toronto,13/09/2020,2020-10-06 12:14:45.757136
1523901472,/v-snowboard/city-of-toronto/burton-grom-youth-jr-snowboard-bindings-near-new-size-1-3/1523901472,60.0,Burton Grom youth jr snowboard bindings - near NEW - size 1-3,,Used only a few times and in perfect condition. Fits youth size 1-3. Unisex black colour. Quality built binding by Burton - a cinch to put on/off via single a supportive slap rachet strap. Paid $150. ...,City of Toronto,13/09/2020,2020-10-06 12:14:45.757731
1485752018,/v-snowboard/city-of-toronto/oakley-canopy-prizm-technology-goggles/1485752018,150.0,Oakley Canopy Prizm Technology Goggles,,9.5/10 condition. Oakley Canopy Prizm Goggles LENS: Black Iridium Prizm FRAME: MATTE Black Will post actual pics later. https://www.oakley.com/en-us/prizm/snow,City of Toronto,13/09/2020,2020-10-06 12:14:45.758305
1523879661,/v-snowboard/city-of-toronto/mens-size-8-snowboarding-boots-like-new-forum/1523879661,100.0,Men's Size 8 Snowboarding Boots (like new) - Forum,,Men's Forum Stunner snowboarding boots with quick lace system. Three tugs and you're done. Size 8. Perfect condition. Purchased new and never used due to being a size smaller than advertised (i.e. ...,City of Toronto,13/09/2020,2020-10-06 12:14:45.759146
1523874904,/v-snowboard/city-of-toronto/snowboard-equipment-for-sale/1523874904,550.0,Snowboard Equipment for sale,,"1. Snowboard - Flow Quantum, length 59"" / 150 cm 2. Bindings - Burton 3. Boots - Solomon Faction, size 10 Boots can be sold separately",City of Toronto,13/09/2020,2020-10-06 12:14:45.759678
1523870977,/v-snowboard/city-of-toronto/womens-snowboarding-boots-lightly-used-size-6/1523870977,100.0,Women's Snowboarding Boots (lightly used) - Size 6,,"K2 Sapera snowboarding boots, with a ""cable and reel"" lacing system to allow for quick and easy lacing. Just twist to tighten. Women's size 6. Excellent condition. Used less than one season.",City of Toronto,13/09/2020,2020-10-06 12:14:45.760451
1523870803,/v-snowboard/city-of-toronto/snowboard-siphon/1523870803,80.0,SNOWBOARD Siphon,,Snowboard siphon with bindings Gently used 1 season,City of Toronto,13/09/2020,2020-10-06 12:14:45.761260
1523826382,/v-snowboard/city-of-toronto/salomon-f20-womens-snowboard-boots-size-7-or-7-5-like-new/1523826382,80.0,Salomon F20 Womens Snowboard boots size 7 or 7.5 - Like new,,"An amazing high-end intermediate riding boot. Superior comfort (blows away any Burton, Vans, DC boot) and much warmer too. As a snowboard instructor, fit and heel lock are key to helping my students ...",City of Toronto,13/09/2020,2020-10-06 12:14:45.761777
1523822758,/v-snowboard/city-of-toronto/snowboard-boots:-like-new-salamon-pearl-size-8-5/1523822758,35.0,Snowboard Boots: LIKE NEW! Salamon Pearl Size 8.5,,High quality snowboard boots Used only 1 season,City of Toronto,13/09/2020,2020-10-06 12:14:45.762279
1523794864,/v-snowboard/city-of-toronto/womans-snowboard-and-boots-almost-brand-new/1523794864,200.0,Woman's Snowboard and Boots (almost brand new),,Morrow Mantra 148cm snowboard with matching bindings in great condition. Also a pair of K2 Sundit in size 8.5 in excellent condition. Almost brand new!! Never been molded so can be formed to fit your ...,City of Toronto,13/09/2020,2020-10-06 12:14:45.762796
1523787963,/v-snowboard/city-of-toronto/ride-dh-snowboard-union-data-bindings/1523787963,250.0,Ride DH Snowboard & Union Data bindings,,Great for a park rat or beginner. Solid setup for any type of rider looking to get ready for the upcoming season. Ride DH Snowboard (151cm) and Union/Burton Data (men's large) Frankenstein bindings. ...,City of Toronto,13/09/2020,2020-10-06 12:14:45.763364
1523787924,/v-snowboard/city-of-toronto/signal-yup-snowboard-with-burton-bindings/1523787924,500.0,Signal Yup Snowboard with Burton Bindings,,Used for a year then stored away. Moving and won't be able to ride anymore. Great all mountain board. Stable at speeds and carves like butter Asking 500,City of Toronto,13/09/2020,2020-10-06 12:14:45.764100
1523706313,/v-snowboard/city-of-toronto/burton-snowboard-and-bindings/1523706313,200.0,Burton snowboard and bindings,,"Burton snowboard and bindings, 140cm, Very good condition",City of Toronto,13/09/2020,2020-10-06 12:14:45.764915
1502628807,/v-snowboard/city-of-toronto/snowboard-kids/1502628807,40.0,Snowboard kids,,"Kids snowboard with handlebar, excellent condition 39 inches long 9 inches wide Handle is 9 inches high Handle folds for storage",City of Toronto,13/09/2020,2020-10-06 12:14:45.765477
1502605808,/v-snowboard/city-of-toronto/head-flair-snowboarding-boots-ladies-size-7/1502605808,35.0,"Head Flair Snowboarding boots (Ladies, Size 7)",,"Great starting boots! Well made, comfortable. Selling because I bought another pair. 8/10 condition. Pick up from Bloor West Village.",City of Toronto,12/09/2020,2020-10-06 12:14:45.765991
1502605634,/v-snowboard/city-of-toronto/smith-allure-ski-and-snowboard-helmet-size-s/1502605634,45.0,Smith Allure Ski and Snowboard Helmet (size S),,"Smith Allure Helmet, Size S (54-56 cms). In very good condition. Has not taken any bangs or scratches. Comes with secure latch for Goggles. Colour is gray and yellow (see pic). Includes zip pouches ...",City of Toronto,12/09/2020,2020-10-06 12:14:45.766497
1523640887,/v-snowboard/city-of-toronto/snowboard-with-binders-great-condition/1523640887,60.0,Snowboard with binders - great condition,,147cm board with binders Barely used few times,City of Toronto,12/09/2020,2020-10-06 12:14:45.767019
