,url,price,title,distance,description,location,time_offset,retreived
1467752895,/v-baby-clothes-12-18-months/city-of-toronto/zara-toddler-shoes-size-23/1467752895,10.0,Zara Toddler Shoes size 23,,Zara Toddler Shoes size 23,City of Toronto,20/09/2020,2020-10-06 11:42:21.500569
1525112284,/v-baby-clothes-12-18-months/city-of-toronto/bag-of-used-girl-clothes-size-18-months/1525112284,25.0,Bag of Used Girl Clothes Size 18 Months,,"I have a bag of girl’s clothes, size 18 months. It is not an entire wardrobe, but there is a good assortment. Asking $25. Smoke-free, pet-free, COVID-free home. Please be sure to check out my other ...",City of Toronto,20/09/2020,2020-10-06 11:42:21.501058
1525075492,/v-baby-clothes-12-18-months/city-of-toronto/deux-par-deux-winter-snow-suit-12m-18m/1525075492,50.0,Deux par deux winter snow suit 12m-18m,,Selling our amazing deux par deux baby snow suit. This amazing Montreal based company makes the most incredibly warm and durable kids snow suits. This snow suit served us in the coldest of weather. ...,City of Toronto,20/09/2020,2020-10-06 11:42:21.501557
1508462039,/v-baby-clothes-12-18-months/city-of-toronto/graco-pack-n-play-with-bassinet-change-table/1508462039,40.0,Graco Pack 'n Play with Bassinet & Change Table,,"Great condition Includes : - Music and Night light - Provides a comfy place to lounge and play as baby grows from infant to toddler - Newborn Lounger creates a cozy, dedicated spot for baby to rest - ...",City of Toronto,20/09/2020,2020-10-06 11:42:21.502045
1504017899,/v-baby-clothes-12-18-months/city-of-toronto/new-stride-rite-white-leather-toddler-sandals-size-5-21-eur/1504017899,20.0,NEW Stride Rite white leather toddler sandals size 5 / 21 EUR,,"Brand new in box, purchased wrong size",City of Toronto,20/09/2020,2020-10-06 11:42:21.502540
1502545227,/v-baby-clothes-12-18-months/city-of-toronto/pediped-originals-baby-shoes-6-months/1502545227,25.0,Pediped Originals Baby Shoes 6 months,,Pediped Originals Baby Shoes - boys size 6 months Man-made material upper Breathable leather lining All leather soft-sole with slip resistant diamond tread Casual sneaker style with Velcro® closure ...,City of Toronto,19/09/2020,2020-10-06 11:42:21.503040
1525022791,/v-baby-clothes-12-18-months/city-of-toronto/gap-baby-coldcontrol-ultra-max-down-bundler-12-18mos/1525022791,25.0,Gap Baby ColdControl Ultra Max Down Bundler 12-18mos,,"Pre-owned, in excellent condition. No stains or tears. Fully functioning zippers. Two front zippers at upper half. Convertible zipper at bottom. Zip together or zip separately for pants. Size 12-18 ...",City of Toronto,19/09/2020,2020-10-06 11:42:21.503527
1525004543,/v-baby-clothes-12-18-months/city-of-toronto/stonz-boots-with-fleece-liner-large/1525004543,25.0,STONZ Boots with Fleece Liner LARGE,,"Purple STONZ Booties with fleece lined - $25 Normally Fleece inserts sell for $20 new, botties $40 so great deal! Pet free, smoke free and bug free home :) Porch Pickup from Ossington and Davenport",City of Toronto,19/09/2020,2020-10-06 11:42:21.504016
1503522504,/v-baby-clothes-12-18-months/city-of-toronto/blue-nike-sweater-size-18m/1503522504,10.0,Blue Nike Sweater Size 18M,,Blue Nike sweater size 18M Like New gently used condition contactless pickup Woodbine and Lumsden area $10,City of Toronto,19/09/2020,2020-10-06 11:42:21.504504
1524949157,/v-baby-clothes-12-18-months/city-of-toronto/infant-and-toddler-fall-and-winter-clothes/1524949157,10.0,Infant and Toddler fall and winter clothes,,Pic 2: Baby gap hoodie unisex Size 3-6 months $5 Pic 3: Navy blue Janie and Jack fall trench coat Size: 12-24 $15 Pic 4: Pink Baby Gap fleece onesie Size 3-6 months $10 Pic 5: Purple Roots onesie ...,City of Toronto,19/09/2020,2020-10-06 11:42:21.505070
1524896675,/v-baby-clothes-12-18-months/city-of-toronto/baby-shortalls-12-18-months/1524896675,5.0,Baby Shortalls — 12-18 Months,,* PICK UP near Victoria Park & Eglinton * - EUC (excellent used condition) - Cute short overalls with adjustable button straps and snaps at the bottom for easy diaper changes - From a smoke-free and ...,City of Toronto,19/09/2020,2020-10-06 11:42:21.505567
1524894640,/v-baby-clothes-12-18-months/city-of-toronto/baby-suspender-pants-12-18-months/1524894640,5.0,Baby Suspender Pants — 12-18 Months,,* PICK UP near Victoria Park & Eglinton * - GUC (good used condition) - Cute baby jeans with detachable suspenders - From a smoke-free and pet-free home Please see my other listings for more baby ...,City of Toronto,19/09/2020,2020-10-06 11:42:21.506055
1524855638,/v-baby-clothes-12-18-months/city-of-toronto/baby-dr-martens-black-patent-leather-boots-us-4-18m-new/1524855638,40.0,Baby Dr Martens Black Patent Leather Boots - US 4 (18M) NEW,,"Doc Martens black patent leather boots for baby, size US 4 (approx ~18M, 4.86""). Side zip access. New in box, never worn. Retail price $70+ Pick up and cash only. Due to Covid trying on will not be ...",City of Toronto,19/09/2020,2020-10-06 11:42:21.506544
1524834828,/v-baby-clothes-12-18-months/city-of-toronto/roots-baby-boy-zipper-hoodie-and-sweatpants-large-12-18mo/1524834828,6.0,"Roots Baby Boy zipper hoodie and sweatpants, Large (12-18mo)",,"Roots fleece-lined zippered hoodie $10. Roots fleece-lined sweatpants $6. Or, both for $14. Both gently worn and well taken-care of. Cozy and will keep your little guy comfy all day long.",City of Toronto,18/09/2020,2020-10-06 11:42:21.507051
1524798415,/v-baby-clothes-12-18-months/city-of-toronto/12-18-months-leather-slippers-joe-fresh/1524798415,8.0,12 -18 MONTHS LEATHER SLIPPERS JOE FRESH,,In Great Condition Size 12 - 18 months Leather Slippers Joe Fresh Pet and Smoke free home,City of Toronto,18/09/2020,2020-10-06 11:42:21.507542
1524793250,/v-baby-clothes-12-18-months/city-of-toronto/6t-old-navy-toddler-shoes/1524793250,10.0,6T OLD NAVY TODDLER SHOES,,In Good Condition WATER PROOF AND BREATHABLE Very comfortable and easy to slip on and off SIZE 6T,City of Toronto,18/09/2020,2020-10-06 11:42:21.508037
1524790767,/v-baby-clothes-12-18-months/city-of-toronto/size-4c-nike-toddler-sneakers/1524790767,15.0,Size 4C NIKE Toddler Sneakers,,"In Good Condition Some stains on one of the shoes, but they are not easily identified Pet and smoke free home",City of Toronto,18/09/2020,2020-10-06 11:42:21.508527
1524784575,/v-baby-clothes-12-18-months/city-of-toronto/custom-onsies-shirts/1524784575,20.0,Custom Onsies & shirts,,Custom made personalized baby onesies or t- shirts. 100% cotton. Share you ideas with me and I’ll make it happen. Great for birth / sibling announcements. Make fabulous one of a kind shower or ...,City of Toronto,18/09/2020,2020-10-06 11:42:21.509020
1524782643,/v-baby-clothes-12-18-months/city-of-toronto/oshkosh-one-piece-snowsuit-12-month/1524782643,35.0,OshKosh One piece Snowsuit 12 Month,,"One Piece Snowsuit, size 12 month, OshKosh, rated for -30, with removable mittens and booties. As good as new, worn only once. Extremely good condition.",City of Toronto,18/09/2020,2020-10-06 11:42:21.509563
1524782407,/v-baby-clothes-12-18-months/city-of-toronto/brand-new-12-18m-clothes/1524782407,15.0,Brand new 12-18M clothes,,All brand new. All size:12-18M $ 15 each,City of Toronto,18/09/2020,2020-10-06 11:42:21.510353
1524763421,/v-baby-clothes-12-18-months/city-of-toronto/grobag-and-aden-anais-sleep-sacks-sleepsac/1524763421,10.0,Grobag and Aden Anais Sleep Sacks Sleepsac,,"Pic 1: Grobag 6-18 month 2.5 TOG: $15 for both Pic 2: Aden and Anais 12-18 month 1.0 TOG (pink trim) : $10 From a smoke free, pet free home. Porch pickup.",City of Toronto,18/09/2020,2020-10-06 11:42:21.511087
1524751191,/v-baby-clothes-12-18-months/city-of-toronto/geox-toddler-shoes-size-5-21-for-15/1524751191,15.0,Geox toddler shoes size 5(21) for$15,,Like new condition. Free pets and smokes home. Welcome to see my other kids shoes. Porch pick up at anytime near by Eglinton and Kipling,City of Toronto,18/09/2020,2020-10-06 11:42:21.511588
1524747074,/v-baby-clothes-12-18-months/city-of-toronto/icoo-grow-with-me-123/1524747074,200.0,iCoo Grow With Me 123,,i’coo Grow With Me 1-2-3. Retail:$499 3 in 1. Easy-to-use. Light weight. Portable. Very good condition. Like new. 0 to 3 age. Bassinet to Bouncer Chair with music and vibration to High Chair Please ...,City of Toronto,18/09/2020,2020-10-06 11:42:21.512086
1524727797,/v-baby-clothes-12-18-months/city-of-toronto/toddler-geox-boys-shoes-size-6-5/1524727797,15.0,"Toddler Geox boys shoes size 6,5",,Good condition. Light up. Porch pick up at anytime near by Eglinton and Kipling. Welcome to see my other kids shoes and clothes,City of Toronto,18/09/2020,2020-10-06 11:42:21.512586
1486150569,/v-baby-clothes-12-18-months/city-of-toronto/12-18m-toddler-onesies/1486150569,8.0,12-18m Toddler onesies,,Toddler onesies in excellent used condition. The purple one is in good condition. Size 12-18months. Porch pick up Woodbine and Danforth. Etransfer only atm. Thnx!,City of Toronto,18/09/2020,2020-10-06 11:42:21.513089
1524649712,/v-baby-clothes-12-18-months/city-of-toronto/baby-toddler-sleepers-pajamas-18m/1524649712,10.0,Baby Toddler Sleepers / Pajamas (18m),,"Very cute sleepers for toddlers. Size is 18 months. In good condition, no stain no tear. Contactless pick up only near Yonge and Finch. We do not handle cash and will only accept email bank transfer. ...",City of Toronto,17/09/2020,2020-10-06 11:42:21.513582
1524647695,/v-baby-clothes-12-18-months/city-of-toronto/hatley-winter-snow-one-piece-suit-12-18m/1524647695,40.0,Hatley winter snow one piece suit (12-18m),,"Brand new condition, super cute snow suit from Hatley. Size is 12-18 months. Contactless pick up only near Yonge and Finch. We do not handle cash and will only accept email bank transfer. Pet free, ...",City of Toronto,17/09/2020,2020-10-06 11:42:21.514077
1524642680,/v-baby-clothes-12-18-months/city-of-toronto/lion-halloween-costume-12-18-months-20/1524642680,20.0,Lion Halloween Costume 12-18 months $20,,Gap Lion Costume in excellent condition. You pick up around Keele and Sheppard. $20,City of Toronto,17/09/2020,2020-10-06 11:42:21.514581
1524619285,/v-baby-clothes-12-18-months/city-of-toronto/snowsuit-12-18months/1524619285,15.0,Snowsuit (12-18months),,Very warm and suitable for cold winters. Used but in excellent condition. Pick up at Bathurst and Lakeshore,City of Toronto,17/09/2020,2020-10-06 11:42:21.515150
1524619002,/v-baby-clothes-12-18-months/city-of-toronto/fall-jacket-12-18-months/1524619002,10.0,Fall jacket (12-18 months),,Used but in great condition. Pick up at Bathurst and Lakeshore,City of Toronto,17/09/2020,2020-10-06 11:42:21.515646
1524618082,/v-baby-clothes-12-18-months/city-of-toronto/toddler-shoes/1524618082,5.0,Toddler shoes,,"Great condition, used twice. Suitable for fall. Robeez shoes. Pick up Lakeshore and Bathurst",City of Toronto,17/09/2020,2020-10-06 11:42:21.516142
1524585288,/v-baby-clothes-12-18-months/city-of-toronto/baby-girl-clothe/1524585288,15.0,Baby Girl clothe,,Very good condition. 12-18 months No pets. No smoked,City of Toronto,17/09/2020,2020-10-06 11:42:21.516643
1524578899,/v-baby-clothes-12-18-months/city-of-toronto/12m-18m-baby-girls-clothing/1524578899,15.0,12m~18m baby girl's clothing,,In good condition. Some summer clothes are included. Pet free smoke free.,City of Toronto,17/09/2020,2020-10-06 11:42:21.517131
1470327588,/v-baby-clothes-12-18-months/city-of-toronto/fleece-hat-with-velcro-closure-12-24-months/1470327588,3.0,"Fleece hat with Velcro closure, 12-24 months",,Brand the children's place Smoke free pet free home,City of Toronto,17/09/2020,2020-10-06 11:42:21.517620
1470198117,/v-baby-clothes-12-18-months/city-of-toronto/12-to-18-months-navy-blue-one-piece-hooded-snowsuit/1470198117,10.0,12 to 18 months navy blue one piece hooded snowsuit,,One piece snowsuit Excellent condition Smoke-free pet free home,City of Toronto,17/09/2020,2020-10-06 11:42:21.518111
1043026938,/v-baby-clothes-12-18-months/city-of-toronto/dora-the-explorer-plush-indoor-shoe-plush/1043026938,5.0,Dora the Explorer Plush Indoor Shoe Plush,,Dora the Explorer Plush Indoor Shoe Sandal Plush Size 5-6,City of Toronto,17/09/2020,2020-10-06 11:42:21.518611
1054155679,/v-baby-clothes-12-18-months/city-of-toronto/baby-jeans-pants-12-18-months-all-kind-of-brand-names/1054155679,4.0,Baby Jeans Pants 12-18 Months All Kind of Brand Names,,We have alot of baby clothes. Buy buy buy thats all we were doing for our little one. Pretty much different clothing everyday Prices for these will be $4 ea $15 for 4 or take all 8 of them for $25 ...,City of Toronto,17/09/2020,2020-10-06 11:42:21.519106
1292250373,/v-baby-clothes-12-18-months/city-of-toronto/halo-sleepsack-wearable-blanket-size-12-18-months/1292250373,20.0,Halo Sleepsack Wearable Blanket Size 12- 18 months,,Halo Sleepsack Wearable Blanket Size 12- 18 months in excellent condition,City of Toronto,17/09/2020,2020-10-06 11:42:21.519599
1513384070,/v-baby-clothes-12-18-months/city-of-toronto/brand-new-minimocs/1513384070,40.0,Brand new Minimocs,,"Brand new, no box blue leather mini Mocs moccasins. Size 5. Retail fur $50 plus tax. $40 cash",City of Toronto,17/09/2020,2020-10-06 11:42:21.520090
1513384390,/v-baby-clothes-12-18-months/city-of-toronto/brand-new-mini-mocs-size-5/1513384390,40.0,Brand New Mini Mocs Size 5,,"As described. Grey, brand new without box. Size 5. Retails for $50 plus tax. . Asking $40",City of Toronto,17/09/2020,2020-10-06 11:42:28.563001
1524459009,/v-baby-clothes-12-18-months/city-of-toronto/toddler-vans-shoes/1524459009,8.0,Toddler Vans Shoes,,High top with zipper Size 6 $8,City of Toronto,16/09/2020,2020-10-06 11:42:28.563501
1513787286,/v-baby-clothes-12-18-months/city-of-toronto/aqua-dry-bucket-hat-toddler-hat/1513787286,10.0,Aqua Dry Bucket Hat toddler hat,,"Super cute toddler hat, hat is reversible with I’m a hoot and Early Bird. Hat has a chin strap for windy days or a day at the beach. Hat was purchased at West Coast Kids.",City of Toronto,16/09/2020,2020-10-06 11:42:28.563998
1503081336,/v-baby-clothes-12-18-months/city-of-toronto/bnib-jack-lily-12-18-months-baby-shoes-sz-5-5-6-5/1503081336,15.0,BNIB Jack & Lily 12-18 months baby shoes (sz. 5.5 - 6.5),,"Brand new in box Jack & Lily baby shoes, size 5.5 - 6.5 (12-18 months). ***** Hand crafted from genuine and vegan leather • Equipped with signature super-flex sole, made to give and stretch. The ...",City of Toronto,16/09/2020,2020-10-06 11:42:28.564512
1513654110,/v-baby-clothes-12-18-months/city-of-toronto/assorted-clothing-for-12-18-months-1-each/1513654110,1.0,Assorted clothing for 12-18 months - $1 each!!!,,"Assorted clothing for 12-18 months. 47 pieces to choose from, including onsies, tops and pants + 2 sets. In very good condition. $1 each!!! Pick what you like! From a pet free and smoke free home. ...",City of Toronto,15/09/2020,2020-10-06 11:42:28.565011
1501520696,/v-baby-clothes-12-18-months/city-of-toronto/infant-baby-12-18-months-simple-lion-costume-2-pc-jumpsuit-hat/1501520696,10.0,Infant Baby 12-18 Months simple Lion Costume 2 Pc Jumpsuit & Hat,,Infant Baby 12-18 Months simple Lion Costume 2 Pieces Jumpsuit and Hat by Tiny Treats,City of Toronto,15/09/2020,2020-10-06 11:42:28.565570
1524254640,/v-baby-clothes-12-18-months/city-of-toronto/stride-rite-shoes-toddler-size-4-5-m-euc/1524254640,8.0,Stride Rite shoes toddler size 4.5 M EUC,,"Excellent condition, lightly used when in between sizes. Best shoes for new walkers, very flexible and comfortable. APMA approved brand",City of Toronto,15/09/2020,2020-10-06 11:42:28.566071
1524103223,/v-baby-clothes-12-18-months/city-of-toronto/bnwt-children-s-place-baby-snowsuit-12-18-mos-bunting-suit/1524103223,35.0,Bnwt Children’s place Baby snowsuit 12-18 mos bunting suit,,Brand new with tags never used Gender neutral navy blue bunting suit/ snow suit. Size is 12-18 mos. Pick up midland and Eglinton,City of Toronto,14/09/2020,2020-10-06 11:42:28.566572
1524074059,/v-baby-clothes-12-18-months/city-of-toronto/kids-baby-girl-clothing/1524074059,33.0,Kids- Baby Girl Clothing,,Baby Girl clothing Size 12 Month Hand Made Never used So gorgeous Don`t miss out!,City of Toronto,14/09/2020,2020-10-06 11:42:28.567072
1503007195,/v-baby-clothes-12-18-months/city-of-toronto/baby-boy-lot-12-18-months/1503007195,60.0,Baby boy lot (12-18 months),,"PORCH PICK UP DURING COVID19 SOCIAL DISTANCING. Beautiful good quality clothes, in great used condition. 12-18 months - everything in pics + few more that I tossed in after, including a raincoat (at ...",City of Toronto,14/09/2020,2020-10-06 11:42:28.567568
1524025521,/v-baby-clothes-12-18-months/city-of-toronto/baby-girl-jacket/1524025521,10.0,Baby girl jacket,,Almost new No pets. No smoked,City of Toronto,14/09/2020,2020-10-06 11:42:28.568071
1524020248,/v-baby-clothes-12-18-months/city-of-toronto/overalls-12-24-months/1524020248,10.0,Overalls 12-24 months,,Three pairs of very cute overalls various sizes between 12-24 months. See photos for sizes and brands. $10 for all three pairs.,City of Toronto,14/09/2020,2020-10-06 11:42:28.568581
1524019214,/v-baby-clothes-12-18-months/city-of-toronto/sweaters-12-24-months/1524019214,5.0,Sweaters 12-24 months,,Four sweaters varied sizes between 12-24 months. Good used condition. See photos for brands and sizes.,City of Toronto,14/09/2020,2020-10-06 11:42:28.569077
1524018624,/v-baby-clothes-12-18-months/city-of-toronto/dress-shirts-for-12-24-months/1524018624,5.0,Dress shirts for 12-24 months,,Adorable dress shirts. Left- Gymboree 12-18 months Right- Osh kosh 24 months. $5 total for both.,City of Toronto,14/09/2020,2020-10-06 11:42:28.569571
1523989407,/v-baby-clothes-12-18-months/city-of-toronto/oshkosh-fall-jacket-coat-12-18-months/1523989407,15.0,Oshkosh fall jacket/coat 12-18 months,,Looks like new. From clean pet free smoke free home. Prewashed. Porch pick up. Nice for cooler fall days that are coming up so quickly. Porch pick up. Etransfer for payment.,City of Toronto,14/09/2020,2020-10-06 11:42:28.570067
1523971169,/v-baby-clothes-12-18-months/city-of-toronto/baby-snowsuit/1523971169,50.0,Baby snowsuit,,GUC Baby snowsuit 12 months Pet and smoke free home Queens Quay West and Spadina Pick up only,City of Toronto,14/09/2020,2020-10-06 11:42:28.570575
1523969322,/v-baby-clothes-12-18-months/city-of-toronto/toddler-shirt-pant-sets-12-18-months/1523969322,15.0,TODDLER SHIRT & PANT SETS (12 - 18 months),,Great condition. No stains or rips. Yellow one is Gymboree Blue one is First Impressions Both are long sleeves and long pants. Perfect for fall/winter! $15 for both Pickup near Avenue RD and Eglinton ...,City of Toronto,14/09/2020,2020-10-06 11:42:28.571090
1513363697,/v-baby-clothes-12-18-months/city-of-toronto/boys-high-top-sneakers-size-6/1513363697,5.0,Boys high top sneakers size 6,,Great condition toddler high top Old Navy runners in size 6. The shoes have a side zipper to make putting them on easier. Brown colour similar to converse.,City of Toronto,13/09/2020,2020-10-06 11:42:28.571585
1513353077,/v-baby-clothes-12-18-months/city-of-toronto/boys-squeaky-leather-shoes-size-7/1513353077,5.0,Boys Squeaky Leather Shoes size 7,,Great condition boys leather shoes by Little Squeakly Feet in size 7 for toddler. Shoes squeak so you can hear your child.,City of Toronto,13/09/2020,2020-10-06 11:42:28.572076
1513336914,/v-baby-clothes-12-18-months/city-of-toronto/baby-leather-shoes-dry-erase-book/1513336914,10.0,Baby Leather Shoes & Dry Erase Book,,Brand new Thomas the Train Baby leather slip on shoes in size 12 - 18 months. Gently played dry ease Thomas the Train Counting Fun book. Both for $10,City of Toronto,13/09/2020,2020-10-06 11:42:28.572566
1513332409,/v-baby-clothes-12-18-months/city-of-toronto/boys-hot-wheels-crocs-size-6-7-and-toy-story-water-shoes/1513332409,10.0,Boys Hot Wheels Crocs size 6/7 and Toy Story water shoes,,Great condition toddler Hot Wheels Crocs in size 6/7 and Toy Story water shoes in size 7. Both for $10.,City of Toronto,13/09/2020,2020-10-06 11:42:28.573064
1523900707,/v-baby-clothes-12-18-months/city-of-toronto/h-m-baby-pink-rain-boots-size-6-5/1523900707,10.0,H&M baby pink rain boots - size 6.5,,Good condition. No leaks! See my other listings for more shoes and clothes. Pet and smoke free home. Pick up only near Eglinton and Scarlett.,City of Toronto,13/09/2020,2020-10-06 11:42:28.573556
1523898969,/v-baby-clothes-12-18-months/city-of-toronto/patagonia-torrentshell-one-piece-rain-suit-size-12-18-months/1523898969,50.0,Patagonia torrentshell one piece rain suit - size 12-18 months,,Excellent condition - like new! Check out my other listing for rain boots! Pet and smoke free home. Pick up only near Eglinton and Scarlett.,City of Toronto,13/09/2020,2020-10-06 11:42:28.574047
1523831787,/v-baby-clothes-12-18-months/city-of-toronto/brand-new-disney-baby-winnie-the-pooh-snowsuit-sz-12-18m/1523831787,25.0,Brand new Disney baby Winnie the Pooh snowsuit sz 12-18m,,Brand new with tags. Retails $40 plus taxes. Pick up Islington and Finch area. Firm price. Thanks,City of Toronto,13/09/2020,2020-10-06 11:42:28.574533
1523830741,/v-baby-clothes-12-18-months/city-of-toronto/geox-respira-baby-sweater-12-months/1523830741,15.0,GEOX RESPIRA BABY SWEATER (12 months),,GEOX Respira sweater! Size: 12 months Pickup near Avenue rd and Eglinton Avenue **SAFE CONTACT FREE PORCH PICKUP**,City of Toronto,13/09/2020,2020-10-06 11:42:28.575045
1523828921,/v-baby-clothes-12-18-months/city-of-toronto/brand-new-baby-jacket-12-months/1523828921,25.0,BRAND NEW!  BABY JACKET (12 months),,BRAND NEW! My daughter never got to wear this as we were in a warm climate during that year. Really gorgeous in person and super soft and cozy! Pickup near Avenue rd. and Eglinton Avenue **SAFE ...,City of Toronto,13/09/2020,2020-10-06 11:42:28.575599
1523820578,/v-baby-clothes-12-18-months/city-of-toronto/baby-halloween-costume-poodle/1523820578,10.0,Baby Halloween costume - poodle,,"Baby Halloween costume - poodle. Fits up to 18 months. Only worn once. Comfortable, warm, and easy to take on and off. Weston road and highway 401 area pickup.",City of Toronto,13/09/2020,2020-10-06 11:42:28.576097
1523774786,/v-baby-clothes-12-18-months/city-of-toronto/lot-of-4-euc-carters-18mo-long-sleeved-onsies/1523774786,10.0,Lot of 4 EUC Carter's 18mo long-sleeved onsies,,"Perfect for fall, four neutral coloured long-sleeved onsies by Carter's, size 18 months. Some slight wear, no stains. Excellent used condition. Pick-up only, Greenwood and Dundas.",City of Toronto,13/09/2020,2020-10-06 11:42:28.576658
1523769317,/v-baby-clothes-12-18-months/city-of-toronto/12-18m-halloween-costume/1523769317,20.0,12-18m Halloween costume,,$10 each. Prefer to sell as a pair 12-18m zip up costumes Contactless pick up at DVP and Lawrence,City of Toronto,13/09/2020,2020-10-06 11:42:28.577163
1523761163,/v-baby-clothes-12-18-months/city-of-toronto/toddler-clothes-6-18-months/1523761163,10.0,Toddler clothes (6-18 months),,Excellent condition. Clean. Downtown pick up.,City of Toronto,13/09/2020,2020-10-06 11:42:28.577655
1523753005,/v-baby-clothes-12-18-months/city-of-toronto/pajama-18m-winter/1523753005,3.0,pajama 18M winter,,Pick up at blue jays center,City of Toronto,13/09/2020,2020-10-06 11:42:28.578143
1523749238,/v-baby-clothes-12-18-months/city-of-toronto/pajama-18m/1523749238,3.0,Pajama 18M,,Pick up at blue jays center.,City of Toronto,13/09/2020,2020-10-06 11:42:28.578670
1502594902,/v-baby-clothes-12-18-months/city-of-toronto/4-euc-18m-summer-dresses/1502594902,15.0,4 EUC 18m summer dresses,,All in excellent condition. Only worn a few times. Top Left- Samantha Says Top Right- Children’s Place Bottom Left- Deux Par Deux Bottom Right- Lili Gaudrette Smoke free home. $15. Pick up Port ...,City of Toronto,13/09/2020,2020-10-06 11:42:28.579178
1523710131,/v-baby-clothes-12-18-months/city-of-toronto/carter-s-llama-baby-halloween-costume-18-months-like-new/1523710131,14.0,Carter’s Llama baby Halloween costume 18 months Like-New,,"The most adorable baby costume! Perfect condition, worn once just for pictures. Comes with top and tights. Top is brand new, never worn. Washed with unscented detergent and air dried. Smoke-free home",City of Toronto,13/09/2020,2020-10-06 11:42:28.579679
1523657618,/v-baby-clothes-12-18-months/city-of-toronto/baby-sleepsack-gro-bag-6-18-months-1-0-tog/1523657618,20.0,"Baby sleepsack, Gro bag, 6-18 months, 1.0 tog",,"Excellent condition, barely used Baby sleepsack, Gro bag, 6-18 months, 1.0 tog TWO available - $20 each",City of Toronto,12/09/2020,2020-10-06 11:42:28.580171
1523657030,/v-baby-clothes-12-18-months/city-of-toronto/baby-sleepsack-gro-bag-6-18-months-2-5-tog/1523657030,20.0,"Baby sleepsack, Gro bag, 6-18 months, 2.5 tog",,"Excellent condition, barely used Gro bag, 6-18 months, 2.5 tog TWO available - $20 each",City of Toronto,12/09/2020,2020-10-06 11:42:28.580679
1523620493,/v-baby-clothes-12-18-months/city-of-toronto/baby-gap-minnie-mouse-winter-jacket-girls-12-18-month/1523620493,30.0,Baby Gap Minnie Mouse winter jacket (girls 12-18 month),,"Super-adorable girls' Minnie Mouse puffer jacket. Features Minnie Mouse ears and bow on hood! Excellent used condition—barely worn! Retails for $60 + tax. Comes from a smoke-free, pet-free, ...",City of Toronto,12/09/2020,2020-10-06 11:42:28.581177
1523558638,/v-baby-clothes-12-18-months/city-of-toronto/cute-toddler-sweater-with-zipper-18m/1523558638,6.0,Cute toddler sweater with zipper ( 18M ),,Very cute toddler snowflakes sweater! (18M ) Very good condition Pick up only at Davisville × Mt. Pleasant No return Please check my other ads too!,City of Toronto,12/09/2020,2020-10-06 11:42:28.581676
1512915961,/v-baby-clothes-12-18-months/city-of-toronto/euc-baby-shoes-size-4-5/1512915961,20.0,EUC Baby Shoes size 4.5,,EUC Clark’s sandals. Size 4.5. Contactless porch pick up. Yonge and Lawrence. Purchased for $65 + tax but our little guy grew right out of them!,City of Toronto,11/09/2020,2020-10-06 11:42:28.582175
