,url,price,title,distance,description,location,time_offset,retreived
1522037515,/v-mountain-bike/city-of-toronto/adult-bike-80/1522037515,80.0,Adult bike $80,,Adult bike for sale Works fine Couple of years old Good Brakes (Picture 5) Front gear handle only Where the wire attached broke (fixable) No big issue,City of Toronto,04/09/2020,2020-10-07 00:29:01.730099
1511267784,/v-mountain-bike/city-of-toronto/bike-repair-around-north-york/1511267784,1.0,Bike Repair Around North York,,Any kind of bicycle Repair,City of Toronto,04/09/2020,2020-10-07 00:29:01.730801
1521977830,/v-mountain-bike/city-of-toronto/26-bike-for-sale-30/1521977830,30.0,"26""  bike for sale $30",,"Selling bike with 26"" dia wheels. Tires still in good condition. Rear break cable stuck. $30 OBO.",City of Toronto,04/09/2020,2020-10-07 00:29:01.731294
1521951920,/v-mountain-bike/city-of-toronto/bike-for-sale-size-l/1521951920,125.0,Bike for sale - Size L,,Used Bike for Sale Still in great Rideable condition Comes as is ; Front break works perfect Back break very soft Has some rust on front shocks Tires are good but need a little air When riding it ...,City of Toronto,04/09/2020,2020-10-07 00:29:01.731819
1521951882,/v-mountain-bike/city-of-toronto/bike-for-sale-size-m/1521951882,125.0,Bike for sale - Size M,,"Used Bike for Sale Still in great Rideable condition Comes as is ; Everything works perfect, Tires may need some air Seat needs to be tighten in position Asking $125 Meet ups/Pick ups in North York",City of Toronto,04/09/2020,2020-10-07 00:29:01.732342
1521946458,/v-mountain-bike/city-of-toronto/moutain-bike/1521946458,250.0,Moutain bike,,250$ comes with speedometer and flashing signal in the back Bike is perfect condition Gears 10/10 Tires 9/10 Brakes 10/10 Very lightbike Pick up only,City of Toronto,03/09/2020,2020-10-07 00:29:01.732890
1511378224,/v-mountain-bike/city-of-toronto/super-cyle-dual-suspension-xti18ds-18-speed/1511378224,225.0,Super Cyle Dual suspension XTi18DS 18 speed,,Super Cyle Dual suspension XTi18DS - red and black paint in good condition - 18 speed - 26'' tires in good shape - aluminum rims - 18 inch frame - adjustable rear suspension - mercalli front ...,City of Toronto,03/09/2020,2020-10-07 00:29:01.733406
1434592006,/v-mountain-bike/city-of-toronto/arashi-comet-18-speed-mountain-bike:-as-is-sz-med-fram/1434592006,50.0,* * * ARASHI 'Comet 18-Speed Mountain Bike: AS IS (Sz. MED. Fram,,* * * ARASHI 'Comet 18-Speed Mountain Bike: AS IS (Sz. MED. Frame)' * * * *This bicycle is NOT ready to ride. *This bicycle needs parts or is a project/re-build bike. *For fast reply: Virgo416 @ mail ...,City of Toronto,03/09/2020,2020-10-07 00:29:01.733906
1521909443,/v-mountain-bike/city-of-toronto/norco-vintage-mountain-bike/1521909443,200.0,Norco vintage mountain bike,,I fixed and tune it up....restored a vintage piece. You could always add on to it if you would like but ride good clean. New brakes and tune up . Medium size frame. Asking price $200,City of Toronto,03/09/2020,2020-10-07 00:29:01.734400
1521872549,/v-mountain-bike/city-of-toronto/bicycle-for-sale-250/1521872549,250.0,Bicycle for Sale- $250,,"Bicycle for sale for adult In good working condition Brakes, gears and tires in good condition No repairs needed Has suspension See pictures for frame size, gears, etc",City of Toronto,03/09/2020,2020-10-07 00:29:01.734901
1521878383,/v-mountain-bike/city-of-toronto/supercycle-vice-dual-suspension-mountain-bike-26-in/1521878383,205.0,"Wanted:
                            Supercycle Vice Dual Suspension Mountain Bike, 26-in",,"The Supercycle Vice 26"" Dual Suspension Mountain Bike features a full suspension steel frame with shock fork and rear suspension spring for a smoother, more efficient ride. What makes it extra cool? ...",City of Toronto,03/09/2020,2020-10-07 00:29:01.735733
1521898383,/v-mountain-bike/city-of-toronto/oryx-hta125-21-speed-mountain-bike-399/1521898383,399.0,Oryx HTA125 21 Speed Mountain Bike  $399,,"Oryx HTA125 21 SpeedMountain Bike Aluminum, light weight.and in good condition. Frame Size : 18 Stand Over Height : 30 Speed : 21 speed Gear Shifter : Shimano rapid fire plus Front Derailleur : ...",City of Toronto,03/09/2020,2020-10-07 00:29:01.736703
1521897778,/v-mountain-bike/city-of-toronto/bicycle-26/1521897778,75.0,"Bicycle 26""",,"Bicycle for sale, wheel size 26"". Brakes need work but otherwise in rideable condition.",City of Toronto,03/09/2020,2020-10-07 00:29:01.737258
1521885967,/v-mountain-bike/city-of-toronto/26-inches-wheels-adult-mountain-bike/1521885967,130.0,26 inches wheels adult mountain bike.,,"26inches wheels adult mountain bike. Good condition, all work perfect, don't need fixed nothing. Weston rd/hw401",City of Toronto,03/09/2020,2020-10-07 00:29:01.737759
1511285616,/v-mountain-bike/city-of-toronto/raleigh-al-200-21-speed-fs-bike/1511285616,150.0,Raleigh AL-200 21-Speed FS Bike,,"IF THE AD IS UP, IT'S AVAILABLE. THE PRICE IS LISTED ON THE AD, IF YOU CAN'T AFFORD IT, DON'T CONTACT ME. PLEASE READ THE ENTIRE AD BEFORE INQUIRING GOOD CONDITION SEAT IS DIFFICULT TO ADJUST AT 41"" ...",City of Toronto,03/09/2020,2020-10-07 00:29:01.738254
1521868495,/v-mountain-bike/city-of-toronto/supercycle-bike/1521868495,170.0,Supercycle Bike,,"Supercycle Nitro Men's Hardtail Mountain Bike with a high-tensile steel frame Condition: Like brand new, used for 2 months only 21-speed 26"" (66 cm) tires Power grip shifters Power grip derailleurs ...",City of Toronto,03/09/2020,2020-10-07 00:29:01.738792
1521858371,/v-mountain-bike/city-of-toronto/blade-compression-full-suspension-mountain-bike-17-in/1521858371,200.0,"Blade Compression Full Suspension Mountain Bike, 17-in",,"200$ FIRM PRICE FEATURES Blade Compression Full-Suspension Mountain Bike features a 17"" aluminum frame 26"" tires 21 speed Shimano EZ-Fire shifters Shimano derailleurs Dual disc brakes Suntour ...",City of Toronto,03/09/2020,2020-10-07 00:29:01.739293
1521853942,/v-mountain-bike/city-of-toronto/supercycle-nitrous-dual-suspension-mountain-bike-26-in/1521853942,129.0,"Supercycle Nitrous Dual Suspension Mountain Bike, 26-in",,"Supercycle Nitrous Dual Suspension Mountain Bike with a high-tensile frame 26"" (66 cm) wheels 21-speed Shimano derailleur Front and rear V-brakes Three-piece crank",City of Toronto,03/09/2020,2020-10-07 00:29:01.739785
1521850384,/v-mountain-bike/city-of-toronto/great-condition-nakamura-24-inches-hardtail-mountain-bike/1521850384,120.0,*GREAT CONDITION * Nakamura 24 inches Hardtail Mountain Bike,,Nakamura Agyl 24 Hardtail Mountain Bike features a proven and sturdy high-tensile steel frame Modern geometry design offers excellent handling 30mm travel suspension fork helps smooth out the ride ...,City of Toronto,03/09/2020,2020-10-07 00:29:01.740274
1521841682,/v-mountain-bike/city-of-toronto/supercycle-ascent-18-speed-mountain-bike-26-tires/1521841682,70.0,"Supercycle Ascent 18 Speed Mountain Bike 26"" tires",,"Supercycle Ascent 18 Speed Mountain Bike 26"" tires 18"" frame Tires hold air, grips are good, pedals are good, gears all change, kick stand is good. The rear wheel has a little wobble at high speeds ...",City of Toronto,03/09/2020,2020-10-07 00:29:01.740792
1521827812,/v-mountain-bike/city-of-toronto/mongoose-bicycle-preowned/1521827812,200.0,MONGOOSE BICYCLE Preowned,,MONGOOSE BICYCLE Ready to use. I am done with cycling!,City of Toronto,03/09/2020,2020-10-07 00:29:01.741285
1510900677,/v-mountain-bike/city-of-toronto/17-raleigh-mountain-bike-21-speed-dual-suspension-like-new/1510900677,295.0,"17"" Raleigh Mountain bike 21 Speed Dual Suspension like new",,"Dual suspension very comfortable and super light unisex mountain bike Brand: Raleigh Color: Black Aluminum Almost brand new, in great condition as shown in pictures",City of Toronto,03/09/2020,2020-10-07 00:29:01.741779
1521805113,/v-mountain-bike/city-of-toronto/ccm-29er-hard-tail/1521805113,500.0,CCM 29er hard tail,,"I painted the bike this year , owned it for 2 29 inch wheels , disc brakes , new bars and grip Everything works on the bike. Just selling cause I ride on the road more so don’t need it.",City of Toronto,03/09/2020,2020-10-07 00:29:01.742476
1521790027,/v-mountain-bike/city-of-toronto/motorized-bicycle-for-sale/1521790027,750.0,Motorized bicycle for sale,,New motorized bike for sale,City of Toronto,03/09/2020,2020-10-07 00:29:05.603602
1521784997,/v-mountain-bike/city-of-toronto/nakamura-ecko-mountain-biycle/1521784997,175.0,Nakamura Ecko mountain biycle,,"Selling a good condition bike. 26"" tires.",City of Toronto,03/09/2020,2020-10-07 00:29:05.604101
1521781765,/v-mountain-bike/city-of-toronto/raleigh-mountain-bike-52cm/1521781765,150.0,Raleigh Mountain Bike (52cm),,Barely Ridden. Very good condition. No Rust. Tuned and ready to ride.,City of Toronto,03/09/2020,2020-10-07 00:29:05.604591
1521765493,/v-mountain-bike/city-of-toronto/stolen-bike:-trek-4300-custom-cash-reward/1521765493,100.0,STOLEN BIKE: Trek 4300 Custom- CASH REWARD,,"Custom Built Trek 4300 STOLEN. Has Gold Rockshox fork, full Shimano XTR groupset and XTR V Brakes, with SRAM hydraulic Disc brakes. Also has different tires and handlebars than shown from the ...",City of Toronto,03/09/2020,2020-10-07 00:29:05.605080
1521757302,/v-mountain-bike/city-of-toronto/scott-demo-series-970-small-size/1521757302,1000.0,SCOTT DEMO SERIES 970 SMALL SIZE,,SCOTT DEMO SERIES 970 SMALL SIZE (PRICE NEGOTIABLE) VERY GOOD CONDITION,City of Toronto,02/09/2020,2020-10-07 00:29:05.605574
1521725769,/v-mountain-bike/city-of-toronto/bicycle-jamis-coda/1521725769,300.0,Bicycle  Jamis Coda,,The Jamis Coda is a fantastic urban bicycle with well-thought- out geometry and a heads-up riding position for comfortable riding. It’s very good condition,City of Toronto,02/09/2020,2020-10-07 00:29:05.606064
1521743248,/v-mountain-bike/city-of-toronto/ccm-bike/1521743248,225.0,CCM BIKE,,Like new A steal in my opinion Used only for a couple months Payed $400+ for brand new Large size good for 5”2-6’3 Comes with a lock,City of Toronto,02/09/2020,2020-10-07 00:29:05.606588
1521725714,/v-mountain-bike/city-of-toronto/amazing-adult-mountain-bike-20-frame/1521725714,145.0,AMAZING ADULT MOUNTAIN BIKE 20 FRAME,,"LOOK AT THIS AMAZING ADULT MOUNTAIN BIKE 20 INCH FRAME 26INCH TIRES, DOUBLE SUSPENSION,SHIMANO GEARS.EVERYTHING IS WORKING NO ISSUES. READY FOR PICKUP. DON'T MISS OUT ON THIS BEAUTIFUL MOUNTAIN BIKE. ...",City of Toronto,02/09/2020,2020-10-07 00:29:05.607083
1521721847,/v-mountain-bike/city-of-toronto/bicycle/1521721847,75.0,bicycle,,excellent bike with good condition. tire size 24*1.75. beautiful color. brand new cost $450 at Canadian Tire.,City of Toronto,02/09/2020,2020-10-07 00:29:05.607571
1521710594,/v-mountain-bike/city-of-toronto/foldable-bike-26-rarely-used-like-brand-new/1521710594,750.0,Foldable bike 26” Rarely used like brand new,,"Foldable bike 26” Rarely used like brand new . Posted in bikes, mountain in City of Toronto. September 2, 2020",City of Toronto,02/09/2020,2020-10-07 00:29:05.608085
1521694355,/v-mountain-bike/city-of-toronto/giant-fathom-mountain-bike/1521694355,200.0,"Wanted:
                            Giant Fathom Mountain Bike",,"I'm looking to buy my stolen Giant Fathom mountain bike. Stolen from the front of Money Mart store, 617 Yonge St. Toronto Wed, Sept 02 about 13:30. I'll purchase it back, no questions! The enclosed ...",City of Toronto,02/09/2020,2020-10-07 00:29:05.608576
1521696266,/v-mountain-bike/city-of-toronto/ccm-savage-27-5-mountain-bike/1521696266,250.0,"Ccm savage 27.5"" mountain bike",,Decent condition 250 firm,City of Toronto,02/09/2020,2020-10-07 00:29:05.609063
1521677876,/v-mountain-bike/city-of-toronto/cherokee-mudslide-mountain-bike/1521677876,75.0,Cherokee Mudslide Mountain bike,,Old bike in moderate condition. Selling cheap and fast as is.,City of Toronto,02/09/2020,2020-10-07 00:29:05.609550
1521671201,/v-mountain-bike/city-of-toronto/gt-mountain-bike/1521671201,400.0,GT Mountain Bike,,"Adult GT Tempest Moutain Bike. Rarely used, always stored indoors, good condition. Shimano brakes.",City of Toronto,02/09/2020,2020-10-07 00:29:05.610036
1521652787,/v-mountain-bike/city-of-toronto/mountain-bike-ccm/1521652787,170.0,"Mountain bike
CCM",,"Wheels 26×2.oo Regular brakes Fits up to 5'5"" Inseam 12"" 7 speeds",City of Toronto,02/09/2020,2020-10-07 00:29:05.610524
1521652376,/v-mountain-bike/city-of-toronto/24-inch-21-speed-dual-suspension-supercycle-bike-for-90-obo/1521652376,90.0,24 inch 21 speed Dual suspension Supercycle bike for $90 obo,,Selling my old dual suspension bike for $90 or best offer! I got a new one so I do not need it anymore. It requires some tlc (as in cleaning) but still rides well! I am trying to sell it before ...,City of Toronto,02/09/2020,2020-10-07 00:29:05.611020
1521637941,/v-mountain-bike/city-of-toronto/womens-hardtale-mountain-bike-26-in/1521637941,200.0,Women's Hardtale Mountain Bike 26-in,,In brand new condition as I've only rode it twice. Was a gift and I am selling it because I don't use it. Comes with the Bicycle Owners Manuel. Tires need some air. Supercycle 1800 Women's Mountain ...,City of Toronto,02/09/2020,2020-10-07 00:29:05.611508
1521626374,/v-mountain-bike/city-of-toronto/raleigh-scout-xc-24-bicycle/1521626374,250.0,Raleigh Scout XC 24 bicycle,,Mountain bike. Good for 54”-61” tall child. Ages 9-12 approx Excellent condition. My son has become too tall...,City of Toronto,02/09/2020,2020-10-07 00:29:05.611994
1521624093,/v-mountain-bike/city-of-toronto/bear-mountain-hype-bike/1521624093,160.0,Bear mountain hype bike,,There is nothing to be said but it is just a really nice bike but i need the money,City of Toronto,02/09/2020,2020-10-07 00:29:05.612478
1510802980,/v-mountain-bike/city-of-toronto/new-mountain-bike-youth-5-speed-20/1510802980,150.0,NEW Mountain Bike Youth 5 speed 20”,,Brand NEW Excellent condition Never used Super cycle Impulse Youth Bike White/Purple Multi speed mountain bike 5 speed shifting system Newly installed quality training wheels Front/rear steel V ...,City of Toronto,02/09/2020,2020-10-07 00:29:05.612967
1521542766,/v-mountain-bike/city-of-toronto/stolen-bicycle/1521542766,0.0,STOLEN BICYCLE,,"Don't buy this bicycle as it was stolen from Eaton center downtown Toronto ,if any information please call me on 6478344700",City of Toronto,02/09/2020,2020-10-07 00:29:05.613455
1376209346,/v-mountain-bike/city-of-toronto/mint-condition-specialized-downhill-mountain-bike/1376209346,700.0,Mint condition specialized  Downhill mountain bike,,"The Specialized Ground Control. 26"" wheels. 18"" frame. 24 speeds. Full adjustable suspension. In mint condition. All original. Very lightweight. The tires still have the nubs on them. Make me an ...",City of Toronto,02/09/2020,2020-10-07 00:29:05.613965
1521567221,/v-mountain-bike/city-of-toronto/trek-womens-bike-mountain-250/1521567221,250.0,TREK Women's bike (mountain) $250,,"Perfect condition... everything works, and just put new brake pads and new tire tubes. Barely used...my mom bought it in 2011 and never rode it once...so she gave it to me because all my other bikes ...",City of Toronto,02/09/2020,2020-10-07 00:29:05.614455
1521566255,/v-mountain-bike/city-of-toronto/mountain-bike/1521566255,100.0,Mountain bike,,"26” Grey bike, smooth..not much used! They gears don’t work...I don’t know how to fix them but, the cycle works fine and very smooth. Text me for quick response. ***Interested Buyers Only***",City of Toronto,02/09/2020,2020-10-07 00:29:05.614932
1521564397,/v-mountain-bike/city-of-toronto/mountain-bike/1521564397,300.0,Mountain Bike,,"- like a new 22"" Steel Mountain Bike - Designed for a rider height of 147-178 cm (58-70 in) - Front and rear steel linear pull brakes - Never been ridden outdoors",City of Toronto,02/09/2020,2020-10-07 00:29:05.615448
1521563573,/v-mountain-bike/city-of-toronto/mongoose-bike-26/1521563573,345.0,Mongoose bike 26,,Mongoose bike 26 like new,City of Toronto,02/09/2020,2020-10-07 00:29:05.615947
1521563223,/v-mountain-bike/city-of-toronto/schwinn-bike-26/1521563223,355.0,Schwinn bike 26,,Schwinn bike 26 great condition like new,City of Toronto,02/09/2020,2020-10-07 00:29:05.616442
1521546886,/v-mountain-bike/city-of-toronto/raleigh-small-bike/1521546886,50.0,Raleigh small bike,,Needs a new crank. Everything else is good. Pick up only.,City of Toronto,01/09/2020,2020-10-07 00:29:05.616937
1521470308,/v-mountain-bike/city-of-toronto/mountain-bike-for-sale-super-new-barely-ride-it-220/1521470308,220.0,Mountain Bike for Sale - Super New Barely ride it $220,,A brand new Nitro-Supercycle mountain bike that fits perfectly for medium-size adults. I only rode it twice because I had to give up my storage space and I do not have any place to store this ...,City of Toronto,01/09/2020,2020-10-07 00:29:05.617432
1521532716,/v-mountain-bike/city-of-toronto/this-is-a-great-huffy-mountain-bike-its-only-a-year-and-a-1-2/1521532716,75.0,This is a great Huffy mountain bike. It's only a year and a 1/2,,"Brand name bike, not some cheaply made bikes from this company which is Huffy. Great for either young adult or adult.",City of Toronto,01/09/2020,2020-10-07 00:29:05.617924
1521522995,/v-mountain-bike/city-of-toronto/mountain-bike/1521522995,75.0,Mountain Bike,,"This great little mountain bike runs really well, and is perfect for your little adventurer. The tires are a whopping 3"" thick for extra support, strength and traction.",City of Toronto,01/09/2020,2020-10-07 00:29:05.618419
1521521765,/v-mountain-bike/city-of-toronto/mountain-bike/1521521765,75.0,Mountain Bike,,"This great mountain bike runs well. It's perfect for older kids/mid teens. The tires are 2"" thick.",City of Toronto,01/09/2020,2020-10-07 00:29:05.618921
1521480181,/v-mountain-bike/city-of-toronto/ibis-mojo-sl/1521480181,4000.0,IBIS MOJO SL,,2018 ibis mojo hiderolic seat customized rimz,City of Toronto,01/09/2020,2020-10-07 00:29:05.619411
1521464431,/v-mountain-bike/city-of-toronto/storm-supercycle-15-speed/1521464431,70.0,Storm Supercycle 15 Speed,,Magenta Coloured Bike 15 speed Good condition Some rust Pick up Dufferin and Lawrence,City of Toronto,01/09/2020,2020-10-07 00:29:05.619897
1521457196,/v-mountain-bike/city-of-toronto/26-inch-blue-bike/1521457196,99.0,26 inch blue bike,,Blue 26 inch bike for sale. Asking $99. The rear wheel is broken and needs to be replaced. Except for the rear wheel the bike is in brand new condition. Located near Bathurst and Sheppard. If this ad ...,City of Toronto,01/09/2020,2020-10-07 00:29:05.620383
1521445441,/v-mountain-bike/city-of-toronto/kona-honzo-al-bike/1521445441,2600.0,"Wanted:
                            KONA HONZO AL bike",,KONA honzo AL bike for sale with upgraded peddles and breaks Well maintained Mature lazy owner who only used it 4 times Have the receipt and maintenance records...(tune up earlier this spring) ...,City of Toronto,01/09/2020,2020-10-07 00:29:05.620888
1521420143,/v-mountain-bike/city-of-toronto/excellent-condition-huffy-tundra-21-speed-bike/1521420143,110.0,Excellent condition Huffy Tundra 21 speed bike,,"Selling women’s bicycle, excellent condition 21 speed index shifting $110 OBO",City of Toronto,01/09/2020,2020-10-07 00:29:05.621382
1521407647,/v-mountain-bike/city-of-toronto/mountain-bike-adult-men-s/1521407647,100.0,Mountain bike (adult men’s),,CCM Scout 21 speed 19” frame size. Great condition mechanically and esthetically. Barely used.,City of Toronto,01/09/2020,2020-10-07 00:29:05.622083
1507512013,/v-mountain-bike/city-of-toronto/bike-for-sale-125/1507512013,100.0,Bike for sale $125,,Very good condition Hardly been used *serious inquires only,City of Toronto,01/09/2020,2020-10-07 00:29:05.622600
1507501072,/v-mountain-bike/city-of-toronto/bike-for-sale/1507501072,100.0,Bike for sale,,Bike for sale Very good condition Hardly used *serious inquires only *price as is,City of Toronto,01/09/2020,2020-10-07 00:29:09.403514
1521381220,/v-mountain-bike/city-of-toronto/motorized-bike/1521381220,350.0,Motorized bike,,Motorized bike Needs a tune up $350,City of Toronto,01/09/2020,2020-10-07 00:29:09.404013
1521011881,/v-mountain-bike/city-of-toronto/supercycle-bike-for-parts-or-repair-please-read/1521011881,50.0,Supercycle bike for parts or repair (Please read),,Selling bike AS IS. It does not work and is in need of tune up/repair.,City of Toronto,31/08/2020,2020-10-07 00:29:09.404509
1521356258,/v-mountain-bike/city-of-toronto/dyno-fierce-ds-bike/1521356258,350.0,Dyno Fierce DS bike,,24 speed 19 inch aluminum,City of Toronto,31/08/2020,2020-10-07 00:29:09.404999
1521344811,/v-mountain-bike/city-of-toronto/26inch-bike/1521344811,110.0,26inch bike,,26inch bike for sell. One brake shoe needed which i will provide and tube of the back tire need to be fixed.,City of Toronto,31/08/2020,2020-10-07 00:29:09.405493
1521348474,/v-mountain-bike/city-of-toronto/dh-bike-rmb/1521348474,800.0,Dh bike. Rmb...,,2010 rockymountainb dh bike. 26wheels;. 800 firm.needs shocks tune up.,City of Toronto,31/08/2020,2020-10-07 00:29:09.405981
1521343120,/v-mountain-bike/city-of-toronto/mountain-bike-needs-work/1521343120,20.0,mountain bike (needs work),,Mountain bike Needs work Jane and bloor west area pickup As is Text 647-293-3759,City of Toronto,31/08/2020,2020-10-07 00:29:09.406472
1521325748,/v-mountain-bike/city-of-toronto/ccm-alpha-dual-suspension-29/1521325748,500.0,CCM Alpha Dual Suspension  29,,"I bought it a couple months ago , drove it ones,, Still have warranty,from Canadian tire, Paid 800 with taxes ...",City of Toronto,31/08/2020,2020-10-07 00:29:09.406971
1521318965,/v-mountain-bike/city-of-toronto/rocky-mountain-dj-flow-bmx-dirt-jumper/1521318965,600.0,"Wanted:
                            Rocky Mountain dj flow BMX Dirt Jumper",,Just testing the waters... Rare Rocky Mountain dt flow for sale Dirty photos Lightly and barely used... Built in canada Frames in good shape New handle bars New back disk breaks and caliber Chains a ...,City of Toronto,31/08/2020,2020-10-07 00:29:09.407461
1521316680,/v-mountain-bike/city-of-toronto/mountain-bike-rim/1521316680,25.0,Mountain Bike rim,,26 inch aluminum rim- front wheel. Japanese Araya RM-20,City of Toronto,31/08/2020,2020-10-07 00:29:09.407951
1521315880,/v-mountain-bike/city-of-toronto/aluminum-bike-rim/1521315880,10.0,Aluminum bike rim,,26 inch rim,City of Toronto,31/08/2020,2020-10-07 00:29:09.408451
1521314425,/v-mountain-bike/city-of-toronto/rock-shox/1521314425,280.0,Rock shox,,RL RECON rockshox 15x110 thru axle,City of Toronto,31/08/2020,2020-10-07 00:29:09.408946
1521305695,/v-mountain-bike/city-of-toronto/vintage-90s-precision-cromoly-pr-6045-21-speed-mountain-bike/1521305695,225.0,Vintage 90s Precision Cromoly PR 6045 21 speed mountain bike,,The bike is in excellent condition to Vintage bike super clean really nice Parts 21 speed located at Bathurst and college area please call 647-1843 if interested looking for serious buyers only ...,City of Toronto,31/08/2020,2020-10-07 00:29:09.409433
1521295598,/v-mountain-bike/city-of-toronto/mountain-bike-for-sale-or-trade/1521295598,100.0,Mountain Bike for Sale or Trade,,"Ride ready bike but needs TLC. Tires hold air. A bit of rust but nothing that makes the bike unusable. Has front shocks. Trade for anything interesting. My height is 5'11"" and it's a comfortable bike ...",City of Toronto,31/08/2020,2020-10-07 00:29:09.410122
1521294003,/v-mountain-bike/city-of-toronto/reebok-mountain-bike/1521294003,200.0,Reebok mountain bike,,Reebok mountain bike with Shimano components excellent condition,City of Toronto,31/08/2020,2020-10-07 00:29:09.410621
1521269466,/v-mountain-bike/city-of-toronto/bike/1521269466,500.0,Bike,,"Bike like new, used a couple times and been in storage. $500",City of Toronto,31/08/2020,2020-10-07 00:29:09.411115
1521287904,/v-mountain-bike/city-of-toronto/brand-new-haro-vector-v1/1521287904,350.0,Brand new Haro Vector V1,,"HARO Vector V1 Brand new, was in storage for many years and never ridden. 17.5 inch frame 26 inch tires Lightweight and Immaculate condition, no scratches, comes with kickstand and ready to ride $350",City of Toronto,31/08/2020,2020-10-07 00:29:09.411605
1521277657,/v-mountain-bike/city-of-toronto/scott-reflex-mountain-bike/1521277657,300.0,Scott Reflex Mountain Bike,,"Scott Reflex mountain bike for sale Size: small - Selling as is, bike in good shape - New grips this year - Tires still have lots of tread left - Stored indoors - Tuned up in March, may need a new ...",City of Toronto,31/08/2020,2020-10-07 00:29:09.412094
1521275511,/v-mountain-bike/city-of-toronto/women-s-mountain-bike/1521275511,400.0,Women’s Mountain Bike,,Mountain bike for sale $400 or OBO Perfect condition - has only been ridden a dozen times before I decided to buy another one. I’ve been keeping it indoors so as not to have it exposed to weather ...,City of Toronto,31/08/2020,2020-10-07 00:29:09.412586
1521271688,/v-mountain-bike/city-of-toronto/bicycle-sportek-ridgerunner/1521271688,350.0,Bicycle Sportek Ridgerunner,,I am selling my Bicycle for $350 or best offer. First come first serve.,City of Toronto,31/08/2020,2020-10-07 00:29:09.413078
1521252787,/v-mountain-bike/city-of-toronto/rocky-mountain-equipe-bike-in-excellent-condition/1521252787,500.0,Rocky Mountain Equipe bike in excellent condition,,"High end components, 1997 model, frame 18.5"", excellent condition. Price is firm. Fork Rock Shox Judy C Component Group Grip Shift/Shimano Deore LX Brakeset Avid 1D-30 brakes, Avid SD-2.0 levers ...",City of Toronto,31/08/2020,2020-10-07 00:29:09.413761
1521232299,/v-mountain-bike/city-of-toronto/bike-for-sale/1521232299,50.0,Bike for sale,,Bike for sale $50.00,City of Toronto,31/08/2020,2020-10-07 00:29:09.414249
1521192535,/v-mountain-bike/city-of-toronto/bike/1521192535,120.0,Bike,,Sold as is Great for someone who is shorter than 5ft 5,City of Toronto,31/08/2020,2020-10-07 00:29:09.414745
