,url,price,title,distance,description,location,time_offset,retreived
1445999624,/v-bike-clothes-shoes-accessories/city-of-toronto/motorcycle-helmet-size-medium-large/1445999624,25.0,Motorcycle helmet size medium/large,,Motorcycle/snowmobile helmet medium /large size. Good condition .,City of Toronto,07/09/2020,2020-10-07 00:31:47.511442
1522553897,/v-bike-clothes-shoes-accessories/city-of-toronto/louis-garneau-unisex-cycling-jersey-size-xs/1522553897,20.0,Louis Garneau Unisex Cycling Jersey - Size XS,,This is a cycling jersey from my local bike shop in Richmond Hill called Evolution Cycles. Wonderful shop! Very good used condition.,City of Toronto,07/09/2020,2020-10-07 00:31:47.511937
1522546649,/v-bike-clothes-shoes-accessories/city-of-toronto/shimano-spd-clips-road-bike-shoes/1522546649,50.0,Shimano SPD clips Road Bike shoes,,Barely used Shimano SPD Clip in shoes. Used for a tri and never used a again. See pic for product details from manufacturer Clips not included. Maybe willing to sell SPD pedals to serious inquiries ...,City of Toronto,07/09/2020,2020-10-07 00:31:47.512433
1452160796,/v-bike-clothes-shoes-accessories/city-of-toronto/women-nike-cycling-shoes/1452160796,50.0,Women Nike Cycling Shoes,,"Nike cycling shoes for women, size 7.5. $50 obo If you see the ad, then it's available.",City of Toronto,07/09/2020,2020-10-07 00:31:47.512927
1511904106,/v-bike-clothes-shoes-accessories/city-of-toronto/thule-bicycle-roof-rack/1511904106,875.0,Thule Bicycle Roof Rack,,"Thule Wingbar Evo Roof rack, with a Yakima Frontloader Bike Rack, currently fits an Audi A4",City of Toronto,07/09/2020,2020-10-07 00:31:47.513423
1522490828,/v-bike-clothes-shoes-accessories/city-of-toronto/two-bell-helmets-riot-dot-05/1522490828,79.0,Two Bell helmets riot dot 05,,"Two Bell motocross helmets riot dot 05 , size M and XL. Used only one time Best offer",City of Toronto,06/09/2020,2020-10-07 00:31:47.513923
1522484611,/v-bike-clothes-shoes-accessories/city-of-toronto/gel-bike-seat-covers-5-each/1522484611,10.0,Gel bike seat covers - 5$ each,,Bike seat covers $10 for all Pickup near jane and st.clair First come first served,City of Toronto,06/09/2020,2020-10-07 00:31:51.759166
1501502748,/v-bike-clothes-shoes-accessories/city-of-toronto/louis-garneau-vorttice-time-trial-triathlon-helmet/1501502748,170.0,Louis Garneau Vorttice Time Trial/ Triathlon Helmet,,"BNIB, never used. Size medium, fits 56-59 cm circumference heads. Includes helmet bag. Note the slight damage to one small part of the box. No damage to the helmet whatsoever. From the Louis Garneau ...",City of Toronto,06/09/2020,2020-10-07 00:31:51.759706
1522476069,/v-bike-clothes-shoes-accessories/city-of-toronto/bnib-bikeconsole-bike-mount-for-iphone-6-7-8/1522476069,50.0,BNIB BikeCONSOLE Bike Mount for iPhone 6/7/8,,"By Tigra Sport. Brand new in box, never used. An amazing handlebar mount for iPhone. Features: -Waterproof submersible, touch screen operable with over 90% sensitivity. Sleep/wake/home button ...",City of Toronto,06/09/2020,2020-10-07 00:31:51.760205
1522461205,/v-bike-clothes-shoes-accessories/city-of-toronto/tailgate-bike-protector-pad-new/1522461205,160.0,"Tailgate bike protector pad, new",,"Swagman TAILWHIP 54"" long Tailgate pad model 64761 has large built-in flaps so you can access your tailgate handle without removing the pad. Only takes a few minutes to install, then simply strap ...",City of Toronto,06/09/2020,2020-10-07 00:31:51.760703
1140550578,/v-bike-clothes-shoes-accessories/city-of-toronto/brand-new-hincapie-emergence-tt-skinsuit-assos-chronos-suit-tt/1140550578,150.0,Brand New Hincapie Emergence TT Skinsuit & Assos Chronos suit TT,,"Price around US$300. only C$150 Available size Med,XL and XXL one of each. No tags for the XL size. But everything is new. Take all 3 for $400 Assos Chronosuit for TT price $200 large Discription for ...",City of Toronto,06/09/2020,2020-10-07 00:31:51.761200
1522425077,/v-bike-clothes-shoes-accessories/city-of-toronto/phone-holder-for-bike/1522425077,20.0,phone holder for bike,,universal fit,City of Toronto,06/09/2020,2020-10-07 00:31:51.761698
1522372267,/v-bike-clothes-shoes-accessories/city-of-toronto/harley-davidson-bike-jacket/1522372267,100.0,Harley Davidson Bike Jacket,,New Harley Davidson Biker Jacket (female). Has pockets for elbow protection. Size XS with side and arm adjustments.,City of Toronto,06/09/2020,2020-10-07 00:31:51.762198
1522345343,/v-bike-clothes-shoes-accessories/city-of-toronto/sunding-sd-563a-wired-bicycle-computer-mini-odometer-stopwatch/1522345343,25.0,SUNDING SD-563A Wired  Bicycle Computer Mini Odometer Stopwatch,,"Excellent Condition Used but Still has factory plastic on screen. No scratches Pick up at Avenue Rd & Dupont Features: Wired Bicycle speedometer with LCD display, easy to use. With mounting ...",City of Toronto,06/09/2020,2020-10-07 00:31:51.762705
1522324271,/v-bike-clothes-shoes-accessories/city-of-toronto/nakamura-kid-s-helmet/1522324271,20.0,Nakamura Kid’s Helmet,,Selling this brand new Nakamura Kid’s Helmet,City of Toronto,06/09/2020,2020-10-07 00:31:51.763207
1511713691,/v-bike-clothes-shoes-accessories/city-of-toronto/bike-helmet-10-size-small-csa-approved/1511713691,10.0,Bike helmet - $10 - size small - CSA approved,,"Still available if ad is up. Bike helmet, size small, $10 CSA approved",City of Toronto,05/09/2020,2020-10-07 00:31:51.763699
1522286066,/v-bike-clothes-shoes-accessories/city-of-toronto/masks-for-your-protection/1522286066,25.0,Masks for your protection,,"Keep yourself safe during these difficult times Features: Moisture resistant, you won’t be sweating Very breathable Filters air very well Comes in forest green, black and navy blue. More photos and ...",City of Toronto,05/09/2020,2020-10-07 00:31:51.764192
1511697435,/v-bike-clothes-shoes-accessories/city-of-toronto/blackburn-trackstand-indoor-trainer/1511697435,70.0,Blackburn trackstand indoor trainer,,Never used. Magnetic resistance. Email or text.,City of Toronto,05/09/2020,2020-10-07 00:31:51.764685
1522247478,/v-bike-clothes-shoes-accessories/city-of-toronto/brand-new-crocs/1522247478,7.0,Brand new crocs.,,"$7 Brand new crocs. . Posted in bikes, clothing, shoes, accessories in City of Toronto. September 5, 2020",City of Toronto,05/09/2020,2020-10-07 00:31:51.765180
1522245463,/v-bike-clothes-shoes-accessories/city-of-toronto/bicycle-helmet-youth/1522245463,10.0,Bicycle helmet Youth,,"Bicycle helmet Youth Pick up at Dundas and Bloor, Toronto (Close to Dundas West subway station)",City of Toronto,05/09/2020,2020-10-07 00:31:51.765675
1522204125,/v-bike-clothes-shoes-accessories/city-of-toronto/rapha-travel-backpack/1522204125,125.0,Rapha Travel Backpack,,"Condition: Excellent (used 3 times) Colour -reflective grey with pink stripe The pack has ergonomic padding designed for a road riding bike position, as well as multiple storage compartments. ...",City of Toronto,05/09/2020,2020-10-07 00:31:51.766165
1522198238,/v-bike-clothes-shoes-accessories/city-of-toronto/ninebot-original-lock-new/1522198238,35.0,Ninebot original lock(new),,Ninebot original lock(new) Original combination lock for Ninebot KickScooter MAX G30 ES1 ES2 ES3 ES4 E25 Xiaomi electric scooter anti-theft security lock,City of Toronto,05/09/2020,2020-10-07 00:31:51.766667
1441793151,/v-bike-clothes-shoes-accessories/city-of-toronto/pearl-izumi-mens-select-pursuit-jersey-brand-new-with-tags-xl/1441793151,30.0,Pearl Izumi Men's Select Pursuit Jersey (brand new with tags) XL,,*pictures on request *grey and black *full length zipper for venting *elasticized gripper on back holds jersey in place *three back pockets *BioVi high visibility colors and reflective elements ...,City of Toronto,05/09/2020,2020-10-07 00:31:51.767160
1522165368,/v-bike-clothes-shoes-accessories/city-of-toronto/road-bike-shoes/1522165368,10.0,Road bike shoes,,"Used 3 years, selling because got a new ones",City of Toronto,05/09/2020,2020-10-07 00:31:51.767652
1522158492,/v-bike-clothes-shoes-accessories/city-of-toronto/helmet/1522158492,50.0,Helmet,,"New Micro helmet with LED light in the back, size M 54-58 cm",City of Toronto,05/09/2020,2020-10-07 00:31:51.768145
1522095983,/v-bike-clothes-shoes-accessories/city-of-toronto/look-cycling-shoes-size-9-or-43-used/1522095983,75.0,LOOK cycling shoes size 9 or (43) used,,Used LOOK cycling used size 9 or 43eu Shoes are in great condition and comes with new look cleats and has carbon fiber sole,City of Toronto,04/09/2020,2020-10-07 00:31:51.768635
1522068784,/v-bike-clothes-shoes-accessories/city-of-toronto/young-adult-pink-schwinn-bicycle-helmet/1522068784,10.0,Young adult Pink Schwinn bicycle helmet,,Pink Schwinn bicycle helmet. Size M 54- 58cm Never used.,City of Toronto,04/09/2020,2020-10-07 00:31:51.769129
1507302485,/v-bike-clothes-shoes-accessories/city-of-toronto/pearl-izumi-cycle-shoes-women/1507302485,30.0,Pearl Izumi Cycle Shoes Women,,"This was a gift. The sizing runs small. I wore it 2x to make sure and its too tight for me. Its well made, sturdy and last for at least 5 years (if not more). I know because I own an exact pair which ...",City of Toronto,04/09/2020,2020-10-07 00:31:51.769617
1522026640,/v-bike-clothes-shoes-accessories/city-of-toronto/bell-rogue-helmet-size-large/1522026640,300.0,Bell Rogue Helmet size Large,,"Bell Rogue Helmet size Large...worn 5 times last year. Comes with carrying bag. Retails for $340+tax , it's never been dropped or in an accident. I need a larger size so I'm selling so I can purchase ...",City of Toronto,04/09/2020,2020-10-07 00:31:51.770105
1522017121,/v-bike-clothes-shoes-accessories/city-of-toronto/bell-sports-helmet/1522017121,50.0,Bell sports helmet ⛑,,"Silver, size Medium. Great condition. South Etobicoke area only.",City of Toronto,04/09/2020,2020-10-07 00:31:51.770606
1521944062,/v-bike-clothes-shoes-accessories/city-of-toronto/huffy-bicycle-with-accessories-pickup-only-north-york-on/1521944062,500.0,"Huffy Bicycle with accessories -pickup only (North York, ON)",,"Selling my bike. Rarely used. A bit rusty from exposure in balcony. Bought it for higher price. Suitable for height 5' 4"" or below. Frame size around 15 inch. Includes Memory foam seat, bell, helmet, ...",City of Toronto,04/09/2020,2020-10-07 00:31:51.771102
1440687261,/v-bike-clothes-shoes-accessories/city-of-toronto/flashlight-armytek-wizard-pro-v3-magnet-usb-2300lm-18650liion/1440687261,100.0,Flashlight Armytek Wizard Pro v3 Magnet USB 2300lm + 18650LiIon,,Brand New Fixed Price Text me please 6478902530 or email if interested Amazingly powerful multi-flashlight with 1 250 LED lm brightness powered by only one 18650 Li-Ion battery. Rechargeable ...,City of Toronto,04/09/2020,2020-10-07 00:31:51.771599
1521943908,/v-bike-clothes-shoes-accessories/city-of-toronto/garmin-pedals-for-bike-one-side/1521943908,600.0,Garmin pedals for bike (one side),,Measures your power.,City of Toronto,03/09/2020,2020-10-07 00:31:51.772092
1521878302,/v-bike-clothes-shoes-accessories/city-of-toronto/specialized-torch-woman-s-cycling-road-shoes/1521878302,75.0,Specialized Torch Woman’s Cycling Road shoes,,Worn a couple of times. Practically brand new. Size 42,City of Toronto,03/09/2020,2020-10-07 00:31:51.772588
1521854543,/v-bike-clothes-shoes-accessories/city-of-toronto/emporia-italian-sport-jacket-new-xxl/1521854543,200.0,"Emporia , Italian sport jacket, new, XXL",,Brand new Size XXL Emporia Athletic Sports wear,City of Toronto,03/09/2020,2020-10-07 00:31:51.773085
1521791133,/v-bike-clothes-shoes-accessories/city-of-toronto/bike-helmet-and-shoes/1521791133,75.0,Bike helmet and shoes,,"Two separate items, or a package deal Women’s Size 38 (7.5 US) Mountain Biking Shoes Brand: Specialized Condition: Good Low wear on cleats and sole Price without helmet: $40 OBO Women’s Adjustable ...",City of Toronto,03/09/2020,2020-10-07 00:31:51.773577
1507790564,/v-bike-clothes-shoes-accessories/city-of-toronto/giro-scamp-bike-helmet-xs/1507790564,20.0,Giro Scamp Bike Helmet XS,,"Cute Helmet, the smallest I could find when we stared riding with my little girl. Like new. The Scamp is packed with amazing features, including some of the same elements found in our best adult ...",City of Toronto,02/09/2020,2020-10-07 00:31:51.774066
1500907504,/v-bike-clothes-shoes-accessories/city-of-toronto/new-electric-scooter-bike-bags-reebok-sneaker/1500907504,4.0,"New electric scooter, bike bags, Reebok sneaker",,"** new Electric Scooter ........ never used, I haven't moved it for a while so the charge doesn't go well. no idea why, you may be able to fix it if you are good at electrical systems.. take as it is ...",City of Toronto,02/09/2020,2020-10-07 00:31:51.774558
1521716005,/v-bike-clothes-shoes-accessories/city-of-toronto/bike-seat-cover/1521716005,20.0,Bike seat cover,,Bike seat cover - Memory foam,City of Toronto,02/09/2020,2020-10-07 00:31:51.775062
1521704806,/v-bike-clothes-shoes-accessories/city-of-toronto/phone-holder-bag-for-bike-fits-small-phone/1521704806,15.0,"Phone holder bag for bike, fits small phone",,"*Brand new, unused *Everyday brand cellphone bag for mounting on a bicycle *transparent touchscreen window *Weather resistant *Adjustable velcro attachment straps (2) to attach to bike frame *You can ...",City of Toronto,02/09/2020,2020-10-07 00:31:51.775553
1521662274,/v-bike-clothes-shoes-accessories/city-of-toronto/oakley-mens-bib-shorts/1521662274,110.0,Oakley Men's Bib Shorts,,"Comes as a men's large size in gray, asking 110 obo",City of Toronto,02/09/2020,2020-10-07 00:31:51.776250
1521641208,/v-bike-clothes-shoes-accessories/city-of-toronto/timbuk2-especial-cycling-messenger-bag/1521641208,95.0,TIMBUK2 Especial Cycling Messenger Bag,,"Brand new. Never used. Medium size. Dimensions: 11.0"" x 13.8"" x 5.9"" Volume: 22L - Bullet-proof design with seam-taped waterproof liner and integrated reflective panels - Waterproof zipper on the ...",City of Toronto,02/09/2020,2020-10-07 00:31:51.776742
1521620842,/v-bike-clothes-shoes-accessories/city-of-toronto/hydro-bag/1521620842,20.0,Hydro bag,,Selling my almost new hydro bag only... Take it for $19.99,City of Toronto,02/09/2020,2020-10-07 00:31:51.777239
1521600492,/v-bike-clothes-shoes-accessories/city-of-toronto/fs:-gladiator-2-bike-hanging-rack-60-or-best-offer/1521600492,60.0,FS: Gladiator 2 bike hanging rack $60 or best offer,,Hi I'm selling the Gladiator bike hanging rack (supports 2 bikes). Mounting Screws not included. Selling for $60 or best offer Thanks Angelo,City of Toronto,02/09/2020,2020-10-07 00:31:51.777733
1440832517,/v-bike-clothes-shoes-accessories/city-of-toronto/brand-new-wireless-cycling-computer-dashboard-bicycle-odometer/1440832517,25.0,Brand New Wireless Cycling Computer Dashboard Bicycle Odometer,,Brand New Wireless Cycling Computer Waterproof Bicycle Odometer Speedometer Dashboard With LCD Display Bike Speedometer Cycling Bicycle Stopwatch Feature: 1.Item Code:80178 2.100% Brand new and high ...,City of Toronto,02/09/2020,2020-10-07 00:31:53.343364
1521549095,/v-bike-clothes-shoes-accessories/city-of-toronto/cycling-clothing-for-sales-all-for-80/1521549095,80.0,"Cycling clothing for sales, All for $80",,All for $80,City of Toronto,01/09/2020,2020-10-07 00:31:53.343875
1511060597,/v-bike-clothes-shoes-accessories/city-of-toronto/bike-accessories-bicycle-bags-gloves-led-lights/1511060597,19.99,"Bike Accessories - Bicycle Bags, Gloves, LED Lights",,A variety of different bicycle and Ebike accessories. Visit www.Victorebikes.ca for even more accessories and Electric Bike products! Bike Mask - 19.99 Bike Gloves Half Finger - 17.49 Bike Gloves - ...,City of Toronto,01/09/2020,2020-10-07 00:31:53.344375
1521542615,/v-bike-clothes-shoes-accessories/city-of-toronto/mission-workshop-rummy-messenger-bag/1521542615,100.0,Mission workshop rummy messenger bag,,"Rummy 27L Mission workshop rummy messenger bag. Posted in bikes, clothing, shoes, accessories in City of Toronto. September 1, 2020",City of Toronto,01/09/2020,2020-10-07 00:31:53.344870
1521522855,/v-bike-clothes-shoes-accessories/city-of-toronto/hjc-helmet-with-avs-advanced-ventilation-system/1521522855,100.0,HJC Helmet with AVS (Advanced Ventilation System),,HJC Motorcycle Helmet - Chin bar vent flows air across the face shield to help eliminate shield fogging - Removable and washable crown and chin pads,City of Toronto,01/09/2020,2020-10-07 00:31:53.345363
1521494560,/v-bike-clothes-shoes-accessories/city-of-toronto/prologo-nago-eco-dea-women-s-saddle/1521494560,50.0,Prologo nago eco DEA women’s saddle,,Like-new bike saddle. Bought it and rode 45mins before deciding it’s just not for me. Too bad - it’s pretty and really light! Reviews are good. Just not for me. Can do Coxwell and Gerrard ...,City of Toronto,01/09/2020,2020-10-07 00:31:53.345860
1521489892,/v-bike-clothes-shoes-accessories/city-of-toronto/bell-arella-400-led-flashing-turn-signal-for-bikes/1521489892,20.0,Bell Arella 400 Led flashing Turn Signal for bikes,,Rechargeable via USB turn signals ans red flashing or steady light controlled via remote control. New in the box never used and tested.,City of Toronto,01/09/2020,2020-10-07 00:31:53.346356
1521382381,/v-bike-clothes-shoes-accessories/city-of-toronto/2-bike-rack-hitch/1521382381,160.0,2 Bike Rack Hitch,,Fits 1 1/4 and 2” hitch 2” hitch adapter included Missing one wheel rack (see pic) Fold up for easy storage $160 obo,City of Toronto,01/09/2020,2020-10-07 00:31:53.346877
1521466520,/v-bike-clothes-shoes-accessories/city-of-toronto/cycling-shoes-lg-garneau-size-44eu-men/1521466520,80.0,Cycling shoes. LG Garneau size 44EU (men),,Size 44 EU or 11 USA. Used for a season but switched to road shoes.,City of Toronto,01/09/2020,2020-10-07 00:31:53.347479
1521452364,/v-bike-clothes-shoes-accessories/city-of-toronto/women-s-bontrager-mtb-shoes-size-39/1521452364,80.0,Women’s Bontrager MTB shoes - Size 39,,Women’s Bontrager MTB shoes size 39 in excellent used condition with SPD cleats. Bought a size too small and have not been able to wear them comfortably.,City of Toronto,01/09/2020,2020-10-07 00:31:53.348073
1521426334,/v-bike-clothes-shoes-accessories/city-of-toronto/selling-a-new-pair-of-giro-road-shoes-size-39-us-8-40/1521426334,40.0,"Selling a new pair of Giro road shoes, size 39(US 8) $40",,"Hi I’m selling a new pair of Giro cycling shoes, size 8 (39). This pair is in brand new condition as I had accidentally got the wrong size, turns out I’m Bike shoe size 9. These shoes use both road ...",City of Toronto,01/09/2020,2020-10-07 00:31:53.348712
1521425385,/v-bike-clothes-shoes-accessories/city-of-toronto/selling-brand-new-pair-of-unisex-louis-garneau-cycling-shoes-40/1521425385,40.0,Selling brand new pair of unisex Louis Garneau cycling shoes $40,,Hi I’m selling my new pair of Louis Garneau road bike shoes as I got the wrong size online. The shoes size is 38 (7.5). I paid $129.99 + tax & only asking $40. Check my other pair of shoes too. ...,City of Toronto,01/09/2020,2020-10-07 00:31:53.349413
1392027925,/v-bike-clothes-shoes-accessories/city-of-toronto/kryptonite-kryptolok-series-2-price-is-final/1392027925,60.0,Kryptonite Kryptolok Series 2 (price is FINAL),,NOTE: Due to covid I am no longer selling items for the time being. Thanks for all the inquiries and apologies I haven’t been able to respond to all of them. In excellent condition. Came with the ...,City of Toronto,01/09/2020,2020-10-07 00:31:53.349919
1521417838,/v-bike-clothes-shoes-accessories/city-of-toronto/swagman-roof-mount-bike-rack/1521417838,60.0,Swagman roof mount bike rack,,"Swagman model 64720 Upright roof rack installs in minutes and carries one bike with no wheel removal necessary. Fits square, round and oval bars up to 3"" wide and multiple racks can be used on a ...",City of Toronto,01/09/2020,2020-10-07 00:31:53.350427
1471407836,/v-bike-clothes-shoes-accessories/city-of-toronto/spd-boots-winter-cycling-boots-louis-garneau-klondike/1471407836,120.0,SPD Boots - Winter Cycling Boots - Louis Garneau Klondike,,Very clean Cycling Winter boots by LG. Size: 41 Cleats included: No,City of Toronto,01/09/2020,2020-10-07 00:31:53.350987
1510841108,/v-bike-clothes-shoes-accessories/city-of-toronto/sugoi-zap-bike-jacket-mens-small/1510841108,100.0,Sugoi Zap Bike Jacket Mens Small,,"Sugoi Zap Bike Jacket Mens small S Fully reflective waterproof, PU coated fabric designed for high visibility in low light conditions Water resistant front zip with garage Rear pocket for storing ...",City of Toronto,31/08/2020,2020-10-07 00:31:53.351637
1452480072,/v-bike-clothes-shoes-accessories/city-of-toronto/2pcs-bike-led-bicycle-flash-head-tail-safety-light-lamp-clip-on/1452480072,12.0,2pcs Bike LED Bicycle Flash Head Tail Safety Light Lamp Clip-on,,"Brand New! Size: 6cm (L) x 5.7cm (W) x 2cm (H) Color: Blue, Red, Green, Multi-color. You can select any 2 colors. Package Included: 2x LED Tail Light 2x cell battery",City of Toronto,31/08/2020,2020-10-07 00:31:53.352144
1510846140,/v-bike-clothes-shoes-accessories/city-of-toronto/specialized-turbo-connect/1510846140,50.0,Specialized Turbo Connect,,IF U SEE THIS AD ITS STILL FOR SALE. Specialized Turbo Connect Display..Purchased in December but since then decided to go another route.. Brand New never used. Open box. Comes with two mounts. ...,City of Toronto,31/08/2020,2020-10-07 00:31:53.352642
1499888545,/v-bike-clothes-shoes-accessories/city-of-toronto/new-kids-bike-helmets/1499888545,25.0,New kid's bike helmets,,spring safety..ride with confidence kid's helmet,City of Toronto,31/08/2020,2020-10-07 00:31:53.353144
1521309666,/v-bike-clothes-shoes-accessories/city-of-toronto/yakima-2-tray-locking-roof-mount-bike-rack/1521309666,149.0,Yakima 2 tray locking roof mount bike rack,,Fork mount locking roof rack with air deflector. Located in Collingwood but can be transported to Toronto if required.,City of Toronto,31/08/2020,2020-10-07 00:31:53.353636
1521307851,/v-bike-clothes-shoes-accessories/city-of-toronto/thule-2-tray-locking-fork-mount-rack-2-receiver/1521307851,249.0,Thule 2 tray locking fork mount rack. 2” receiver.,,A perfect rack to secure and lock your bikes while on the go. Tilting function to allow access to back of the vehicle. Located in Collingwood area but could be transported to Toronto if required.,City of Toronto,31/08/2020,2020-10-07 00:31:53.354175
1521306008,/v-bike-clothes-shoes-accessories/city-of-toronto/bike-stand-storage/1521306008,50.0,Bike Stand / Storage,,Used to store up to two bicycles Can be used in garage or in living space Very easy to assemble/disassemble Designed to leave bikes and walls unmarred Very similar to the one at this link (and ...,City of Toronto,31/08/2020,2020-10-07 00:31:53.354779
1510814012,/v-bike-clothes-shoes-accessories/city-of-toronto/new-victorinox-bike-tool/1510814012,45.0,NEW Victorinox Bike Tool,,New in box. Victorinox Swiss Army bike tool. Very handy for anyone,City of Toronto,31/08/2020,2020-10-07 00:31:53.355369
1521212629,/v-bike-clothes-shoes-accessories/city-of-toronto/new-bontrager-glo-multi-use-bicycle-light/1521212629,20.0,New Bontrager Glo multi-use bicycle light,,"Pick up from Bloor west village. Works perfectly, is unused, I just have an extra one. Retails for $33 plus tax. Price is firm.",City of Toronto,31/08/2020,2020-10-07 00:31:53.356201
1483237100,/v-bike-clothes-shoes-accessories/city-of-toronto/giordana-mens-winter-insulated-bib-tights/1483237100,35.0,Giordana men's winter insulated bib tights,,Size xl but fit like big medium and large. New without tags. Bought at wheels of Bloor but decided not to winter ride. Fleece lined inside and no shammy. Black with white straps. Pretty good weight ...,City of Toronto,31/08/2020,2020-10-07 00:31:53.356698
1507863591,/v-bike-clothes-shoes-accessories/city-of-toronto/rhyno-bike-gloves/1507863591,40.0,Rhyno bike gloves,,"like brand new , worn two days Rhyno Kevlar leather bike golves",City of Toronto,30/08/2020,2020-10-07 00:31:53.357202
1510663139,/v-bike-clothes-shoes-accessories/city-of-toronto/bicycle-helmet-monogoose-brand-new-5-in-the-package/1510663139,45.0,BICYCLE HELMET Monogoose - Brand new - 5+ In the package!!!,,Brand new in the Package!! Bike / Scooter Helmet!! Monogoose! Beautiful bright colours and designs. 5+ child Adjustable!,City of Toronto,30/08/2020,2020-10-07 00:31:53.357702
1521133631,/v-bike-clothes-shoes-accessories/city-of-toronto/medium-bike-helmet/1521133631,10.0,Medium bike helmet,,"Medium Posted by greg in bikes, clothing, shoes, accessories in Toronto (GTA), City of Toronto. September 12, 2020",City of Toronto,30/08/2020,2020-10-07 00:31:53.358208
1487987160,/v-bike-clothes-shoes-accessories/city-of-toronto/heavyduty-womens-size-7-impact-answer-mountain-bike-shoes/1487987160,80.0,HEAVYDUTY WOMENS SIZE 7 IMPACT ANSWER MOUNTAIN BIKE SHOES,,***BRAND NEW*** WOMENS HEAVYDUTY ANSWER IMPACT MOUNTAIN BIKE CYCLING SHOES SIZE WOMENS US 7 BRAND NEW SHOES NEVER USED $80 CAN POSSIBLY DELIVER/MEETUP(IF NOT TOO FAR) DONT BUY NEW SAVE TIME/MONEY ...,City of Toronto,30/08/2020,2020-10-07 00:31:53.358716
1487985332,/v-bike-clothes-shoes-accessories/city-of-toronto/womens-shimano-wm-60-mountain-bike-shoes-us-6-5-euro38-deliver/1487985332,70.0,WOMENS SHIMANO WM-60 MOUNTAIN BIKE SHOES US 6.5 EURO38 DELIVER,,***BRAND NEW*** WOMENS SHIMANO WM-60 SPD MOUNTAIN BIKE SHOES WHITE/BLUE ACCENTS SIZE WOMENS US 6.5 EURO 40 BRAND NEW TAGS STILL ON $70 CAN POSSIBLY DELIVER/MEETUP(IF NOT TOO FAR) TOUGH COMFORTABLE ...,City of Toronto,30/08/2020,2020-10-07 00:31:53.359210
1487983796,/v-bike-clothes-shoes-accessories/city-of-toronto/womens-garneau-hrs-80-cycling-spin-shoes-size-6-5-euro-38-deliv/1487983796,70.0,WOMENS GARNEAU HRS-80 CYCLING SPIN SHOES SIZE 6.5 EURO 38 DELIV,,***BRAND NEW*** WOMENS GARNEAU CYCLING SPIN ROAD SHOES BLACK/PINK ACCENTS SIZE WOMENS US 6.5 EURO 38 BRAND NEW NEVER USED $70 CAN POSSIBLY DELIVER/MEETUP(IF NOT TOO FAR) ULTRA COMFORT SHOES GARNEAU ...,City of Toronto,30/08/2020,2020-10-07 00:31:53.359697
