,url,price,title,distance,description,location,time_offset,retreived
1524673989,/v-stereo-systems-home-theatre/city-of-toronto/zenith-allegro-4140-record-radio-cassette-8-track-player/1524673989,125.0,Zenith Allegro 4140 Record Radio Cassette 8 Track Player,,Good working and sounding condition. Comes with one original speaker. Turntable has stylus. Plastic cover lid is in very nice mare free condition.,City of Toronto,18/09/2020,2020-10-07 17:37:44.699292
1524671856,/v-stereo-systems-home-theatre/city-of-toronto/samsung-vintage-stereo/1524671856,50.0,Samsung Vintage Stereo,,I have had this for 20 years. Most recently used it with an adapter to provide surround sound on the PS3 in the spare room. Moved the PS3 into the main bedroom which has a surround sound system so I ...,City of Toronto,18/09/2020,2020-10-07 17:37:44.699831
1524670690,/v-stereo-systems-home-theatre/city-of-toronto/cd-player-am-fm-radio/1524670690,10.0,CD player + AM/FM radio,,"CD player + AM/FM radio. Posted in audio, stereo systems, home theatre in City of Toronto. September 17, 2020",City of Toronto,17/09/2020,2020-10-07 17:37:44.700330
1524668847,/v-stereo-systems-home-theatre/city-of-toronto/line-phono-turntable-audio-stand/1524668847,300.0,Line phono turntable audio stand,,Almost brand new line phono turntable audio stand... in smoke grey.... msrp is 520plus tax,City of Toronto,17/09/2020,2020-10-07 17:37:44.700819
1524663842,/v-stereo-systems-home-theatre/city-of-toronto/russound-sdb-4-ez-4-channel-stereo-speaker-selector-with-gain-co/1524663842,295.0,Russound SDB-4 EZ 4 channel stereo speaker selector with gain co,,"LOWEST PRICE IS $295 NOTHING LOWER SORRY! This is a Russound 4 channel stereo speaker selector. Useful for distributed sound, home audio, or monitor mixes. Accepts power input and distributes to 4 ...",City of Toronto,17/09/2020,2020-10-07 17:37:44.701309
1524663428,/v-stereo-systems-home-theatre/city-of-toronto/sony-ta-e9000es-surround-sound-control-preamplifier-preamp/1524663428,295.0,Sony TA-E9000ES Surround Sound Control Preamplifier Preamp,,LOWEST PRICE IS $295 NOTHING LOWER WILL BE ACCEPTED! PLEASE NOTE THE TOP COVER IS LOSE I TOOK IT OFF AND LOST THE SCREWS. IF YOU BUY THE SCREWS IT WILL HOLD BUT EVERYTHING STILL WORKS FINE. SONY ...,City of Toronto,17/09/2020,2020-10-07 17:37:44.701794
1503054069,/v-stereo-systems-home-theatre/city-of-toronto/technics-su-v60-stereo-integrated-amplifier/1503054069,180.0,Technics SU V60 Stereo Integrated Amplifier,,Nice sounding amp with pre in and facility for MC MM phono inputs full tested all controls cleaned 90 watts per channel very warm class A,City of Toronto,17/09/2020,2020-10-07 17:37:44.702281
1513950933,/v-stereo-systems-home-theatre/city-of-toronto/teac-surround-sound-home-theater-receiver/1513950933,55.0,TEAC surround sound home theater receiver.,,Great sound!! You know your TEAC!!! Radio has no signal. Asking $55.00,City of Toronto,17/09/2020,2020-10-07 17:37:44.702771
1512581188,/v-stereo-systems-home-theatre/city-of-toronto/mega-sound-stereo-equalizer-wuq-120/1512581188,125.0,Mega Sound Stereo Equalizer WUQ-120,,Mega Sound Stereo Equalizer WUQ-120 10 BAND STEREO 20 SLIDERS,City of Toronto,17/09/2020,2020-10-07 17:37:44.703463
1524609966,/v-stereo-systems-home-theatre/city-of-toronto/technics-76wpc-8ohms-turntable-cd-player-tuner-tape/1524609966,100.0,Technics 76wpc @8ohms/turntable/CD player/Tuner/Tape,,"SU V76 INTEGRATED AMPLIFIER SL-BD26 TURNTABLE with audio technica at101p catrige. SL-P117 CD PLAYER ST-S76 TUNER RS-T16 TAPE PLAYER (as is) Could add $70 for a pair of Advent The 4 1987, Japan, ...",City of Toronto,17/09/2020,2020-10-07 17:37:44.703948
1524604243,/v-stereo-systems-home-theatre/city-of-toronto/boss-bluetooth-round-stereo/1524604243,150.0,BOSS BLUETOOTH ROUND STEREO,,EUC. GREAT FOR ANYWHERE OR ANY APPLICATION,City of Toronto,17/09/2020,2020-10-07 17:37:44.704437
1524593234,/v-stereo-systems-home-theatre/city-of-toronto/lg-soundplate-lap240/1524593234,50.0,LG SOUNDPLATE LAP240,,LG Soundplate Speaker Built in subwoofer 100 watts Bluetooth Optical $50 obo,City of Toronto,17/09/2020,2020-10-07 17:37:44.705041
1514072340,/v-stereo-systems-home-theatre/city-of-toronto/enlightened-audio-designs-dac-dsp-1000-transport-t-1000-rem/1514072340,900.0,ENLIGHTENED AUDIO DESIGNS  DAC  DSP-1000/ TRANSPORT T-1000 & REM,,"PLEASE GIVE US A CALL FOR QUICK ANSWERS . WE DO NOT REGULARLY CHECK OUR MAILS SO CALLING IS YOUR BEST OPTION . Item is in good working condition . Come and see hundreds of items ( Vintage audio , led ...",City of Toronto,17/09/2020,2020-10-07 17:37:44.705593
1490541511,/v-stereo-systems-home-theatre/city-of-toronto/samsung-55-led-sony-yamaha-receiver-4k/1490541511,500.0,SAMSUNG 55 LED SONY YAMAHA RECEIVER 4K,,"Samsung UN55D7900 Series 55"" Inch HD SMART LED TV Highlights SMART APPPS Auto Motion Plus 240Hz Full HD 1080p Resolution One Design (0.5"" Bezel) Exceeds Energy Star Standards Experience 3D Excitement ...",City of Toronto,17/09/2020,2020-10-07 17:37:44.706508
1524540764,/v-stereo-systems-home-theatre/city-of-toronto/outdoor-movie-screen/1524540764,125.0,Outdoor movie screen,,Outdoor movie screen 10ft by 5ft. Comes with frame. Hang anywhere.,City of Toronto,17/09/2020,2020-10-07 17:37:44.706997
1524536981,/v-stereo-systems-home-theatre/city-of-toronto/jvc-home-theatre-speaker-pair-w-stands/1524536981,25.0,JVC Home Theatre Speaker Pair w/ Stands,,Pair of JVC SX-XS33 speakers designed to be used as part of a surround sound system. Can also be used as bookshelf stereo speakers. Stands included.,City of Toronto,17/09/2020,2020-10-07 17:37:44.707499
1345065704,/v-stereo-systems-home-theatre/city-of-toronto/abstract-acoustics-rms-807-3-way-speaker-system/1345065704,200.0,ABSTRACT ACOUSTICS. RMS 807 3 Way Speaker System,,ABSTRACT ACOUSTICS. RMS 807 3 Way Speaker System as shown,City of Toronto,17/09/2020,2020-10-07 17:37:44.707986
1524531953,/v-stereo-systems-home-theatre/city-of-toronto/yamaha-htr-6030-av-receiver-w-remote-5-speakers-subwoofer/1524531953,125.0,"Yamaha HTR-6030 AV receiver W/ Remote, 5 Speakers & Subwoofer",,"The Yamaha HTR-6030 AV receiver performance features include Yamaha's scene, compressed music enhancer, XM ready with XM HD surround, front panel mini jack for portable audio players and a head phone ...",City of Toronto,17/09/2020,2020-10-07 17:37:44.708470
1513911961,/v-stereo-systems-home-theatre/city-of-toronto/pioneer-sx255-stereo-receiver/1513911961,125.0,Pioneer SX255 stereo receiver,,https://www.hifiengine.com/manual_library/pioneer/sx-255r.shtml Sorry no remote,City of Toronto,16/09/2020,2020-10-07 17:37:44.708965
1524473701,/v-stereo-systems-home-theatre/city-of-toronto/wanted-looking-got-a-clairtone-project-g-g2-or-g3/1524473701,1.0,"Wanted; Looking got a Clairtone project G, G2 or G3",,"I'm looking for a Clairtone Project G, G2 or G3 in good working condition. Please send pictures and price, thank you.",City of Toronto,16/09/2020,2020-10-07 17:37:44.709427
1494314569,/v-stereo-systems-home-theatre/city-of-toronto/vintage-1960s-heathkit-aa-100-tube-amp-fully-re-stored-working/1494314569,599.99,VINTAGE 1960's HEATHKIT AA-100 TUBE AMP FULLY RE-STORED+WORKING!,,On-line sales only please No cash pick ups due to Covid19 Orders are payable by emt to: dc_171717@hotmail.com Also please send your full address to ship each order to Fully re-stored and working ...,City of Toronto,16/09/2020,2020-10-07 17:37:44.709911
1503394295,/v-stereo-systems-home-theatre/city-of-toronto/the-classic-vintage-nad-stereo-reciever-model:-7020e/1503394295,350.0,The Classic Vintage NAD Stereo Reciever Model:  7020e.,,"The Classic Vintage NAD Stereo Reciever Model: 7020e. In good condition. Clean sound...no pops, ticks or scratches from any circuits. Warm tone and a listening pleasure. Two speakers, wires and AM/FM ...",City of Toronto,16/09/2020,2020-10-07 17:37:44.710401
1485651463,/v-stereo-systems-home-theatre/city-of-toronto/cd-player-and-speaker/1485651463,80.0,CD player and speaker,,I am selling a CD player and speaker for $80,City of Toronto,16/09/2020,2020-10-07 17:37:44.710888
1513926773,/v-stereo-systems-home-theatre/city-of-toronto/panasonic-am-fm-5-cd-changer-cassette-stereo-speakers/1513926773,65.0,Panasonic AM FM 5 CD Changer Cassette Stereo & Speakers,,The Panasonic measures 10 inches high and 12 inches deep. Remote control is included. . The Realistic Speakers are bookshelf size...7 inches high x 4.5 x 4 inches. Speaker wire is not included unless ...,City of Toronto,16/09/2020,2020-10-07 17:37:44.711383
1476026871,/v-stereo-systems-home-theatre/city-of-toronto/vintage-teac-cd-p3500-stereo-cd-player/1476026871,50.0,VINTAGE TEAC CD P3500 STEREO CD PLAYER,,"Specs 1bit bitstream conversion, Philips SAA7350 dac / filter, KSS-210A transport / pickup, M4565L op amp, Tec, Rubycon components, S/N ≥ 104 dB @ 1 kHz, dynamic range ≥ 98 dB @ 1 kHz, channel ...",City of Toronto,16/09/2020,2020-10-07 17:37:44.711872
1503408044,/v-stereo-systems-home-theatre/city-of-toronto/yamaha-6-1-channel-av-receiver/1503408044,190.0,Yamaha 6.1 channel AV Receiver,,"Yamaha HTR - 5940 6.1 Channel 105 Watts per Channel, Dolby Digital, DTS and Dolby PRO-Logic, AM/FM/XM - Home Theatre Receiver",City of Toronto,16/09/2020,2020-10-07 17:37:44.712360
1513484407,/v-stereo-systems-home-theatre/city-of-toronto/denon-avr-688/1513484407,150.0,Denon AVR-688,,"Denon AVR-688 7.1 Channel AV Home Theater Multi-Source/Multi-Zone Receiver with HDMI In good working condition when I upgraded my system ,Includes Denon remote. See photos and setup microphone",City of Toronto,16/09/2020,2020-10-07 17:37:44.712845
1524448546,/v-stereo-systems-home-theatre/city-of-toronto/pioneer-channel-networked-av-receiver-radio-speaker/1524448546,250.0,Pioneer Channel Networked AV Receiver radio speaker,,"Mint condition and works in excellent condition Used as radio, speaker, home radio, and receiver",City of Toronto,16/09/2020,2020-10-07 17:37:44.713334
1524443881,/v-stereo-systems-home-theatre/city-of-toronto/bose-acoustimass-15-series-2-yamaha-receiver/1524443881,650.0,Bose Acoustimass 15 Series 2. Yamaha Receiver.,,"Excellent condition, also has bose speaker stand.",City of Toronto,16/09/2020,2020-10-07 17:37:51.305413
1524443634,/v-stereo-systems-home-theatre/city-of-toronto/teac-gf-550-all-in-one-turn-table-cd-tape-aux-tuner/1524443634,60.0,"Teac Gf-550 all in one turn table, cd, tape, aux, tuner",,Works perfectly. The tape sounds a bit muffled probably needs a clean. Hasn't been used in ages. Couple light scuffs on the top otherwise mint. Great all in one unit.,City of Toronto,16/09/2020,2020-10-07 17:37:51.305910
1524411477,/v-stereo-systems-home-theatre/city-of-toronto/polk-audio-speaker-system/1524411477,170.0,polk audio speaker system,,hi selling polk audio speaker system in good condition contact for more info 647-389–5512,City of Toronto,16/09/2020,2020-10-07 17:37:51.306602
1524388963,/v-stereo-systems-home-theatre/city-of-toronto/bnib-daneli-acoustic-soundbar-system/1524388963,150.0,BNIB Daneli Acoustic soundbar system,,If AD is up it is available!!! BNIB Daneli Acoustic soundbar system Daneli Acoustic HD-29 For Home and Professional Use For HDTV theater Designed in Italy Take your digital music collection to ...,City of Toronto,16/09/2020,2020-10-07 17:37:51.307091
1524387030,/v-stereo-systems-home-theatre/city-of-toronto/itube-carbon-edition-valve-amplifier-with-ipod-docking-station/1524387030,250.0,Itube Carbon Edition Valve Amplifier with iPod Docking station,,"HARDLY USED FATMAN ITUBE CARBON EDITION VALVE AMPLIFIER WITH INTEGRATED IPOD DOCK, 25 WATTS. COMES WITH OWNERS MANUAL, REMOTE, ORIGINAL PACKING IT IS IN MINT CONDITION, NO SCRATCHES, NO PROBLEMS. ...",City of Toronto,16/09/2020,2020-10-07 17:37:51.307592
1513794362,/v-stereo-systems-home-theatre/city-of-toronto/vtg-kenwood-am-fm-ster-rec-kr-4600-1972-100w-200w/1513794362,150.0,Vtg. Kenwood am/fm ster.rec.kr-4600-1972 100w-200w,,1 or 2 bulbs burnt out--some light scratches-20lbs all working well,City of Toronto,16/09/2020,2020-10-07 17:37:51.308080
1503190361,/v-stereo-systems-home-theatre/city-of-toronto/sony-stereo-headphones-mdr-xd200-used/1503190361,20.0,Sony stereo headphones MDR-XD200 used.,,Sony stereo headphones MDR-XD200 used. You will get what you see in the photos.,City of Toronto,16/09/2020,2020-10-07 17:37:51.308565
1513722953,/v-stereo-systems-home-theatre/city-of-toronto/linn-wakonda-preamplifier-with-remote-manual/1513722953,600.0,LINN WAKONDA  PREAMPLIFIER  WITH REMOTE & MANUAL,,"PLEASE GIVE US A CALL FOR QUICK ANSWERS . WE DO NOT REGULARLY CHECK OUR MAILS SO CALLING IS YOUR BEST OPTION . Item is in good working condition . Come and see hundreds of items ( Vintage audio , led ...",City of Toronto,16/09/2020,2020-10-07 17:37:51.309110
1513720637,/v-stereo-systems-home-theatre/city-of-toronto/cambridge-audio-azur-540c-cd-player-with-remote/1513720637,200.0,CAMBRIDGE AUDIO AZUR 540C CD PLAYER WITH REMOTE,,"PLEASE GIVE US A CALL FOR QUICK ANSWERS . WE DO NOT REGULARLY CHECK OUR MAILS SO CALLING IS YOUR BEST OPTION . Item is in good working condition . Come and see hundreds of items ( Vintage audio , led ...",City of Toronto,16/09/2020,2020-10-07 17:37:51.309606
1513721409,/v-stereo-systems-home-theatre/city-of-toronto/two-connoisseur-bd2-turntables/1513721409,200.0,Two Connoisseur BD2 Turntables,,"Two Connoisseur BD2 Turntables In ‘as is’ condition As seen in my photos Had these on a shelf for years But now I’m doing the ‘Covid Cleanup’ One dustcover is good, one dustcover is crap Somebody ...",City of Toronto,16/09/2020,2020-10-07 17:37:51.310100
1503157933,/v-stereo-systems-home-theatre/city-of-toronto/rotel-integrated-amp-ra-985bx/1503157933,500.0,Rotel Integrated Amp RA-985BX,,"$500 dollars OBO Continuous Power Output (20-20 kHz, < 0.03%, 8 ohms) Total Harmonic Distortion (20Hz-20kHz) Intermodulation Distortion (60 Hz : 7 kHz, 4:1) Frequency Response - all inputs Damping ...",City of Toronto,16/09/2020,2020-10-07 17:37:51.310821
1503157075,/v-stereo-systems-home-theatre/city-of-toronto/rotel-ra985-bx-integrated-amp/1503157075,500.0,ROTEL RA985-BX INTEGRATED AMP,,"$500 dollars OBO Continuous Power Output (20-20 kHz, < 0.03%, 8 ohms) Total Harmonic Distortion (20Hz-20kHz) Intermodulation Distortion (60 Hz : 7 kHz, 4:1) Frequency Response - all inputs Damping ...",City of Toronto,16/09/2020,2020-10-07 17:37:51.311325
1503156624,/v-stereo-systems-home-theatre/city-of-toronto/rotel-ra-985bx-integrated-amp/1503156624,500.0,ROTEL RA 985BX Integrated Amp,,"$500 dollars OBO Continuous Power Output (20-20 kHz, < 0.03%, 8 ohms) Total Harmonic Distortion (20Hz-20kHz) Intermodulation Distortion (60 Hz : 7 kHz, 4:1) Frequency Response - all inputs Damping ...",City of Toronto,16/09/2020,2020-10-07 17:37:51.311815
1503155866,/v-stereo-systems-home-theatre/city-of-toronto/rotel-ra-985bx-integrated-amp/1503155866,500.0,Rotel RA-985BX Integrated Amp,,"$500 dollars OBO Specifications Continuous Power Output (20-20 kHz, < 0.03%, 8 ohms) Total Harmonic Distortion (20Hz-20kHz) Intermodulation Distortion (60 Hz : 7 kHz, 4:1) Frequency Response - all ...",City of Toronto,16/09/2020,2020-10-07 17:37:51.312304
1503154241,/v-stereo-systems-home-theatre/city-of-toronto/yamaha-power-amp-p4500-320-watts-per-side/1503154241,500.0,Yamaha Power Amp P4500 320 Watts per side,,$500 or Best Offer. The output capacity of this amplifier is very high: 460 W+460 W (8Ω) in stereo and 1240 W (8Ω) in monaural on the P4500; 340 W+340 W (8Ω) in stereo and 880 W (8Ω) in monaural on ...,City of Toronto,16/09/2020,2020-10-07 17:37:51.312795
1503153838,/v-stereo-systems-home-theatre/city-of-toronto/yamaha-p4500-power-amp-320-watts-per-channel/1503153838,500.0,Yamaha P4500 Power Amp. 320 watts per channel,,Asking $500 or Best Offer. The output capacity of this amplifier is very high: 460 W+460 W (8Ω) in stereo and 1240 W (8Ω) in monaural on the P4500; 340 W+340 W (8Ω) in stereo and 880 W (8Ω) in ...,City of Toronto,16/09/2020,2020-10-07 17:37:51.313286
1503153334,/v-stereo-systems-home-theatre/city-of-toronto/yamaha-p4500-power-amp-320-watts-per-channel/1503153334,500.0,Yamaha P4500 power amp 320 watts per channel,,$500 or Best Offer. The output capacity of this amplifier is very high: 460 W+460 W (8Ω) in stereo and 1240 W (8Ω) in monaural on the P4500; 340 W+340 W (8Ω) in stereo and 880 W (8Ω) in monaural on ...,City of Toronto,16/09/2020,2020-10-07 17:37:51.313779
1524344395,/v-stereo-systems-home-theatre/city-of-toronto/sound-bar/1524344395,65.0,Sound bar,,Insignia Soundbar with Bluetooth model NS-SB314 in mint condition!,City of Toronto,16/09/2020,2020-10-07 17:37:51.314266
1524344121,/v-stereo-systems-home-theatre/city-of-toronto/nikko-digital-synthesizer-am-fm-stereo-tuner-nt-700ii/1524344121,20.0,nikko digital synthesizer am/fm stereo tuner nt-700ii,,Looks good and powers on. Not fully tested because I don't have speakers that will connect to them. Quality brand. Pick up Kipling & Dundas St W,City of Toronto,16/09/2020,2020-10-07 17:37:51.314761
1513676479,/v-stereo-systems-home-theatre/city-of-toronto/panasonic-radio-cd-cassette-system/1513676479,50.0,Panasonic Radio/CD/Cassette System,,Panasonic - Radio/ CD / Cassette System - Model SA_PM28 With Remote Control-In Good Working Condition for $60 Speakers on the image are not included,City of Toronto,16/09/2020,2020-10-07 17:37:51.315254
1513671599,/v-stereo-systems-home-theatre/city-of-toronto/sony-mega-bass_cdf768-radio-cd-double-cassette-recorder/1513671599,60.0,Sony Mega Bass_CDF768- Radio/CD/ Double Cassette Recorder,,Sony Mega Bass Model CFD-768 with Remote Control Radio - CD - Double Cassette Recorder/ Hi Speed Dubbing Works with battery and also 110 volt (cable included) In Good Working Condition for $80,City of Toronto,16/09/2020,2020-10-07 17:37:51.315753
1524300454,/v-stereo-systems-home-theatre/city-of-toronto/high-quality-kenwood-home-stereo/1524300454,85.0,High Quality Kenwood Home Stereo,,"Digital display flips when turned on. Barely used, sounds amazing. Auxiliary audio in and Sub out. Comes with remote and manual. Don Mills & Finch Available Wednesday and Thursday. Must be gone by ...",City of Toronto,16/09/2020,2020-10-07 17:37:51.316244
1524294424,/v-stereo-systems-home-theatre/city-of-toronto/technics-sa-da8-av-receiver/1524294424,100.0,Technics SA-DA8 AV receiver,,"Old, but still works",City of Toronto,15/09/2020,2020-10-07 17:37:51.316731
1524292106,/v-stereo-systems-home-theatre/city-of-toronto/yamaha-ysp2700-b-7-1-channel-surround-sound-speaker-system/1524292106,750.0,Yamaha (YSP2700 B) 7.1-Channel Surround Sound Speaker System,,"Reason for selling: moving Very good condition - Built-in Chromecast, Airplay, Spotify Connect (support for other popular streaming services) - 4K pass-through - MusicCast multi-room system - ...",City of Toronto,15/09/2020,2020-10-07 17:37:51.317212
1524288979,/v-stereo-systems-home-theatre/city-of-toronto/marantz-5220-cassette-deck/1524288979,900.0,Marantz 5220 Cassette Deck,,"This Marantz 5220 is a stereo cassette deck with Dolby B noise reduction, it was first sold by Marantz in 1974 with a list price of USD $350 and discontinued 3 years later in 1977. The main features ...",City of Toronto,15/09/2020,2020-10-07 17:37:51.317698
1524284679,/v-stereo-systems-home-theatre/city-of-toronto/new-vivid-portable-am-fm-stereo-cd-player-tape-player/1524284679,75.0,"NEW - VIVID Portable AM/FM Stereo, CD Player, Tape Player",,"Brand: VIVID Stereo; Spectrum VFD – Digital Programmable Compact Disc System Model: MX-123VD (not certain if this is Model #) AM / FM Stereo, CD Player, Tape Player, 3D Virtual Dimensions: 23 1/2;” x ...",City of Toronto,15/09/2020,2020-10-07 17:37:51.318183
1524281161,/v-stereo-systems-home-theatre/city-of-toronto/speaker-panasonic-theatre-audio-system-panasonic/1524281161,29.0,"Speaker ""panasonic"" Theatre Audio System Panasonic",,Must sell! $29 or best offer If your reading this its still available! 1st come 1st served,City of Toronto,15/09/2020,2020-10-07 17:37:51.318685
1513677434,/v-stereo-systems-home-theatre/city-of-toronto/power-conditioner-ultralink-hdc-200rm/1513677434,300.0,Power conditioner ultralink hdc-200rm,,"9 outlet power conditioner for your home theater and tidying up power cords. Stage 2 filtering. Msrp $379.99+tax, $300 all included price. Comes with all retail packaging and receipt for warranty. ...",City of Toronto,15/09/2020,2020-10-07 17:37:51.319178
1464289964,/v-stereo-systems-home-theatre/city-of-toronto/pioneer-dolby-b-c-hx-pro-cassette-deck-with-media/1464289964,290.0,Pioneer  Dolby B/C /HX-Pro Cassette Deck with Media,,Pioneer Dolby B/C /HX-Pro Cassette Deck with Media Pioneer Dolby B/C /HX-Pro /Auto Reverse / 2 Motor / Auto Tape Setup / Cassette Deck with Media model: CT-S601R Noise Reduction Dolby B/C/HX-Pro ...,City of Toronto,15/09/2020,2020-10-07 17:37:51.319676
1503138127,/v-stereo-systems-home-theatre/city-of-toronto/sony-docking-station/1503138127,39.99,Sony  docking station,,Excellent brand new in box. CD boom box. Great for your indoor or outdoor entertainment. Price is firm as this is Abrams new item and sells for $125 new.,City of Toronto,15/09/2020,2020-10-07 17:37:51.320357
1498782140,/v-stereo-systems-home-theatre/city-of-toronto/massive-subwoofer-and-surround-speakers-for-surround-sound/1498782140,500.0,"massive subwoofer,and surround speakers for surround sound",,"15"" Velodyne CT-150 subwoofer hardly used. Powerful enough to shake the whole house! $500 Also Monitor Audio, Bronze BX-FX surround speakers $200",City of Toronto,15/09/2020,2020-10-07 17:37:51.320881
1524250391,/v-stereo-systems-home-theatre/city-of-toronto/sony-stereo-system-5-speakers/1524250391,175.0,SONY STEREO SYSTEM - 5 SPEAKERS,,Excellent sound! Priced to move. Free cabinet.,City of Toronto,15/09/2020,2020-10-07 17:37:51.321369
1524238999,/v-stereo-systems-home-theatre/city-of-toronto/nad-6340-cassette-deck/1524238999,200.0,NAD 6340  CASSETTE DECK,,"PLEASE GIVE US A CALL FOR QUICK ANSWERS . WE DO NOT REGULARLY CHECK OUR MAILS SO CALLING IS YOUR BEST OPTION . Item is in good working condition . Come and see hundreds of items ( Vintage audio , led ...",City of Toronto,15/09/2020,2020-10-07 17:37:51.321860
1485658230,/v-stereo-systems-home-theatre/city-of-toronto/bathroom-digital-clock-fm-radio/1485658230,8.0,Bathroom Digital Clock FM Radio,,High fidelity FM reception with digital clock Silver/Blue,City of Toronto,15/09/2020,2020-10-07 17:37:53.072124
1524225390,/v-stereo-systems-home-theatre/city-of-toronto/4-way-hdmi-switcher-with-digital-and-analog-audio-extraction/1524225390,25.0,4-way HDMI switcher with digital and analog audio extraction.,,Very useful for sending sound from HDMI sourves to vintage receivers. In perfect condition. More info here: https://www.monoprice.com/product?p_id=5557,City of Toronto,15/09/2020,2020-10-07 17:37:53.072613
1360350536,/v-stereo-systems-home-theatre/city-of-toronto/sony-xplod-head-unit-cdx-gt430ip/1360350536,40.0,Sony Xplod Head Unit - CDX- GT430IP,,Sony Xplod Head Unit - CDX- GT430IP Comes with remote & ipod hook up cable at rear $40 or best reasonable offer smoke & pet free home 416 985 9459 call or text,City of Toronto,15/09/2020,2020-10-07 17:37:53.073487
1476323666,/v-stereo-systems-home-theatre/city-of-toronto/telefunken-model-t-1000-tuner/1476323666,250.0,Telefunken Model T-1000 Tuner,,"Update - May 2020 - Amp + Cabinets sold, tuner still available - Telefunken integrated amplifier and tuner up for sale - both in good working condition. They came in with a pair of Telefunken Disco ...",City of Toronto,15/09/2020,2020-10-07 17:37:53.073970
1524186494,/v-stereo-systems-home-theatre/city-of-toronto/bose-acoustimass-6-series-3-with-yamaha-av-receiver/1524186494,800.0,BOSE Acoustimass 6 Series 3 with Yamaha AV Receiver,,"selling this bose home entertainment speaker system (good condition and comes with original wires + setup guide/manual) comes with Yamaha AV Receiver HTR-3066 (+ remote, AM antenna, and cd-rom owners ...",City of Toronto,15/09/2020,2020-10-07 17:37:53.074451
1524169459,/v-stereo-systems-home-theatre/city-of-toronto/tape-cd-radio-sony-player/1524169459,50.0,Tape cd radio Sony player,,Tape cd radio Sony player in excellent condition used gently,City of Toronto,15/09/2020,2020-10-07 17:37:53.075132
1513439452,/v-stereo-systems-home-theatre/city-of-toronto/vintage-akai-integrated-amplifier/1513439452,165.0,Vintage Akai  Integrated Amplifier,,Akai AM-U01 Stereo Integrated Amplifier Excellent Condition As seen in my photos Solid vintage 1980 unit Made in Japan In perfect working condition with great sound. Works perfectly with any ...,City of Toronto,15/09/2020,2020-10-07 17:37:53.075629
1513443133,/v-stereo-systems-home-theatre/city-of-toronto/sonance-ss4-speaker-switch/1513443133,85.0,Sonance SS4 Speaker Switch,,"Sonance SS4 Speaker Switch Excellent condition From a pet-free, smoke-free home Sells for $114.98 USD on BestBuy US web site Not available at BestBuy in Canada",City of Toronto,15/09/2020,2020-10-07 17:37:53.076112
1524147225,/v-stereo-systems-home-theatre/city-of-toronto/logitech-z5500-speaker-system-greatest-of-all-time/1524147225,200.0,Logitech Z5500 Speaker System - greatest of all time,,Literally one of the best speaker systems ever created. Can be connected to computers or stereo system (rca or optical) The speakers are crystal clear and the bass will shake you to the bones. ...,City of Toronto,15/09/2020,2020-10-07 17:37:53.076597
1524133795,/v-stereo-systems-home-theatre/city-of-toronto/timeless-stereo/1524133795,400.0,Timeless Stereo,,Original Vintage Wood Marantz Receiver. Model 2220,City of Toronto,15/09/2020,2020-10-07 17:37:53.077082
