,url,price,title,distance,description,location,time_offset,retreived
1512917253,/v-baby-clothes-12-18-months/city-of-toronto/euc-adidas-toddler-running-shoes-size-6/1512917253,20.0,EUC adidas toddler running shoes size 6,,Sneakers in excellent condition. Barely worn. Toddler size 6. Contactless porch pickup. Yonge and Lawrence,City of Toronto,11/09/2020,2020-10-06 11:42:28.582676
1512876486,/v-baby-clothes-12-18-months/city-of-toronto/kids-clothes-for-12-18-months-10-for-8/1512876486,10.0,Kids Clothes for 12-18 months - $10 for 8,,Kids Clothes for 12-18 months - $10 for 8 pieces. In very good condition. From a pet free and smoke free home. Pick up from front door.,City of Toronto,11/09/2020,2020-10-06 11:42:30.459945
1523466856,/v-baby-clothes-12-18-months/city-of-toronto/carter-s-floral-hoodie-12-18-months-like-new/1523466856,4.0,Carter’s floral hoodie 12-18 months Like-New,,Like-new condition,City of Toronto,11/09/2020,2020-10-06 11:42:30.460448
1523465802,/v-baby-clothes-12-18-months/city-of-toronto/old-navy-pink-long-sleeved-top-12-18-months/1523465802,1.0,Old Navy pink long sleeved top 12-18 months,,"Good condition, smoke-free home",City of Toronto,11/09/2020,2020-10-06 11:42:30.460945
1523444936,/v-baby-clothes-12-18-months/city-of-toronto/canada-goose-baby-bunting-bag/1523444936,100.0,Canada Goose baby bunting bag,,Excellent condition- barely used! Single leg option or combine for one big pocket for the feet. SFPF home,City of Toronto,11/09/2020,2020-10-06 11:42:30.461556
1523312667,/v-baby-clothes-12-18-months/city-of-toronto/adidas-size-5c/1523312667,15.0,Adidas size 5c,,Still in great condition- pink and blue adidas in size 5c. $15,City of Toronto,11/09/2020,2020-10-06 11:42:30.462064
1523309749,/v-baby-clothes-12-18-months/city-of-toronto/padraigs-knit-slippers-20-pair/1523309749,20.0,Padraigs knit slippers $20 / pair,,Green are B5 shoe size 5-7 approx toddler Purple C9 toddler shoes size 9 Located near Trinity Bellwoods.,City of Toronto,10/09/2020,2020-10-06 11:42:30.462573
1523296707,/v-baby-clothes-12-18-months/city-of-toronto/12-18-month-girl-clothing/1523296707,40.0,12-18 Month Girl Clothing,,"A large box full of clothing!! All In great condition, lots of shirts, pants, dresses, pjs, my daughter outgrew everything!! Please message me for more info :) Over 50 items, makes each item less ...",City of Toronto,10/09/2020,2020-10-06 11:42:30.463070
1523291370,/v-baby-clothes-12-18-months/city-of-toronto/baby-girl-dress/1523291370,20.0,Baby girl dress,,Baby girl dress ( The children's place) New with tags (12-18 months) Text (416) 553-2290,City of Toronto,10/09/2020,2020-10-06 11:42:30.463563
1502330486,/v-baby-clothes-12-18-months/city-of-toronto/winter-jacket/1502330486,10.0,Winter jacket,,BNWT Infant girl Oshkosh jacket size 18months . SFPF home.,City of Toronto,10/09/2020,2020-10-06 11:42:30.464064
1523263836,/v-baby-clothes-12-18-months/city-of-toronto/baby-winter-jacket-size-12m/1523263836,10.0,baby winter jacket size 12m.,,Good condition.,City of Toronto,10/09/2020,2020-10-06 11:42:30.464610
1523211432,/v-baby-clothes-12-18-months/city-of-toronto/brand-new-zara-sweater-12-18months/1523211432,15.0,BRAND NEW Zara Sweater 12-18months,,Purchased in March but because of COVID could not return it. Size 12-18 months. Purchased for $22.90.,City of Toronto,10/09/2020,2020-10-06 11:42:30.465153
1523208759,/v-baby-clothes-12-18-months/city-of-toronto/brand-new-zara-snowsuit-12-18months/1523208759,30.0,BRAND NEW Zara Snowsuit 12-18months,,BRAND NEW Zara Snowsuit 12-18months. Bought this brand new from Zara in March but because of COVID I couldn’t exchange it for a larger size. Tags are still on! Never worn! Bought it for $39.90.,City of Toronto,10/09/2020,2020-10-06 11:42:30.465655
1523202403,/v-baby-clothes-12-18-months/city-of-toronto/brand-new-infant-adidas-stmajo-size-4us/1523202403,40.0,BRAND NEW Infant Adidas STMAJO - Size 4US,,NEVER WORN!! BRAND NEW Infant Adidas STMAJO - Size 4US. Retails at Footlocker for $65.,City of Toronto,10/09/2020,2020-10-06 11:42:30.466152
1523174156,/v-baby-clothes-12-18-months/city-of-toronto/new-infant-sorel-boots-black-size-6/1523174156,45.0,NEW!! Infant Sorel Boots (black) Size 6,,SOREL Infants Snow Commander boots in black. Bought these for my son but he wasn’t walking yet and then he outgrew them. Wore them only a few times. They are BRAND NEW! Retails for $65.,City of Toronto,10/09/2020,2020-10-06 11:42:30.466657
1523123070,/v-baby-clothes-12-18-months/city-of-toronto/gap-frosted-pink-snowsuit-toddler-girl-size-12-18-mths/1523123070,20.0,Gap Frosted Pink Snowsuit Toddler Girl (size 12-18 mths),,Excellent condition. It was always kept in a pet-free and smoke-free home. It comes with detachable matching mittens and boots. Pick up from near Bayview Village Mall area (Bayview and Sheppard).,City of Toronto,10/09/2020,2020-10-06 11:42:30.467167
1523110900,/v-baby-clothes-12-18-months/city-of-toronto/brand-new-carters-footless-hockey-fleece-sleeper-18-months/1523110900,5.0,Brand New Carters Footless Hockey Fleece Sleeper (18 months),,Brand new Size 18 months (12-18 months) Light pink Retails $16. Asking $5,City of Toronto,09/09/2020,2020-10-06 11:42:30.467666
1523096369,/v-baby-clothes-12-18-months/city-of-toronto/uniqlo-toddler-fleece-shirt-12-18m/1523096369,3.0,Uniqlo toddler fleece shirt ( 12 - 18M ),,Very good condition. My son wore it only a couple of times. Pick up only at Davisville × Mt. Pleasant No return Please check my other ads too!,City of Toronto,09/09/2020,2020-10-06 11:42:30.468169
1494042542,/v-baby-clothes-12-18-months/city-of-toronto/brand-new-baby-clothes-12-24months/1494042542,1.0,Brand new baby clothes 12-24months,,"Picture 1:$2, 18months picture 2:$2, 24months picture 3:$1, 24months picture 4:$1, 12months picture 5:$2, 12-18months picture 6:$2, 18months picture 7:$2, 18months Picture 8: $2, 24months see my ...",City of Toronto,09/09/2020,2020-10-06 11:42:30.468663
1523094251,/v-baby-clothes-12-18-months/city-of-toronto/polo-ralph-lauren-shirt-for-toddler-18m/1523094251,3.0,Polo Ralph Lauren shirt for toddler ( 18M ),,Very cute polo Ralph Lauren toddler shirt! Pick up only at Davisville × Mt. Pleasant No return Please check my other ads too!,City of Toronto,09/09/2020,2020-10-06 11:42:30.469159
1523082288,/v-baby-clothes-12-18-months/city-of-toronto/boys-onsies-12-m-to-24m-lot/1523082288,20.0,Boys onsies 12 m to 24m lot,,5 brand new onsies Joe fresh Baby gap Superman,City of Toronto,09/09/2020,2020-10-06 11:42:30.469658
1463585285,/v-baby-clothes-12-18-months/city-of-toronto/guy-laroche-winter-baby-outfit-18-months/1463585285,15.0,Guy Laroche Winter Baby outfit 18 months,,New Size 18 months From smoke and pet free home.,City of Toronto,09/09/2020,2020-10-06 11:42:30.470153
1522930183,/v-baby-clothes-12-18-months/city-of-toronto/new-boy-12-18-month-outfit-4-pieces/1522930183,12.0,New boy 12-18 month outfit (4 pieces),,"Outfit includes all of the following: 1. Boys khaki pants 2. Old Navy, navy blue long sleeve polo shirt 3. Children's Place grey sweater and 4. Children's Place long sleeve robot graphic shirt $12 ...",City of Toronto,08/09/2020,2020-10-06 11:42:30.470881
1522900028,/v-baby-clothes-12-18-months/city-of-toronto/sleep-sack-with-feet-2-5-tog/1522900028,20.0,Sleep sack with feet 2.5 tog,,"Slumbersafe sleep sack with feet 2.5 tog - perfect for fall/winter Size 12-18 months Excellent, like-new condition No stain No rip/tear From smoke-free, pet-free home Pick up in Liberty Village ...",City of Toronto,08/09/2020,2020-10-06 11:42:30.471381
1522899924,/v-baby-clothes-12-18-months/city-of-toronto/3-new-boys-childrens-place-shirts-size-12-to-18-months/1522899924,10.0,3 New boys Children's Place shirts size 12 to 18 months,,3 Brand-new new boys Children's Place shirts: 1. red long sleeve 2. navy blue t-shirt 3. orange golf t-shirt All 3 for $10,City of Toronto,08/09/2020,2020-10-06 11:42:30.471882
1522893462,/v-baby-clothes-12-18-months/city-of-toronto/baby-girl-12-24-mos-fall-winter-sleepers/1522893462,12.0,Baby girl 12-24 mos fall/winter sleepers,,"Baby girl 12-24 mos fall/winter sleepers. Posted in baby items, clothing - 12-18 months in City of Toronto. September 8, 2020",City of Toronto,08/09/2020,2020-10-06 11:42:30.472377
1522892677,/v-baby-clothes-12-18-months/city-of-toronto/baby-girl-12-24-mos-fall-winter-lot/1522892677,40.0,Baby girl 12-24 mos fall/winter lot,,"Baby girl 12-24 mos fall/winter lot. Posted in baby items, clothing - 12-18 months in City of Toronto. September 8, 2020",City of Toronto,08/09/2020,2020-10-06 11:42:30.472874
1522857379,/v-baby-clothes-12-18-months/city-of-toronto/the-north-face-tnf-bunting-snowsuit-12-18m-infant/1522857379,30.0,The North Face TNF bunting snowsuit 12-18m Infant,,"North Face midweight snowsuit. Size 12-18m, fits large. Smoke free and Pet free home. Very gently used. If ad is up, it’s available. Pick up only. Please check out my other ads.",City of Toronto,08/09/2020,2020-10-06 11:42:30.473371
1522854955,/v-baby-clothes-12-18-months/city-of-toronto/mec-mountain-equipment-co-op-cocoon-baby-bunting-12m-snowsuit/1522854955,25.0,MEC mountain equipment co-op Cocoon baby bunting 12m snowsuit,,"MEC midweight snowsuit. Great for the car. Size 12m, fits large. Smoke free and Pet free home. Excellent condition. If ad is up, it’s available. Pick up only.",City of Toronto,08/09/2020,2020-10-06 11:42:30.473869
1522852417,/v-baby-clothes-12-18-months/city-of-toronto/minnie-mouse-baby-moments-marker-dry-erase-board/1522852417,3.0,"Minnie mouse baby moments marker
Dry erase board",,"Brand new Posted in baby items, clothing - 12-18 months in Toronto (GTA), City of Toronto. September 18, 2020",City of Toronto,08/09/2020,2020-10-06 11:42:30.474364
1522842947,/v-baby-clothes-12-18-months/city-of-toronto/real-leather-baby-shoes-size-eu:22-us:-6-13-cm/1522842947,25.0,"Real leather Baby Shoes, Size Eu:22, US: 6, 13 cm",,"Pablosky real leather Baby Shoes, (made in Spain) Size EU: 22, US: 6, 13 cm, Price: $25 (not negotiable), For stable and healthy steps, Check Pablosky Website: a leading brand of children footwear. ...",City of Toronto,08/09/2020,2020-10-06 11:42:30.474915
1522822450,/v-baby-clothes-12-18-months/city-of-toronto/12-18-month-baby-lot/1522822450,6.0,12-18 month baby lot,,"12-18 month baby lot 2 pj sets, 1 shirt, 1 skort, 1 soft jean shorts, and 1 pair of sox. $6 From a clean, pet/smoke free home Please check my other posts for more great sale items.",City of Toronto,08/09/2020,2020-10-06 11:42:30.475417
1522817570,/v-baby-clothes-12-18-months/city-of-toronto/baby-girl-red-plaids-christmas-long-sleeve-dress/1522817570,15.0,Baby Girl Red Plaids Christmas Long Sleeve Dress,,Baby Girl Red Plaids Christmas Long Sleeve Dress,City of Toronto,08/09/2020,2020-10-06 11:42:30.475914
1522815661,/v-baby-clothes-12-18-months/city-of-toronto/12-18-months-soft-jean-skort/1522815661,2.0,12-18 months soft jean skort,,"12-18 months soft jean skort. Great condition. From clean, pet/smoke free home Please check my other posts for more great sale items",City of Toronto,08/09/2020,2020-10-06 11:42:30.476418
1522815280,/v-baby-clothes-12-18-months/city-of-toronto/baby-girl-mini-skirt-plaid-bow-outfit-set/1522815280,10.0,Baby Girl  Mini Skirt Plaid+Bow  Outfit Set,,Baby Girl Mini Skirt Plaid+Bow Outfit Set,City of Toronto,08/09/2020,2020-10-06 11:42:30.476914
1522811593,/v-baby-clothes-12-18-months/city-of-toronto/floral-2-piece-shorts-top-set/1522811593,15.0,FLORAL 2 PIECE SHORTS & TOP SET,,FLORAL 2 PIECE SHORTS & TOP SET,City of Toronto,08/09/2020,2020-10-06 11:42:30.477416
1522792178,/v-baby-clothes-12-18-months/city-of-toronto/north-face-winter-pants-size-18-months/1522792178,15.0,North Face Winter Pants Size 18 months,,North Face Winter Pants Size 18 months,City of Toronto,08/09/2020,2020-10-06 11:42:30.477918
1522732620,/v-baby-clothes-12-18-months/city-of-toronto/burberry-baby-dress/1522732620,45.0,Burberry Baby Dress,,Authentic; in excellent condition. Colour: light pink. Age: 12 months; height 74 cm.,City of Toronto,07/09/2020,2020-10-06 11:42:30.478422
1522722692,/v-baby-clothes-12-18-months/city-of-toronto/black-shorts-for-toddlers-12-18m/1522722692,1.0,Black shorts for toddlers ( 12 - 18M ),,"It says ""12-18M"", but yonger one can wear them. They are very short so it was helpful for hot summer! Please pick up at Davisville × Mt. Pleasant No returns Please check my other ads too!",City of Toronto,07/09/2020,2020-10-06 11:42:30.478933
1512115065,/v-baby-clothes-12-18-months/city-of-toronto/baby-socks-brand-new-set-of-5-from-drake-general-store/1512115065,15.0,Baby socks brand new set of 5 from Drake General Store,,Brand new gift set of infant/baby socks size 12 to 24 months. All socks still in box from the Drake General Store. Brand is Arborist. Such a cute gift or for your own Baby. Paid $23 plus tax. Asking ...,City of Toronto,07/09/2020,2020-10-06 11:42:30.479431
1522706322,/v-baby-clothes-12-18-months/city-of-toronto/carters-black-shirt-12m/1522706322,2.0,Carter's Black Shirt ( 12M ),,Very cute space shirt! Please pick up at Davisville × Mt. Pleasant No returns Please check my other ads too!,City of Toronto,07/09/2020,2020-10-06 11:42:32.570123
1522695261,/v-baby-clothes-12-18-months/city-of-toronto/write-shirt-for-toddler-80-90/1522695261,3.0,write shirt for toddler ( 80 ~ 90 ),,Very cute & cool shirt! My son wore it only a couple of times when he was 1 yo. Please pick up at Davisville × Mt. Pleasant No returns Please check my other ads too!,City of Toronto,07/09/2020,2020-10-06 11:42:32.570635
1522690691,/v-baby-clothes-12-18-months/city-of-toronto/new-mexx-shirt-boys-12-18-months/1522690691,20.0,"New ""MEXX"" shirt boys 12-18 months",,Brand New $20 or best offer Located near Fairview Mall Can meet at Fairview Mall or Don Mills subway station.,City of Toronto,07/09/2020,2020-10-06 11:42:32.571126
1522690654,/v-baby-clothes-12-18-months/city-of-toronto/leggings-and-pants-for-12-18-months-baby/1522690654,3.0,Leggings and pants for 12-18 months baby,,"Have 2 pairs of leggings and 1 pair of pants for baby 12-18 months old. Asking $3 for each or $5 for all. Have tons of baby items for sale, please see my other ads.",City of Toronto,07/09/2020,2020-10-06 11:42:32.571622
1522689824,/v-baby-clothes-12-18-months/city-of-toronto/leggings-and-pants-for-12-18-months-babies/1522689824,3.0,Leggings and pants for 12-18 months babies,,Have 2 pairs of leggings and a pants for baby 12-18 months. One leggings are brand new. Asking $3 each or $5 for all. Have tons of other clothes. Please see my other ads.,City of Toronto,07/09/2020,2020-10-06 11:42:32.572131
1512178182,/v-baby-clothes-12-18-months/city-of-toronto/tommy-hilfiger-hooded-sweatshirt-12-18-months/1512178182,4.0,Tommy Hilfiger hooded sweatshirt 12-18 months,,"Great condition, smoke-free home",City of Toronto,07/09/2020,2020-10-06 11:42:32.572620
1522634941,/v-baby-clothes-12-18-months/city-of-toronto/gap-light-jacket-size-12-18-m/1522634941,10.0,"GAP Light Jacket, size 12-18 m",,"Gap baby's light jacket, Size: 12-18 m, Price: $10 (not negotiable), very gently used, Pet and smoke free home, pick up only at 23 Glebe Rd., W., Toronto, Yonge and davsiville, 5 minutes walk north ...",City of Toronto,07/09/2020,2020-10-06 11:42:32.573109
1509403190,/v-baby-clothes-12-18-months/city-of-toronto/carters-boys-short-sleeved-onesies-12mths/1509403190,10.0,Carter's boys' short sleeved onesies 12mths,,Very gently used and from SFPF home.,City of Toronto,07/09/2020,2020-10-06 11:42:32.573602
1509401521,/v-baby-clothes-12-18-months/city-of-toronto/pekkle-short-sleeved-onesies-12-18-months/1509401521,10.0,Pekkle short sleeved onesies 12-18 months,,Very gently used. SFPF home.,City of Toronto,07/09/2020,2020-10-06 11:42:32.574095
1522605522,/v-baby-clothes-12-18-months/city-of-toronto/snow-pants-and-warm-winter-jacket-for-toddler-12-18-months/1522605522,10.0,Snow pants and warm winter jacket for toddler 12-18 months,,"I have a lot of kids clothes for sale, please see nu other adds. Light purple snow pants- Cherokee baby 12M- $10 in great condition; Baby Gap Jacket - 12-18M- $10 like new.",City of Toronto,07/09/2020,2020-10-06 11:42:32.574600
1501946438,/v-baby-clothes-12-18-months/city-of-toronto/bnib-harry-potter-bodysuit-leggings-12-18-months/1501946438,10.0,BNIB Harry Potter bodysuit & leggings 12 & 18 months,,Solemnly swear 12 m set and HP Crest 18 m set $10 each Pick up Victoria Park/401 area.,City of Toronto,07/09/2020,2020-10-06 11:42:32.575089
1522569756,/v-baby-clothes-12-18-months/city-of-toronto/bogs-b-moc-winter-boots-for-infant-toddler/1522569756,40.0,Bogs B-Moc Winter Boots for Infant/Toddler,,Used for less than a week as we bought it in March and then Covid lockdown happened and he didn’t wear them again. They are in like new condition. Size 5 for infants or toddler. Selling for $40. ...,City of Toronto,07/09/2020,2020-10-06 11:42:32.575575
1522549634,/v-baby-clothes-12-18-months/city-of-toronto/size-4-toddler-clarks-shoes/1522549634,5.0,Size 4 toddler Clarks shoes,,Size 4 baby/toddler dress shoes for all your holiday party needs,City of Toronto,07/09/2020,2020-10-06 11:42:32.576081
1522527304,/v-baby-clothes-12-18-months/city-of-toronto/gap-girls-warm-coat-12-18m-nwt-retail-135/1522527304,50.0,Gap girls warm coat 12-18M nwt retail $135,,"New with tags. Porch pick up in Etobicoke (Royal York & Eglinton) or meet at Royal York & bloor, Sherway, cloverdale mall, Dixie mall, Vaughan mills mall, or Richmond hill (Leslie & 16th or bayview & ...",City of Toronto,07/09/2020,2020-10-06 11:42:32.576617
1522498910,/v-baby-clothes-12-18-months/city-of-toronto/gap-girls-waffle-warm-fall-jacket-12-18m-nwt-retail-77/1522498910,29.0,Gap girls waffle warm fall jacket 12-18M NWT retail $77,,"New with tags Porch pick up in Etobicoke (Royal York & Eglinton) or meet at Royal York & bloor, Dixie mall, cloverdale mall, Sherway, or Richmond hill (Leslie & 16th or bayview & 16th) Selling for my ...",City of Toronto,06/09/2020,2020-10-06 11:42:32.577110
1522456667,/v-baby-clothes-12-18-months/city-of-toronto/brand-new-never-worn-h-m-sweater-size-12-18-months/1522456667,3.0,Brand new never worn H&M sweater size 12-18 months,,Brand new without tags H&M sweater size 12-18 months. Washed but never worn. Pickup by Fairview Mall area or can meet depending on the area. Smoke-free pet-free home.,City of Toronto,06/09/2020,2020-10-06 11:42:32.577598
1522456238,/v-baby-clothes-12-18-months/city-of-toronto/brand-new-never-worn-h-amp-m-fleece-sweater-size-12-18-months/1522456238,5.0,Brand new never worn H&amp;M fleece sweater size 12-18 months,,Brand new never worn H&M fleece sweater size 12-18 months. Washed but never worn. Pickup by Fairview Mall area or can meet depending on the area. Smoke-free pet-free home.,City of Toronto,06/09/2020,2020-10-06 11:42:32.578089
1522439616,/v-baby-clothes-12-18-months/city-of-toronto/12-18-months-baby-pajamas/1522439616,10.0,12-18 months baby pajamas,,Never used.,City of Toronto,06/09/2020,2020-10-06 11:42:32.578589
1510463670,/v-baby-clothes-12-18-months/city-of-toronto/burberry-girl-size-18-months/1510463670,40.0,Burberry girl size 18 months,,-Burberry girls’ outfit size 18 months -Like new -I live in Quebec but will ship to you,City of Toronto,06/09/2020,2020-10-06 11:42:32.579278
1317311143,/v-baby-clothes-12-18-months/city-of-toronto/brand-new-pj-sets/1317311143,11.0,Brand new PJ sets,,Brand new 2 PJ sets from carters. Size 18 months. Both sets for $11. Smoke and pet free home.,City of Toronto,06/09/2020,2020-10-06 11:42:32.579765
1501348638,/v-baby-clothes-12-18-months/city-of-toronto/sold-patagonia-baby-down-sweater-packable-down-jacket/1501348638,60.0,SOLD-Patagonia Baby Down Sweater (packable down jacket),,"Purple packable down jacket in 12-18 months. Unisex. From clean, smoke-free, pet-free home. More info here: ...",City of Toronto,06/09/2020,2020-10-06 11:42:32.580256
1428845983,/v-baby-clothes-12-18-months/city-of-toronto/new-zara-baby-girl-toddler-navy-white-eyelet-dress-12-18/1428845983,15.0,NEW ZARA Baby GIRL TODDLER Navy White Eyelet Dress 12-18,,New without tags Zara Girls dress Navy and white Pinstripe One piece Bottom skirt has eyelet pattern Size 12-18 months Made in Portugal,City of Toronto,05/09/2020,2020-10-06 11:42:32.580756
1522292653,/v-baby-clothes-12-18-months/city-of-toronto/toddler-beige-pants-12m-to-2t/1522292653,4.0,Toddler beige pants ( 12M to 2T ),,"Very cute pants and I loved them! Great for both boys and girls The tag says 100 ( as you can see in the pic ), but my son wore this pants when he was 1 to 2 Yo. Please pick up at Davisville × Mt. ...",City of Toronto,05/09/2020,2020-10-06 11:42:32.581265
1501429542,/v-baby-clothes-12-18-months/city-of-toronto/baby-girl-clothes-12-18-mos-oshkosh-and-more/1501429542,7.0,Baby Girl  Clothes - 12-18 mos - Oshkosh and more…,,Pick up only. West End Toronto - Royal York and Evans Lot J - Oshkosh Overall Dress - Flower Medley (EUC)- Selling for $15 Lot K - **SOLD** Lot L - **SOLD** Lot M - **SOLD** Lot N - Summer Hibiscus ...,City of Toronto,05/09/2020,2020-10-06 11:42:32.581761
1382576004,/v-baby-clothes-12-18-months/city-of-toronto/brand-new-robeez-soft-soles-size-12-18m/1382576004,18.0,Brand New Robeez Soft Soles Size 12-18M,,Pink and cream soft soles with a 3D flower on the side Brand new in packaging Fits girls size 12-18 months Real leather with a suede sole,City of Toronto,05/09/2020,2020-10-06 11:42:32.582252
1522285373,/v-baby-clothes-12-18-months/city-of-toronto/holiday-christmas-red-dress-for-12-months/1522285373,5.0,Holiday/Christmas red dress for 12 months,,"Red dress in great condition, worn once. Polyester and nylon. Great for Christmas.",City of Toronto,05/09/2020,2020-10-06 11:42:32.582760
1522284313,/v-baby-clothes-12-18-months/city-of-toronto/holiday-dress-for-12-months/1522284313,7.0,Holiday dress for 12 months,,"Beautiful cream dress with embroidery, polyester and spandex, great condition. It was worn once.",City of Toronto,05/09/2020,2020-10-06 11:42:32.583254
1522231865,/v-baby-clothes-12-18-months/city-of-toronto/baby-gap-ultramax-snow-suit-95-value/1522231865,65.0,BABY GAP ULTRAMAX SNOW SUIT - $95 VALUE,,"Bundle and Save with loads more items. Condition: In Perfect condition - Practically new!! Size: 12-18 Months Material: Waterproof, Down Filled. Features: Boot and Mittens attached with snaps. Style: ...",City of Toronto,05/09/2020,2020-10-06 11:42:32.583747
1470005864,/v-baby-clothes-12-18-months/city-of-toronto/gap-down-snowsuit-12-18-mo-barely-worn/1470005864,45.0,Gap Down Snowsuit - 12-18 mo. Barely worn!,,"Like new! Unisex steel grey colour. Detachable booties and mittens included. Cozy fleece lining. See other booties posted in size 5 and 6. More items also posted! Pick up near yonge and bloor, union ...",City of Toronto,04/09/2020,2020-10-06 11:42:32.584239
1522037208,/v-baby-clothes-12-18-months/city-of-toronto/toddler-shoes-sz-2-4-adidas-converse-native-freshly-picked/1522037208,10.0,"Toddler Shoes sz 2-4 (Adidas, Converse, Native, Freshly Picked)",,Excellent Used Condition (EUC) Toddler/Kids Shoes Top Row (L-R) - Black Native Jefferson Size 4 ($20) - Black Converse with hidden velcro closure Size 4 ($15) - Grey Suede Gap Loafers Size 5 ($10) ...,City of Toronto,04/09/2020,2020-10-06 11:42:32.584741
1511168570,/v-baby-clothes-12-18-months/city-of-toronto/pediped-toddler-shoes/1511168570,15.0,Pediped toddler shoes,,Pediped pink flora leather shoes in size US 5-5.5 suitable for 12-18 months little walkers. These shoes are in excellent condition as my daughter hardly worn them. Its made with breathable leather ...,City of Toronto,04/09/2020,2020-10-06 11:42:32.585255
1463307303,/v-baby-clothes-12-18-months/city-of-toronto/pea-coat/1463307303,19.0,Pea coat,,Once worn peacoat with hoodie in excellent condition. Size 12-18 months. Smoke and pet free home.,City of Toronto,04/09/2020,2020-10-06 11:42:32.585768
1303443939,/v-baby-clothes-12-18-months/city-of-toronto/knitted-with-hoodie/1303443939,7.0,Knitted with hoodie,,Once worn Knitted with hoodie in excellent cindition (12-18 mnths).,City of Toronto,04/09/2020,2020-10-06 11:42:32.586362
1521949046,/v-baby-clothes-12-18-months/city-of-toronto/canada-goose-down-filled-winter-jacket-for-babies/1521949046,140.0,Canada Goose down filled winter jacket for babies,,"Selling an excellent condition authentic winter jacket for babies. Size is 6-12 months , but can fit kids upto 2 years. Lots of life left in jacket.",City of Toronto,04/09/2020,2020-10-06 11:42:32.586947
1448513636,/v-baby-clothes-12-18-months/city-of-toronto/toddler-lot-of-shoes-vans-jordans-toms-crocs-etc/1448513636,25.0,"Toddler Lot of Shoes- Vans, Jordans, Toms, Crocs etc.",,Toddler Shoes: Vans - velcro $15 (Size 8) Nike Air Jordans - $15 (Size 9) Crocs Purple $15 (Size 6/7) Crocs - $15 (Size 8/9) Kamik Rain Boots $15 (Size 8) Toms - $25 (Size 8),City of Toronto,03/09/2020,2020-10-06 11:42:32.587458
1521939624,/v-baby-clothes-12-18-months/city-of-toronto/new-toddler-sandals-size-12/1521939624,10.0,"New toddler sandals, size 12",,"Brand new toddler sandals, size 12 Pickup in Toronto (Bloor and Ossington) or Richmond hill (Yonge and 19th).",City of Toronto,03/09/2020,2020-10-06 11:42:32.587979
1521838719,/v-baby-clothes-12-18-months/city-of-toronto/winter-jacket-and-trousers/1521838719,30.0,Winter Jacket and trousers,,Toddlers winter jacket and trousers Lassie by Reima Size 80 Warmth 0 to -10 *C,City of Toronto,03/09/2020,2020-10-06 11:42:32.588490
1521820539,/v-baby-clothes-12-18-months/city-of-toronto/12-month-fall-clothing-lot-brand-names/1521820539,60.0,12 month Fall Clothing Lot - Brand Names,,All are in EUC - no stains or rips. Sizes and brands listed below. Pick up only at Woodbine and Danforth. SFPF home. No holds and cross posted. E-transfer preferred. Selling as a lot for $60. Thanks! ...,City of Toronto,03/09/2020,2020-10-06 11:42:32.588993
