,url,price,title,distance,description,location,time_offset,retreived
1522098269,/v-laptops/city-of-toronto/sony-vaio-e-vpceh25en-laptop-core-i3-2nd-gen-2-gb-320-gb-window/1522098269,130.0,Sony VAIO E VPCEH25EN Laptop (Core i3 2nd Gen/2 GB/320 GB/Window,,Sony VAIO E VPCEH25EN Laptop (Core i3 2nd Gen/4 GB/320 GB/Windows 7/512 MB) have broken in skin(charger $20),City of Toronto,04/09/2020,2020-10-07 17:45:35.163215
1522093140,/v-laptops/city-of-toronto/virus-removal-windows-installation-ms-office-installation/1522093140,49.0,Virus removal * Windows Installation * MS Office Installation,,"WINDOWS 10 INSTALLATION $50 ANY DESKTOP AND LAPTOP AND PICK SAME DAY *****************CERTIFIED TECHNICIAN AVAILABLE************** FAST SERVICE LOW COST, VIRUS REMOVAL, DC JACK REPLACEMENT. Desktop, ...",City of Toronto,04/09/2020,2020-10-07 17:45:35.163700
1522088318,/v-laptops/city-of-toronto/13-5-microsoft-surface-book-2-i7-8gb-256gb-gtx-1050-bundle/1522088318,2000.0,"13.5"" Microsoft Surface Book 2 i7 8GB 256GB GTX 1050 Bundle",,"Selling a 13.5 inch Microsoft Surface Book 2 in like new 10/10 condition. No scratches, dents or scuffs anywhere on the device. It has always been in a case and has always had a tempered glass screen ...",City of Toronto,04/09/2020,2020-10-07 17:45:35.164225
1522079520,/v-laptops/city-of-toronto/macbook-air-13/1522079520,790.0,Macbook Air 13',,"13” MacBook Air, (specifications in the pics) Great condition, like new. Works perfectly. Original owner. With receipt as proof of purchase. Took care of it. Used case, and fabric cover from day one. ...",City of Toronto,04/09/2020,2020-10-07 17:45:35.164708
1522075519,/v-laptops/city-of-toronto/2009-macbook-pro-15-2-8ghz-core-2-duo-4gb-500gb-mojave/1522075519,350.0,"2009 Macbook Pro 15"" - 2.8GHz Core 2 Duo - 4GB - 500GB - Mojave",,"For sale is a used, fully functional Macbook Pro 15"" - 2009. Officially this system supports El Capitan, however, we have updated it to MacOS Mojave, which is a still supported version and functions ...",City of Toronto,04/09/2020,2020-10-07 17:45:35.165188
1522073794,/v-laptops/city-of-toronto/used-lenovo-x230-tablet-i5-8gb-128gb-ssd-touch-lte/1522073794,399.0,"Used - Lenovo X230 Tablet, i5, 8GB, 128GB SSD, Touch, LTE",,"Used - Lenovo X230 Tablet, i5, 8GB, 128GB SSD, LTE, Touchscreen",City of Toronto,04/09/2020,2020-10-07 17:45:35.165666
1522072191,/v-laptops/city-of-toronto/windows-10-with-ms-office-drop-off-and-pickup/1522072191,49.0,Windows 10 with MS office - Drop-off and pickup,,**LAPTOP REPAIR SERVICE **WE CAN FIX ALL LAPTOP PROBLEM **LOW COST **SAME DAY SERVICE -Hard drive failed and black or blue screen -Install new windows WE CAN FIX ANY PHONES/LAPTOP/PC ETC-NO PROBLEMS ...,City of Toronto,04/09/2020,2020-10-07 17:45:35.166143
1522068828,/v-laptops/city-of-toronto/gigabyte-aero-15-oled-4k-xb-intel-10th-gen-new-2020/1522068828,3700.0,"Gigabyte AERO 15 OLED 4K - XB  (Intel 10th Gen)  [NEW, 2020]",,NEW 2020 Laptop: Gigabyte AERO 15 OLED XB-8US51B0SP ---------------------------------------------------------------------- 10th Gen Intel® Core™ i7-10875H 8Cores (16Threads) NVIDIA® GeForce RTX™ 2070 ...,City of Toronto,04/09/2020,2020-10-07 17:45:35.166627
1522065404,/v-laptops/city-of-toronto/gta-windows-10-installation-on-any-desktop-and-laptop-50/1522065404,49.0,GTA-WINDOWS 10 INSTALLATION ON ANY DESKTOP AND LAPTOP -$50,,**LAPTOP REPAIR SERVICE **WE CAN FIX ALL LAPTOP PROBLEM **LOW COST **SAME DAY SERVICE -Hard drive failed and black or blue screen -Install new windows WE CAN FIX ANY PHONES/LAPTOP/PC ETC-NO PROBLEMS ...,City of Toronto,04/09/2020,2020-10-07 17:45:35.167113
1522062394,/v-laptops/city-of-toronto/macbook-air-11-2014-model/1522062394,550.0,"MacBook Air 11""  (2014 model)",,"Selling my MacBook Air 11"" 1.4GHz i5 4GB/128GB (2014) Model, Grade A, Excellent, 9/10 I bought a new MacBook so I no longer need this one. Macbook is in excellent condition, excellent battery life, ...",City of Toronto,04/09/2020,2020-10-07 17:45:35.167596
1522050241,/v-laptops/city-of-toronto/asus-rog-g752vs-gaming-laptop/1522050241,1000.0,ASUS ROG G752VS Gaming Laptop,,"**WINDOWS 10 INCLUDED** **Intel® Core™ i7 6700HQ Processor** 17.3"" (16:9) LED-backlit FHD (1920x1080) 60Hz Anti-Glare Panel with 45% NTSC with wide 178° viewing angles with G-SYNC™ **NVIDIA® GeForce® ...",City of Toronto,04/09/2020,2020-10-07 17:45:35.168263
1522039374,/v-laptops/city-of-toronto/sony-vpceh-pcg-71811w-i3-4gb-320gb/1522039374,110.0,sony vpceh Pcg-71811w  i3  4GB  320GB,,sony vpceh Pcg-71811w i3 4GB 320GB,City of Toronto,04/09/2020,2020-10-07 17:45:35.168744
1522038252,/v-laptops/city-of-toronto/macbook-pro/1522038252,350.0,MacBook Pro,,Slightly used Mackbook pro that comes with charger and case,City of Toronto,04/09/2020,2020-10-07 17:45:35.169223
1522035356,/v-laptops/city-of-toronto/macbook-air-2014/1522035356,650.0,MacBook Air 2014,,13-inch 1.14Ghz i5 4GB 1600 MHz DDR3,City of Toronto,04/09/2020,2020-10-07 17:45:35.169706
1522025643,/v-laptops/city-of-toronto/lenovo-ideapad-touch-screen-laptop-upgraded/1522025643,350.0,Lenovo IdeaPad Touch Screen Laptop UPGRADED,,"Over $300 in Upgrades, Lenovo IdeaPad P400 Touch Screen Laptop will come COMPLETELY WIPED and ready to start fresh. Plug and play. --- Features: --- - Backlit keyboard - Touch screen - Webcam - SSD ...",City of Toronto,04/09/2020,2020-10-07 17:45:35.170184
1522023292,/v-laptops/city-of-toronto/macbook-pro-15-inch-mid-2014-2-8ghz-i7-16gb-512-ssd/1522023292,1400.0,MacBook Pro 15-inch (Mid 2014) - 2.8Ghz i7/16GB/512 SSD,,"I am selling my Mid 2014 MacBook Pro 15-inch, w/ 512GB SSD. — Price is negotiable. All specs were maxed out at the original time purchase except for the SSD. - 2.8 Ghz, Intel Quad-Core i7 - 16GB RAM ...",City of Toronto,04/09/2020,2020-10-07 17:45:35.170665
1522018987,/v-laptops/city-of-toronto/dell-e7440-latitude/1522018987,650.0,Dell E7440 Latitude,,"I am dismantling home lab. So clearing off the hardware that, I won't need anymore. The laptop is in good condition. No damage to the screen or laptop. Screen resolution 1366x768 I am willing to ...",City of Toronto,04/09/2020,2020-10-07 17:45:35.171142
1522017716,/v-laptops/city-of-toronto/lenovo-t430s/1522017716,250.0,Lenovo T430s,,"I am dismantling home lab. So clearing off the hardware that, I won't need anymore. The laptop is in good condition. No damage to the screen or laptop. Screen resolution 1600x900. I am willing to ...",City of Toronto,04/09/2020,2020-10-07 17:45:35.171625
1522014026,/v-laptops/city-of-toronto/13-inch-macbook-pro-2014-model-500/1522014026,500.0,"13-Inch MacBook Pro, 2014 Model - $500",,"It's a 2014 MacBook Pro that has keyboard issues once in a while. Specs: 2.6 GHz dual-core Intel Core i5 with 3MB L3 cache, 8GB of 1600MHz DDR3L SDRAM, 256GB flash storage. Comes with power adapter ...",City of Toronto,04/09/2020,2020-10-07 17:45:35.172077
1492539234,/v-laptops/city-of-toronto/lcd-led-screen-display-glass-for-apple-macbook-pro-17-a1297-200/1492539234,10.0,"LCD LED Screen Display Glass for Apple MacBook Pro 17"" A1297 200",,Brand new just the glass,City of Toronto,04/09/2020,2020-10-07 17:45:35.172558
1510948145,/v-laptops/city-of-toronto/acer-aspire-5516/1510948145,99.0,Acer Aspire 5516,,"Specs: 15.6"" screen AMD Athlon Dual-Core Processor 3GB RAM 149GB Hard-Drive ATI Radeon X1200 graphics card Front Camera/Webcam Windows XP Everything works fine. Don't have a charger with it but any ...",City of Toronto,04/09/2020,2020-10-07 17:45:35.173039
1510887307,/v-laptops/city-of-toronto/acer-aspire-es1-512-p0sy/1510887307,499.0,Acer Aspire ES1-512-P0SY,,"Specs: 15.6"" LCD Screen 16:9 aspect ratio Intel Quad-core processor 8GB RAM 1TB Hard-drive Intel HD Graphics Has a front camera/webcam 3 USB ports, 1 HDMI Windows 10 operating system Charger ...",City of Toronto,04/09/2020,2020-10-07 17:45:35.173521
1521953304,/v-laptops/city-of-toronto/dell-xpa-3-13-5-platinum-alcantara-i5-8gb-128gb/1521953304,900.0,"DELL XPA  3 - 13.5"", Platinum (Alcantara®), i5, 8GB, 128GB",,"3 13.5"" touchscreen laptop. It has an Intel Core i5-1035G7 processor and 8GB of RAM, plus 256GB of SSD. Perfect for students or office work, It's light and thin can fit anywhere, Bought last year ...",City of Toronto,04/09/2020,2020-10-07 17:45:35.174036
1521944127,/v-laptops/city-of-toronto/mac-book-air/1521944127,700.0,Mac book air,,-Brand new Mac book air -11” inch screen -4gb -Comes with chager case as well as laptop case -Comes with keyboard protector,City of Toronto,03/09/2020,2020-10-07 17:45:35.174519
1521942191,/v-laptops/city-of-toronto/apple-macbook-pro-13-inch-core-i5-touch-mid-2017/1521942191,1700.0,"Apple MacBook Pro 13-Inch ""Core i5"" Touch/Mid-2017",,"Apple MacBook Pro 13-Inch ""Core i5"" 3.1 Touch/Mid-2017 Processor Core i5 (I5-7267U) 3.1 GHz Ram 8Gb 256Gb SSD 13.3"" color widescreen LED-backlit display with IPS technology with a 2560 by 1600 native ...",City of Toronto,03/09/2020,2020-10-07 17:45:35.175000
1521939981,/v-laptops/city-of-toronto/dell-e5510-laptop-i5-16-4gb-canadacellphone-ca/1521939981,199.0,"Dell E5510 Laptop i5 16"" 4GB canadacellphone.ca",,canadacellphone.ca 390 Progress ave. #7 647-948-9460 11-6 Sunday Close,City of Toronto,03/09/2020,2020-10-07 17:45:35.175499
1521939931,/v-laptops/city-of-toronto/razer-blade-2080/1521939931,2800.0,RAZER BLADE 2080,,"Selling my Razer Blade 15 advanced. RTX 2080 with Max-q design Intel I7 9750 16GB ram 500gb NVME drive 15"" 4k display Along to trade for a 13 MacBook pro + cash 2800 FIRM FIRM. Best pricef Razer ...",City of Toronto,03/09/2020,2020-10-07 17:45:35.175983
1521934881,/v-laptops/city-of-toronto/police-panasonic-toughbook-cf-51/1521934881,240.0,Police Panasonic Toughbook CF-51,,Used removed from working police vehicle. Panasonic Toughbook CF-51. Will need a hard drive and programming.,City of Toronto,03/09/2020,2020-10-07 17:45:35.176466
1521934601,/v-laptops/city-of-toronto/police-panasonic-toughbook-cf-52/1521934601,300.0,Police Panasonic Toughbook CF-52,,Used removed from a working police patrol vehicle. Panasonic Toughbook CF-52. Will need hard drive and programming.,City of Toronto,03/09/2020,2020-10-07 17:45:35.176948
1521934330,/v-laptops/city-of-toronto/police-panasonic-toughbook-cf-19/1521934330,280.0,Police Panasonic Toughbook CF-19,,Used police Panasonic Toughbook CF-19. Removed from working patrol vehicle. Will need hard drive and programming. Has touchscreen pen as well. Forms into tablet as well.,City of Toronto,03/09/2020,2020-10-07 17:45:35.177430
1521932665,/v-laptops/city-of-toronto/macbook-air-late-2018-16gb-ram-256gb-hard-drive/1521932665,1400.0,"Macbook Air (late 2018), 16gb RAM, 256gb hard drive",,Mint condition fully upgraded Macbook Air. Selling because I purchased a Macbook Pro. Serious inquiries only please!,City of Toronto,03/09/2020,2020-10-07 17:45:35.178103
1521928767,/v-laptops/city-of-toronto/hp-pavilion-dv6000-gm006ua-abl-2-00ghz-200gb-32-bit-laptop/1521928767,20.0,HP Pavilion DV6000 GM006UA-ABL 2.00GHz 200GB 32-bit Laptop,,TESTED WITH UBUNTU LIVE CD! INTEL CORE 2 DUO T2450 2.0GHz x2 2GB RAM 200 GB HDD WiFi Bluetooth Optical drive Minor wear and tear on shell. Laptop-to-monitor hinges loose. Left shift key missing.,City of Toronto,03/09/2020,2020-10-07 17:45:35.178583
1106586967,/v-laptops/city-of-toronto/bench-60/1106586967,60.0,bench $ 60,,"CALL for PICK UP OR INFO. 10 am to 8 pm 416 532 0158, Frank cheers !",City of Toronto,03/09/2020,2020-10-07 17:45:35.179065
1317910816,/v-laptops/city-of-toronto/video-recorder-60/1317910816,60.0,video recorder $ 60,,"CALL for PICK UP OR INFO. 10 am to 8 pm 416 532 0158, Frank cheers !",City of Toronto,03/09/2020,2020-10-07 17:45:41.284749
1452220445,/v-laptops/city-of-toronto/hp-laptop-15/1452220445,200.0,"HP laptop 15""",,"HP laptop 15"" mint condition no scratches Windows Vista everything working perfect CD/DVD recorder HP Pavillion dv6500. For extra $$ I have 12 cell battery and case",City of Toronto,03/09/2020,2020-10-07 17:45:41.285430
1521914562,/v-laptops/city-of-toronto/dell-latitude-d630-laptop/1521914562,80.0,Dell Latitude D630 laptop,,"Dell Latitude D630 laptop Good condition Intel Core Duo Processor 2.0 GHZ 2GB RAM 80GB Hard Drive 4 USB Ports. Built in Wi-Fi With Extra Brand New 1080P Web Camera and Mouse will be $90 , otherwise ...",City of Toronto,03/09/2020,2020-10-07 17:45:41.285943
1521912859,/v-laptops/city-of-toronto/asus-zenbook-laptop-model:-ux430u-perfect-condition/1521912859,650.0,Asus Zenbook Laptop. Model: UX430U. Perfect condition,,I5 1.6ghz processor Intel UHD 620 Graphics card 8gb memory 256 SSD hardrive No dents scratches or software issues Im asking for 700,City of Toronto,03/09/2020,2020-10-07 17:45:41.286423
1521911981,/v-laptops/city-of-toronto/hp-laptop-windows-10/1521911981,200.0,HP Laptop Windows 10,,"HP laptop Windows 10. has small crack on top right corner case. screen is working fine. Laptop is reset, battery taking charge fine. comes with ac adapter.",City of Toronto,03/09/2020,2020-10-07 17:45:41.286903
1521897498,/v-laptops/city-of-toronto/brand-new-sealed-16-inch-macbook-pro-with-apple-care/1521897498,2900.0,BRAND NEW SEALED 16 INCH MACBOOK PRO WITH APPLE CARE+,,"BRAND NEW SEALED 16 INCH MACBOOK PRO WITH APPLE CARE+ retail is 2999 plus tax and applecare+ = 3862 my price=2900 2.6GHz 6‑core 9th‑generation Intel Core i7 processor, Turbo Boost up to 4.5GHz 16GB ...",City of Toronto,03/09/2020,2020-10-07 17:45:41.287402
1521884923,/v-laptops/city-of-toronto/asus-gaming-laptop/1521884923,1100.0,Asus gaming laptop,,Selling towards a mac for productivity Will factory reset and comes with box and charging cables Not shipping 17-6700hq 16gb ram Nvidia 1070 1TB hdd Integrated Wi-Fi 5 (802.11 ac) Bluetooth ...,City of Toronto,03/09/2020,2020-10-07 17:45:41.287926
1521876575,/v-laptops/city-of-toronto/2016-15-apple-macbook-pro-a1707-i7-2-9ghz-16gb-1tb-ssd-catalin/1521876575,1800.0,"2016 15"" Apple MacBook Pro A1707 i7 2.9GHz 16GB 1TB SSD ,Catalin",,"Very Good Cosmetic and Perfectly Working Order 2016 15"" Apple MacBook Pro A1707 i7 2.9GHz 16GB 1TB SSD Mac OS Mojave 10.14 Final Cut Pro 10.4 Logic Pro 10.2 Adobe CS6",City of Toronto,03/09/2020,2020-10-07 17:45:41.288414
1521870617,/v-laptops/city-of-toronto/surface-book-2-13-inch-i7-gtx-1050/1521870617,1300.0,Surface Book 2 13 inch I7 GTX 1050,,Microsoft Surface Book 2 for sale 13 inch screen 8th gen INTEL core i7 processor 256gb ssd 8gb ram Gtx 1050 No Box INCLUDES free surface arc mouse and laptop sleeve case,City of Toronto,03/09/2020,2020-10-07 17:45:41.288901
1521766955,/v-laptops/city-of-toronto/2019-13-inch-macbook-air-256gb-ssd/1521766955,1250.0,2019 13-inch Macbook Air 256gb SSD,,Barely used. Very good condition. No scratch.,City of Toronto,03/09/2020,2020-10-07 17:45:41.289382
1521829119,/v-laptops/city-of-toronto/usb-type-c-for-macbook-pro/1521829119,20.0,USB type c for MacBook Pro,,"Brand new USB type c for MacBook Pro . Posted in computers, laptops in City of Toronto. September 3, 2020",City of Toronto,03/09/2020,2020-10-07 17:45:41.289864
1521828674,/v-laptops/city-of-toronto/macbook-case-13-inch/1521828674,25.0,MacBook case 13 inch,,Brand new seal,City of Toronto,03/09/2020,2020-10-07 17:45:41.290346
1510714404,/v-laptops/city-of-toronto/fujitsu-lifebook-ah530-i3-350m-4-gb-256-gbssd/1510714404,199.0,Fujitsu LIFEBOOK AH530 i3-350M /4 GB /256 GBSSD,,"Fujitsu LIFEBOOK AH530 Notebook Black 39.6 cm (15.6"") 1366 x 768 pixels Intel® Core™ i3 -350M 4 GB DDR3-SDRAM 256GB SSD Bluetooth WiFi Windows 10 PS My laptop would be so much faster because I ...",City of Toronto,03/09/2020,2020-10-07 17:45:41.290829
1521803948,/v-laptops/city-of-toronto/acer-laptop-with-i5/1521803948,350.0,Acer laptop with i5,,"Acer E1572-6847; 15.6 laptop with i5 processor, 750 gb HDD, 8 ram, touch screen with web cam is available for sale. Great performance with no issues. I recently bought acer i7. Laptop is 2 years old, ...",City of Toronto,03/09/2020,2020-10-07 17:45:41.291353
1521796974,/v-laptops/city-of-toronto/macbook-pro-large-screen-15-4-2009-recently-factory-reset/1521796974,400.0,"MacBook Pro Large Screen 15.4"" (2009) Recently Factory Reset",,- Good condition; some minor cosmetic marks but works perfectly - Recently wiped hard drive (factory reset) - Includes brand new charger Here are the specs ...,City of Toronto,03/09/2020,2020-10-07 17:45:41.291840
1521772139,/v-laptops/city-of-toronto/selling-macbook-pro-2009-17inch-used-w-charger-used/1521772139,300.0,Selling MACBOOK PRO 2009 17inch used w/ Charger. USED,,Selling MACBOOK PRO 2009 17inch used w/ Charger. USED ALL HARDWARE ISSUES Photographed *STILL WORKS PERFECTLY FINE*,City of Toronto,03/09/2020,2020-10-07 17:45:41.292325
1521680418,/v-laptops/city-of-toronto/macbook-pro-16inch-2019-sealed-with-apple-care/1521680418,3150.0,MacBook Pro 16inch 2019 - Sealed with Apple Care +,,16 inch 2019 MacBook Pro Apple Care + covering Accidental Damage for 3 years. 6 core i7 processor 16 GB DDR4 Ram 512 GB SSD AMD Radeon Pro with 4GB GDDR6 memory Intel UHD Graphics 630.,City of Toronto,03/09/2020,2020-10-07 17:45:41.292813
1521684905,/v-laptops/city-of-toronto/13-macbook-air-2019-with-apple-care/1521684905,1350.0,13'' MacBook Air 2019 with Apple Care +,,2019 MacBook Air with Retina display - Brand New Condition Apple Care + covers 3 years accidental damage 1.6 GHz Dual core i5 processor 8 GB RAM 128 GB Flash Storage Intel UHD Graphics 617,City of Toronto,03/09/2020,2020-10-07 17:45:41.293297
1521763863,/v-laptops/city-of-toronto/surface-pro-6-i7-16gb-512-gb/1521763863,1599.0,Surface Pro 6 i7 16GB 512 GB,,Like new. Protected by cover since new. Top specs. i7 1.9 GHz 2.11 Ghz 512 GB HD,City of Toronto,03/09/2020,2020-10-07 17:45:41.293774
1521719518,/v-laptops/city-of-toronto/mac-book-air-2020/1521719518,1400.0,MAC BOOK AIR 2020,,"MacBook Air (2020). 2020 EAR PODS INCLUDED WiFi 802.11ac, Bluetooth 5.0 TOUCH ID 304,1 x 212,4 x 16,1 mm 1,29 kg macOS 10.15 CATALINA EVERYTHING WAS PURCHASED 3 MONTH AGO",City of Toronto,03/09/2020,2020-10-07 17:45:41.294256
1521760403,/v-laptops/city-of-toronto/lenovo-g550-laptop/1521760403,110.0,Lenovo G550 laptop,,"500g Hdd 4g DDR 3, Win 7 64 orignal. with adapter. battery lost, sorry im not order new battery. all works normal., ask get good offer",City of Toronto,02/09/2020,2020-10-07 17:45:41.294737
1511190910,/v-laptops/city-of-toronto/like-new-late-2017-macbook-pro-touchbar-15-i7-2-8-16-1tb/1511190910,2300.0,LIKE NEW!!! - Late 2017 Macbook Pro Touchbar 15 i7/2.8/16/1TB,,"Excellent condition. FEELS LIKE NEW - NEW keyboard and battery - replaced by Apple (top panel replaced under warranty - this includes new keyboard, battery and speakers). ONLY 4 Charging Cycles - see ...",City of Toronto,02/09/2020,2020-10-07 17:45:41.295217
1521664143,/v-laptops/city-of-toronto/barely-used-acer-swift-3-15-16gb-ram-256-ssd/1521664143,759.0,"[BARELY USED] Acer Swift 3 15"" 16GB RAM 256 SSD",,"..... and nearly perfect condition. Especially powerful when working with heavy design programs (e.g. Adobe Premiere Pro, Photoshop etc) and gaming. Keypad is both in English and Korean. No issues at ...",City of Toronto,02/09/2020,2020-10-07 17:45:41.295733
1521720635,/v-laptops/city-of-toronto/apple-macbook-pro-13-3-inch-laptop-2015/1521720635,1200.0,Apple MacBook Pro 13.3 inch Laptop 2015,,"Apple MacBook Pro 13.3 inch Laptop 2015 Processor Type: Core i5 (I5-5287U) 2.9 GHz Standard RAM: 8 GB Intel Iris 6100 graphics processor Built-in Display 13.3"" Widescreen Native Resolution: 2560x1600 ...",City of Toronto,02/09/2020,2020-10-07 17:45:41.296214
1521715729,/v-laptops/city-of-toronto/hp-probook-g2-15-6-intel-i5-6300-16gb-256gb-ssd-win10-1yr-wrrt/1521715729,950.0,"HP ProBook G2 15.6"" intel i5-6300 16GB 256GB SSD Win10 1YR WRRT",,"Top of the line, the latest greatest HP Professional Series 15.6"" Super LED Laptop Computer. Comes with bonus like Backlit Keyboard and MS office full version. Also has one full year warranty from HP ...",City of Toronto,02/09/2020,2020-10-07 17:45:41.296692
1521714938,/v-laptops/city-of-toronto/hp-laptop-for-sale/1521714938,620.0,HP Laptop for sale,,"I am selling my brand new laptop for sale. Laptop comes with charger. No damages, scratches or problems. It's less than 8 months since I purchased. Selling because I have been offered a new one from ...",City of Toronto,02/09/2020,2020-10-07 17:45:41.297175
1521714708,/v-laptops/city-of-toronto/panasonic-toughbook-laptop-fully-rugged-with-alot-of-upgrades/1521714708,350.0,Panasonic toughbook laptop Fully Rugged with alot of upgrades,,"This is fully rugged panasonic toughbook laptop computer. can be used both indoors and outdoors. With 800knit screen and shock proof, humidy and weather proof. See specifications and upgrades below. ...",City of Toronto,02/09/2020,2020-10-07 17:45:41.297657
1521709318,/v-laptops/city-of-toronto/apple-macbook-pro-a1398-core-i7-8-gb-ram-512-gb-ssd-999/1521709318,999.0,"Apple Macbook Pro  A1398, Core i7/8 GB RAM/ 512 GB SSD $999",,"Apple Macbook Pro Retina A1398 Grade AAA Condition , Like new Intel Core i7 RAM - 8 GB 512 GB SSD Long Last Battery 15"" Retina Display Discounted Price - $ 999",City of Toronto,02/09/2020,2020-10-07 17:45:41.298138
1521709089,/v-laptops/city-of-toronto/acer-aspire-e5/1521709089,580.0,ACER ASPIRE E5,,I5-8250u @1.6Ghz 12 GB DDR4 RAM 1 TB HDD Fully Functioning Computer Comes with original packaging,City of Toronto,02/09/2020,2020-10-07 17:45:41.298620
1521669875,/v-laptops/city-of-toronto/90-new-lab-top/1521669875,210.0,90% new lab top,,"Notebook lab top , 90% new, 210 dollars.",City of Toronto,02/09/2020,2020-10-07 17:45:41.299291
1521653969,/v-laptops/city-of-toronto/hp-probook-4310s/1521653969,170.0,Hp Probook 4310s,,Selling my hp pro-book Intel core duo-2gb R-4 gb HD for $170. Please contact at 647-706-2239 for more information.,City of Toronto,02/09/2020,2020-10-07 17:45:41.299816
1521639470,/v-laptops/city-of-toronto/dell-latitude-e4510/1521639470,270.0,Dell Latitude E4510,,Selling my used dell laptop i5-4gb R-160hd for $270. Please contact serious buyer only at 647-706-2239..,City of Toronto,02/09/2020,2020-10-07 17:45:41.300307
1521605527,/v-laptops/city-of-toronto/surface-pro-7-black-intel-core-i5-8gb-256gb-perfect-condition/1521605527,1300.0,"Surface Pro 7 - Black, Intel Core i5,8GB,256GB perfect condition",,"Selling Surface Pro 7 - Black, Intel Core i5, 8GB, 256GB. Purchased on April 8, 2020 (5 months old) from Microsoft Store. Comes with grey type cover keyboard, charger and original box. $2,100 value! ...",City of Toronto,02/09/2020,2020-10-07 17:45:41.300790
1500748872,/v-laptops/city-of-toronto/apple-macbook-pro-15-4-256gb-ssd-intel-core-i7-3rd-gen-2-30/1500748872,775.0,"Apple MacBook Pro 15.4"""" (256GB SSD, Intel Core i7 3rd Gen, 2.30",,"Apple MacBook Pro 15.4 Intel Core i7 3rd Gen, 2.30GHz, 256GB SSD, 8 GB DDR3 Power adapter Price$ 775 Come with warranty. All are Installed and ready to use. Routersale 2200 MARKHAM RD U 7, ...",City of Toronto,02/09/2020,2020-10-07 17:45:41.301273
1521579719,/v-laptops/city-of-toronto/macbook-air-1100cad-firm-price/1521579719,1100.0,MACBOOK AIR - 1100CAD - FIRM PRICE,,MacBook Air 1.1GHz Quad-Core Core i5 Processor 10th-generation Intel Turbo Boost up to 3.5GHz 256GB Storage Touch ID Retina display with True Tone Intel Iris Plus Graphics 8GB 3733MHz LPDDR4X memory ...,City of Toronto,02/09/2020,2020-10-07 17:45:49.931700
1521572115,/v-laptops/city-of-toronto/apple-macbook-pro-late-2013/1521572115,700.0,Apple MacBook Pro late 2013,,Apple MacBook Pro late 2013 15” core i7 2.0ghz 256 gb for sale. $700 only,City of Toronto,02/09/2020,2020-10-07 17:45:49.932197
1509233887,/v-laptops/city-of-toronto/apple-macbook-pro-13-retina-early-2015-256gb/1509233887,850.0,"Apple MacBook Pro 13"" Retina Early 2015 256GB",,"MacBook Pro 13"" Early 2015 256GB SSD 8GB RAM 2.7GHz i5 CPU Hasn’t been used much, only around 400 cycles used since purchase in late 2015. I put a skin on the top since the purchase which you can ...",City of Toronto,02/09/2020,2020-10-07 17:45:49.932702
1521546946,/v-laptops/city-of-toronto/macbook-pro-13-mid-2012/1521546946,550.0,Macbook Pro 13 Mid 2012,,Apple MacBook Pro 13 Mid 2012 A1278 i5-2.4GHz Memory Installed: 4GB Hard Drive Capacity: 500GB HDD Operating System: MACOS High Sierra Condition: Mint MacBook Pro - 60W MagSafe Power Adapter Charger ...,City of Toronto,01/09/2020,2020-10-07 17:45:49.933392
1391164840,/v-laptops/city-of-toronto/dell-latitude-e6420-laptop/1391164840,210.0,Dell Latitude E6420 Laptop,,"Processors: Intel i5 Dual-Core 2.5GHz CPU Memory: 8GB DDR3 Memory Hard Drive: 320GB SATA 2.5"" HDD Graphics Video Card: Intel HD Graphics Card Optical Drive: CD-RW/DVD-ROM HDMI Port Power Supply: Dell ...",City of Toronto,01/09/2020,2020-10-07 17:45:49.933884
1521541583,/v-laptops/city-of-toronto/macbook-pro-15-a1226/1521541583,290.0,"MacBook Pro 15""  a1226",,"It is working perfectly. 2.4gh core 2 duo, 4gb ram, 250gb HD OS X reinstalled El Capitan 10.11.6 Looks like new for 2007/2008 modell Price is negotiable",City of Toronto,01/09/2020,2020-10-07 17:45:49.934370
1521540717,/v-laptops/city-of-toronto/macbook-pro-13/1521540717,1400.0,"MacBook Pro 13""",,"Posted by Qu in computers, laptops in Toronto (GTA), City of Toronto. September 1, 2020",City of Toronto,01/09/2020,2020-10-07 17:45:49.934858
1521537324,/v-laptops/city-of-toronto/need-100-laptop/1521537324,100.0,"Wanted:
                            Need 100$ laptop",,Hi i need a laptop that works well and that the battery holds a charge delivered to 1001 queen st w. because i am confined at CAMH. Send me the details of your laptop i may be willing to go a little ...,City of Toronto,01/09/2020,2020-10-07 17:45:49.935328
