,url,price,title,distance,description,location,time_offset,retreived
1522732070,/v-renovation-electrical/city-of-toronto/heat-tracing-cable-heat-tape-self-regulating-cable/1522732070,2.81,Heat Tracing cable/Heat Tape/ Self Regulating cable,,"www.canstal.com Selling Self Regulating Heat Tape, it can be used for pipe heating/ Freeze protection selling it for $2.81 ft, we have any quantity you need. call us at 1.888.609.7505 located in GTA ...",City of Toronto,07/09/2020,2020-10-07 16:44:50.030368
1522607627,/v-renovation-electrical/city-of-toronto/lifeline-track-lights-4-sections-7-sections-over-28/1522607627,250.0,Lifeline track lights 4’ sections (7) sections over 28’,,I have 7 sections with adjustable track heads and bulb. Retails over $200 each section Brushed nickel colour,City of Toronto,07/09/2020,2020-10-07 16:44:50.030853
1522592432,/v-renovation-electrical/city-of-toronto/stablock-breakers/1522592432,5.0,Stablock breakers,,"I am getting ride of my stock of breakers, they are for stablock panels originally federal pioneer panels 15 amp single pole 5$/each x14 15 amp two pole 15$/each x1 20 amp single pole 10$/each x2 30 ...",City of Toronto,07/09/2020,2020-10-07 16:44:50.031347
1487889723,/v-renovation-electrical/city-of-toronto/bq3b100l-siemens-circuit-breaker-3-pole-100-amp-240-vac/1487889723,29.0,BQ3B100L SIEMENS CIRCUIT BREAKER 3 POLE 100 AMP 240 VAC,,"100 AMP 3 POLE 120/240 VAC 10,000 AIC RATING MOLDED CASE THERMAL MAGNETIC CIRCUIT BREAKER TYPE BQ Line Lugs Breaker",City of Toronto,07/09/2020,2020-10-07 16:44:50.031832
1487886123,/v-renovation-electrical/city-of-toronto/westinghouse-ba-50-amps-circuit-breaker-120-240-volt-2-pole-bolt/1487886123,19.0,Westinghouse BA 50 Amps Circuit Breaker 120/240 Volt 2 Pole Bolt,,"Excellent Condition, ready to install. This item was removed from a working environment.",City of Toronto,07/09/2020,2020-10-07 16:44:50.032318
1501521543,/v-renovation-electrical/city-of-toronto/light-fixtures/1501521543,5.0,Light Fixtures,,Have 10 of these lights $5/each Must take whole lot $50 Brand new never used,City of Toronto,06/09/2020,2020-10-07 16:44:50.035537
1522473670,/v-renovation-electrical/city-of-toronto/3-recessed-lighting-kits/1522473670,20.0,3” Recessed lighting kits,,Each box hold 6 6 box total PLEASE CALL OR TEXT 6475819778,City of Toronto,06/09/2020,2020-10-07 16:44:50.036070
1522412549,/v-renovation-electrical/city-of-toronto/led-light-54v-corded-just-plug-in-and-you-can-use-anywhere/1522412549,10.0,Led light 54v corded just plug in and you can use anywhere,,"7"" Led light,pick up only",City of Toronto,06/09/2020,2020-10-07 16:44:50.036595
1522401643,/v-renovation-electrical/city-of-toronto/portable-construction-work-light/1522401643,20.0,Portable Construction Work Light,,Portable work light. Suitable for wet locations. Like new. Protective cage and tilt feature.,City of Toronto,06/09/2020,2020-10-07 16:44:50.037117
1210150673,/v-renovation-electrical/city-of-toronto/fan-electric-portable-blade-style-to-cool-you-off/1210150673,10.0,FAN - ELECTRIC PORTABLE - BLADE STYLE - TO COOL YOU OFF,,NEED A PORTABLE FAN for those MUGGY JULY DAYS + NIGHTS ??? Portable Electric FAN --- Electric Plug-In Style--- 4 BLADES enclosed in a Wire Cage --- Sits on Counter Top or on Floor – COMPLETELY ...,City of Toronto,06/09/2020,2020-10-07 16:44:50.037712
1511792006,/v-renovation-electrical/city-of-toronto/2000-amp-2-pole-240-vac-fused-disconnect-switch-new/1511792006,60.0,"2000 AMP, 2 POLE, 240 VAC FUSED DISCONNECT SWITCH ~ NEW!",,"Service entrance switch interrupter 2000 AMP, 2 POLE, 120/ 240 VAC FUSED DISCONNECT SWITCH",City of Toronto,06/09/2020,2020-10-07 16:44:50.038213
1522312781,/v-renovation-electrical/city-of-toronto/connectors/1522312781,4.0,connectors,,lot of 22 electrical twist on connectors $4 would like gone by the end of SEPT,City of Toronto,05/09/2020,2020-10-07 16:44:51.662384
1511757232,/v-renovation-electrical/city-of-toronto/bnib-3-led-potlights-5-available/1511757232,50.0,BNIB; 3” LED Potlights. 5 available.,,Catalina Lighting 18289-001 Brushed Nickel Remodel Led Recessed Light Fixture Kit https://www.amazon.ca/dp/B00M8AEXYO/ref=cm_sw_r_sms_c_api_i_XT0cFbXV22EA6 Price is for all 5.,City of Toronto,05/09/2020,2020-10-07 16:44:51.662890
1493512697,/v-renovation-electrical/city-of-toronto/bnib:-4-recessed-led-lights-4-pack/1493512697,50.0,"BNIB: 4"" recessed LED lights 4 pack",,"Brand new 4-pack 4"" indoor/outdoor LED lights. Sells for $160: https://www.lowes.ca/product/recessed-downlights/trenz-lighting-thinled-4000k-4-in-recessed-light-4-pack-779752 Lifetime warranty.",City of Toronto,05/09/2020,2020-10-07 16:44:51.663389
1522284461,/v-renovation-electrical/city-of-toronto/iberville-device-box/1522284461,4.0,Iberville Device Box,,Have no use for these and would like gone right away. Selling 3.50 each but willing to negotiate.,City of Toronto,05/09/2020,2020-10-07 16:44:51.663884
1152389821,/v-renovation-electrical/city-of-toronto/skilsaw-circular-power-saw-574c-made-in-canada/1152389821,60.0,Skilsaw Circular Power Saw 574C Made In Canada,,"Selling a Skilsaw 7 1/4 circular power saw model 574C with burnout protected motor 115 volts 10 amp motor 5700 RPM made in Canada with blade that works and looks like new , selling for only $60 and i ...",City of Toronto,05/09/2020,2020-10-07 16:44:51.664416
1522259984,/v-renovation-electrical/city-of-toronto/light-switch-covers/1522259984,0.5,Light switch Covers,,"Light Switch Covers. QUANTITIES INCLUDED IN THE PICS. Asking $0.50 each. New, unused. If the ad is still up it is still available. Porch pick up only in Gerrard and Greenwood area.",City of Toronto,05/09/2020,2020-10-07 16:44:51.664914
1522259601,/v-renovation-electrical/city-of-toronto/leviton-electrical-outlet/1522259601,1.0,Leviton electrical Outlet,,"Electrical Outlet, Leviton brand. Retails for $2.69. Asking for $1 each. 6 are available. New, unused. If the ad is still up it is still available. Porch pick up only in Gerrard and Greenwood area.",City of Toronto,05/09/2020,2020-10-07 16:44:51.665425
1522259360,/v-renovation-electrical/city-of-toronto/leviton-light-switch/1522259360,1.0,Leviton Light Switch,,"Light Switch. Leviton brand, 15A 120 Volt. 7 are available. New, unused. If the ad is still up it is still available. Porch pick up only in Gerrard and Greenwood area.",City of Toronto,05/09/2020,2020-10-07 16:44:51.665917
1522235777,/v-renovation-electrical/city-of-toronto/construction-light/1522235777,45.0,construction light,,"I am selling fully functional construction light fairly used with some paint chip, otherwise its look new. asking $45.00 as is.. Twin headlamps rotate 360-degrees and fixture telescopes up to ...",City of Toronto,05/09/2020,2020-10-07 16:44:51.666400
1522213559,/v-renovation-electrical/city-of-toronto/stab-lok-federal-pioneer-breakers/1522213559,5.0,stab-lok federal pioneer breakers,,"15A single pole 20 pieces $5 each or $10 for 3. 15A double pole 3 pieces $10 each 30A double pole 3 pieces $15 each 40A double pole 1 piece $30 all price obo, buy all for $150. all used in perfect ...",City of Toronto,05/09/2020,2020-10-07 16:44:51.666883
1522212576,/v-renovation-electrical/city-of-toronto/federal-pioneer-stab-lok-200a-breaker-panel/1522212576,5.0,federal pioneer stab-lok 200a breaker panel,,"200A breaker panel. replaced for a customer. Main breaker lock screw not good. all others in excellent condition with a lot of breakers. you can use it if you replace the main breaker, or use it as ...",City of Toronto,05/09/2020,2020-10-07 16:44:51.667376
1522194363,/v-renovation-electrical/city-of-toronto/single-pole-15a-breakers-qbh-command/1522194363,5.0,single pole 15a breakers qbh command,,used $5 each,City of Toronto,05/09/2020,2020-10-07 16:44:51.667857
1522193666,/v-renovation-electrical/city-of-toronto/double-pole-eaton-qbh-15a-breakers/1522193666,10.0,double pole Eaton QBH 15a breakers,,"4 used 15a double pole breakers. same all three brands: eaton, command and Sylvania. $10 each.",City of Toronto,05/09/2020,2020-10-07 16:44:51.668381
1522192584,/v-renovation-electrical/city-of-toronto/2-cafci-breakers/1522192584,20.0,2 CAFCI  breakers,,"2 used CAFCI one brand is command another is sylvania. both are same type, pulled out from same one panel. $20 each. obo",City of Toronto,05/09/2020,2020-10-07 16:44:51.668871
1522190660,/v-renovation-electrical/city-of-toronto/stelpro-15a-single-pole-breakers/1522190660,5.0,Stelpro 15a single pole breakers,,Rare found 15a used in good working conditions. $5 each or take all 5 for $20.,City of Toronto,05/09/2020,2020-10-07 16:44:51.669355
1522178881,/v-renovation-electrical/city-of-toronto/5-lutron-fluorescent-dimmers/1522178881,500.0,5 Lutron fluorescent dimmers,,Unused - value of $200 each Please contact 905 246-0815 if interested,City of Toronto,05/09/2020,2020-10-07 16:44:51.669843
1522162656,/v-renovation-electrical/city-of-toronto/fluorescent-light-fixture-flat-panel/1522162656,55.0,fluorescent light fixture flat panel,,Great condition 14 light panels for sale Must go this month,City of Toronto,05/09/2020,2020-10-07 16:44:51.670387
1511592390,/v-renovation-electrical/city-of-toronto/ite-pushmatic-p20-electrical-panel-with-breakers/1511592390,150.0,ITE Pushmatic P20 electrical panel with breakers,,"I have an ITE P20 Pushmatic electrical panel with breakers. 3x double push, 11x single push. 100A panel single phase 120/240V. Bulldog Pushmatic.",City of Toronto,04/09/2020,2020-10-07 16:44:51.670868
1501182278,/v-renovation-electrical/city-of-toronto/decora-coax-cable-jack/1501182278,5.0,DECORA Coax Cable Jack,,"This brand new, Leviton, Decora, White Wall Jack with F type co-axial connector - 75 Ohms, push through F connector - mount in standard or multi-gang electrical box - ideal where flush mount ...",City of Toronto,04/09/2020,2020-10-07 16:44:51.671360
1511495455,/v-renovation-electrical/city-of-toronto/retrofit-4-pot-light-housing-par16-non-ic-rated/1511495455,5.0,"Retrofit 4"" Pot Light Housing (Par16, Non-IC rated)",,"45 x Non-IC 4"" Pot Lights housing by Luminiz. I have 45 available @ $5 each. These retail for $15 each. Compatible with Par16 light bulbs. These are recessed pot lights.",City of Toronto,04/09/2020,2020-10-07 16:44:51.671854
1377013494,/v-renovation-electrical/city-of-toronto/led-light-bulb/1377013494,3.0,LED Light bulb,,Brand new led light bulb One case 20 bulb brand new. Dim able. See photo for details. Can be sold separately. $3 each If it's posted it's avaliable!!!,City of Toronto,04/09/2020,2020-10-07 16:44:51.672336
1377910487,/v-renovation-electrical/city-of-toronto/14-2-romex-wire-nmd90/1377910487,110.0,14-2 Romex wire NMD90,,"Brand new coils 14-2 Romex 150M coil $110 Plus tax Canadian Wire, CSA Approved Thanks romex electrical electrician construction build renovation 14-2 14/2",City of Toronto,04/09/2020,2020-10-07 16:44:51.672816
1377328988,/v-renovation-electrical/city-of-toronto/14-2-romex-wire-nmd90-14-2/1377328988,110.0,14-2 Romex Wire NMD90 14/2,,New coils 14-2 NMD90 150M 110 plus tax per 150M roll Thanks 14/2 NMD90 Romex Wire construction home electrical electrician,City of Toronto,04/09/2020,2020-10-07 16:44:51.673301
1521956800,/v-renovation-electrical/city-of-toronto/ideal-wire-pulling-lubricant-yellow-77-model-:-31-351/1521956800,70.0,IDEAL WIRE PULLING LUBRICANT   YELLOW 77 --Model #: 31-351 --,,IDEAL WIRE PULLING LUBRICANT YELLOW 77 --Model #: 31-351 -- 1 Gallon Bucket Safe to use with most cable types except low-density polyethylene and semi-conducting jackets Clings to cable throughout ...,City of Toronto,04/09/2020,2020-10-07 16:44:51.673787
1521956606,/v-renovation-electrical/city-of-toronto/pct-messenger-coaxial-cable-spool-rg11/1521956606,400.0,PCT MESSENGER COAXIAL CABLE SPOOL RG11,,PCT MESSENGER COAXIAL CABLE SPOOL RG11 Professional grade coaxial cable for all your CATV and broadband network service needs . PCT BI-SHIELDED RG11 60% ALUMINUM BRAID WITH MESSENGER - 400-FT SPOOL - ...,City of Toronto,04/09/2020,2020-10-07 16:44:51.674269
1511427749,/v-renovation-electrical/city-of-toronto/ridgid-outdoor-extension-cord-12-ga-50ft-single-lited-end/1511427749,60.0,RIDGID OUTDOOR EXTENSION CORD 12 GA. 50FT SINGLE LITED END,,Brand new. Retail $99 This heavy duty extension cord with durable SJOW jacket provides superior resistance to abrasion and the damaging effects of oil and fuel. SJOW jackets remain more supple than ...,City of Toronto,03/09/2020,2020-10-07 16:44:51.675926
1511428129,/v-renovation-electrical/city-of-toronto/ridgid-50ft-all-weather-contractor-grade-extension-cord-12-gauge/1511428129,40.0,RIDGID 50ft All Weather Contractor Grade Extension Cord 12 Gauge,,"Brand new. Retail $62.38 Extra heavy-duty super flexible all-weather thermoplastic elastomer cord, 50 ft. long. Superior resistance to oily, moisture, ozone, cracking and are standing for abuse, ...",City of Toronto,03/09/2020,2020-10-07 16:44:51.676448
1521940560,/v-renovation-electrical/city-of-toronto/recessed-pot-lights-4-potlights/1521940560,10.0,"Recessed Pot lights 4"" -  potlights",,"Globe Electric 90540; 4 inch; Swivel Round Trim Recessed Lighting , White, Easy Install Push-N-Click Clips, 3.88 inch; ; Hole Size. I have 6 potlights left over from a renovation. Willing to sell ...",City of Toronto,03/09/2020,2020-10-07 16:44:51.676929
1521883380,/v-renovation-electrical/city-of-toronto/check-meter-qlc-s-20/1521883380,400.0,Check Meter QLC S-20,,"I have a 2 year old Check Meter QLC S-20. It was used for a commercial tenant, but last year I installed a separate meter for them. I paid $1,000.00 - $800.00 for this. I am selling for $400.00 or ...",City of Toronto,03/09/2020,2020-10-07 16:44:51.677408
1521879781,/v-renovation-electrical/city-of-toronto/circuit-breaker/1521879781,40.0,circuit breaker,,Used and good condition circuit breaker; • 2 pole 200 amp Siemens push on $50.00 • Type QBHG15 single pole 15 amp ground fault circuit interrupter circuit breaker $20.00each. • ITE TYPE BL 1 POLE and ...,City of Toronto,03/09/2020,2020-10-07 16:44:51.677888
1521877084,/v-renovation-electrical/city-of-toronto/circuit-breaker/1521877084,50.0,Circuit breaker,,"Used Breaker, good condition • 3 pole - 20 and 15 FP - NB- Bolt-On Stab Lok –Circuit Breaker.$50.00 each.. • 3 pole Square D -40,50,60 amp push on $40.00each. • 3 pole Square D 40 amp bolt on on ...",City of Toronto,03/09/2020,2020-10-07 16:44:53.383512
1492908061,/v-renovation-electrical/city-of-toronto/new-beghelli-stella-rm-steel-led-exit-sign/1492908061,110.0,NEW Beghelli Stella RM Steel LED Exit Sign,,New in box. Beghelli running man light up exit sign. Model is Stella RM Steel.,City of Toronto,03/09/2020,2020-10-07 16:44:53.384001
1521823263,/v-renovation-electrical/city-of-toronto/linkable-led-white-motion-under-cabinet-strip-light/1521823263,70.0,Linkable LED White Motion Under Cabinet Strip Light,,"Brand New Cascadia Instalux Linkable LED White Motion Under Cabinet Strip Light. This Instalux under cabinet LED will provide the perfect amount of illumination in your kitchen, laundry room, office ...",City of Toronto,03/09/2020,2020-10-07 16:44:53.384481
1474729147,/v-renovation-electrical/city-of-toronto/3-ballasts-7-fluorescent-bulbs-good-working-order-30-00-obo/1474729147,30.0,3 ballasts & 7 fluorescent bulbs good working order.  $30.00 OBO,,3 ballasts & 7 fluorescent bulbs good working order. $30.00 or best offer.,City of Toronto,03/09/2020,2020-10-07 16:44:53.384961
1303208496,/v-renovation-electrical/city-of-toronto/lutron-radiora-classic-repeater-ra-rep/1303208496,50.0,Lutron RadioRA Classic Repeater RA-REP,,Like new. Used only once to program a system.,City of Toronto,03/09/2020,2020-10-07 16:44:53.385519
1521759843,/v-renovation-electrical/city-of-toronto/shop-vac/1521759843,50.0,Shop Vac,,This Shop Vac is a young 4 years old. It was only used at a coffee shop for cleaning up coffee grinds. It’s in great condition and will defiantly get cleaned before pick up,City of Toronto,02/09/2020,2020-10-07 16:44:53.386065
1521716891,/v-renovation-electrical/city-of-toronto/siemens-200a-40-80-circuit-panel-package-with-breakers/1521716891,325.0,SIEMENS 200A 40/80 Circuit  Panel Package with Breakers,,New Never Used - SIEMENS 200A 40/80 Spaces 120 - 240 V Circuit Panel Package with Breakers Includes... 14 - 15A Breakers 2 - 15A Double Breakers 2 - 30A Double Breakers 1 - 40A Double Breaker,City of Toronto,02/09/2020,2020-10-07 16:44:53.386549
1521702053,/v-renovation-electrical/city-of-toronto/ikea-under-counter-lights-non-10-watts-barely-used/1521702053,10.0,Ikea Under Counter Lights “Non” 10 Watts - Barely Used,,I’m selling my Ikea Under Counter Lights “Non” 10 Watts in Barely Used Condition. Selling each pair for $10 White Pair - Quantity 1 Silver Pair - Quantity 4 Description: Transformer included. Halogen ...,City of Toronto,02/09/2020,2020-10-07 16:44:53.387086
1138086448,/v-renovation-electrical/city-of-toronto/2-receptacle-wall-plate-brass-plated-new/1138086448,1.0,2 Receptacle Wall Plate - Brass Plated - New,,"2 Receptacle Wall Plate - Brass Plated - New New, never used, not in original packaging $3.72 +HST at Home Depot",City of Toronto,02/09/2020,2020-10-07 16:44:53.387603
1511005343,/v-renovation-electrical/city-of-toronto/nordic-pure-20x25x1-ac-furnace-air-filters-merv-12-box-of-5/1511005343,25.0,"Nordic Pure 20x25x1 AC Furnace Air Filters MERV 12, box of 5",,"CLOSING SALE ( we moved to new address) CLEARANCE FINAL SALE (SoldLess Clearance Center INC) all our prices are without tax (cash only ) regular price :$55 our price :$25 New , open box Final ...",City of Toronto,02/09/2020,2020-10-07 16:44:53.388087
1521631273,/v-renovation-electrical/city-of-toronto/fuses-fuse-holders-and-fuse-covers/1521631273,90.0,"FUSES, FUSE HOLDERS AND FUSE COVERS",,"INDUSTRIAL FUSE HOLDERS , FUSE COVERS AND FUSES. ALL NEW AND IN GOOD CONDITION. ALL FOR $90",City of Toronto,02/09/2020,2020-10-07 16:44:53.388575
1500754806,/v-renovation-electrical/city-of-toronto/2000-professional-grade-electrical-tie-wraps-fasteners/1500754806,50.0,2000 + Professional Grade Electrical Tie Wraps / Fasteners,,"If ad is up, ties are available. I’d interested, please call my landline at 416-438-6903. Thanks, Chris.",City of Toronto,01/09/2020,2020-10-07 16:44:53.389066
1443574923,/v-renovation-electrical/city-of-toronto/4-0-copper-cable-wire/1443574923,550.0,4/0 copper cable wire,,"4/0 copper cable rw90 xlpe. Four (4) pcs roughly 30' each. 30', 31.5', 36', 27'. Total 124.5'. 124.5 x $5/ft = $622.5 Good for 235A or 225A panel.",City of Toronto,01/09/2020,2020-10-07 16:44:53.389554
1510960289,/v-renovation-electrical/city-of-toronto/metalmak-supra-square-light-fixture/1510960289,8.0,METALMAK SUPRA SQUARE LIGHT FIXTURE,,This is a second-hand Metalmak Supra square white light fixture that was assembled in Canada and can be used indoors or outdoors. The fixture is 24 inches x 24 inches x 4 inches deep. It takes ...,City of Toronto,01/09/2020,2020-10-07 16:44:53.390238
1419972009,/v-renovation-electrical/city-of-toronto/120v-led-strip-light-white-warm-white-4-0-meter/1419972009,4.0,120v LED Strip Light (White/Warm White)，$4.0/meter,,120v LED Strip Light (White/Warm White)，$4.0/meter 120v LED RGB Color Strip $6 per meter White/Warm White Strip $4 per meter RGB remote controller $15 White strip connector $7 ...,City of Toronto,01/09/2020,2020-10-07 16:44:53.390921
1521320727,/v-renovation-electrical/city-of-toronto/new-eaton-cutler-hammer-circuit-breakers-panel/1521320727,80.0,New Eaton/Cutler-Hammer circuit breakers panel,,new CPL112W - Eaton Cutler-Hammer Plug-in Loadcentre Specifications: Product Name: Eaton CPL Plug-in Loadcentre Type: CPL112 Phase: Single-phase Enclosure: NEMA 3 Amperage Rating: 125A Authentic ...,City of Toronto,31/08/2020,2020-10-07 16:44:53.391412
1521314272,/v-renovation-electrical/city-of-toronto/lot-bql-nc-nb-na-qbh-15a-20a-30a-40a-single-double-breakers/1521314272,5.0,Lot BQL NC NB NA QBH 15A 20A 30A 40A single double breakers,,"*If you see the ad, some breakers are still available! SEE DETAILS* Stab-lok Commander Challenger Sylvania Eaton Cuttler-Hammer pole bolt on screw lock This is a lot of breakers that come from panels ...",City of Toronto,31/08/2020,2020-10-07 16:44:53.391902
1521250526,/v-renovation-electrical/city-of-toronto/led-bulb-dimmable/1521250526,5.0,"LED bulb, dimmable",,"Noma LED bulb, $5 each or 2 for $8 Pick up near Victoria Park and St Clair Description: Color Soft White 810 lumens 8.5 watts 25,000 hours life Dimmable",City of Toronto,31/08/2020,2020-10-07 16:44:53.392388
1521235262,/v-renovation-electrical/city-of-toronto/one-ceiling-fan-light-twosconces/1521235262,50.0,One Ceiling Fan/Light  & TwoSconces,,3 Speed Ceiling Fan with Halogen light ( with own switch) Frosted Glass ($50.00) 21 inch/5 blades with different color on the opposite side of the blade ( white/wood grain) Excellent working ...,City of Toronto,31/08/2020,2020-10-07 16:44:53.392875
1521202700,/v-renovation-electrical/city-of-toronto/assorted-lutron-fiet-light-switches-and-dimmers/1521202700,10.0,Assorted Lutron & FIET Light Switches and Dimmers,,"I have a variety of lightly used light switches and dimmers from my renovation project. Retail prices on these switches are typically $40 each. The dimmers include four Lutron Skylark SCL-153P, one ...",City of Toronto,31/08/2020,2020-10-07 16:44:53.393361
1477893005,/v-renovation-electrical/city-of-toronto/suspended-ceiling-light-office-commercial-led-40w-new/1477893005,119.99,"Suspended ceiling light, Office, Commercial, LED 40W New",,"Premium Lighting 2x4 led panel light 50 w 6000LM, 4000K, Tri Voltage 120-347V, 0-10V Dimmable, cUL and DLC Listed flat panel led - Suspended ceiling light, Office, Commercial, Please call or TEXT to ...",City of Toronto,31/08/2020,2020-10-07 16:44:53.393852
1497047803,/v-renovation-electrical/city-of-toronto/electrical-wall-plates-for-outlet-receptacle/1497047803,10.0,Electrical wall plates for outlet / receptacle,,"Brand new wall plates, had left overs. Special offset wall plates, for outlets in tight places. (see pic as example). Metal (not plastic). Black. 5x available. $10 for the lot. Click map button for ...",City of Toronto,31/08/2020,2020-10-07 16:44:53.394340
1521142711,/v-renovation-electrical/city-of-toronto/new-brk-smoke-alarm-9120a/1521142711,50.0,NEW BRK Smoke Alarm - 9120A,,"New, in box. The 9120 Series smoke alarms have been designed to install faster, perform better and be even smarter than before. These improvements help reduce nuisance alarms and save you time and ...",City of Toronto,30/08/2020,2020-10-07 16:44:53.395023
1521028260,/v-renovation-electrical/city-of-toronto/15-minute-spring-operated-electric-switch-5/1521028260,5.0,15 Minute spring operated electric switch - $5,,PARAGON spring operated electric switch 15 minute cycle 15A 125VAC PSW15M Brushed aluminum switchplate For use in single gang switchbox choice of 2 knobs East York area meet,City of Toronto,30/08/2020,2020-10-07 16:44:53.395513
1521009748,/v-renovation-electrical/city-of-toronto/eaton-wmzt2d10-circuit-breaker-2-pole/1521009748,1.0,Eaton WMZT2D10 Circuit Breaker 2 Pole,,BRAND-------Eaton MPN----------WMZT2D10 10 pieces available not in box accept any reasonable offer Product Key Features Voltage Rating (DC)48 VDC Number of Poles2 Voltage Rating (AC)277 VAC Circuit ...,City of Toronto,30/08/2020,2020-10-07 16:44:53.396028
1510481489,/v-renovation-electrical/city-of-toronto/electrical-200a-siemens-panel-and-updated-accessories/1510481489,550.0,Electrical 200A Siemens panel and updated accessories,,"Package unopened Siemens 200A service entrance loadcentre with main breaker and some material accessories, all brand new sale for less.",City of Toronto,30/08/2020,2020-10-07 16:44:53.396514
1520970943,/v-renovation-electrical/city-of-toronto/2-875-rigid-metal-conduit-rmc-10-with-coupler/1520970943,25.0,2.875” Rigid Metal Conduit (RMC) 10' with coupler,,"2.875” (trade sizes 2 1/2) Rigid Metal Conduit (RMC) 10' with coupler 2.875"" outside diameter galvanized Rigid Metal Conduit (RMC) 10 feet with coupler RMC trade sizes 2 1/2. RMC is threaded on both ...",City of Toronto,30/08/2020,2020-10-07 16:44:53.397793
1520944159,/v-renovation-electrical/city-of-toronto/ac-converter-240v/1520944159,35.0,Ac-converter 240v,,Max 100 watts (va) Input 110v-200v-220v-240v Output 110v-220v,City of Toronto,29/08/2020,2020-10-07 16:44:53.398280
1520920002,/v-renovation-electrical/city-of-toronto/ballasts/1520920002,5.0,Ballasts,,"Selling new ballasts, only $5.00 each. Over 60 ballasts available. Replacement ballasts for T-12 lamps 2 -F 40 or F 34 (2- 4ft lamps) Fluorescent lighting powered with 347volt.",City of Toronto,29/08/2020,2020-10-07 16:44:53.398764
1510173159,/v-renovation-electrical/city-of-toronto/electrical-floor-box-cover-aluminum-hubbell/1510173159,50.0,Electrical Floor Box Cover Aluminum Hubbell,,"Brand new Electrical Floor Box Cover Aluminum Hubbell. Posted in home renovation materials, electrical in City of Toronto. July 4, 2020",City of Toronto,29/08/2020,2020-10-07 16:44:57.926489
1128459514,/v-renovation-electrical/city-of-toronto/door-bell-lighted-switch-brand-new-broan-brand-golden-metalized/1128459514,9.0,Door Bell lighted Switch Brand new Broan brand Golden metalized,,Door Bell illuminated(Lighted) Push button Switch Brand new Broan brand Golden metalized cover Sealled pack call or text 6477017349..,City of Toronto,29/08/2020,2020-10-07 16:44:57.926982
1520815771,/v-renovation-electrical/city-of-toronto/new-t4-t6-t8-mini-ballast-transformer-four-tubes/1520815771,50.0,New t4 t6 t8 mini ballast transformer four tubes,,"New t4 t6 t8 mini ballast transformer powers upto four fluorescent light tubes. I assume it is either four 2ft tubes or two 4ft tubes, but u need to check manufacturer specs. Online. Works with all ...",City of Toronto,29/08/2020,2020-10-07 16:44:57.927475
