,url,price,title,distance,description,location,time_offset,retreived
1516676340,/v-laptops/city-of-toronto/lenovo-14-fhd-laptop-14w-black-new/1516676340,200.0,"Lenovo 14"" FHD Laptop - 14w Black - new",,"Lenovo 14inch Full HD Laptop - 14w model - Student Laptop in new condition. Still under 1 year warranty, letting it go due to wife having gone on maternity leave. The Lenovo 14w Notebook is an ...",City of Toronto,03/10/2020,2020-10-07 17:43:01.387865
1527722610,/v-laptops/city-of-toronto/dell-latitude-3540/1527722610,550.0,Dell Latitude 3540,,Used for few hours probably less than 10-11 hours and is excellent condition.,City of Toronto,03/10/2020,2020-10-07 17:43:01.388361
1527708103,/v-laptops/city-of-toronto/macbook-air-13-late-2010-core-2-duo-1-86ghz-2gb-ram-128gb-ssd/1527708103,400.0,"MacBook Air 13"" Late 2010, Core 2 Duo 1.86GHz, 2GB Ram,128GB SSD",,"MacBook Air 13"" Late 2010, Core 2 Duo 1.86GHz, 2GB Ram,128GB SSD Excellent condition / Perfect Screen - No ghosting or dead pixels Battery is in great shape - charger Included Small dent in underside ...",City of Toronto,03/10/2020,2020-10-07 17:43:01.389055
1527706134,/v-laptops/city-of-toronto/macbook-pro-retina-13-mid-2014/1527706134,1000.0,"MacBook Pro Retina 13"" Mid 2014",,"Processor: 2.8Ghz Intel Core i5 Memory: 16GB 1600MHz DDR3 Graphics: Intel Iris 1536 HD: 500GB Flash Storage Rarely used, in great condition, no scratches, both speakers are working. Comes with the ...",City of Toronto,03/10/2020,2020-10-07 17:43:01.389547
1527703155,/v-laptops/city-of-toronto/dell-inspiron-15-7000-series-2-in-1model:-7591sliver15-6/1527703155,725.0,Dell Inspiron 15 7000 Series 2-in-1Model: 7591Sliver15.6,,"Dell Inspiron 15 7000 Series 2-in-1 Model: 7591 Sliver 15.6"" FHD Touch Display with Webcam Performance Itel Core i5-10210U Processor 8GB memory 512GB Intel SSD+32GB Optane UHD Graphics Windows 10, ...",City of Toronto,03/10/2020,2020-10-07 17:43:01.390039
1527691639,/v-laptops/city-of-toronto/surface-book-biggest-sale-of-the-year/1527691639,799.0,SURFACE BOOK   - BIGGEST SALE OF     THE YEAR!!!,,SURFACE BOOK - BIGGEST SALE OF THE YEAR!!! ----------------------------------------------------------------------- MODEL 1703 REG PRICE:- $999 SALE PRICE:- $799 INTEL I5 6TH GEN 8GB RAM 128GB SSD ...,City of Toronto,03/10/2020,2020-10-07 17:43:01.390526
1527691594,/v-laptops/city-of-toronto/hp-probook-mt41-biggest-sale-of-the-year/1527691594,219.0,HP PROBOOK MT41 - BIGGEST SALE OF     THE    YEAR!!!,,HP PROBOOK MT41 - BIGGEST SALE OF THE YEAR!!! ------------------------------------------------------------------------------------------------- REG PRICE:- $399.99 SALE PRICE:- $219.99 ...,City of Toronto,03/10/2020,2020-10-07 17:43:01.391019
1527691489,/v-laptops/city-of-toronto/lenovo-thinkpad-t440s-biggest-sale-of-the-year/1527691489,379.0,LENOVO THINKPAD T440S  –  BIGGEST SALE OF THE YEAR!!!,,LENOVO THINKPAD T440S – BIGGEST SALE OF THE YEAR!!! ------------------------------------------------------------------------------- •INTEL I5 4TH GEN •8GB RAM •128GB SSD •Windows 10 ...,City of Toronto,03/10/2020,2020-10-07 17:43:01.391520
1527690172,/v-laptops/city-of-toronto/macbook-pro-13-dock/1527690172,80.0,MacBook Pro 13 Dock,,"MacBook Pro 13 Dock station works MacBook Pro 2016-2020 )touchbar, just dock only ! Sell for $80 !!",City of Toronto,03/10/2020,2020-10-07 17:43:01.392006
1527686289,/v-laptops/city-of-toronto/macbook-pro-2011-13-inch/1527686289,400.0,MacBook Pro 2011 13 inch,,"MacBook Pro 2011 13 inch. Posted in computers, laptops in City of Toronto. October 3, 2020",City of Toronto,03/10/2020,2020-10-07 17:43:01.392497
1527681559,/v-laptops/city-of-toronto/2015-macbook-pro-13-128gb-ssd/1527681559,450.0,2015 MacBook Pro 13” 128gb SSD,,"2015 MacBook Pro, in good shape but has major issues. 1: the screen is dead on the first few lines on the left side. (Not super noticeable but still there) 2: the keyboard and trackpad are not ...",City of Toronto,03/10/2020,2020-10-07 17:43:01.392986
1527680489,/v-laptops/city-of-toronto/acer-aspire-5630-laptop/1527680489,100.0,Acer Aspire 5630 Laptop,,"The configuration Acer provides comes with a Intel Core 2 Duo Processor n/a Serial ATA, Ultra ATA/100 PC Card (PCMCIA) Windows 7 ultimate Edition , NVIDIA GeForce Go 7300, 15.4 inch screen size, 128 ...",City of Toronto,03/10/2020,2020-10-07 17:43:01.393474
1527678545,/v-laptops/city-of-toronto/lenovo-ideapad-miix-700-12isk/1527678545,400.0,Lenovo Ideapad miix 700-12ISK,,In great conditions Lenovo Ideapad miix 700-12ISK. Hard drive 256GB Ram 8GB See photos for more information. Comes with charger. No trades or low offers.,City of Toronto,03/10/2020,2020-10-07 17:43:01.393962
1527673747,/v-laptops/city-of-toronto/macbook-pro-13-2018-512gb-ssd-touch-bar-four-thunderbolt-3/1527673747,1700.0,"MacBook Pro 13"" 2018, 512GB SSD, Touch Bar, Four Thunderbolt 3",,"- Apple MacBook Pro 13.3"" - Model - A1989 MR9V2LL/A - Silver - Touch Bar with integrated Touch ID sensor - 512GB SSD - 8GB of 2133MHz LPDDR3 onboard memory - Intel Iris Plus Graphics 655 Includes: - ...",City of Toronto,03/10/2020,2020-10-07 17:43:01.394456
1527672838,/v-laptops/city-of-toronto/macbook-pro-mid2014-15-weekend-sale/1527672838,900.0,Macbook Pro Mid2014 15” weekend SALE!!!,,Slightly use and only recording,City of Toronto,03/10/2020,2020-10-07 17:43:01.394947
1527670120,/v-laptops/city-of-toronto/slightly-used-macboom-pro/1527670120,1800.0,Slightly used MacBoom Pro,,2019 Extra accessories Box w/ original accessories Kate Spade bag 2 hard cases Apple mouse Free cables,City of Toronto,03/10/2020,2020-10-07 17:43:01.395446
1527667186,/v-laptops/city-of-toronto/acer-15-travelmate-p6-intel-i7-laptop/1527667186,800.0,"Acer 15"" TravelMate P6 Intel i7 Laptop",,"Selling an Acer Acer TravelMate P6 TMP658-MG-749P-US Ultrabook. Was using it as a work laptop, but have since changed jobs and have switched to a desktop PC. The laptop has minor cosmetic damage ...",City of Toronto,03/10/2020,2020-10-07 17:43:01.395936
1527666409,/v-laptops/city-of-toronto/macbook-pro-16-64gb-ram-1tb-ssd-8gb-gpu-applecare-2023/1527666409,4500.0,"MacBook Pro 16"" - 64GB Ram - 1TB SSD - 8GB GPU - AppleCare 2023",,Selling a 2 month old like new Apple MacBook 16-inch - Silver Cosmetic condition: 10/10 Working condition: 10/10 AppleCare+ till July 2023 CPU: 2.4Ghz 8-core Intel Core i9 RAM: 64GB 2667 MHz DDR4 ...,City of Toronto,03/10/2020,2020-10-07 17:43:01.396435
1527665848,/v-laptops/city-of-toronto/lenovo-laptop/1527665848,1700.0,Lenovo laptop,,Gaming laptop Never opened Info in second picture,City of Toronto,03/10/2020,2020-10-07 17:43:01.396985
1527664267,/v-laptops/city-of-toronto/samsung-chromebook-11-6-inch-widescreen/1527664267,149.0,SAMSUNG CHROMEBOOK - 11.6 INCH WIDESCREEN,,SAMSUNG XE500C12 CHROMEBOOK SPECS: - 11.6 Inches Display Size - Intel Celeron N2840 Dual-core 2.16 Ghz - Metallic Silver - 2 Gb Ddr3l Sdram Ram - Intel Hd Graphics - Chrome Os - 1366 X 768 16:9 ...,City of Toronto,03/10/2020,2020-10-07 17:43:01.397506
1527663331,/v-laptops/city-of-toronto/new-xps-17-9700-for-sale-urgently/1527663331,3000.0,New XPS 17 9700 for sale. Urgently.,,"Reason for selling: Emergency money needs. Needs to sell urgently! Sale Price: CAD $3000 only (Negotiable) Original Price : CAD $3,623.64 (Tax included) Check: ...",City of Toronto,03/10/2020,2020-10-07 17:43:01.398008
1527660579,/v-laptops/city-of-toronto/sony-vaio-vpcel23fd/1527660579,120.0,Sony VAIO VPCEL23FD,,"Processor: AMD E-450 dual core Graphics: AMD Radeon HD 6320 RAM: 8GB (2x 4GB) Hard drive: 250GB solid state drive (SSD) Display: 15.6"" 1366x768 Operating system: Windows 10 home Pick up around ...",City of Toronto,03/10/2020,2020-10-07 17:43:01.398505
1527659465,/v-laptops/city-of-toronto/omen-x-2s-15-dg0020nr-dual-screen-gaming-laptop-sealed/1527659465,3200.0,Omen X 2S 15-dg0020nr Dual-screen Gaming Laptop Sealed,,"Item is brand new, never opened never used. Not sure how HP warranty works, but do not have a receipt for this item. Inbox for questions, thanks! Could be opened and tested together to make sure ...",City of Toronto,03/10/2020,2020-10-07 17:43:01.399005
1527658731,/v-laptops/city-of-toronto/dell-latitude-e7470/1527658731,450.0,Dell Latitude E7470,,I am selling like new Dell Latitude E7470. Specs: Intel i5 - 6300U- 2.4GHz- 16GB Ram -256SSD Hard drive - Camera - Backlit keyboard - Fingerprint reader - Windows 10 Professional firm price. Cash ...,City of Toronto,03/10/2020,2020-10-07 17:43:01.399712
1527656213,/v-laptops/city-of-toronto/dell-latitude-5400/1527656213,800.0,Dell Latitude 5400,,I am selling New Dell Latitude 5400 business Laptop. Intel i5 - 8365U- 16GB Ram - 256SSD NVME Hard Drive - Camera - Backlit keyboard - Fingerprint reader - Windows 10 Professional. $800 firm price. ...,City of Toronto,03/10/2020,2020-10-07 17:43:01.400209
1527655578,/v-laptops/city-of-toronto/dell-d620-core2b-t5600-1-82ghz-good-condition/1527655578,50.0,"dell D620 CORE2B T5600,1.82Ghz good condition",,"dell D620 CORE2B T5600,1.82Ghz mem 3g hdd 320g dvd/rw win/sp office..... godd condition",City of Toronto,03/10/2020,2020-10-07 17:43:01.400706
1527574839,/v-laptops/city-of-toronto/asus-tuf-gaming-laptop/1527574839,850.0,Asus TUF Gaming Laptop,,"Bought Laptop for a 3 month course in Nov 2019. Reset to factory settings, pristine condition, no scratch dent or marks. Comes with charger 15.6 inch monitor AMD Ryzen 5 3550H w/Radeon Vega Mobile ...",City of Toronto,03/10/2020,2020-10-07 17:43:01.401201
1527651204,/v-laptops/city-of-toronto/pelican-1470-series-protector-laptop-carrying-case-used/1527651204,125.0,Pelican 1470 Series Protector Laptop Carrying Case used,,"Pelican 1470 Series Protector Laptop Carrying Case Designed with an automatic purge valve that equalizes air pressure, a watertight silicone O-ring lid, over-molded rubber handles, and stainless ...",City of Toronto,03/10/2020,2020-10-07 17:43:01.401690
1527650920,/v-laptops/city-of-toronto/2012-macbook-air-13-mid-2012-8gb-1-8-ghz-129-gb/1527650920,450.0,2012 MacBook Air 13” (Mid 2012) 8gb 1.8 GHZ 129 GB,,Great machine. Was just tuned up at the Mac repair shop and they said it’s still a great machine Only thing up front is battery is only about 1.5 hours (can use a new one for $100). Loaded with ...,City of Toronto,03/10/2020,2020-10-07 17:43:01.402184
1527648958,/v-laptops/city-of-toronto/asus-17-hd-laptop-core-i7-2-40-ghz-8gbram-256ssd-windows-10-64/1527648958,469.0,"ASUS 17"" HD laptop Core i7 2.40 ghz 8gbRam 256ssd Windows 10 64",,"ASUS sonicmaster 17.3"" HD laptop 17"" ASUS laptop Core i7 4500u Quad 2.40ghz 8gb ram 256 ssd Win10 model # X750LA-FS7 Intel Core i7 2.40ghz 4500u 64bit processor 8gb ram DDR3 - 12800s 256 SSD solid ...",City of Toronto,03/10/2020,2020-10-07 17:43:01.402677
1527647103,/v-laptops/city-of-toronto/dell-latitude-7480/1527647103,600.0,Dell Latitude 7480,,"I am selling like new Dell Latitude 7480 Business Laptop. Specs: Intel i5 - 6300U- 16GB Ram - 512SSD M.2 Hard Drive -Camera - Backlit keyboard - 14"" Screen Size - 190X1080 Resulation - Windows 10 ...",City of Toronto,03/10/2020,2020-10-07 17:43:04.394075
1527646966,/v-laptops/city-of-toronto/macbook-pro-13-4gb-500gb-office-2019-logic-pro-final-cut/1527646966,450.0,MacBook Pro 13 4GB 500GB Office 2019 Logic Pro Final Cut,,MacBook Pro 13 4GB 500GB Office 2019 Logic Pro Final Cut Like new condition! Battery Cycle count only 19 Excellent battery Everything up to date *** Running the Latest OS X Operating System macOS ...,City of Toronto,03/10/2020,2020-10-07 17:43:04.394578
1527646379,/v-laptops/city-of-toronto/macbook-12-inch-retina-2015/1527646379,700.0,Macbook 12 Inch Retina (2015),,"Retina 12-inch Macbook, Early 2015. 1.2GHz Dual-Core Intel Core M 8GB RAM 500GB SSD Original Charger and cable Sleeve Case (Incase brand) The original box is not be available The laptop works ...",City of Toronto,03/10/2020,2020-10-07 17:43:04.395066
1527645764,/v-laptops/city-of-toronto/asus-144hz-rog-zephyrus-8th-gen-15-6-ultra-slim-gaming-laptop/1527645764,2000.0,Asus 144hz ROG Zephyrus (8th-Gen) 15.6 Ultra Slim Gaming Laptop,,"Asus 144hz ROG Zephyrus (8th-Gen) 15.6 Ultra Slim Gaming Laptop Asus GX501GI-XS74 ROG Zephyrus (8th-Gen) 15.6” Ultra Slim Gaming Laptop, GTX 1080 8GB 144hz CPU: Intel Core i7-8750H (up to 3.9 GHz) ...",City of Toronto,03/10/2020,2020-10-07 17:43:04.395634
1527643977,/v-laptops/city-of-toronto/macbook-pro-13-2-5-intel-core-i5-8gb-300gb-ssd-solid-state-state/1527643977,550.0,Macbook Pro 13 2.5 Intel Core i5 8GB 300GB SSD SOLID STATE STATE,,Macbook Pro 13 2.5 Intel Core i5 8GB 300GB SSD SOLID STATE STATE *** Running the Latest OS X Operating System macOS Catalina *** Specs] Display size/resolution 13.3 Inches PC CPU 2.5 GHz Intel Core ...,City of Toronto,03/10/2020,2020-10-07 17:43:04.396127
1527640496,/v-laptops/city-of-toronto/2019-macbook-pro-16inch-i9-32gb-ram-1tb-ssd/1527640496,4150.0,"2019 MacBook Pro, 16inch, i9, 32gb ram, 1tb ssd",,"Brand new still has the wrapper and apple care warranty. Excellent laptop, almost the highest specifications that you can get, has not been used outside a handful of times. Laptop is still under ...",City of Toronto,03/10/2020,2020-10-07 17:43:04.396615
1527639624,/v-laptops/city-of-toronto/dell-14-notebook-windows-10/1527639624,250.0,"Dell 14"" Notebook / Windows 10",,Bit Rate: 64 Optical Drive Type: DVD-ROM Brand: Dell Primary Graphics Card: Intel Graphics HD Hard Drive Capacity: 120GB Processor: 2.50Ghz Intel Core i5-2520M Memory: 4GB Recovery Partition: Yes ...,City of Toronto,03/10/2020,2020-10-07 17:43:04.397106
1527639594,/v-laptops/city-of-toronto/2016-macbook-pro-15inch-i7-16gb-ram-1tb-ssd/1527639594,2150.0,"2016 MacBook Pro 15inch, i7, 16gb ram, 1tb ssd",,"2016 Macbook pro that was purchased new in 2017 Highly optioned, has had keyboard and battery replaced by Apple Has been sitting as a backup for over a year, works flawlessly. Comes with original box",City of Toronto,03/10/2020,2020-10-07 17:43:04.397591
1527638414,/v-laptops/city-of-toronto/macbook-pro-13-2020/1527638414,1600.0,"MACBOOK PRO 13""  2020",,"FIXED PRICE, NON NEGOTIABLE!!! HI ALL I AM SELLING MY MACBOOK PRO 2020 WHICH I BOUGHT IN MID MAY. YOU CAN SEE THE SPECS ON THE SCREEN. ITS A POWERFULE MACHINE. SELLING IT BECAUSE I NEED MONEY. MINT ...",City of Toronto,03/10/2020,2020-10-07 17:43:04.398072
1527638190,/v-laptops/city-of-toronto/dell-chromebook-11-11-6-display-chrome-os-used/1527638190,200.0,"Dell Chromebook 11 / 11.6"" Display / Chrome OS ""used""",,"used in very good condition Additional Features: Webcam, Card Reader MPN: 83C80 Additional Ports: HDMI Operating System: Chrome OS Brand: Dell Optical Drive: No Graphics Processing Type: ...",City of Toronto,03/10/2020,2020-10-07 17:43:04.398553
1527637867,/v-laptops/city-of-toronto/dell-xps-13-intel-core-i7-16gb-512gb-touch-screen/1527637867,850.0,Dell XPS 13 Intel Core i7 16GB 512GB Touch Screen,,"Dell XPS 13 Intel Core i7 16GB 512GB Touch Screen IF you see this ad, it is still available! Like New Specs: Dell XPS 13 Intel Core i7-7Y75 1.30 16GB LPDDR3 RAM 512GB M.2 SSD 802.11ac Wi-Fi | ...",City of Toronto,03/10/2020,2020-10-07 17:43:04.399132
1527637501,/v-laptops/city-of-toronto/laptop-for-sale/1527637501,150.0,Laptop for sale,,- Core Duo 2 - Windows 10 - Microsoft Edge - older version of Photoshop is included - charger cord,City of Toronto,03/10/2020,2020-10-07 17:43:04.399636
1527637425,/v-laptops/city-of-toronto/dell-xps-laptop-i7-8g-120g-speedy-storage-jbl-speakers-1g-vrm/1527637425,399.0,Dell XPS laptop(i7/8G/120G Speedy storage/JBL Speakers/1G VRM),,"Shop online(www.used-laptops.ca) for a 10% discount on laptops. Dell XPS L501X(i7) CPU Processor: Intel Core i7 M620 2.67Ghz Memory: 8GB DDR3 Dual Graphics Card: Intel HD Graphics/Nvidia Geforce GT ...
                        
                            
                            
                                
                            
                            
                        

                        
                            
                                Lowest prices in the market. One year warranty.
No questions asked money back guarantee.",City of Toronto,03/10/2020,2020-10-07 17:43:04.400226
1527636105,/v-laptops/city-of-toronto/hp-15-6-laptop-dual-core-4g-128g-ssd-hdmi-webcam-10-off-online/1527636105,259.0,"HP 15.6"" laptop(Dual core/4G/128G SSD/HDMI/Webcam)10% off online",,"Shop online(www.used-laptops.ca) for a 10% discount on laptops. HP 255 G3 CPU Processor: AMD E1-6010 1.35Ghz AMD R2 Graphics(Dual Core） Memory: 4GB DDR3 Storage: 128G SSD Optical Drive :NO Network: ...
                        
                            
                            
                                
                            
                            
                        

                        
                            
                                Lowest prices in the market. One year warranty.
No questions asked money back guarantee.",City of Toronto,03/10/2020,2020-10-07 17:43:04.400772
1524492773,/v-laptops/city-of-toronto/new-acer-10-1-2-in-1-touch-64gb-ssd-500gb-hdd-4gb-ram-sale/1524492773,399.0,"NEW ACER 10.1"" 2-in-1 Touch 64gb ssd + 500gb hdd 4gb ram SALE!",,"**We are open 11am to 7pm everyday at the moment. Please call 647 939 3325**** Do not miss out on limited time specials! - $399.99+tax All prices are FIRM, with taxes on top, and warranty + receipt ...",City of Toronto,03/10/2020,2020-10-07 17:43:04.401258
1527628625,/v-laptops/city-of-toronto/acer-a315-laptop/1527628625,250.0,ACER A315 LAPTOP,,Great condition 9/10 INTEL 1.10GHZ 4GB RAM 500GB HDD Located at; 697 Markham rd Scarborough ON M1H 2A4 4164380887 Monday-Friday 10am-8pm Saturday 10am-7pm Sunday 11am-6pm,City of Toronto,03/10/2020,2020-10-07 17:43:04.401747
1527626499,/v-laptops/city-of-toronto/acer-predator-17-nvidia-geforce-gt980m-gaming-laptop-like-new/1527626499,820.0,"Acer Predator 17"" NVIDIA GeForce GT980M Gaming Laptop, Like New!",,"Selling my Acer Predator 17"" gaming laptop because I've got a gaming desktop now. It's been barely used and in mint condition. Bought brand new at Amazon.ca for $1,908 inc. tax back in 2018 and I ...",City of Toronto,03/10/2020,2020-10-07 17:43:04.402234
1527622695,/v-laptops/city-of-toronto/gaming-laptop-lenovo-geforce-1060-15-y520/1527622695,800.0,"Gaming Laptop Lenovo GeForce 1060 15"" Y520",,"Hi I am selling my laptop that works amazingly because I find I do all my gaming on my switch. Specs are as follows ●  Intel Core i5-7300HQ Processor (2.5Ghz 6MB) ●  15.6"" FHD (1920x1080) IPS ...",City of Toronto,03/10/2020,2020-10-07 17:43:04.402724
1527619632,/v-laptops/city-of-toronto/asus-15-6-inch-windows-10-home-edition-4gb-ram-hdmi-laptop/1527619632,220.0,ASUS 15.6 Inch Windows 10 Home Edition 4GB Ram HDMI Laptop,,This was my personal laptop used for approximately 1 year. No Low ball offers please :-) SPECS Bundled Services 3 GB ASUS WebStorage Manufacturer - Asus PROCESSOR / CHIPSET CPU Intel Celeron N2830 / ...,City of Toronto,03/10/2020,2020-10-07 17:43:04.403209
1527617688,/v-laptops/city-of-toronto/new-genuine-lenovo-ac-adapter-charger-65w-20v/1527617688,30.0,New Genuine Lenovo AC Adapter Charger 65W 20V,,New Genuine Lenovo ThinkPad AC Adapter Charger 65 W 20V BRAND NEW >> Interested prospects please respond with phone number Pick up or meet at downtown Toronto or along subway line. IF ADVT UP STILL ...,City of Toronto,03/10/2020,2020-10-07 17:43:04.403708
1527617671,/v-laptops/city-of-toronto/brand-new-dell-inspiron-42wh-wdxor-laptop-battery/1527617671,60.0,BRAND NEW Dell Inspiron 42Wh WDXOR Laptop Battery,,@@@@ BRAND NEW DELL INSPIRON LAPTOP BATTERY @@@@ 42HWh - WDXOR - RECHARGEABLE LITHIUM BATTERY COMPATIBLE WITH FOLLOWING DELL LAPTOP MODELS: Dell Inspiron 15 5565 5567 5568 5578 5579 7560 7570 7573 ...,City of Toronto,03/10/2020,2020-10-07 17:43:04.404197
1527617601,/v-laptops/city-of-toronto/microsoft-surface-laptop-intel-core-i5-4gb-ram-128gb/1527617601,550.0,"Microsoft Surface Laptop (Intel Core i5, 4GB RAM, 128GB)",,"-----$550 Firm--------- ----Yes, it is still available.---- What time do you want to pick it up? Microsoft Surface Laptop features a 7th generation Intel Core i5 processor, 128 GB of storage, 4 GB ...",City of Toronto,03/10/2020,2020-10-07 17:43:04.404684
1527612638,/v-laptops/city-of-toronto/laptops-for-sale/1527612638,10.0,Laptops For Sale,,Toshiba- Some keys on keyboard not functioning - $30 HP - selling for parts -$10 Feel free for any questions! Bundle deal for $35,City of Toronto,03/10/2020,2020-10-07 17:43:04.405170
1527611944,/v-laptops/city-of-toronto/razer-blade-stealth-13-3-qhd-touchscreen-ultrabook/1527611944,1300.0,"Razer Blade Stealth 13.3"" QHD+ Touchscreen Ultrabook",,"Razer Blade Stealth 13.3"" QHD+ Touchscreen Ultrabook The 13.3” Razer Blade Stealth is available in a black or gunmetal gray finish. The gunmetal variant features a tone-on-tone Razer logo for a ...",City of Toronto,03/10/2020,2020-10-07 17:43:04.405715
1527606223,/v-laptops/city-of-toronto/laptop-dell-int-core-i5-4gb-300gb-dvd-win10-warranty-199-no-tax/1527606223,199.99,laptop-DELL int core i5-4gb 300gb-DVD-win10-warranty-$199-no tax,,laptop dell/hp-intel core 15-4gb 300gb-WEB CAM-DVD BURN-win10-with warranty-$199.99 - NO TAX-NO TAX-NO TAX-NO TAX-SALE - laptop dell/hp-intel core 15-8gb 300gb-WEB CAM-DVD BURN-win10-with ...,City of Toronto,03/10/2020,2020-10-07 17:43:04.406207
1516869436,/v-laptops/city-of-toronto/laptop-batteries-power-adapters-misc-parts/1516869436,10.0,"Laptop Batteries, Power Adapters & Misc Parts",,Laptop Batteries ================= All batteries are used and they were taken from the damaged laptops and are in good condition. Most are 11.1V unless otherwise noted. Batteries marked by v ^ are of ...,City of Toronto,03/10/2020,2020-10-07 17:43:04.406708
1527535591,/v-laptops/city-of-toronto/laptop-hp-omen/1527535591,1900.0,Laptop HP OMEN,,1 TB More graphics16GB More Video 8GB,City of Toronto,03/10/2020,2020-10-07 17:43:04.407199
1527584055,/v-laptops/city-of-toronto/slightly-used-laptop/1527584055,250.0,Slightly Used Laptop,,"Laptop age: 4 months Description: Lenovo IdeaPad 15.6"" Laptop AMD E2A-9000/500 GB HDD/4 GB RAM/Windows 10",City of Toronto,03/10/2020,2020-10-07 17:43:04.407699
1516157394,/v-laptops/city-of-toronto/hewlett-packard-laptop-hp/1516157394,25.0,Hewlett-Packard Laptop (HP),,HP Compaq nc6000 - Windows XP Professional,City of Toronto,03/10/2020,2020-10-07 17:43:04.408183
1527577475,/v-laptops/city-of-toronto/asus-chromebook/1527577475,230.0,ASUS CHROMEBOOK,,ITS A PRETTY FAST ASUS CHROMEBOOK HAS A HD CAMERA COMES WITH A NEW CHARGER LAPTOP ITSELF IS PRETTY NEW BOUGHT A MAC SO I DON'T NEED IT i'LLL DELIVER IT TO YOU (647) 474-2446,City of Toronto,03/10/2020,2020-10-07 17:43:04.408672
1527575375,/v-laptops/city-of-toronto/selling-lnib-surface-pro-5-512gb-i7-16gb-ram-accesories/1527575375,1100.0,Selling LNIB Surface Pro 5 | 512GB | i7 | 16GB Ram | Accesories,,Microsoft Surface Pro 5 LNIB was just replaced by Microsoft - i7 Processor - Extended Warranty until October 31 2021 w/ Accidental Damage Replacement - 16GB ram - 512GB HDD UPGRADE - Alcantra ...,City of Toronto,03/10/2020,2020-10-07 17:43:04.409159
1506597896,/v-laptops/city-of-toronto/laptop-bag-5/1506597896,5.0,Laptop bag $5,,"Laptop bags - Targus, Noteworthy and Protocol basics. Sold individually (3 remaining). 5$ each",City of Toronto,03/10/2020,2020-10-07 17:43:04.409650
1527574554,/v-laptops/city-of-toronto/surface-pro-4-256gb-i7-8gb/1527574554,595.0,Surface Pro 4 - 256GB i7 8GB,,Surface Pro 4 - 256GB i7 - includes Type cover and power charger,City of Toronto,03/10/2020,2020-10-07 17:43:04.410134
1527571345,/v-laptops/city-of-toronto/macbook-air-2019/1527571345,1200.0,"Wanted:
                            MacBook  air 2019",,Need gone asap has water damage and some dents but works fine and apple can replace the laptop still had 2 years warranty Price is negotiable,City of Toronto,03/10/2020,2020-10-07 17:43:04.410620
1527513329,/v-laptops/city-of-toronto/razer-blade-stealth-13-inch-gaming-laptop/1527513329,1200.0,Razer Blade Stealth 13 inch gaming laptop,,Rarely used razer blade stealth 13 laptop. I7 processor and 8gb of dual channel ram. Selling it because I upgraded to a desktop shortly after purchase of laptop. It's in great condition (like new) ...,City of Toronto,03/10/2020,2020-10-07 17:43:04.411105
1527565444,/v-laptops/city-of-toronto/macbook-pro-15-inch-2017-space-grey/1527565444,2300.0,"MacBook Pro (15 inch, 2017) SPACE GREY",,"MacBook Pro 15” Touch Bar For Sale MacBook Pro (15 inch, 2017) SPACE GREY Model Number: A1707 Processor Name: Quad Core Intel i7 2.9 Ghz Memory: 16gb 2133 Mhz LPDDR3 512GB PCIe based SSD Radeon Pro ...",City of Toronto,03/10/2020,2020-10-07 17:43:04.411603
1527560137,/v-laptops/city-of-toronto/macbook-pro-13-2011/1527560137,350.0,"MacBook pro 13"" (2011)",,"Selling my mac because I'm moving to windows. Willing to trade for Dell XPS 13"" and will also add extra cash",City of Toronto,03/10/2020,2020-10-07 17:43:09.860574
1527555642,/v-laptops/city-of-toronto/2019-macbook-pro-touch-sensor-13-3-space-grey-i5-128gb-8gb/1527555642,1300.0,"2019 MacBook Pro touch sensor 13.3""-Space Grey i5 128GB/8GB",,Selling my MacBook that I bought on November 29 2019 (can show you original receipt) because I no longer need it and would like the money for other things. I love this laptop and I took perfect care ...,City of Toronto,03/10/2020,2020-10-07 17:43:09.861068
1527554224,/v-laptops/city-of-toronto/apple-powerbook-g4/1527554224,120.0,Apple Powerbook G4,,"PowerBook5,8 (15"")",City of Toronto,03/10/2020,2020-10-07 17:43:09.861553
