,url,price,title,distance,description,location,time_offset,retreived
1525540303,/v-mountain-bike/city-of-toronto/adult-ladies-full-size-bike/1525540303,99.0,adult ladies full size bike,,Will trade for a decent telescope too Bikes were imposible to buy this summer it was sold out in very store so get one and use for rest of this year plus next full size ladies bike i think the wheels ...,City of Toronto,22/09/2020,2020-10-07 00:28:31.318904
1525534525,/v-mountain-bike/city-of-toronto/bike-for-parts-or-repair-good-condition/1525534525,60.0,Bike for parts or repair ( good condition ),,"Selling my bike for parts or for repair, just needs a new seat and seat post and it’s good to ride. 60$ OBO",City of Toronto,22/09/2020,2020-10-07 00:28:31.319402
1525534514,/v-mountain-bike/city-of-toronto/bike-for-parts-or-repair-good-condition/1525534514,60.0,Bike for parts or repair ( good condition ),,"Selling my bike for parts or for repair, just needs a new seat and seat post and it’s good to ride. 60$ OBO",City of Toronto,22/09/2020,2020-10-07 00:28:31.319902
1525534506,/v-mountain-bike/city-of-toronto/bike-for-parts-or-repair-good-condition/1525534506,60.0,Bike for parts or repair ( good condition ),,"Selling my bike for parts or for repair, just needs a new seat and seat post and it’s good to ride. 60$ OBO",City of Toronto,22/09/2020,2020-10-07 00:28:31.320453
1525532090,/v-mountain-bike/city-of-toronto/giant-ac-mountain-bike-17-frame/1525532090,1600.0,"Giant AC MOUNTAIN BIKE 17"" Frame",,"Last 2 photos are a list of the items on the bike. Highlighted in Yellow is whats is on the bike and highlighted inred is what is not on the bike (changed or upgraded) Upgraded Full Shimano breaks, ...",City of Toronto,22/09/2020,2020-10-07 00:28:31.320962
1525528651,/v-mountain-bike/city-of-toronto/supercycle-youth-mountain-bike/1525528651,100.0,Supercycle Youth Mountain Bike,,"In great condition, 24” dual suspension mountain bike. Also can be used by females 5”4 and under.",City of Toronto,22/09/2020,2020-10-07 00:28:31.321474
1525511728,/v-mountain-bike/city-of-toronto/norco-optic-c7-2/1525511728,4000.0,Norco Optic C7.2,,Babied Norco Optic C7.2. Carbon L Frame. Stock components including Float FOX front and rear. 27.5 wheels converted to tubeless with Continental Trail King 2.4 front and Continental Mountain King 2.4 ...,City of Toronto,22/09/2020,2020-10-07 00:28:31.321986
1525507958,/v-mountain-bike/city-of-toronto/26-bicycle/1525507958,110.0,"26"" bicycle",,"26"" bicycle, good condition, seldom used - $110.",City of Toronto,22/09/2020,2020-10-07 00:28:31.322495
1525498086,/v-mountain-bike/city-of-toronto/new-mountain-bike/1525498086,225.0,New mountain bike,,"Bought it couple of months back, almost new. You can come try it on D’arcy street.",City of Toronto,22/09/2020,2020-10-07 00:28:31.323122
1514398570,/v-mountain-bike/city-of-toronto/vintage-trek-850-mountain-bike/1514398570,260.0,Vintage TREK 850 mountain bike,,"Trek 850 in mint condition, 26 inch wheels, 16.5 inch frame size, 21 speed shimano drivetrain, stx rear derailour, acera brakes and shifters and alivio front derailour. just the grips are a little ...",City of Toronto,22/09/2020,2020-10-07 00:28:31.323633
1525471624,/v-mountain-bike/city-of-toronto/bike-ccm-ds-650-only-150/1525471624,150.0,Bike Ccm Ds 650 only 150$,,8/10 condition. Every thing works well!,City of Toronto,22/09/2020,2020-10-07 00:28:31.324343
1524799123,/v-mountain-bike/city-of-toronto/used-supercycle-xt1-18-dual-suspension-21-speed-mountain-bike/1524799123,100.0,"Used Supercycle XT1-18 Dual-Suspension, 21 speed Mountain Bike",,Recently repaired and refurbished by a professional mechanic. In good working condition. Cosmetic damage. Call Don at 604 222 6683 if interested.,City of Toronto,22/09/2020,2020-10-07 00:28:31.324864
1525453194,/v-mountain-bike/city-of-toronto/transition-scout-carbon-medium/1525453194,4200.0,Transition Scout Carbon Medium,,for sale is a medium 17.5 2017 Transition scout Carbon. rockshox pike fork with 150mm travel. rockshox deluxe shocks. sram x01 drive train. 30 chainring with 11-42 cassette. raceface turbine cranks. ...,City of Toronto,21/09/2020,2020-10-07 00:28:31.325500
1525446988,/v-mountain-bike/city-of-toronto/mountain-bike-ladies-medium/1525446988,230.0,Mountain Bike Ladies (Medium),,Reebok Women's Luna Mountain Bike Hardly used in excellent condition Selling for 230 OBO,City of Toronto,21/09/2020,2020-10-07 00:28:31.326016
1525443665,/v-mountain-bike/city-of-toronto/bike-trunk-mount-ccm/1525443665,100.0,Bike trunk mount CCM,,"Brand new, I bought it on July. I have only used it once. Retail price is 129+tax ($145.77). I’m asking for 100 firm. It works with both sedans and SUVs. Please reply to this and for more info. ...",City of Toronto,21/09/2020,2020-10-07 00:28:31.326593
1525430106,/v-mountain-bike/city-of-toronto/bikes-for-sale/1525430106,60.0,BIKES FOR SALE,,I AM SELLING USED BIKES GOOD CONDITION MSG ME IF INTERESRED,City of Toronto,21/09/2020,2020-10-07 00:28:31.327315
1525426720,/v-mountain-bike/city-of-toronto/ccm-hardline-27-5-with-brand-new-kryptonite-lock-140/1525426720,100.0,CCM Hardline 27.5 with brand new Kryptonite lock. 140$,,"Moving today and need this gone. Had it listed earlier for 140$ including Kryptonite lock. Come get it tonight and I'll let it all go for 100$. Virtually brand new, it's been rode maybe a handful of ...",City of Toronto,21/09/2020,2020-10-07 00:28:32.926228
1525410173,/v-mountain-bike/city-of-toronto/ccm-bike/1525410173,400.0,CCM bike,,CCM bike woman,City of Toronto,21/09/2020,2020-10-07 00:28:32.927861
1525409827,/v-mountain-bike/city-of-toronto/used-bikes-x5-for-restore/1525409827,200.0,Used bikes x5 for restore,,"Used bikes for restore,neglected barn finds for repair or parts,all four $200 pick up northwest toronto,contact 6478189347,",City of Toronto,21/09/2020,2020-10-07 00:28:32.928378
1525405069,/v-mountain-bike/city-of-toronto/perfect-condition-full-suspension-mountain-bike-24/1525405069,450.0,Perfect Condition Full Suspension Mountain Bike 24”,,"There’s a valid one year guarantee Have original tags not attached to bike Only used once Purchased June 8, 2020 Located Toronto, ON Please feel free to message if you have any questions",City of Toronto,21/09/2020,2020-10-07 00:28:32.928881
1525395896,/v-mountain-bike/city-of-toronto/16-inch-bike-30/1525395896,30.0,16' inch bike $30,,"No pet, no smoke home. It is in a good condition. Price to sell. No lower baller, please.",City of Toronto,21/09/2020,2020-10-07 00:28:32.929380
1525362232,/v-mountain-bike/city-of-toronto/specialized-enduro-early-2019/1525362232,3700.0,Specialized enduro early 2019,,Full suspension mountain bike Perfect condition Stock Tubeless conversion Deity pedals NO BRAKES Thats the catch lol Discs are included Please serious buyers 3700 lowest Key words Santa Cruz scott ...,City of Toronto,21/09/2020,2020-10-07 00:28:32.929875
1525355362,/v-mountain-bike/city-of-toronto/ccm-savage-womens-dual-suspension-mountain-bike-with-a-16inc-4/1525355362,180.0,CCM Savage Women's Dual Suspension Mountain Bike with a 16inc (4,,"CCM Savage Women's Dual Suspension Mountain Bike, 26-inch CCM Savage Women's Dual Suspension Mountain Bike with a 16inc (40.6 cm) high-tensile steel frame 26inc (66 cm) wheels 21-Speed Microshift ...",City of Toronto,21/09/2020,2020-10-07 00:28:32.930365
1525345218,/v-mountain-bike/city-of-toronto/jamis-dakar-xct-race-15-small/1525345218,2999.0,"Jamis Dakar XCT Race 15"" small",,Brand New Jamis Dakar XCT Race with factory warranty! Jamis Bicycle Distributor - 153 Bridgeland Unit 10 4162192165 text me to check it out but we usually are open on Thursdays. $2999 reg price is ...,City of Toronto,21/09/2020,2020-10-07 00:28:32.930880
1525337440,/v-mountain-bike/city-of-toronto/supercycle-mountain-bike/1525337440,45.0,Supercycle Mountain Bike,,20 “ Frame 21 Speed 26” Wheels Low mileage Has some surface rust All original parts Good running condition Pick up only Covid free home,City of Toronto,21/09/2020,2020-10-07 00:28:32.931383
1525333215,/v-mountain-bike/city-of-toronto/brand-new-20-bike-movelo-algonquin-steel-mountain-bike/1525333215,130.0,"Brand New 20 "" Bike Movelo Algonquin - Steel Mountain Bike",,"Brand New 20"" Bike Movelo Algonquin - Steel Mountain Bike Never used was bought as a gift for my child but it is too big. Storage space is limited that is the reason for selling it. Description Six ...",City of Toronto,21/09/2020,2020-10-07 00:28:32.932082
1525329367,/v-mountain-bike/city-of-toronto/bike-for-sale/1525329367,50.0,Bike for sale,,It's in working order I don't have any use for it,City of Toronto,21/09/2020,2020-10-07 00:28:32.932581
1525328914,/v-mountain-bike/city-of-toronto/bike/1525328914,200.0,Bike,,Hybrid KHS urban express bike 21 speed Wheel size 700c x 35 Frame size 31” Light and strong bike Tuned up and ready to ride,City of Toronto,21/09/2020,2020-10-07 00:28:32.933079
1525323027,/v-mountain-bike/city-of-toronto/mountain-bike/1525323027,70.0,mountain bike,,"Supercycle unisex mountain bike, 24"" wheel. Price negotiable.",City of Toronto,21/09/2020,2020-10-07 00:28:32.933576
1525313869,/v-mountain-bike/city-of-toronto/ccm-mountain-bike/1525313869,120.0,Ccm mountain bike,,Good condition Runs fine Ccm brand 20”frame Asking $120,City of Toronto,21/09/2020,2020-10-07 00:28:32.934279
1525312507,/v-mountain-bike/city-of-toronto/marin-nail-trail-hard-tail/1525312507,500.0,Marin Nail Trail Hard Tail,,"Excellent condition. Upgraded to Shimano XT 10-speed. Both hydraulic front and rear brakes. New Maxxis Minion DHR rear tire, new chain. Fully turned up and ready to nail trail. $500 OBO",City of Toronto,21/09/2020,2020-10-07 00:28:32.935178
1525312220,/v-mountain-bike/city-of-toronto/fuji-mountain-bike/1525312220,145.0,Fuji mountain bike,,"Fuji boulevard mountain bike for sale. - Medium size - 26"" wheels - grip shift - 21 speed - v brakes full specs: ...",City of Toronto,21/09/2020,2020-10-07 00:28:32.936697
1525301819,/v-mountain-bike/city-of-toronto/mountain-bike/1525301819,150.0,Mountain Bike,,Dont need it anymore iv spent over $300 on it. Brand name and part name is all in the pictures. Good condition just dirty thats all.,City of Toronto,21/09/2020,2020-10-07 00:28:32.937254
1514011196,/v-mountain-bike/city-of-toronto/mountain-bikes-26-tires/1514011196,199.99,"MOUNTAIN BIKES 26"" TIRES",,PICTURE # 1 = LIKE NEW MADE IN CANADA CCM - Purple oversized aluminum tube with shimano Altus sz. small.Like New $199.99 PICTURE # 2 = 80's Miele - sz. small smooth and tuned up cable goes in frame ...,City of Toronto,21/09/2020,2020-10-07 00:28:32.938048
1525278978,/v-mountain-bike/city-of-toronto/schwinn-mountain-bike-small/1525278978,125.0,Schwinn Mountain Bike. Small!,,Nice classic 80s mountain bike :) SMALL SIZE. Great condition overall. Safety-checked. Tuned-up and ready to ride. Rear rack and bottle cage not included (sold separately) :) MAFAC alloy cantilever ...,City of Toronto,21/09/2020,2020-10-07 00:28:32.938758
1509735712,/v-mountain-bike/city-of-toronto/kranked-mountain-bike-front-wheel-racing-bike-front-wheel/1509735712,30.0,Kranked mountain bike front wheel  Racing bike front wheel,,racking bike wheel missing the nut $20 Mountain bicycle wheel $30,City of Toronto,21/09/2020,2020-10-07 00:28:32.939303
1431418389,/v-mountain-bike/city-of-toronto/specialized-rockhopper-a1-comp-fs/1431418389,450.0,Specialized Rockhopper A1 Comp FS,,"Classic old school mountain bike in excellent shape! Frame & Fork Frame size; 19"" Frame Construction TIG-welded Frame Material Specialized A1 Premium Plus aluminum Fork Answer Manitou Spyder Fork ...",City of Toronto,20/09/2020,2020-10-07 00:28:32.939811
1525263922,/v-mountain-bike/city-of-toronto/mountain-bike/1525263922,70.0,Mountain Bike,,Mountain Bike with 7 Speeds/Gears and Steady Mountain Tires in Excellent Condition. No Damages for only $70,City of Toronto,20/09/2020,2020-10-07 00:28:32.940309
1525263232,/v-mountain-bike/city-of-toronto/selling-2-bikes-needs-service-selling-for-300-00-obo/1525263232,300.0,Selling 2 bikes needs Service selling for $300.00 obo,,Hi I am selling 2 bikes that needs some Service over all the bikes are in very good shape no ones used them anymore bikes are over $700.00 plus tax brand new selling used as is for $300.00 obo,City of Toronto,20/09/2020,2020-10-07 00:28:32.940815
1525261337,/v-mountain-bike/city-of-toronto/adult-bicycle-supercycle/1525261337,60.0,Adult Bicycle - Supercycle,,"Selling this Supercycle Adult bicycle, has great thick tires so I was able to ride all winter too. It needs a tune up but otherwise works fine. 60$ OBO",City of Toronto,20/09/2020,2020-10-07 00:28:32.941309
1525256150,/v-mountain-bike/city-of-toronto/infinity-hard-drive-21-speed-mountain-bike-26-inch-tires/1525256150,175.0,Infinity Hard Drive 21-Speed Mountain Bike 26 Inch tires,,LOWEST PRICE IS $175 NOTHING LOWER WILL BE ACCEPTED SORRY! ONLY THING THAT DOESNT WORK ON THIS BIKE IS THE FRONT SHOCKS ALL RUST HAS BEEN GREASED. BIKE IS IN GREAT SHAPE ALL SPEEDS WORK! NO NOISES! ...,City of Toronto,20/09/2020,2020-10-07 00:28:32.941802
1525221458,/v-mountain-bike/city-of-toronto/2018-devinci-django-carbon-gx-eagle/1525221458,3600.0,2018 Devinci Django Carbon GX Eagle,,Selling my Devinci Django as I have too many bikes. Just replaced cassette with new GX Eagle cassette (1 ride) and XX1 Chain. Suspension (front and rear) serviced by S4 Suspension. Brakes were ...,City of Toronto,20/09/2020,2020-10-07 00:28:32.942299
1521459934,/v-mountain-bike/city-of-toronto/white-shimano-aluminum-alloy-mountain-bike/1521459934,80.0,White Shimano Aluminum Alloy Mountain Bike,,Size for teenage boys (8-15) Not brand new but in very good condition *Price open for negotiation,City of Toronto,20/09/2020,2020-10-07 00:28:32.942800
1524854084,/v-mountain-bike/city-of-toronto/d-street-frame-custom-build-breve-crank-and-rear-wheel-pro-logo/1524854084,550.0,D street frame custom build breve crank and rear wheel pro logo,,Call if interested I have a custom bike for sale asking 600 call if interested 647677173,City of Toronto,20/09/2020,2020-10-07 00:28:32.943294
1524853941,/v-mountain-bike/city-of-toronto/giant-bikes-for-sale-large-and-m-frame/1524853941,350.0,Giant bikes for sale large and m frame,,The first photo Is a m frame giant bike I have for sale and a large giant for sale second photo call for more information or if interested 350 each 6476771173 237 Dundas street east,City of Toronto,20/09/2020,2020-10-07 00:28:32.943787
1524740170,/v-mountain-bike/city-of-toronto/urgent-super-rare-kona-cowan-hardtail-dirt-jumper/1524740170,650.0,URGENT - SUPER RARE Kona Cowan Hardtail/Dirt Jumper,,"Selling my pride and joy Kona Cowan hardtail/dirt jumper, You can keep it as a XC trail bike by keeping the seat up and keeping the other components on the drivetrain, or convert it into a dirt ...",City of Toronto,20/09/2020,2020-10-07 00:28:32.944282
1525097077,/v-mountain-bike/city-of-toronto/bike-on-sale/1525097077,200.0,Bike on sale,,Supercycle 7-speed In Condition $200(Can negotiate) 4379808720,City of Toronto,20/09/2020,2020-10-07 00:28:32.944774
1525177841,/v-mountain-bike/city-of-toronto/ccm-27-5-hardtail-fat-tire/1525177841,400.0,Ccm 27.5 hardtail fat tire,,Amazing bike Mint condition Ready to ride No issues Leds included,City of Toronto,20/09/2020,2020-10-07 00:28:32.945268
1525215359,/v-mountain-bike/city-of-toronto/men-s-bike/1525215359,20.0,Men’s bike,,Flat tires... a little TLC needed,City of Toronto,20/09/2020,2020-10-07 00:28:32.945764
1525171784,/v-mountain-bike/city-of-toronto/ccm-hard-trail-mountain-bike/1525171784,470.0,Ccm hard trail mountain bike,,It is in Good condition and price is negotiable,City of Toronto,20/09/2020,2020-10-07 00:28:32.946260
1525184455,/v-mountain-bike/city-of-toronto/kona-mountain-bike/1525184455,199.0,KONA MOUNTAIN BIKE,,"Components The Fire Mountain 2002 comes with Mountain Mix components, including a Kona Control stem, a threadless Aheadset STS headset and Shimano Acera EZ Fire Plus shifters. Drivetrain The Fire ...",City of Toronto,20/09/2020,2020-10-07 00:28:32.946821
1525165487,/v-mountain-bike/city-of-toronto/giant-child-mountain-bike/1525165487,175.0,Giant Child Mountain Bike,,"Giant Mountain bike for sale - Great condition - used for one season. 7 gears, front and back brakes. Should fit most most 6-8 year olds 3 years old but only used for 1 with pretty minor use.",City of Toronto,20/09/2020,2020-10-07 00:28:32.947323
1525165100,/v-mountain-bike/city-of-toronto/trek-single-track-hard-tail/1525165100,500.0,TREK SINGLE TRACK HARD TAIL,,TREK single track hardtail bicycle for sale. Has received a couple of upgrades some of which include brand new break pads and chain in spring of last year. It rides great off roads and can be even ...,City of Toronto,20/09/2020,2020-10-07 00:28:32.947820
1524510832,/v-mountain-bike/city-of-toronto/bike-giant/1524510832,500.0,Bike - Giant,,BIKE FOR SALE $500.00 Escape by Giant Hybrid Small white with green frame Rarely used White Giro Helmet $50.,City of Toronto,20/09/2020,2020-10-07 00:28:32.948313
1525154301,/v-mountain-bike/city-of-toronto/gary-fisher-bike/1525154301,400.0,GARY FISHER BIKE,,"Bike is in really good condition, looking to upgrade. Gary Fisher - Gold Series 6061 : T6 Aluminum 15.5” - 39.5cm Shimano 8 Speed - V Brake",City of Toronto,20/09/2020,2020-10-07 00:28:36.328058
1525125895,/v-mountain-bike/city-of-toronto/hitch-bike-carrier-for-2-bike/1525125895,65.0,Hitch bike carrier for 2 bike,,"Great shape and come with a both style of hitch mount. Two 2"" and 1.25"". Located in whitby",City of Toronto,20/09/2020,2020-10-07 00:28:36.328757
1525116229,/v-mountain-bike/city-of-toronto/ccm-18-speed-mountain-bike-60-trade/1525116229,1.0,CCM 18 speed Mountain Bike (60/trade),,Have a CCM Mountain bike in used but good condition. Grey in colour. Everything works. Has a medium to large frame best suited for people under 5ft8 . So perfect for a teen looking for a first full ...,City of Toronto,20/09/2020,2020-10-07 00:28:36.329250
1525113125,/v-mountain-bike/city-of-toronto/ccm-mountain-bike/1525113125,150.0,CCM Mountain Bike,,"CCM mountain bike, great condition. Medium frame 21 speed 26” rims",City of Toronto,20/09/2020,2020-10-07 00:28:36.329738
1525110929,/v-mountain-bike/city-of-toronto/mec-ace-jr-mountain-bike/1525110929,375.0,Mec ACE jr mountain bike,,"Basically brand new (used lightly less than 10 times...see the tire tread!) Here is the description of the model from MEC: The Ace is a ""real-deal"" mountain bike for kids from about 8 to 11. It uses ...",City of Toronto,20/09/2020,2020-10-07 00:28:36.330225
1524368777,/v-mountain-bike/city-of-toronto/supercycle/1524368777,180.0,Supercycle,,"Selling my Sypercycle! Almost new. Ride only around a month in that summer. All working good ,no issue! Locker and phone mount included",City of Toronto,20/09/2020,2020-10-07 00:28:36.330724
1525105860,/v-mountain-bike/city-of-toronto/spindoctor-race-bicycle-repair-and-tuneup-stand/1525105860,275.0,Spindoctor Race bicycle repair and tuneup stand,,"This is a high-quality like-new stand for repair and tuneup or bicycles, especially toad and mountain bikes. Folds to a compact portable shape; Is built from very high-quality materials. Any bike ...",City of Toronto,20/09/2020,2020-10-07 00:28:36.331212
1525098555,/v-mountain-bike/city-of-toronto/huffy-bike-for-sale/1525098555,40.0,Huffy Bike for Sale,,"Selling this bike. A lityle rust but otherwise rides well. Brakes, tires are all good.",City of Toronto,20/09/2020,2020-10-07 00:28:36.331700
1525094508,/v-mountain-bike/city-of-toronto/ladies-retro-90s-mckinley-bike/1525094508,100.0,Ladies retro  90's Mckinley bike,,"The bicycle rides nice, no issues ready to ride. - 18 speed with thumb shifters -18 inch frame. - kick stand - the saddle is functional but shows wear - ideal size someone around 5ft 4"" - 5ft 7_ ...",City of Toronto,20/09/2020,2020-10-07 00:28:36.332192
1525091315,/v-mountain-bike/city-of-toronto/mountain-bike-shwinn-mesa-250/1525091315,250.0,"Mountain  bike
Shwinn  MESA  $ 250",,Google for description $ 250,City of Toronto,20/09/2020,2020-10-07 00:28:36.332678
1525088663,/v-mountain-bike/city-of-toronto/trek-st-120-vintage-dual-suspension/1525088663,300.0,Trek st 120- vintage dual suspension,,Vintage dual suspension (I believe it was trek’s first) Runs well still Tuned up last year,City of Toronto,20/09/2020,2020-10-07 00:28:36.333172
1525073057,/v-mountain-bike/city-of-toronto/rocky-mountain-thunderbolt-2019-l/1525073057,4950.0,Rocky Mountain Thunderbolt 2019 - L,,"Rocky Mountain Thunderbolt Large 2019 Full Suspension 1x 11 Shimano XT Fox fork 34 27.5” ARC Maxxis tubeless Bought new this spring from Browns with receipt, need XL size",City of Toronto,20/09/2020,2020-10-07 00:28:36.333674
1525042428,/v-mountain-bike/city-of-toronto/mountain-bicycle-21-speed/1525042428,150.0,Mountain Bicycle 21 Speed,,"Mountain bicycle 21 speed for sale. Very good condition. New gear shifter, new brakes, new freewheel, tuned up, dual suspension, 26 inches wheels, 16 inches frame, $150. Call/text 4165593166.",City of Toronto,19/09/2020,2020-10-07 00:28:36.334164
1525042418,/v-mountain-bike/city-of-toronto/brand-new-bike/1525042418,390.0,Brand New Bike,,Bought 2 months back brand new minimally ridden with warranty paperwork as well! Available for pickup but can also arrange to drop off. Diadora Novara 650B Large Hardtail Mountain Bike features a ...,City of Toronto,19/09/2020,2020-10-07 00:28:36.334657
1525037471,/v-mountain-bike/city-of-toronto/specialized-hard-rock/1525037471,300.0,Specialized HARD ROCK,,Shimano Alivio CR-Mo SFS tubing 21 speed Long bike stem Small/medium frame,City of Toronto,19/09/2020,2020-10-07 00:28:36.335148
1525029355,/v-mountain-bike/city-of-toronto/mountain-bike-24-190/1525029355,190.0,mountain bike 24” - $190,,Recently purchased 24” mountain bike. Pick up in Markham. $190,City of Toronto,19/09/2020,2020-10-07 00:28:36.335638
1525022217,/v-mountain-bike/city-of-toronto/mountain-bike-raleigh/1525022217,150.0,Mountain bike - RALEIGH,,"Excellent conditions Good for youth/adult Size:Medium, Frame Size : 17"" (6061 Aluminium), Tire Size : 26",City of Toronto,19/09/2020,2020-10-07 00:28:36.336128
1513392032,/v-mountain-bike/city-of-toronto/bike-phone-holder-bicycle-phone-mount-super-durable-360/1513392032,26.0,"Bike Phone Holder/Bicycle Phone Mount Super Durable, 360°",,"premium bike phone holders from a business owner. Excellent Quality! Anti Shake, Universal for iPhone 11 Pro Max X XR Xs 7s 8 Plus, Samsung S20 S7/S6/Note10/9/8/4, GPS Mount 4 to 6.5'' ✅ SUPER ...",City of Toronto,19/09/2020,2020-10-07 00:28:36.336619
1525013115,/v-mountain-bike/city-of-toronto/selling-a-yellow-vintage-bike-for-adults-price-negotiable/1525013115,260.0,Selling a yellow vintage bike for adults— PRICE NEGOTIABLE,,Hello! I’m selling a yellow vintage bike for adults. It’s in great condition and the price is negotiable!,City of Toronto,19/09/2020,2020-10-07 00:28:36.337114
1525006885,/v-mountain-bike/city-of-toronto/specialized-hard-rock/1525006885,300.0,Specialized HARD ROCK,,Shimano Alivio CR-Mo SFS tubing 21 speed Long bike stem Small/medium frame,City of Toronto,19/09/2020,2020-10-07 00:28:36.337604
1525005944,/v-mountain-bike/city-of-toronto/mountain-bike/1525005944,89.0,Mountain BIKE,,"For sale, used MOUNTAIN BIKE wheel size measuring 23"" in diameter, asking $89.00 or best offer.",City of Toronto,19/09/2020,2020-10-07 00:28:36.338094
1524982055,/v-mountain-bike/city-of-toronto/supercycle-hooligan-dual-suspension-aluminum-mountain-bike/1524982055,200.0,Supercycle Hooligan Dual Suspension Aluminum Mountain Bike,,Supercycle Hooligan Dual Suspension Aluminum Mountain bike in excellent condition. Was tuned up July. Mercalli Downhill Swingarm with Shimano V brake.,City of Toronto,19/09/2020,2020-10-07 00:28:36.338588
1524979310,/v-mountain-bike/city-of-toronto/kona-cowan-hardtail-dirt-jumper/1524979310,650.0,Kona Cowan Hardtail/Dirt Jumper,,THE PRICE IS NEGOTIABLE!! (to a decent amount at least…) Selling my pride and joy Kona Cowan. You can easily convert it from XC hardtail to dirt jumper by lowering the seat. I first got it mid-april ...,City of Toronto,19/09/2020,2020-10-07 00:28:36.339080
1524971963,/v-mountain-bike/city-of-toronto/giant-butte-mountain-bike/1524971963,225.0,Giant Butte Mountain Bike,,Giant Butte Mountain Bike - 21 speed - 26 x 1.95 wheels - Frame Material: Cromoly - Derailleurs: Shimano 200GS - Rear Cassette: Shimano 200GS - Crankset: Shimano 200GS - Shift Type: Index - Frame ...,City of Toronto,19/09/2020,2020-10-07 00:28:36.339564
1524960341,/v-mountain-bike/city-of-toronto/women-s-super-cycle-mountain-bike/1524960341,80.0,Women’s super cycle Mountain bike.,,Used very few times. Like new.,City of Toronto,19/09/2020,2020-10-07 00:28:36.340252
1524557778,/v-mountain-bike/city-of-toronto/pro-caliber-6-2020-size-l-asking-2600/1524557778,2600.0,Pro caliber 6 2020 SIZE L asking 2600$,,This bike has treated me very well. Originally purchased for 3200$ I’m looking for 2600$ after a year of minimal use. This is a size large men’s This bike is clean and a head turner. This spike also ...,City of Toronto,19/09/2020,2020-10-07 00:28:36.340746
1524956940,/v-mountain-bike/city-of-toronto/ccm-apex-8-speed/1524956940,300.0,CCM apex 8 speed,,"This bike is in really good condition, I don’t ride bikes anymore, in total I rode it maybe 6 times, my friend owed me a bit of money so he gave me this bike, if you go to retail stores it would cost ...",City of Toronto,19/09/2020,2020-10-07 00:28:36.341235
