,url,price,title,distance,description,location,time_offset,retreived
1526694091,/v-printers-scanners-fax/city-of-toronto/hp-03a-c3903a-original-black-toner-cartridge/1526694091,100.0,HP 03A C3903A Original Black Toner Cartridge,,HP 03A C3903A Original Black Toner Cartridge,City of Toronto,28/09/2020,2020-10-06 12:28:17.428610
1526693108,/v-printers-scanners-fax/city-of-toronto/hp-10a-q2610a-black-original-toner-cartridge/1526693108,160.0,HP 10A (Q2610A)  Black Original Toner Cartridge,,Black Original Toner Cartridge,City of Toronto,28/09/2020,2020-10-06 12:28:17.429079
1526690972,/v-printers-scanners-fax/city-of-toronto/xerox-orignal-black-drum-013r00663/1526690972,75.0,Xerox Orignal Black Drum 013R00663,,"For Color 550, 560, 570, C60, C70",City of Toronto,28/09/2020,2020-10-06 12:28:17.429572
1526684644,/v-printers-scanners-fax/city-of-toronto/canon-printer/1526684644,5.0,Canon Printer,,Printer/Scanner in good condition. Needs ink cartridge. Price $5,City of Toronto,28/09/2020,2020-10-06 12:28:17.430065
1526683283,/v-printers-scanners-fax/city-of-toronto/genuine-epson-252xl-ink-yellow-magenta/1526683283,45.0,Genuine Epson 252XL ink (yellow & magenta),,"Two brand new, genuine Epson 252XL cartridges. These are the high yield ones, each sells for $50 at Staples. We had to replace the printer entirely, so we have these two left over. The price is for ...",City of Toronto,28/09/2020,2020-10-06 12:28:17.430558
1526677624,/v-printers-scanners-fax/city-of-toronto/new-canon-pixma-ts5020-wireless-inkjet-all-in-one-printer/1526677624,70.0,New Canon PIXMA TS5020 Wireless Inkjet All in One Printer.,,"Canon PIXMA TS5020 Wireless Inkjet All in One Printer. Quickly access scan, copy and print functions with an easily adjustable front panel and 7.5cm LCD display. An innovative rear paper feeder ...",City of Toronto,28/09/2020,2020-10-06 12:28:17.431071
1515997392,/v-printers-scanners-fax/city-of-toronto/brother-pt-80-label-thermal-printer/1515997392,15.0,Brother PT-80 Label Thermal Printer,,I'm selling a Label Printer - Brother PT-80 Label Thermal Printer There is some label left. AAA batteries are not included. (You need 4 AAA batteries),City of Toronto,28/09/2020,2020-10-06 12:28:17.431566
1526655901,/v-printers-scanners-fax/city-of-toronto/brother-multifunction-printer/1526655901,50.0,Brother Multifunction Printer,,Model: MFC-J425w This printer does it all! Used but in perfect shape. Barely have use for it now as I’m done school. Text for faster reply! No shipping or PayPal sorry!,City of Toronto,28/09/2020,2020-10-06 12:28:17.432408
1515971484,/v-printers-scanners-fax/city-of-toronto/color-and-black-ink-cartridges-for-brother-printer/1515971484,0.0,Color and black ink cartridges for Brother printer,,"Unopened and recently purchased LC-51 inkjet cartridges - 1 of each black, yellow, cyan and magenta. The black one is Staples brand, the color ones are Fuzion New brand. The box/bag had been opened ...",City of Toronto,28/09/2020,2020-10-06 12:28:17.432999
1526628448,/v-printers-scanners-fax/city-of-toronto/hp-envy-5530-printer-scanner-copier/1526628448,50.0,"HP ENVY 5530 - printer, scanner, copier",,"Selling my HP ENVY 5530. Its in PERFECT condition. Everything works as new, no issues at all. Wifi wireless printing. SD card slot. I just bought another printer, hence selling this one",City of Toronto,28/09/2020,2020-10-06 12:28:17.433504
1526618693,/v-printers-scanners-fax/city-of-toronto/epson-545-printer-ink-from-amazon-10/1526618693,10.0,Epson 545 printer + ink from amazon - $10,,Epson all in one Printer - printer head may need some fix/clean up before next use,City of Toronto,27/09/2020,2020-10-06 12:28:17.434045
1526613734,/v-printers-scanners-fax/city-of-toronto/brother-mfc-495cw-wireless-all-in-one-color-inkjet-printer/1526613734,100.0,Brother MFC-495CW Wireless All-In-One Color Inkjet Printer,,"The printer belonged to my 98yr old grandpa and he didn’t receive many faxes.... works like new, very lightly used! It’s features include, wireless internet and Ethernet, fax, photocopier, scanner, ...",City of Toronto,27/09/2020,2020-10-06 12:28:17.434570
1023397309,/v-printers-scanners-fax/city-of-toronto/epson-777-printer-refill-black-ink/1023397309,2.0,Epson 777 printer refill black ink,,I am selling an Epson 777 printer refill black ink in origional package.,City of Toronto,27/09/2020,2020-10-06 12:28:17.435113
1526603487,/v-printers-scanners-fax/city-of-toronto/hp-envy-photo-7155-wi-fi-color-printer-scanner/1526603487,59.0,HP ENVY Photo 7155 Wi-Fi Color Printer & Scanner,,HP ENVY Photo 7155 All-in-One Printer *** TWO NEW INSTANT INK CARTRIDGES INCLUDED (BLACK + COLOR) *** needs online registration HP Instant Ink compatible (free 2 months trial) Thermal inkjet ...,City of Toronto,27/09/2020,2020-10-06 12:28:17.435662
1278583598,/v-printers-scanners-fax/city-of-toronto/new-panasonic-fax-2-4-ghz-cordless-phone-digital-answering/1278583598,80.0,NEW PANASONIC Fax & 2.4 GHz Cordless Phone & Digital Answering,,>>> NEW PANASONIC Plain Paper Fax with 2.4 GHz Cordless Phone and Digital Answering System model - KX-FPG371 complete with all the original accessories this is an OPEN BOX product. it was my back-up ...,City of Toronto,27/09/2020,2020-10-06 12:28:17.436160
1410720194,/v-printers-scanners-fax/city-of-toronto/brother-printer-dr-520-drum-unit-still-in-the-box-unopened/1410720194,175.0,Brother Printer DR-520 Drum Unit - Still in the box unopened!,,Brother printer replacement drum unit (not printer cartridge) for use with a variety of printers listed on the box (see image). Not needed and past the time to return it. Box is still sealed. Retails ...,City of Toronto,27/09/2020,2020-10-06 12:28:17.436658
1526589159,/v-printers-scanners-fax/city-of-toronto/printer-hp-officejet-pro-6978/1526589159,50.0,Printer HP OfficeJet Pro 6978,,Mint condition and new black ink extra large from HP Pickup only,City of Toronto,27/09/2020,2020-10-06 12:28:17.437170
1463942475,/v-printers-scanners-fax/city-of-toronto/brother-ink-lc-71-lc-75-lc75-lc-75bk-lc-75c-lc-75m-lc-75y-ink/1463942475,10.0,Brother Ink LC-71 LC-75 LC75 LC-75BK LC-75C LC-75M LC-75Y InK,,Brother LC-71 LC-75 LC75 LC-75BK LC-75C LC-75M LC-75Y Inkjet Cartridge Compatible With Brother MFC-J280W MFC-J425W MFC-J430W MFC-J435W MFC-J5910DW MFC-J625DW MFC-J6510DW MFC-J6710DW MFC-J6910DW ...,City of Toronto,27/09/2020,2020-10-06 12:28:17.437673
1515860595,/v-printers-scanners-fax/city-of-toronto/hp-printer/1515860595,15.0,HP Printer,,"great condition. no ink included. pick up only Print the documents you need in a snap. Designed to fit tight spaces and budgets, this printer is simple to set up and use right out of the box. Count ...",City of Toronto,27/09/2020,2020-10-06 12:28:17.438170
1526578949,/v-printers-scanners-fax/city-of-toronto/hp-photosmart-all-in-one-wireless-scanner-printer/1526578949,80.0,"HP Photosmart, All-in-one, Wireless, Scanner, Printer.",,"Original Price $524.⁹⁹. Asking $80.⁰⁰. Barely Used. Out of box. Perfect condition. Highlights: Up To 13.5 PPM Black, 9 PPM Color Automatic Duplex Printing & Copying 20-Sheet ADF Wireless Printing ...",City of Toronto,27/09/2020,2020-10-06 12:28:17.438678
1526541583,/v-printers-scanners-fax/city-of-toronto/form-printer/1526541583,200.0,"Wanted:
                            FORM PRINTER",,Lexmark 2500 Series Never been used,City of Toronto,27/09/2020,2020-10-06 12:28:19.350503
1526540769,/v-printers-scanners-fax/city-of-toronto/hp-laserjet-4050-n-75-obo/1526540769,75.0,HP Laserjet 4050 N ($75 OBO),,HP Laserjet 4050 N ($75 OBO) Power cord Laptop / PC USB cord included.,City of Toronto,27/09/2020,2020-10-06 12:28:19.351047
1526534771,/v-printers-scanners-fax/city-of-toronto/epson-702-printer-cartridge/1526534771,20.0,Epson 702 Printer Cartridge,,"Brand new, unopened Epson 702 printer cartridges: one black, one magenta",City of Toronto,27/09/2020,2020-10-06 12:28:19.352042
1526526116,/v-printers-scanners-fax/city-of-toronto/epson-printer/1526526116,60.0,Epson printer,,Epson printer $60,City of Toronto,27/09/2020,2020-10-06 12:28:19.352541
1526524890,/v-printers-scanners-fax/city-of-toronto/hp-deskjet-printer-d-1600/1526524890,45.0,HP Deskjet Printer D-1600,,"Small profile, Simple and Effective HP Deskjet Printer -D1600. Works very well. Installation CD and instruction manual are available Takes the HP 60 type ink cartridge. There is ink in the cartridge ...",City of Toronto,27/09/2020,2020-10-06 12:28:19.353104
1526509883,/v-printers-scanners-fax/city-of-toronto/hp-color-laserjet-4700dn/1526509883,25.0,HP Color LaserJet 4700dn,,"HP Color LaserJet 4700dn Without any toner cartridges but otherwise fully functional No longer needed since I exhausted all the toner. Call, text or email Alex R 647-226-6323 ...",City of Toronto,27/09/2020,2020-10-06 12:28:19.353618
1526509222,/v-printers-scanners-fax/city-of-toronto/hp-officejet-pro-9025-all-in-one-printer-w-additional-ink-paper/1526509222,140.0,HP OfficeJet Pro 9025 All-in-One Printer W/ Additional Ink&Paper,,"• Print, Copy, Scan, Fax • Print Speed ISO: Black: Up to 24 ppm; Color: Up to 20 ppm • Single-pass, 2-sided, 35-page auto document feeder, additional 250-sheet input tray (500 sheet total) • Instant ...",City of Toronto,27/09/2020,2020-10-06 12:28:19.354149
1526506394,/v-printers-scanners-fax/city-of-toronto/hp-deskjet-f340-all-in-one/1526506394,40.0,HP Deskjet F340 All-in-One,,"Lightly used HP F340 for sale. It's a great little printer/scanner and is in fine working condition, cables included. Cleaning up and have no use for it, priced to sell. - $80 obo Pick up in ...",City of Toronto,27/09/2020,2020-10-06 12:28:19.354874
1526501247,/v-printers-scanners-fax/city-of-toronto/canon-pixma-multifunctional-printer/1526501247,40.0,Canon Pixma Multifunctional Printer,,"Original Price $169.⁰⁰. Asking Price $40.⁰⁰. Do you need a compact, high-quality, stylish and versatile printer that will print great borderless photos, documents and more? The PIXMA MP490 delivers ...",City of Toronto,27/09/2020,2020-10-06 12:28:19.355372
1455557252,/v-printers-scanners-fax/city-of-toronto/samsung-laser-toner-cartridge-mlt-d105l-oem-sealed-box/1455557252,70.0,Samsung  Laser Toner Cartridge MLT-D105L OEM -Sealed Box,,"IF THIS AD IS UP, THE ITEM is STILL AVAILABLE. Unused, Unopened and in original packaging. Selling Samsung OEM Laser Printer/Fax Toner Cartridge. Mono/Black only, high-capacity/size/ page count . - ...",City of Toronto,27/09/2020,2020-10-06 12:28:19.355865
1508194272,/v-printers-scanners-fax/city-of-toronto/wireless-colour-printer-scanner-brother-mfc-j475dw/1508194272,40.0,Wireless Colour Printer & Scanner - Brother MFC J475DW,,Brother wireless colour printer and scanner. It comes with nearly full black ink but colour ink needs to be replaced. USB computer cable included.,City of Toronto,27/09/2020,2020-10-06 12:28:19.356371
1526472152,/v-printers-scanners-fax/city-of-toronto/lexmark-e220-printer/1526472152,60.0,Lexmark E220 Printer,,"Well-suited to delivering clear crisp lines, this Lexmark printer is effective and versatile. The Lexmark E220 is an outstanding all-in-one printer, so you can balance printing, scanning, and copying ...",City of Toronto,27/09/2020,2020-10-06 12:28:19.356860
1526468204,/v-printers-scanners-fax/city-of-toronto/konica-minolta-pagepro-1400w-laser-printer/1526468204,40.0,Konica Minolta PagePro 1400W Laser Printer,,In great condition and in original packaging. Most of the toner is left as I didn't use it much after I replacing it last time. Pick up only. Manufacturer description: One of the smallest monochrome ...,City of Toronto,27/09/2020,2020-10-06 12:28:19.357371
1526454160,/v-printers-scanners-fax/city-of-toronto/hp-laserjet-pro-400-color-laser-printer-m451dn/1526454160,300.0,HP LaserJet Pro 400 color laser printer M451dn,,"Excellent condition! Prints 21 pages per min (b&w or colour) Duplex, large capacity & fast! ~$450 brand new Asking $300 (less than 2600 pages printed)... This thing is a beast! ...",City of Toronto,27/09/2020,2020-10-06 12:28:19.357862
1526449747,/v-printers-scanners-fax/city-of-toronto/hp-125a-cb540a-black-original-laserjet-toner-cartridge/1526449747,75.0,HP 125A (CB540A) Black Original LaserJet Toner Cartridge,,Brand New Sealed HP 125A (CB540A) Black Original LaserJet Toner Cartridge Pick up in Scarborough near Sheppard Ave and Warden Ave,City of Toronto,27/09/2020,2020-10-06 12:28:19.358410
1526449701,/v-printers-scanners-fax/city-of-toronto/hp-35a-black-original-laserjet-toner-cartridge/1526449701,65.0,HP 35A Black Original LaserJet Toner Cartridge,,Brand New Sealed HP 35A Black Original LaserJet Toner Cartridge Pick up in Scarborough near Sheppard Ave and Warden Ave,City of Toronto,27/09/2020,2020-10-06 12:28:19.358918
1515813822,/v-printers-scanners-fax/city-of-toronto/new-in-box-brother-colour-laser-printer-hl-l8360cdw-r-579/1515813822,450.0,NEW IN BOX Brother Colour Laser Printer HL-L8360CDW (r. $579),,"New, unused in box. Prints 33 pages/minute, color or black-white Colour and black cartridges included, lasts for 6500 pages Includes all plugs and manuels in sealed packets Wifi and gigabite ethernet ...",City of Toronto,27/09/2020,2020-10-06 12:28:19.359419
1526423562,/v-printers-scanners-fax/city-of-toronto/hp-laserjet-toner-cartridge-85a/1526423562,30.0,HP Laserjet toner cartridge 85A,,New in box,City of Toronto,27/09/2020,2020-10-06 12:28:19.360437
1505133159,/v-printers-scanners-fax/city-of-toronto/old-ink-cartridges-expired/1505133159,5.0,Old ink cartridges EXPIRED,,Epson 69 yellow unopened exp 2016 - $5 Epson 69 magenta unopened exp 2017 - $5 Epson T018 311 for EPSON stylus colour 777 or 777i (2 available one in box one without) - $5 each Canon BC-01 BJ ...,City of Toronto,26/09/2020,2020-10-06 12:28:19.361467
1526414296,/v-printers-scanners-fax/city-of-toronto/brother-wireless-color-photo-inkjet-printer/1526414296,200.0,Brother Wireless Color Photo Inkjet Printer,,"Brand New $998.⁹⁹. Asking Price $200.⁰⁰. DESCRIPTION: Business Inkjet All-in-One offers the Ultimate Combination of Fast Print Speeds, Touchscreen, Low Cost Printing and Innovative Landscape Print ...",City of Toronto,26/09/2020,2020-10-06 12:28:19.362129
1526412990,/v-printers-scanners-fax/city-of-toronto/hp-photosmart-325-printer/1526412990,20.0,HP Photosmart 325 printer,,Compact photo printer,City of Toronto,26/09/2020,2020-10-06 12:28:19.362644
1526412715,/v-printers-scanners-fax/city-of-toronto/hp-951xl-magenta/1526412715,30.0,Hp 951xl magenta,,Sealed unused hp 951xl magenta ink . $30 firm.,City of Toronto,26/09/2020,2020-10-06 12:28:19.363144
1526411929,/v-printers-scanners-fax/city-of-toronto/discount-on-printer-toners/1526411929,10.0,Discount on Printer toners,,"I can get you high discounts on any Laser printer toners or office printers. We have all makes and models. All toners are sealed, brand-new (not refills). Just send me the toner number or printer ...",City of Toronto,26/09/2020,2020-10-06 12:28:19.363641
1496071362,/v-printers-scanners-fax/city-of-toronto/lnib-hp-sprocket-printer-2nd-edition-luna-pearl/1496071362,100.0,LNIB HP Sprocket Printer - 2nd Edition - Luna Pearl,,Basically used...printed just 3 pics from it $100 FIRM Share the present with instant 5 x 7.6 cm (2 x 3 in) photos from your smartphone. Easily connect smartphones to your Sprocket so everyone can ...,City of Toronto,26/09/2020,2020-10-06 12:28:19.364172
1526400398,/v-printers-scanners-fax/city-of-toronto/genuine-oem-konica-toner-tn511-black/1526400398,50.0,Genuine OEM Konica Toner TN511 Black,,Brand new sealed black toner,City of Toronto,26/09/2020,2020-10-06 12:28:19.364676
1526396898,/v-printers-scanners-fax/city-of-toronto/brother-printer-excellent-condition-with-brand-7-new-sealed-inks/1526396898,55.0,Brother printer excellent condition with brand 7 new sealed inks,,"Excellent work condition, with box and extra 7 brand new sealed inks (3 Black, 2 Magenta, 2 Yellow) Pick up only Cash only. 3 Black, 2 Magenta, 2 Yellow",City of Toronto,26/09/2020,2020-10-06 12:28:19.365176
1526393613,/v-printers-scanners-fax/city-of-toronto/canon-mg2929-printer-wireless/1526393613,50.0,Canon MG2929 Printer Wireless,,In great condition. Never used because roommate bought another one so no need to use two.,City of Toronto,26/09/2020,2020-10-06 12:28:19.365673
1526388388,/v-printers-scanners-fax/city-of-toronto/brother-mfc-440cn-all-in-one-inkjet-printer-copand-fax/1526388388,150.0,Brother MFC-440CN All-In-One Inkjet Printer Copand Fax .,,"Brother MFC-440CN All-In-One Inkjet Printer Copier, Scanner, and Fax , condition is used.",City of Toronto,26/09/2020,2020-10-06 12:28:19.366172
1526378737,/v-printers-scanners-fax/city-of-toronto/hp-deskjet-2665-all-in-one-inkjet-printer/1526378737,45.0,HP Deskjet 2665 All-in-one inkjet printer,,Selling the newly brought HP inject printer at 79.99 +tax and selling it for 45$. Only pickup. Contact me at 437-999-5042.,City of Toronto,26/09/2020,2020-10-06 12:28:19.366681
1526363166,/v-printers-scanners-fax/city-of-toronto/hp-920-black-original-ink-cartridge-brandnew/1526363166,25.0,HP 920 Black Original Ink Cartridge Brandnew,,new-HP 920 Black Original Ink Cartridge (CD971AN),City of Toronto,26/09/2020,2020-10-06 12:28:19.367178
1526353837,/v-printers-scanners-fax/city-of-toronto/hp-laser-1001nw-printer-new/1526353837,250.0,HP Laser 1001nw Printer NEW,,NEW HP Neverstop Laser 1001nw Printer 329$ on Amazon Box opened but never took it out of the box! Keele and Lawrence Area,City of Toronto,26/09/2020,2020-10-06 12:28:19.367673
1526337529,/v-printers-scanners-fax/city-of-toronto/xerox-phaser-3635mfp-toner/1526337529,200.0,Xerox Phaser 3635MFP Toner,,Xerox Phaser 3635MFP Toner original 2 pack cartridges $200.00 plus tax and shipping.,City of Toronto,26/09/2020,2020-10-06 12:28:19.368167
1515562266,/v-printers-scanners-fax/city-of-toronto/lexmark-print-copy-scan-multifunction-reduced/1515562266,185.0,LEXMARK PRINT/COPY/SCAN MULTIFUNCTION-reduced,,"SPACE SAVER desk top. Print/copy/scan GO TO: https://www.lexmark.com/en_ca/printer/2533/Lexmark-X1195 Like new. 6 Black cartridges, 3 colour cartridges included. No expiry on box, so cannot test but ...",City of Toronto,26/09/2020,2020-10-06 12:28:21.174405
1526313457,/v-printers-scanners-fax/city-of-toronto/hp-officejet-pro-8710/1526313457,30.0,HP OFFICEJET PRO 8710,,"All in one fax, scan, copy and print in colour",City of Toronto,26/09/2020,2020-10-06 12:28:21.175123
1515549221,/v-printers-scanners-fax/city-of-toronto/hp-laserjet-4000-laser-printer-black-and-white-parellel-port/1515549221,50.0,Hp LaserJet 4000 Laser Printer Black and White Parellel Port,,Hp LaserJet 4000 Laser Printer Black and White Parellel Port Call 416-534-2222,City of Toronto,26/09/2020,2020-10-06 12:28:21.175657
1526293876,/v-printers-scanners-fax/city-of-toronto/never-used-printer/1526293876,180.0,Never used printer,,Bought never used Moving out need buyer asap Works perfectly no parts missing,City of Toronto,26/09/2020,2020-10-06 12:28:21.176155
1526267099,/v-printers-scanners-fax/city-of-toronto/epson-workforce-pro-wf-3720-all-in-one-color-printer/1526267099,65.0,Epson Workforce Pro WF 3720 All in one color printer,,"Brand new printer, rarely used for sale. Printer is all in one color inkjet printer. Text me if you are interested.",City of Toronto,26/09/2020,2020-10-06 12:28:21.176649
1526236957,/v-printers-scanners-fax/city-of-toronto/all-in-one-laser-printer/1526236957,80.0,All-in-one laser printer,,"Brother MFC-8480DN high performance All-in-one networking and duplex printer. Fully working in spotless clean conditions. 32ppm, 300 sheet paper capacity. Ready to use without any issues. Drum and ...",City of Toronto,26/09/2020,2020-10-06 12:28:21.177158
1526227144,/v-printers-scanners-fax/city-of-toronto/cannon-pixma-g4210/1526227144,300.0,Cannon Pixma G4210,,Brand new in box. Save over 100.00 dollars.,City of Toronto,26/09/2020,2020-10-06 12:28:21.177680
1526225205,/v-printers-scanners-fax/city-of-toronto/hp-officejet-250-all-in-one-mobile-printer/1526225205,375.0,HP OfficeJet 250 All-In-One Mobile Printer,,"Hello, For sale is a new HP officejet 250 AIO mobile printer. I got this to use as a trial for a project and never went through with it. It has been charged only once and the only thing printed was ...",City of Toronto,26/09/2020,2020-10-06 12:28:21.178314
1526218194,/v-printers-scanners-fax/city-of-toronto/hp-color-laserjet-enterprise-flow-m880-mfp/1526218194,1899.0,HP Color Laserjet Enterprise Flow M880 MFP,,"HP Color Laserjet Enterprise Flow M880 MFP Letter/Legal-Size Color Laser Multifunction Printer - 46ppm, Copy, Print, Scan, Auto Duplex, Network, 4 Trays About this item Standard features: Copy, ...",City of Toronto,25/09/2020,2020-10-06 12:28:21.179171
1505095306,/v-printers-scanners-fax/city-of-toronto/brother-ql-570-professional-label-printer-dk1201-labels-29x90mm/1505095306,99.0,Brother QL-570 Professional Label Printer DK1201 labels 29x90mm,,IF the ad is up it's available. For sale used in very good working and cosmetic condition. Brother QL-570 Professional Label Printer with one roll of DK1201 Standard Address Labels 29x90mm Power and ...,City of Toronto,25/09/2020,2020-10-06 12:28:21.179911
1526200745,/v-printers-scanners-fax/city-of-toronto/samsung-ml-2510-mono-laser-printer/1526200745,30.0,Samsung ML-2510 Mono Laser printer,,"Black and white, used toner cartilage (not included) Same as this: https://www.amazon.ca/Samsung-ML-2510-Monochrome-Compact-Personal/dp/B0009KITEU Works fine, just don't need it anymore",City of Toronto,25/09/2020,2020-10-06 12:28:21.180419
1526196169,/v-printers-scanners-fax/city-of-toronto/cannon-printer/1526196169,50.0,CANNON PRINTER,,I HAVE CANNON ONK JET COLOUR PRINTER. MODEL NO TS5020 I BOUGHT 6 MONTHS AGO. STILL LOOKING BRAND NEW. YOU CAN SCANING AS WELL .,City of Toronto,25/09/2020,2020-10-06 12:28:21.181078
1526185540,/v-printers-scanners-fax/city-of-toronto/canon-aio-mg6420-printer-can-be-used-as-a-scanner/1526185540,5.0,Canon AIO MG6420 Printer. Can be used as a scanner.,,"For sale is a Canon Pixma all in one MG6420 Printer. It can scan, great for printing photos and has a lot of features. It currently contains refillable cartridges which you can refill easily saving ...",City of Toronto,25/09/2020,2020-10-06 12:28:21.181849
1504798478,/v-printers-scanners-fax/city-of-toronto/brand-new-pixma-ip3500-photo-printer/1504798478,150.0,Brand new PIXMA iP3500 photo printer,,Selling brand new canon photo printer never used with Kodak premium photo value pack. (Total retail value $250 after tax) Serious inquiries only.,City of Toronto,25/09/2020,2020-10-06 12:28:21.182357
1526133005,/v-printers-scanners-fax/city-of-toronto/brother-hl-l2320d-printer-b-w-laser/1526133005,80.0,Brother HL-L2320D - printer - B/W - laser,,Like New- In very good condition + comes with ink cartridge Compact printer with an up to 250-sheet capacity tray connects with ease to your computer via the Hi-Speed USB 2.0 interface and prints ...,City of Toronto,25/09/2020,2020-10-06 12:28:21.182869
1451656378,/v-printers-scanners-fax/city-of-toronto/hp-designjet-1055cm-large-format-printer-36/1451656378,500.0,"HP Designjet 1055CM Large format printer 36""",,"HP Designjet 1055CM Large format printer 36"" perfect working condition. New belt Full set of OEM ink.Drivers for Windows 10 ,network ready $500 obo",City of Toronto,25/09/2020,2020-10-06 12:28:21.183390
1526119580,/v-printers-scanners-fax/city-of-toronto/hp-laserjet-p1606dn-b-w-printer/1526119580,100.0,HP LaserJet P1606dn B&W printer,,HP LaserJet P1606dn B&W printer with almost new high capacity toner. Both USB and network interfaces. Works perfectly. $100,City of Toronto,25/09/2020,2020-10-06 12:28:21.184081
1084291467,/v-printers-scanners-fax/city-of-toronto/new-genuine-hp-28-tri-color-ink-cartridge/1084291467,15.0,NEW Genuine HP 28 Tri-color Ink Cartridge,,"NEW Genuine HP 28 Tri-color Ink Cartridge New, sealed ink; missing original cardboard box. Probaly expired $15 price is firm",City of Toronto,25/09/2020,2020-10-06 12:28:21.184574
1526115775,/v-printers-scanners-fax/city-of-toronto/hp-officejet-3830-printer/1526115775,40.0,HP OfficeJet 3830 Printer,,"Pickup in Richmond Hill at Bayview/Major Mackenzie. Selling a used inkjet printer in good condition. Multi-function: fax, scan, copy and print. Comes with original packaging, cables and a black ink ...",City of Toronto,25/09/2020,2020-10-06 12:28:21.185065
1526097892,/v-printers-scanners-fax/city-of-toronto/canon-mx-printer-ink-cartridges-replacement-220-221/1526097892,5.0,Canon MX Printer Ink Cartridges Replacement 220 221,,"I have replacement ink Cartridges for Canon MX Pixma printers, BK C-220 (5) BK C-221 (6) Y C-221 (7) M C-221 (5) C C-221 (4) 27 sealed cartridges in total, asking $5 each or $100 for all. Additional ...",City of Toronto,25/09/2020,2020-10-06 12:28:21.185608
1086937502,/v-printers-scanners-fax/city-of-toronto/genuine-hp-14-tri-color-and-hp-14-black-ink-cartridge/1086937502,20.0,Genuine Hp 14 Tri-color and Hp 14 Black Ink Cartridge,,Genuine Hp 4 Tri-color and Hp 14 Black Ink Cartridge The black cartridge package is open but the cartridge is till sealed in it's plastic. The tricolor cartridge is still sealed. Both cartridges ...,City of Toronto,25/09/2020,2020-10-06 12:28:21.186378
1526091529,/v-printers-scanners-fax/city-of-toronto/hp-toner-cartridges-cf410a-411a-412a-413a-new-in-the-box/1526091529,350.0,"HP Toner Cartridges (CF410A, 411A/412A/413A) New in the box",,These were ordered for a new printer requiring CE cartridges instead of CF. All new even if 3 boxes were opened in error.,City of Toronto,25/09/2020,2020-10-06 12:28:21.186961
