,url,price,title,distance,description,location,time_offset,retreived
1521772705,/v-laptops/city-of-toronto/x1-carbon-6th-gen-1tb-ssd-16g-memory/1521772705,1200.0,X1 carbon 6th gen 1TB ssd + 16G Memory,,No warranty left. One corner of the shell with visible scratch. but laptop is functioning well. Machine Type Model: 20KH002HUS Processor: 1x Intel Core i7-8650U Processor(Core i7-8650U) Memory: 1x ...,City of Toronto,< 5 minutes ago,2020-10-07 17:41:51.402825
1528482861,/v-laptops/city-of-toronto/eurocom-m5-pro-15-6-gaming-laptop/1528482861,800.0,"Eurocom M5 Pro 15.6"" Gaming Laptop",,"I'm selling my Eurocom M5 Pro 15.6"" gaming laptop: Intel Core i7 4720HQ @ 2.60GHz 16GB Dual-Channel DDR3 3GB NVIDIA GeForce GTX 970M dedicated graphics 15.6-inch 2K FHD 1920x1080; IPS MATTE LCD ...",City of Toronto,< 11 minutes ago,2020-10-07 17:41:51.403323
1528480200,/v-laptops/city-of-toronto/huge-1tb-ssd-storage-i9-macbook-pro-16-brand-new/1528480200,3199.0,Huge 1TB SSD Storage i9 Macbook Pro 16 Brand New,,"Up for sale is an Apple Macbook Pro 16"" Brand New Seal Box ☆ Highend Spec i9 8-core processor ☆ Huge 1TB SSD Storage ☆ 16GB of Memory ☆ The most recent 2019 model ☆ AMD 5500M Graphic Pro ☆ Apple ...",City of Toronto,< 22 minutes ago,2020-10-07 17:41:51.404008
1528478955,/v-laptops/city-of-toronto/brand-new-hp-elitebook-1040-g3/1528478955,1000.0,Brand new HP Elitebook 1040 G3,,"Brand new HP Elitebook 1040 G3, never opened, original seal. Make me a reasonable offer. i7 6600 cpu 2.6GHz 16GB RAM 256 SSD Same as the one in the link below, except mine is 256 SSD, not 512. ...",City of Toronto,< 28 minutes ago,2020-10-07 17:41:51.404490
1528476776,/v-laptops/city-of-toronto/msi-gf65-thin-9sexr-249/1528476776,1090.0,MSI  GF65 Thin 9SEXR -249,,"About 7 months old, like new condition, everything except camera works well. Didn't use camera before. Don't know why it doesn't work. Compact, light yet very powerful gaming laptop. Intel Cores ...",City of Toronto,< 39 minutes ago,2020-10-07 17:41:51.404947
1528476643,/v-laptops/city-of-toronto/sale-for-macbook-pro-13-retina-2014-3-ghz-i7/1528476643,1200.0,"SALE FOR MACBOOK PRO 13 RETINA 2014,3 Ghz i7",,"SALE FOR MACBOOK PRO 13 RETINA 2014,3 Ghz Quad-core intel core i7 ,16GB Mem,512 GB SSD Perfect working condition A1502 ,Mid 2014 Cosmetic condition 9/10 , Battery cycle only 468. 3.00 Ghz Quad-core ...",City of Toronto,< 40 minutes ago,2020-10-07 17:41:51.405430
1528475036,/v-laptops/city-of-toronto/lenovo-t430-i5-8-gb-250-gb-ssd/1528475036,230.0,Lenovo T430 i5 - 8 GB + 250 GB SSD,,"For sale Lenovo T430 Laptop. Intel Core i5-3320M CPU @ 2.60 GHz. 3rd GEN. 8 GB RAM. 250 GB SSD Hard Drive. Built in camera. 14"" screen. 1600 x 900 Resolution. Windows 10 Pro fresh installed. Genuine ...",City of Toronto,< 50 minutes ago,2020-10-07 17:41:51.405931
1528474777,/v-laptops/city-of-toronto/lenovo-t440s/1528474777,450.0,Lenovo T440s,,"Lenovo T440s, mint condition. No warranty. Only laptop and charger. Intel Core i7-4600U CPU@2.10GHz 2.69GHz RAM 8GB Storage 256GB Windows 10 Pro Display 14 inch 1920*1080",City of Toronto,< 51 minutes ago,2020-10-07 17:41:51.406418
1528473392,/v-laptops/city-of-toronto/lenovo-thinkpad-t540p-business-laptop-w-fingerprint-reader/1528473392,250.0,Lenovo Thinkpad T540p Business Laptop w Fingerprint Reader,,"Very clean, excellent condition. Windows 10 Pro installed. Excellent battery life 5+ hours. Specifications: Intel core i3 4GB DDR3 Intel HD graphics 256GB SSD Original Charger",City of Toronto,< 59 minutes ago,2020-10-07 17:41:51.406905
1528471908,/v-laptops/city-of-toronto/lenovo-thinkpad-x1-extreme-2nd-gen-15-6/1528471908,2700.0,Lenovo Thinkpad X1 Extreme 2nd Gen 15.6,,"Mint condition lightly used Lenovo X1 Extreme. Windows 10 pro 64 Core i9, 1TB storage, 32GB Ram, finger print reader. Working amazing. Comes with charger.",City of Toronto,< 2 hours ago,2020-10-07 17:41:51.407397
1528471593,/v-laptops/city-of-toronto/macbook-pro-13-2012-i5-4gb-240gb-ssd-macos-catalina/1528471593,550.0,"Macbook Pro 13"" 2012 - i5, 4GB, 240GB SSD, MacOS Catalina",,"For sale is a fully working, good condition Macbook Pro 2012 13"" laptop. This has been upgraded to have a solid state drive, so with the Intel Core i5 processor (2.5GHz clock speed), it is very fast. ...",City of Toronto,< 2 hours ago,2020-10-07 17:41:51.407893
1528471581,/v-laptops/city-of-toronto/acer-aspire-5534-laptop-webcam-4-gb-ram-80-hdd-win-10-ready/1528471581,135.0,ACER ASPIRE 5534 LAPTOP-WEBCAM-4 GB RAM-80 HDD-WIN 10-READY,,ACER ASPIRE 5534 LAPTOP FOR SALE... SPECS: WEBCAM 4 GB RAM 80 HDD DVD-RW OFFICE 2007 CHARGER BATTERY GOOD NEW INSTALLED WIN 10/ACTIVATED LAPTOP IS READY TO USE... PRICE $135 FIRM CALL OR TEXT FOR ...,City of Toronto,< 2 hours ago,2020-10-07 17:41:51.408379
1528471496,/v-laptops/city-of-toronto/macbook-2015-12-inch/1528471496,900.0,MacBook 2015 12 inch -,,"MacBook 2015 250 gb Great condition Comes with clear case Battery lasts about 4 hours, not at 100% Selling because I have a MacBook Pro now and do not need this one anymore Great for students (very ...",City of Toronto,< 2 hours ago,2020-10-07 17:41:51.408869
1528470350,/v-laptops/city-of-toronto/macbook-pro-2010-13-fast-and-cheap-2-4ghz-4gb-240gb-ssd/1528470350,420.0,"Macbook Pro 2010 13"" - FAST AND CHEAP 2.4Ghz, 4GB, 240GB SSD",,"We have a Macbook Pro 2010 13"" laptop for sale. It is the 2.4GHz Intel Core 2 Duo CPU version, coming upgraded from a harddrive to a 240GB SSD (Solid State Drive). It is very quick, running MacOS ...",City of Toronto,< 2 hours ago,2020-10-07 17:41:51.409357
1528470274,/v-laptops/city-of-toronto/macbook-pro-2009-13-intel-2-53ghz-4gb-240gb-ssd-cheap-fast/1528470274,400.0,"Macbook Pro 2009 13"" - Intel 2.53Ghz, 4GB, 240GB SSD, CHEAP FAST",,"For sale is a great condition Macbook Pro 2009 13"" laptop It is the 2.53GHz Intel Core 2 Duo CPU version, comes upgraded from a hard drive to a 240GB Solid State Drive, making it very quick. It is ...",City of Toronto,< 2 hours ago,2020-10-07 17:41:51.409849
1528470063,/v-laptops/city-of-toronto/cheap-fast-macbook-pro-2009-13-2-26ghz-4gb-240gb-ssd/1528470063,350.0,"Cheap Fast Macbook Pro 2009 13"" - 2.26Ghz + 4GB + 240GB SSD",,"This is a great condition Macbook Pro 2009 13"" laptop. It is the 2.26GHz Intel Core 2 Duo CPU version, upgraded from a hard drive to a 240GB Solid State Drive. It also has been upgraded to MacOS ...",City of Toronto,< 2 hours ago,2020-10-07 17:41:51.410340
1528469665,/v-laptops/city-of-toronto/dell-xps-13-laptop-brand-new/1528469665,1199.0,DELL XPS 13 laptop (Brand NEW),,"This is brand new pc in sealed Retail box with menu, Dell ONE YEAR warranty. E-mail: danforthcomputer@hotmail.com Computer store : 770 danforth ave. M4J 1L5 416-465-3235 Our business hours are Monday ...",City of Toronto,< 2 hours ago,2020-10-07 17:41:51.411077
1528469625,/v-laptops/city-of-toronto/dell-latitude-business-class-laptop/1528469625,500.0,Dell Latitude - Business class Laptop,,"Dell Latitude 7290 - Intel i5 - 7300U CPU 2.6GHZ 16 Gb DDR4 2400 mhz Super Thin 12.5"" laptop - Very Compact Intel HD Graphic 620 256GB Sata M2 SSD Drive Intel Wireless 9260 160 MHZ with Bluetooth 5.0 ...",City of Toronto,< 2 hours ago,2020-10-07 17:41:51.411585
1528466804,/v-laptops/city-of-toronto/asus-rog-strix-iii-g-17-3-gaming-laptop/1528466804,1450.0,ASUS ROG Strix III G 17.3” Gaming Laptop,,"Like New laptop, mint condition. I bought this laptop new from bestbuy on April 25, 2020. Now that I started work again I don’t use it at all. I have a Bluetooth mouse that I don’t mind giving with. ...",City of Toronto,< 2 hours ago,2020-10-07 17:41:51.412080
1528466033,/v-laptops/city-of-toronto/macbook-pro-13-good-working-condition-for-use-upgrade-or-parts/1528466033,145.0,"Macbook Pro 13,Good Working Condition For Use,Upgrade or Parts!!",,"Macbook Pro 13 , 2009 Model , In Good Working Condition, No specific Issue , Battery lasts around 2 hours . High Sierra installed , 160gb Hard drive , 2Gb Ram . You can use it or upgrade it or use ...",City of Toronto,< 2 hours ago,2020-10-07 17:41:51.412574
1528462521,/v-laptops/city-of-toronto/toshiba-laptop-with-new-battery/1528462521,350.0,Toshiba Laptop with new battery,,"Spec Tecra R850 -15.6 inch -Intel Core i7-2520 CPU, which has two cores, Hyper-Threading and a frequency of 2.5GHz. You also get 4GB of DDR3 SDRAM and 500GB Hard drive -Windows 10 installed ...",City of Toronto,< 2 hours ago,2020-10-07 17:41:51.413150
1528462518,/v-laptops/city-of-toronto/apple-macbook-air-13-inc-2015/1528462518,600.0,"Apple MacBook Air 13-inc, 2015",,"MacBook Air (13-inch, Early 2015) Processor: 1.6 GHz Dual-Core Intel Core i5 Memory: 8 GB 1600 MHz DDR3 Graphics card: Intel HD Graphics 6000 1536 MB More details here: ...",City of Toronto,< 2 hours ago,2020-10-07 17:41:51.413651
1528461233,/v-laptops/city-of-toronto/surfacebook-with-i5-nvidia-gpu-and-surface-pen/1528461233,780.0,"Surfacebook with i5, Nvidia GPU, and Surface Pen",,"SPECS - Free Surface Pen included! Processor: 2.4GHz Intel Core i5 Graphics: Nvidia GeForce graphics (1GB GDDR5 high-speed memory) RAM: 8GB Screen: 13.5-inch, 3,000 x 2,000 (267 ppi) PixelSense ...",City of Toronto,< 3 hours ago,2020-10-07 17:41:51.414141
1528460979,/v-laptops/city-of-toronto/razor-laptop-brand-new-sealed/1528460979,2200.0,Razor laptop brand new sealed,,Brand new sealed razor laptop 4K with touch screen Price is firm no negotiable Pick up only,City of Toronto,< 3 hours ago,2020-10-07 17:41:51.414627
1528459954,/v-laptops/city-of-toronto/macbook-pro/1528459954,1600.0,Macbook Pro,,"15.4"" Macbook Pro (Mid-2015) for sale. $1600 OBO - Storage: 500 GB SSD - Processor: 2.5 GHz Quad-Core Intel Core i7 - Memory: 16 GB 1600 MHz DDR3 - Graphics: Intel Iris Pro 1536 MB Computer is in ...",City of Toronto,< 3 hours ago,2020-10-07 17:41:51.415115
1528459885,/v-laptops/city-of-toronto/macbook-computer-repair/1528459885,60.0,Macbook & Computer Repair,,"We specialize in repairing all kinds of problems and issues with Macbook and Laptop . We repair and resolve both hardware & software issues , anything from broken LCD screen, water damage , ...",City of Toronto,< 3 hours ago,2020-10-07 17:41:51.415614
1528459662,/v-laptops/city-of-toronto/apple-macbook-air-13-i5-3427u-1-8ghz-8gb-240gb-a1466-2012/1528459662,649.99,"Apple MacBook Air   13"" i5-3427U 1.8GHz, 8GB, 240GB, A1466, 2012",,"MacBook Air 13.3"" laptop with the followin g specifications: Processor-Intel i5-3427U 1.8GHz Ram-8GB 1600MHz DDR3L Storage-240GB SSD Graphics-Intel HD 4000 Year-2012 OS X-Catalina Model No.-A1466 ...",City of Toronto,< 3 hours ago,2020-10-07 17:41:51.416158
1528459437,/v-laptops/city-of-toronto/back-to-school-sale-50-off-laptops-all-in-one-computers-desktop/1528459437,99.0,"BACK TO SCHOOL sale 50% off LAPTOPS,ALL IN ONE COMPUTERs,DESKTOP",,"BACK TO SCHOOL sale 50% off LAPTOPS,ALL IN ONE COMPUTERs,DESKTOPs,IMACs,MAC MINIs *********BACK TO SCHOOL SALE ON NOW*********** LAPTOPS,ALL IN ONE COMPUTERs,DESKTOPs,IMACs,MAC MINIs BLOW OUT SALE UP ...",City of Toronto,< 3 hours ago,2020-10-07 17:41:51.416854
1528459307,/v-laptops/city-of-toronto/2017-macbook-pro-13-touchbar-immaculate-condition/1528459307,1375.0,"2017 MacBook Pro 13"" Touchbar Immaculate Condition",,"Selling my 2017 MacBook Pro 13”. In immaculate condition, battery was just replaced so the keyboard, speakers touchpad and touchbar are all brand new. Comes with original charger •Price is firm, ...",City of Toronto,< 3 hours ago,2020-10-07 17:41:51.417369
1528459270,/v-laptops/city-of-toronto/surface-laptop-13-5-i7-7660u-2-5ghz-16gb-512gb-ssd-win-10p/1528459270,1099.99,"Surface Laptop 13.5""   i7-7660U 2.5GHz, 16GB, 512GB SSD, Win 10P",,"Surface laptop complements your personal style with a luxurious Alcantara material-covered keyboard. Complement your style with rich, tone-on-tone colour combin ations and a clean, elegant design ...",City of Toronto,< 3 hours ago,2020-10-07 17:41:51.417870
1528459087,/v-laptops/city-of-toronto/dell-xps-15-9500-i7-10750h-2-6ghz-32gb-512gb-uhd-touch-win10/1528459087,2199.99,"Dell XPS 15 9500 i7-10750H 2.6GHz, 32GB, 512GB, UHD+ Touch Win10",,"Dell XPS 15 9500 New/Open Box Laptop with the following specifications: Processor-Intel i7-10750H 2.60GHz Ram-32GB Hard Drive-512GB NVMe SSD Graphics Card-GeForce GTX 1650Ti Display-15.6"" UHD+ ...",City of Toronto,< 3 hours ago,2020-10-07 17:41:51.418355
1521772705,/v-laptops/city-of-toronto/x1-carbon-6th-gen-1tb-ssd-16g-memory/1521772705,1200.0,X1 carbon 6th gen 1TB ssd + 16G Memory,,No warranty left. One corner of the shell with visible scratch. but laptop is functioning well. Machine Type Model: 20KH002HUS Processor: 1x Intel Core i7-8650U Processor(Core i7-8650U) Memory: 1x ...,City of Toronto,< 5 minutes ago,2020-10-07 17:41:54.412230
1528482861,/v-laptops/city-of-toronto/eurocom-m5-pro-15-6-gaming-laptop/1528482861,800.0,"Eurocom M5 Pro 15.6"" Gaming Laptop",,"I'm selling my Eurocom M5 Pro 15.6"" gaming laptop: Intel Core i7 4720HQ @ 2.60GHz 16GB Dual-Channel DDR3 3GB NVIDIA GeForce GTX 970M dedicated graphics 15.6-inch 2K FHD 1920x1080; IPS MATTE LCD ...",City of Toronto,< 11 minutes ago,2020-10-07 17:41:54.412726
1528480200,/v-laptops/city-of-toronto/huge-1tb-ssd-storage-i9-macbook-pro-16-brand-new/1528480200,3199.0,Huge 1TB SSD Storage i9 Macbook Pro 16 Brand New,,"Up for sale is an Apple Macbook Pro 16"" Brand New Seal Box ☆ Highend Spec i9 8-core processor ☆ Huge 1TB SSD Storage ☆ 16GB of Memory ☆ The most recent 2019 model ☆ AMD 5500M Graphic Pro ☆ Apple ...",City of Toronto,< 22 minutes ago,2020-10-07 17:41:54.413452
1528478955,/v-laptops/city-of-toronto/brand-new-hp-elitebook-1040-g3/1528478955,1000.0,Brand new HP Elitebook 1040 G3,,"Brand new HP Elitebook 1040 G3, never opened, original seal. Make me a reasonable offer. i7 6600 cpu 2.6GHz 16GB RAM 256 SSD Same as the one in the link below, except mine is 256 SSD, not 512. ...",City of Toronto,< 28 minutes ago,2020-10-07 17:41:54.414046
1528476776,/v-laptops/city-of-toronto/msi-gf65-thin-9sexr-249/1528476776,1090.0,MSI  GF65 Thin 9SEXR -249,,"About 7 months old, like new condition, everything except camera works well. Didn't use camera before. Don't know why it doesn't work. Compact, light yet very powerful gaming laptop. Intel Cores ...",City of Toronto,< 39 minutes ago,2020-10-07 17:41:54.414511
1528476643,/v-laptops/city-of-toronto/sale-for-macbook-pro-13-retina-2014-3-ghz-i7/1528476643,1200.0,"SALE FOR MACBOOK PRO 13 RETINA 2014,3 Ghz i7",,"SALE FOR MACBOOK PRO 13 RETINA 2014,3 Ghz Quad-core intel core i7 ,16GB Mem,512 GB SSD Perfect working condition A1502 ,Mid 2014 Cosmetic condition 9/10 , Battery cycle only 468. 3.00 Ghz Quad-core ...",City of Toronto,< 40 minutes ago,2020-10-07 17:41:54.415000
1528475036,/v-laptops/city-of-toronto/lenovo-t430-i5-8-gb-250-gb-ssd/1528475036,230.0,Lenovo T430 i5 - 8 GB + 250 GB SSD,,"For sale Lenovo T430 Laptop. Intel Core i5-3320M CPU @ 2.60 GHz. 3rd GEN. 8 GB RAM. 250 GB SSD Hard Drive. Built in camera. 14"" screen. 1600 x 900 Resolution. Windows 10 Pro fresh installed. Genuine ...",City of Toronto,< 50 minutes ago,2020-10-07 17:41:54.415507
1528474777,/v-laptops/city-of-toronto/lenovo-t440s/1528474777,450.0,Lenovo T440s,,"Lenovo T440s, mint condition. No warranty. Only laptop and charger. Intel Core i7-4600U CPU@2.10GHz 2.69GHz RAM 8GB Storage 256GB Windows 10 Pro Display 14 inch 1920*1080",City of Toronto,< 51 minutes ago,2020-10-07 17:41:54.415994
1528473392,/v-laptops/city-of-toronto/lenovo-thinkpad-t540p-business-laptop-w-fingerprint-reader/1528473392,250.0,Lenovo Thinkpad T540p Business Laptop w Fingerprint Reader,,"Very clean, excellent condition. Windows 10 Pro installed. Excellent battery life 5+ hours. Specifications: Intel core i3 4GB DDR3 Intel HD graphics 256GB SSD Original Charger",City of Toronto,< 59 minutes ago,2020-10-07 17:41:54.416515
1528471908,/v-laptops/city-of-toronto/lenovo-thinkpad-x1-extreme-2nd-gen-15-6/1528471908,2700.0,Lenovo Thinkpad X1 Extreme 2nd Gen 15.6,,"Mint condition lightly used Lenovo X1 Extreme. Windows 10 pro 64 Core i9, 1TB storage, 32GB Ram, finger print reader. Working amazing. Comes with charger.",City of Toronto,< 2 hours ago,2020-10-07 17:41:54.417010
1528471593,/v-laptops/city-of-toronto/macbook-pro-13-2012-i5-4gb-240gb-ssd-macos-catalina/1528471593,550.0,"Macbook Pro 13"" 2012 - i5, 4GB, 240GB SSD, MacOS Catalina",,"For sale is a fully working, good condition Macbook Pro 2012 13"" laptop. This has been upgraded to have a solid state drive, so with the Intel Core i5 processor (2.5GHz clock speed), it is very fast. ...",City of Toronto,< 2 hours ago,2020-10-07 17:41:54.417525
1528471581,/v-laptops/city-of-toronto/acer-aspire-5534-laptop-webcam-4-gb-ram-80-hdd-win-10-ready/1528471581,135.0,ACER ASPIRE 5534 LAPTOP-WEBCAM-4 GB RAM-80 HDD-WIN 10-READY,,ACER ASPIRE 5534 LAPTOP FOR SALE... SPECS: WEBCAM 4 GB RAM 80 HDD DVD-RW OFFICE 2007 CHARGER BATTERY GOOD NEW INSTALLED WIN 10/ACTIVATED LAPTOP IS READY TO USE... PRICE $135 FIRM CALL OR TEXT FOR ...,City of Toronto,< 2 hours ago,2020-10-07 17:41:54.418020
1528471496,/v-laptops/city-of-toronto/macbook-2015-12-inch/1528471496,900.0,MacBook 2015 12 inch -,,"MacBook 2015 250 gb Great condition Comes with clear case Battery lasts about 4 hours, not at 100% Selling because I have a MacBook Pro now and do not need this one anymore Great for students (very ...",City of Toronto,< 2 hours ago,2020-10-07 17:41:54.418505
1528470350,/v-laptops/city-of-toronto/macbook-pro-2010-13-fast-and-cheap-2-4ghz-4gb-240gb-ssd/1528470350,420.0,"Macbook Pro 2010 13"" - FAST AND CHEAP 2.4Ghz, 4GB, 240GB SSD",,"We have a Macbook Pro 2010 13"" laptop for sale. It is the 2.4GHz Intel Core 2 Duo CPU version, coming upgraded from a harddrive to a 240GB SSD (Solid State Drive). It is very quick, running MacOS ...",City of Toronto,< 2 hours ago,2020-10-07 17:41:54.418988
1528470274,/v-laptops/city-of-toronto/macbook-pro-2009-13-intel-2-53ghz-4gb-240gb-ssd-cheap-fast/1528470274,400.0,"Macbook Pro 2009 13"" - Intel 2.53Ghz, 4GB, 240GB SSD, CHEAP FAST",,"For sale is a great condition Macbook Pro 2009 13"" laptop It is the 2.53GHz Intel Core 2 Duo CPU version, comes upgraded from a hard drive to a 240GB Solid State Drive, making it very quick. It is ...",City of Toronto,< 2 hours ago,2020-10-07 17:41:54.419483
1528470063,/v-laptops/city-of-toronto/cheap-fast-macbook-pro-2009-13-2-26ghz-4gb-240gb-ssd/1528470063,350.0,"Cheap Fast Macbook Pro 2009 13"" - 2.26Ghz + 4GB + 240GB SSD",,"This is a great condition Macbook Pro 2009 13"" laptop. It is the 2.26GHz Intel Core 2 Duo CPU version, upgraded from a hard drive to a 240GB Solid State Drive. It also has been upgraded to MacOS ...",City of Toronto,< 2 hours ago,2020-10-07 17:41:54.419968
1528469665,/v-laptops/city-of-toronto/dell-xps-13-laptop-brand-new/1528469665,1199.0,DELL XPS 13 laptop (Brand NEW),,"This is brand new pc in sealed Retail box with menu, Dell ONE YEAR warranty. E-mail: danforthcomputer@hotmail.com Computer store : 770 danforth ave. M4J 1L5 416-465-3235 Our business hours are Monday ...",City of Toronto,< 2 hours ago,2020-10-07 17:41:54.420656
1528469625,/v-laptops/city-of-toronto/dell-latitude-business-class-laptop/1528469625,500.0,Dell Latitude - Business class Laptop,,"Dell Latitude 7290 - Intel i5 - 7300U CPU 2.6GHZ 16 Gb DDR4 2400 mhz Super Thin 12.5"" laptop - Very Compact Intel HD Graphic 620 256GB Sata M2 SSD Drive Intel Wireless 9260 160 MHZ with Bluetooth 5.0 ...",City of Toronto,< 2 hours ago,2020-10-07 17:41:54.421141
1528466804,/v-laptops/city-of-toronto/asus-rog-strix-iii-g-17-3-gaming-laptop/1528466804,1450.0,ASUS ROG Strix III G 17.3” Gaming Laptop,,"Like New laptop, mint condition. I bought this laptop new from bestbuy on April 25, 2020. Now that I started work again I don’t use it at all. I have a Bluetooth mouse that I don’t mind giving with. ...",City of Toronto,< 2 hours ago,2020-10-07 17:41:54.421624
1528466033,/v-laptops/city-of-toronto/macbook-pro-13-good-working-condition-for-use-upgrade-or-parts/1528466033,145.0,"Macbook Pro 13,Good Working Condition For Use,Upgrade or Parts!!",,"Macbook Pro 13 , 2009 Model , In Good Working Condition, No specific Issue , Battery lasts around 2 hours . High Sierra installed , 160gb Hard drive , 2Gb Ram . You can use it or upgrade it or use ...",City of Toronto,< 2 hours ago,2020-10-07 17:41:54.422106
1528462521,/v-laptops/city-of-toronto/toshiba-laptop-with-new-battery/1528462521,350.0,Toshiba Laptop with new battery,,"Spec Tecra R850 -15.6 inch -Intel Core i7-2520 CPU, which has two cores, Hyper-Threading and a frequency of 2.5GHz. You also get 4GB of DDR3 SDRAM and 500GB Hard drive -Windows 10 installed ...",City of Toronto,< 2 hours ago,2020-10-07 17:41:54.422588
1528462518,/v-laptops/city-of-toronto/apple-macbook-air-13-inc-2015/1528462518,600.0,"Apple MacBook Air 13-inc, 2015",,"MacBook Air (13-inch, Early 2015) Processor: 1.6 GHz Dual-Core Intel Core i5 Memory: 8 GB 1600 MHz DDR3 Graphics card: Intel HD Graphics 6000 1536 MB More details here: ...",City of Toronto,< 2 hours ago,2020-10-07 17:41:54.423066
1528461233,/v-laptops/city-of-toronto/surfacebook-with-i5-nvidia-gpu-and-surface-pen/1528461233,780.0,"Surfacebook with i5, Nvidia GPU, and Surface Pen",,"SPECS - Free Surface Pen included! Processor: 2.4GHz Intel Core i5 Graphics: Nvidia GeForce graphics (1GB GDDR5 high-speed memory) RAM: 8GB Screen: 13.5-inch, 3,000 x 2,000 (267 ppi) PixelSense ...",City of Toronto,< 3 hours ago,2020-10-07 17:41:54.423554
1528460979,/v-laptops/city-of-toronto/razor-laptop-brand-new-sealed/1528460979,2200.0,Razor laptop brand new sealed,,Brand new sealed razor laptop 4K with touch screen Price is firm no negotiable Pick up only,City of Toronto,< 3 hours ago,2020-10-07 17:41:54.424034
1528459954,/v-laptops/city-of-toronto/macbook-pro/1528459954,1600.0,Macbook Pro,,"15.4"" Macbook Pro (Mid-2015) for sale. $1600 OBO - Storage: 500 GB SSD - Processor: 2.5 GHz Quad-Core Intel Core i7 - Memory: 16 GB 1600 MHz DDR3 - Graphics: Intel Iris Pro 1536 MB Computer is in ...",City of Toronto,< 3 hours ago,2020-10-07 17:41:54.424516
1528459885,/v-laptops/city-of-toronto/macbook-computer-repair/1528459885,60.0,Macbook & Computer Repair,,"We specialize in repairing all kinds of problems and issues with Macbook and Laptop . We repair and resolve both hardware & software issues , anything from broken LCD screen, water damage , ...",City of Toronto,< 3 hours ago,2020-10-07 17:41:54.425021
1528459662,/v-laptops/city-of-toronto/apple-macbook-air-13-i5-3427u-1-8ghz-8gb-240gb-a1466-2012/1528459662,649.99,"Apple MacBook Air   13"" i5-3427U 1.8GHz, 8GB, 240GB, A1466, 2012",,"MacBook Air 13.3"" laptop with the followin g specifications: Processor-Intel i5-3427U 1.8GHz Ram-8GB 1600MHz DDR3L Storage-240GB SSD Graphics-Intel HD 4000 Year-2012 OS X-Catalina Model No.-A1466 ...",City of Toronto,< 3 hours ago,2020-10-07 17:41:54.425517
1528459437,/v-laptops/city-of-toronto/back-to-school-sale-50-off-laptops-all-in-one-computers-desktop/1528459437,99.0,"BACK TO SCHOOL sale 50% off LAPTOPS,ALL IN ONE COMPUTERs,DESKTOP",,"BACK TO SCHOOL sale 50% off LAPTOPS,ALL IN ONE COMPUTERs,DESKTOPs,IMACs,MAC MINIs *********BACK TO SCHOOL SALE ON NOW*********** LAPTOPS,ALL IN ONE COMPUTERs,DESKTOPs,IMACs,MAC MINIs BLOW OUT SALE UP ...",City of Toronto,< 3 hours ago,2020-10-07 17:41:54.426193
1528459307,/v-laptops/city-of-toronto/2017-macbook-pro-13-touchbar-immaculate-condition/1528459307,1375.0,"2017 MacBook Pro 13"" Touchbar Immaculate Condition",,"Selling my 2017 MacBook Pro 13”. In immaculate condition, battery was just replaced so the keyboard, speakers touchpad and touchbar are all brand new. Comes with original charger •Price is firm, ...",City of Toronto,< 3 hours ago,2020-10-07 17:41:54.426697
1528459270,/v-laptops/city-of-toronto/surface-laptop-13-5-i7-7660u-2-5ghz-16gb-512gb-ssd-win-10p/1528459270,1099.99,"Surface Laptop 13.5""   i7-7660U 2.5GHz, 16GB, 512GB SSD, Win 10P",,"Surface laptop complements your personal style with a luxurious Alcantara material-covered keyboard. Complement your style with rich, tone-on-tone colour combin ations and a clean, elegant design ...",City of Toronto,< 3 hours ago,2020-10-07 17:41:54.427186
1528459087,/v-laptops/city-of-toronto/dell-xps-15-9500-i7-10750h-2-6ghz-32gb-512gb-uhd-touch-win10/1528459087,2199.99,"Dell XPS 15 9500 i7-10750H 2.6GHz, 32GB, 512GB, UHD+ Touch Win10",,"Dell XPS 15 9500 New/Open Box Laptop with the following specifications: Processor-Intel i7-10750H 2.60GHz Ram-32GB Hard Drive-512GB NVMe SSD Graphics Card-GeForce GTX 1650Ti Display-15.6"" UHD+ ...",City of Toronto,< 3 hours ago,2020-10-07 17:41:54.427718
1528459071,/v-laptops/city-of-toronto/macbook-pro-retina-2015-free-stickers/1528459071,700.0,MacBook Pro Retina 2015 (free stickers),,2015 13 inch MacBook Pro in 9/10 condition. Comes with box and all the original accessories. The power adapter is a little rough but it works. If you want the stickers you can have them or I will ...,City of Toronto,< 3 hours ago,2020-10-07 17:42:03.162695
1528458627,/v-laptops/city-of-toronto/2017-macbook-air-13-manufactured-in-2019/1528458627,890.0,2017 MacBook Air 13” Manufactured in 2019,,"Selling a 2017(Manufactured in 2019) MacBook Air 13”. In amazing overall condition. Cycle count is only at 114. Comes with original charger •Price is firm, don’t waste your time sending offers• ...",City of Toronto,< 3 hours ago,2020-10-07 17:42:03.163192
1528456504,/v-laptops/city-of-toronto/apple-macbook-air-3inch-i5-8gb-256gb-ssd-for-sale-799-1-year-wa/1528456504,799.0,Apple MacBook AIR 3inch i5 8gb 256GB SSD FOR SALE $799 1 YEAR WA,,Apple MacBook AIR 3inch i5 8gb 256GB SSD FOR SALE $799 1 YEAR WARRANTY Apple MacBook AIR 13inch i5 8gb 256gb ssd mac os catalina fully loaded with all softwares 1 YEAR WARRANTY LAPTOPS WHOLE SALE ...,City of Toronto,< 3 hours ago,2020-10-07 17:42:03.163874
