,url,price,title,distance,description,location,time_offset,retreived
1527310332,/v-mountain-bike/city-of-toronto/double-shock-aluminum-mountain-bike-medium-size/1527310332,260.0,Double Shock Aluminum Mountain Bike/Medium size,,"Dual Shock Suspension Mountain Bike, Diamondback19'aluminum frame for 5'6""~5'10"", Shimano 21speeds, 26'aluminum wheels, Used, Good working conditions, Great for cheaper city commuting or exercise, ...",City of Toronto,01/10/2020,2020-10-07 00:28:08.940581
1527310120,/v-mountain-bike/city-of-toronto/ladies-mountain-bike-18-speed/1527310120,80.0,Ladies mountain bike - 18 speed,,Good condition with recent tune-up 26 inch wheels,City of Toronto,01/10/2020,2020-10-07 00:28:08.941078
1516508827,/v-mountain-bike/city-of-toronto/jamis-roughneck/1516508827,1199.0,Jamis Roughneck,,Brand new Jamis Roughneck small fat tire mountain bicycle- One left brand new in box with packaging- takes 30 min to put together. rb@rbinc-sports.com gyms are closed time to get outside 416 2192165. ...,City of Toronto,01/10/2020,2020-10-07 00:28:08.941573
1516506162,/v-mountain-bike/city-of-toronto/bad-rad-off-road-electric-mountain-bicycle/1516506162,1399.0,Bad Rad Off Road Electric Mountain Bicycle,,Adventure Cycle presents: Baad Rad Fat Bike Electric $1399 will take it. 153 Bridgeland ave unit 10 we are open by appointment only! 4162192165 rb@rbinc-sports.com Regularly $1999! We are open one ...,City of Toronto,01/10/2020,2020-10-07 00:28:08.942068
1527305581,/v-mountain-bike/city-of-toronto/mens-bike/1527305581,75.0,Men's Bike,,18 speed triumph challenger bike 26 inch tires Works well Medium Frame,City of Toronto,01/10/2020,2020-10-07 00:28:08.942564
1527298751,/v-mountain-bike/city-of-toronto/sporttek-bike-like-new/1527298751,140.0,Sporttek bike like new,,"24 "" wheels like new running condition check and take",City of Toronto,01/10/2020,2020-10-07 00:28:08.943058
1527291947,/v-mountain-bike/city-of-toronto/kona-honzo-downhill-mountain-bike-for-competition-use/1527291947,2475.0,KONA honzo downhill mountain bike for competition use,,Sticker says “for competition use only” This is one serious bike. The only better bike in the store I was told was this in carbon fibre for an extra 5K. Adjustable hydraulic seat that helps allow you ...,City of Toronto,01/10/2020,2020-10-07 00:28:08.943556
1527286068,/v-mountain-bike/city-of-toronto/bike-for-sale/1527286068,200.0,Bike for sale,,"26""wheel , including all lights furnitures , bell and new helmet.",City of Toronto,01/10/2020,2020-10-07 00:28:08.944054
1527280497,/v-mountain-bike/city-of-toronto/old-rayleigh-moutain-bike/1527280497,30.0,Old Rayleigh moutain bike,,"Still rides, needs work $30 or best offer Pick up or delivery to any subway stop for $10 more.",City of Toronto,01/10/2020,2020-10-07 00:28:08.944545
1527274547,/v-mountain-bike/city-of-toronto/big-ripper-se-bikes-custom/1527274547,650.0,Big Ripper SE Bikes custom,,Big Ripper From SE Bikes. Bought the bike in NYC and brought it here. Added front brakes front fork WTB front wheel upgraded the crank to Stoln cranks they are bulletproof. Much better setup than ...,City of Toronto,01/10/2020,2020-10-07 00:28:08.945042
1527268982,/v-mountain-bike/city-of-toronto/26-free-spirit-bike-bicycle-for-sale/1527268982,145.0,26” Free Spirit bike / bicycle for sale,,26” Free Spirit bike / bicycle for sale,City of Toronto,01/10/2020,2020-10-07 00:28:08.945541
1527262561,/v-mountain-bike/city-of-toronto/3-spoke-folding-bicycle/1527262561,400.0,⭐3 Spoke Folding Bicycle,,"Bicycles Available in White, Red and Yellow Bike cost: Assembled and tuned bike cost 450. Bike not assembled and in box cost 400. Features: Unisex foldable folding mountain bike frame can fit into ...",City of Toronto,01/10/2020,2020-10-07 00:28:08.946038
1527255476,/v-mountain-bike/city-of-toronto/assorted-bikes-ccm-supercycle/1527255476,300.0,Assorted bikes CCM/ Supercycle,,"CCM Slope Men's Hardtail Mountain Bike, 26-in $370 https://www.canadiantire.ca/en/pdp/ccm-slope-men-s-hardtail-mountain-bike-26-in-0711096p.html CCM Slope Women's Hardtail Mountain Bike, 26-in $370 ...",City of Toronto,01/10/2020,2020-10-07 00:28:08.946530
1527248659,/v-mountain-bike/city-of-toronto/supercycle-bike/1527248659,200.0,Supercycle bike,,"Supercycle 1800 Men's Rigid Mountain Bike with an 18"" (45.7 cm) high-tensile steel frame 26"" (66 cm) wheels 18-Speed Throwing in a Bike & Motorcycle Phone Mount/360°Rotation Silicone Bicycle Phone ...",City of Toronto,01/10/2020,2020-10-07 00:28:08.947039
1527247217,/v-mountain-bike/city-of-toronto/supercycle-sc1800-bike/1527247217,80.0,Supercycle SC1800 bike,,"Supercycle SC1800 bike. Posted in bikes, mountain in City of Toronto. October 1, 2020",City of Toronto,01/10/2020,2020-10-07 00:28:08.947535
1527240312,/v-mountain-bike/city-of-toronto/2021-giant-trance-2-x-size-large/1527240312,5000.0,2021 Giant Trance 2 X - size large,,Brand new never used. Size large $5000 Trance X 29 2 (2021) | Men Trail bike | Giant Bicycles Canada https://www.giant-bicycles.com/ca/trance-x-29-2-2021,City of Toronto,01/10/2020,2020-10-07 00:28:08.948027
1527237281,/v-mountain-bike/city-of-toronto/giant-yukon-frame/1527237281,100.0,Giant Yukon frame.,,Aluminum. Disc brakes. 17 inch. Wheels and fork also available. $100 b/o,City of Toronto,01/10/2020,2020-10-07 00:28:08.948520
1527234713,/v-mountain-bike/city-of-toronto/ccm-krossport-hybrid-bike/1527234713,260.0,CCM Krossport Hybrid Bike,,Hello! Ready to ride. Selling my CCM Krossport. Mountain-Hybrid. It's got disc brakes and it needs a minor tuneup at local repair shop. All the parts are working very well. This bike is in fact ready ...,City of Toronto,01/10/2020,2020-10-07 00:28:08.949017
1527223587,/v-mountain-bike/city-of-toronto/mountain-bike/1527223587,50.0,Mountain bike,,"Black and Red Movelo 26"" Bike is in good condition but the gear is broken Green and blue Movelo 24"" Bike is in good condition only front break is broken Light blue and white Movelo 20"" Over all good ...",City of Toronto,01/10/2020,2020-10-07 00:28:08.949519
1527218787,/v-mountain-bike/city-of-toronto/kona-mahuna-mtb-hardtail-size-xl/1527218787,1200.0,Kona - Mahuna - MTB Hardtail - Size XL,,Size XL - KONA Mahuna Hardtail Mountain Bike Bought in June - Used 5x on street Link to specs can be found here: https://konaworld.com/mahuna.cfm Please let me know if additional photos are needed.,City of Toronto,01/10/2020,2020-10-07 00:28:08.950017
1527214959,/v-mountain-bike/city-of-toronto/norco-mountain-bike-24-wheels-suits-4-6-5/1527214959,95.0,Norco mountain bike - 24” wheels - suits 4’6”-5’,,Norco mountain bike - 24” wheels - suits 4’6”-5’ - good condition!,City of Toronto,01/10/2020,2020-10-07 00:28:08.950513
1527212028,/v-mountain-bike/city-of-toronto/mountain-bike/1527212028,120.0,Mountain bike,,24 inch wheels medium size aluminum light weight bike in good condition for sale . Comfy bigger seat with spring and side mirror to look back . It has gears .,City of Toronto,01/10/2020,2020-10-07 00:28:08.951015
1527176401,/v-mountain-bike/city-of-toronto/folding-bike-26-inches-18-21-speed-disk-brake/1527176401,450.0,FOLDING BIKE 26 inches 18/21 Speed disk brake,,"Wheel Size:26"" Frame Material:Aluminum Fork Material:Steel Rim Material:Aluminum Alloy Gears:21 Speed Foldable:Yes Application:Racing Net Weight:19KGS Model Number:26"" Gross Weight:21KGS Frame:Steel ...",City of Toronto,30/09/2020,2020-10-07 00:28:08.951514
1527176091,/v-mountain-bike/city-of-toronto/bike-for-sale/1527176091,150.0,Bike for sale,,Very good condition size medium/large 150$ .,City of Toronto,30/09/2020,2020-10-07 00:28:08.952010
1527173477,/v-mountain-bike/city-of-toronto/2016-gt-aggressor-sport-bike/1527173477,300.0,2016 GT Aggressor Sport Bike,,No issues rust shown everything else works perfect 27.5”wheels,City of Toronto,30/09/2020,2020-10-07 00:28:08.952505
1527173054,/v-mountain-bike/city-of-toronto/2016-gt-aggressor-sport/1527173054,300.0,2016 GT Aggressor Sport,,Only rust is shown in picture other then that no issues tires need to be pumped that’s all me and my brothers bikes 27.5” wheels,City of Toronto,30/09/2020,2020-10-07 00:28:08.952999
1527161445,/v-mountain-bike/city-of-toronto/supercycle-bike/1527161445,150.0,Supercycle bike,,Dual shock ready to ride,City of Toronto,30/09/2020,2020-10-07 00:28:08.953493
1527160188,/v-mountain-bike/city-of-toronto/26-mountain-bike/1527160188,85.0,"26"" mountain bike",,"26"" mountain bike in great condition.",City of Toronto,30/09/2020,2020-10-07 00:28:08.953989
1527151529,/v-mountain-bike/city-of-toronto/full-suspension-mountain-bike/1527151529,250.0,Full suspension mountain bike,,"Durable bike in good condition, ready to ride... price is negotiable",City of Toronto,30/09/2020,2020-10-07 00:28:08.954482
1527148785,/v-mountain-bike/city-of-toronto/mountain-bike-18-men-s-260-pickering/1527148785,260.0,MOUNTAIN BIKE 18” Men’s $260 - Pickering,,"NORTHLAND MTB MERIDIAN BIKE 21 speed mountain bike men’s or women’s 18 inch medium size frame, bullhorn bar ends, bottle holder S9C seat, gears and brakes work well, Located in Pickering for pick up ...",City of Toronto,30/09/2020,2020-10-07 00:28:08.954984
1527148150,/v-mountain-bike/city-of-toronto/bike-ccm/1527148150,100.0,Bike CCM,,Selling as is. Works great!,City of Toronto,30/09/2020,2020-10-07 00:28:12.808611
1527143211,/v-mountain-bike/city-of-toronto/2020-santa-cruz-5010/1527143211,8300.0,2020 Santa Cruz 5010,,Medium 2020 Santa Cruz 5010 bought June of this year. Receipt will be provided as proof of purchase. Absolutely no scratches as it was wrapped since month 1 . Bike is a 27.5 + and has been heavily ...,City of Toronto,30/09/2020,2020-10-07 00:28:12.809112
1527143163,/v-mountain-bike/city-of-toronto/mountain-bike/1527143163,100.0,Mountain Bike,,I’m selling my bike. It’s in really good shape. It might need to get the breaks tightened but other than that it’s in pretty good condition. Just bring cash and take it with you. The price is not ...,City of Toronto,30/09/2020,2020-10-07 00:28:12.809605
1527137216,/v-mountain-bike/city-of-toronto/bike-needs-brakes/1527137216,30.0,Bike - needs brakes,,Fully functional bike but needs brakes installed and tires pumped. Selling as is.,City of Toronto,30/09/2020,2020-10-07 00:28:12.810100
1516247919,/v-mountain-bike/city-of-toronto/brand-new-the-bike-club-red/1516247919,20.0,Brand new The Bike Club - red,,For sale is a Brand new red The Bike Club - sealed The ant-theft device for bicycles. Fully adjustable to fit all types of bicycles. Comes with 3 weather resistant keys Made from case hardened steel ...,City of Toronto,30/09/2020,2020-10-07 00:28:12.810603
1527104543,/v-mountain-bike/city-of-toronto/mountain-bike-m/1527104543,70.0,Mountain bike M,,5’8 and under Everything in good working condition. $70 obo,City of Toronto,30/09/2020,2020-10-07 00:28:12.811097
1527104367,/v-mountain-bike/city-of-toronto/mountain-bike-adult/1527104367,120.0,Mountain bike adult,,"Tuned, optimized and ready to ride. $120 obo",City of Toronto,30/09/2020,2020-10-07 00:28:12.811584
1527088698,/v-mountain-bike/city-of-toronto/26-movelo-mountain-bike-send-offers/1527088698,200.0,26” Movelo Mountain Bike SEND OFFERS,,"Text 6478778527 for fast response In new condition Located in Scarborough Black, Red, and Blue Stripes all throughout frame • Designed for a rider height greater than 152 cm (60 in); ages 13 and ...",City of Toronto,30/09/2020,2020-10-07 00:28:12.812075
1527088342,/v-mountain-bike/city-of-toronto/26-movelo-mountain-bike-send-offers/1527088342,200.0,26” Movelo Mountain Bike  SEND OFFERS,,"Text 6478778527 for fast response Selling for $200 In new condition Located in Scarborough Metallic purple with sky blue streaks, the Movelo Algonquin 26-inch Women's Steel Mountain Bike is ready for ...",City of Toronto,30/09/2020,2020-10-07 00:28:12.812645
1527088164,/v-mountain-bike/city-of-toronto/kona-honzo-for-sale/1527088164,2450.0,KONA honzo for sale,,Selling my KONA honzo 2450 obo,City of Toronto,30/09/2020,2020-10-07 00:28:12.813138
1527079330,/v-mountain-bike/city-of-toronto/supercycle-krossroads-27-30-bicycle/1527079330,185.0,Supercycle Krossroads 27-30” Bicycle,,- One break is broken - Work Perfectly Otherwise,City of Toronto,30/09/2020,2020-10-07 00:28:12.813631
1527054891,/v-mountain-bike/city-of-toronto/raleigh-dual-suspension-mountain-bike/1527054891,200.0,Raleigh dual-suspension mountain bike,,"- tuned front and rear gear derailleurs, shifting smoothly - brand new front and rear 24"" Kenda tubes - brand new handlebar grips - did a deep clean of all components, lubed pivots and chain - ...",City of Toronto,30/09/2020,2020-10-07 00:28:12.814123
1527026761,/v-mountain-bike/city-of-toronto/24-supercycle-burner-bike-bicycle-for-sale/1527026761,150.0,"24"" Supercycle Burner bike / bicycle for sale",,"24"" Supercycle Burner bike / bicycle for sale",City of Toronto,30/09/2020,2020-10-07 00:28:12.814823
1527009438,/v-mountain-bike/city-of-toronto/dj-fat-bike-500w-48v-13ah-power-electric-bicycle-matte-black-l/1527009438,1899.0,"DJ Fat Bike 500W 48V 13Ah Power Electric Bicycle, Matte Black, L",,order online- https://amzn.to/2HBNaaE CERTIFICATION: DJ Bikes proudly being the first bike shop passing the highest safety and quality standard recognized by industries and consumers in both the US ...,City of Toronto,30/09/2020,2020-10-07 00:28:12.815316
1526995033,/v-mountain-bike/city-of-toronto/super-cycle-mountain-bike/1526995033,60.0,Super cycle mountain bike,,mint condition,City of Toronto,29/09/2020,2020-10-07 00:28:12.815803
1526983844,/v-mountain-bike/city-of-toronto/nicasio-marin-bike-accessories-very-good-condition/1526983844,950.0,Nicasio | Marin Bike + Accessories  | VERY GOOD CONDITION,,Nicasio bicycle - Lightly Used Comes with: 52cm Frame Saddle Bag 3-Bike Car Trunk Mount Tire Pump Bike Secure Lock Helmet Premium Disk Brakes Available for Pickup - Toronto Nicasio 2 Bicycle ...,City of Toronto,29/09/2020,2020-10-07 00:28:12.816325
1526973379,/v-mountain-bike/city-of-toronto/light-weight-17-inch-frame-trek-ladies-mountain-bike/1526973379,195.0,Light-weight 17-inch-frame TREK Ladies mountain bike,,This is a ladies TREK bike model 720 Antelope 17-inch Chromoly light-weight frame Suitable for anyone with height between 5’4” and 5’10” Very good condition both cosmetically and functionally ...,City of Toronto,29/09/2020,2020-10-07 00:28:12.816820
1526848811,/v-mountain-bike/city-of-toronto/ccm-mountain-bike/1526848811,100.0,CCM Mountain bike,,Big bike works like brand new. Brakes work tires are new. Suspension you can see as desired whenever you want.,City of Toronto,29/09/2020,2020-10-07 00:28:12.817315
1526970615,/v-mountain-bike/city-of-toronto/hit-a-bump-and-absorb-it-a-comfort-bicycle-listed-trek-giant/1526970615,520.0,"Hit a bump and absorb it, A Comfort bicycle (listed Trek Giant )",,"Read all thoroughly please. Contact me only at below number to arrange for pick up A comfortable, versatile, and easy-to-ride bike Ideal for commutes or just going out for a good workout 1) This bike ...",City of Toronto,29/09/2020,2020-10-07 00:28:12.817808
1526969394,/v-mountain-bike/city-of-toronto/yellow-bike/1526969394,150.0,Yellow bike,,Message if interested,City of Toronto,29/09/2020,2020-10-07 00:28:12.818297
1526969442,/v-mountain-bike/city-of-toronto/amazing-mountain-bike-24-inch-tires-18-inch-frame/1526969442,99.0,Amazing Mountain bike 24 inch tires 18 inch frame,,Look at this Amazing Mountain Bike. 26inch tires 18 inch frame. Everything is working no issues. Pick up only. First come first serve Don't wait too long and then feel sorry. Price is firm. ...,City of Toronto,29/09/2020,2020-10-07 00:28:12.818800
1526968229,/v-mountain-bike/city-of-toronto/ccm-blitz-mountain-bike-for-sale/1526968229,80.0,CCM Blitz mountain bike for sale,,"Bike in good condition; gears, brakes and tires all function well. Just clearing out storage. Asking $80 obo.",City of Toronto,29/09/2020,2020-10-07 00:28:12.819288
1526963980,/v-mountain-bike/city-of-toronto/gt-aggressor/1526963980,550.0,GT aggressor,,Size medium,City of Toronto,29/09/2020,2020-10-07 00:28:12.819777
1526961290,/v-mountain-bike/city-of-toronto/cannondale-rush-full-suspension/1526961290,1600.0,Cannondale RUSH Full suspension,,"Size Medium handle bar is enve, seat post as well, blackspire oval chain ring with a 1x9 deore. Rockshox with remote lock 120mm, rims are 29"" Maddux with racing racing ralph and WTB tubeless ready. ...",City of Toronto,29/09/2020,2020-10-07 00:28:12.820263
1526954013,/v-mountain-bike/city-of-toronto/no-3-pics-1-2-3-comfortable-canada-made-supercycle-bike/1526954013,219.0,"No.3.pics.1,2,3 comfortable Canada made Supercycle bike",,"Please Google search my cellphone 6475694928 for more bikes, if has picture , it is aval. text me for more pics and detail. First coming first service, text me before u coming and make sure your ...",City of Toronto,29/09/2020,2020-10-07 00:28:12.820749
1526950211,/v-mountain-bike/city-of-toronto/kona-fire-mountain-24-speed-mountain-bike/1526950211,549.99,Kona Fire Mountain 24-Speed Mountain Bike,,"- Brand : Kona - Model : Fire Mountain - Colour : silver - Frame Size : 16"" - Frame Material : aluminum - Tire Size : 26"" - Rim Material : alloy - Stand Over Height : 27"" - Speed : 24 - Gear Shifter ...",City of Toronto,29/09/2020,2020-10-07 00:28:12.821239
1526950015,/v-mountain-bike/city-of-toronto/rocky-mountain-fusion-40-bike/1526950015,1400.0,Rocky Mountain fusion 40 bike,,"2020 Rocky Mountain fusion 40 hard tail mountain bike, large frame, with upgraded maxxis aspen ultra light tires, raceface pedals, 3 months old, paid 1400 plus tax, pedals and tires paid 320",City of Toronto,29/09/2020,2020-10-07 00:28:12.821701
1526949185,/v-mountain-bike/city-of-toronto/awesome-devinci-remix-r-1-mountain-bike/1526949185,1288.0,Awesome Devinci Remix R.1 mountain bike,,Shimano Alivio gear system. Kenda Nevegal tires on Alexrims X2100. Shimano Deore brakes. Front Rock Shox J2 fork. Fox 600x2.25 rear suspension.Approx 28 inches top bar rising to 34 inches. GREAT ...,City of Toronto,29/09/2020,2020-10-07 00:28:12.822186
1516037554,/v-mountain-bike/city-of-toronto/phoenix-ditchpig-21-speed-bike-250/1516037554,250.0,Phoenix Ditchpig 21-Speed Bike - $250,,Phoenix Ditchpig 21-Speed Bike - $250 21-Speed Mountain Bike with sleek road tires. Great performance for city riding or on the trails. This quality recreational mountain bike offers efficient riding ...,City of Toronto,29/09/2020,2020-10-07 00:28:12.822677
1526942978,/v-mountain-bike/city-of-toronto/supercycle-bmx-5000-dual-suspension-mountain-bike/1526942978,149.99,Supercycle BMX-5000 Dual Suspension Mountain Bike,,- Supercycle BMX-5000 Mountain Bike - Dual suspension frame - Alloy rims - 21 speed grip shifting system,City of Toronto,29/09/2020,2020-10-07 00:28:12.823166
1526935664,/v-mountain-bike/city-of-toronto/upright-large-tall-26-inch-lady-free-spirit-hybrid-bike-riders-5/1526935664,115.0,UPRIGHT LARGE TALL 26 inch LADY Free Spirit Hybrid Bike riders 5,,"MONTAIN BIKE Medium to Large TALL 26 inch LADY Bike for riders 5'01 to 5'05 Tall Tall *This Bikes: a good compromise between performance,comfort and sturdiness. Rather light weight with medium tires, ...",City of Toronto,29/09/2020,2020-10-07 00:28:12.823655
1526929217,/v-mountain-bike/city-of-toronto/sram-eagle-gx-12-speed-10-52t-cassette/1526929217,275.0,SRAM Eagle GX 12 Speed 10-52T Cassette,,"Brand new takeoff, the new SRAM Eagle GX 10-52t cassette, 520% range, see pics for more",City of Toronto,29/09/2020,2020-10-07 00:28:12.824142
1526920478,/v-mountain-bike/city-of-toronto/sibog-mountain-bike/1526920478,400.0,Sibog mountain bike,,I am selling a sibog mountain bike it all works good pick up only,City of Toronto,29/09/2020,2020-10-07 00:28:12.824630
1526919810,/v-mountain-bike/city-of-toronto/norco-scorcher/1526919810,175.0,Norco Scorcher,,"Looking to sell my Norco scorcher. It's a bit small for me. Would work great for anyone 5'5""-6'4"" Has an extended seat post (15"") and a bottle holder. Feels new was recently serviced has an 18.5"" ...",City of Toronto,29/09/2020,2020-10-07 00:28:12.825117
1526908633,/v-mountain-bike/city-of-toronto/fatbike-21-speed-1790-26-x-4-0/1526908633,1790.0,"Fatbike 21 speed  $1790
26"" x 4.0",,26 x 4.0 21 speed Just selling because i need to fix my car. Bike run perfect. Front suspension works perfect. This bike gets aatention wherever you go. Sad that i need to sell it.,City of Toronto,29/09/2020,2020-10-07 00:28:12.825607
1526898769,/v-mountain-bike/city-of-toronto/ccm-29er-mtb/1526898769,500.0,CCM 29er MTB,,"If the ad is up , then it’s available!!! painted the bike this year , owned it for 2 29 inch wheels , disc brakes , new bars and grip Everything works on the bike. Just selling cause I ride on the ...",City of Toronto,29/09/2020,2020-10-07 00:28:12.826106
1526888904,/v-mountain-bike/city-of-toronto/brand-new-mountain-bike-for-sale-650/1526888904,650.0,BRAND NEW MOUNTAIN BIKE FOR SALE $650,,LOCATED AT NORTH YORK THESE NEW BIKES ARE UP FOR GRABS. ABSOLUTE BEAUTIFUL COLORS AND AMAZING MOUNTAIN BIKES. INBOX ME AHEAD OF TIME BEFORE YOU COME PICK UP THE BIKES. WE ASSEMBLE PER ORDER. NO SAME ...,City of Toronto,29/09/2020,2020-10-07 00:28:12.826608
1526878373,/v-mountain-bike/city-of-toronto/raleigh-ladies-18-speed-mountain-bike/1526878373,200.0,Raleigh Ladies' 18 Speed Mountain Bike,,Ladies Raleigh 18 Speed Summit Mountain bike for sale. This bike has been ridden 3 times since new. Lock and helmet included. A truly great deal.,City of Toronto,29/09/2020,2020-10-07 00:28:12.827095
1526876276,/v-mountain-bike/city-of-toronto/ladies-bike/1526876276,90.0,Ladies bike,,North country ladies bike 17 inch frame Wheel size 26,City of Toronto,29/09/2020,2020-10-07 00:28:12.827584
1526872078,/v-mountain-bike/city-of-toronto/supercycle-xti-2-0/1526872078,80.0,Supercycle xti-2.0,,Bike for sale. Pick up only,City of Toronto,29/09/2020,2020-10-07 00:28:14.420831
1526871980,/v-mountain-bike/city-of-toronto/vintage-mountain-bike/1526871980,1500.0,Vintage Mountain Bike,,Time to Hit the Trails! Vintage Mountain Bike for Sale Thin Blue Line Eldorado Vintage -Shimano Deore XT/XTR Components -Marzocchi Bomber Suspension Forks -Fox Rear Suspension -Sell SanMarco Saddle ...,City of Toronto,29/09/2020,2020-10-07 00:28:14.421335
1526869414,/v-mountain-bike/city-of-toronto/double-shock-aluminum-mountain-bike-small-heights/1526869414,200.0,Double Shock Aluminum Mountain Bike/small heights,,"CCM Double shock suspension mountain bike, 18'aluminum frame for 5ft~5'6"", 24'aluminum wheels, Shimano 24spds, Kick stand, General commuting or exercise bike, area: dupont/ lansdowne",City of Toronto,29/09/2020,2020-10-07 00:28:14.421838
1526869411,/v-mountain-bike/city-of-toronto/double-shock-aluminum-mountain-bike-small-heights/1526869411,200.0,Double Shock Aluminum Mountain Bike/small heights,,"CCM Double shock suspension mountain bike, 18'aluminum frame for 5ft~5'6"", 24'aluminum wheels, Shimano 24spds, Kick stand, General commuting or exercise bike, area: dupont/ lansdowne",City of Toronto,29/09/2020,2020-10-07 00:28:14.422334
1526856858,/v-mountain-bike/city-of-toronto/reebok-two-point-six-hardtail-mountain-bike-dirt-jumper/1526856858,175.0,Reebok Two.Point.Six Hardtail Mountain Bike / Dirt Jumper,,"Great condition Reebok Mountain bike (hardtail). 2x7 chainset, new chain and frame guard. Upgraded Judy 100mm Rockshox and 2” Division Tires and headset , Could use a minor tuneup but ready to ride ...",City of Toronto,29/09/2020,2020-10-07 00:28:14.423129
1526856472,/v-mountain-bike/city-of-toronto/bicycle-for-sale-in-excellent-condition/1526856472,70.0,Bicycle for sale in excellent condition,,"Challenger, Laser Robotic, 24"" bicycle, for sale in excellent condition with bell and water bottle holder, 5 gears, suitable for kids 10 - 12 years.",City of Toronto,29/09/2020,2020-10-07 00:28:14.423661
1526850440,/v-mountain-bike/city-of-toronto/canadiana-pathfinder-26/1526850440,49.0,Canadiana Pathfinder 26'',,I am selling a Canadiana Pathfinder mountain bike. 26 inches frame. Call me at (437) 778-5634. Ask for Bayron.,City of Toronto,29/09/2020,2020-10-07 00:28:14.424158
1526849467,/v-mountain-bike/city-of-toronto/men-bike-medium-supercycle/1526849467,130.0,Men bike medium supercycle,,Men bike 130 firm If interested leave number and time you can meet,City of Toronto,29/09/2020,2020-10-07 00:28:14.424653
1526845636,/v-mountain-bike/city-of-toronto/24-supercycle-mountain-bike-excellent-conditio/1526845636,120.0,"24"" Supercycle Mountain Bike, Excellent Conditio",,Ready to ride Excellent working order Front suspension Rear suspension Shimano gear system,City of Toronto,29/09/2020,2020-10-07 00:28:14.425151
1505484775,/v-mountain-bike/city-of-toronto/spd-bike-pedals-radical-escape/1505484775,50.0,SPD Bike Pedals - Radical Escape,,SPD pedals used but good condition (WPD-183) Suitable for mountain and road bikes Great deal,City of Toronto,29/09/2020,2020-10-07 00:28:14.425647
1526825905,/v-mountain-bike/city-of-toronto/mountain-bike/1526825905,80.0,Mountain bike,,"Gently used mountain bike, needs air in tires .... pick up only",City of Toronto,29/09/2020,2020-10-07 00:28:14.426142
1526802999,/v-mountain-bike/city-of-toronto/gmc-disc-full-suspension-bike-dh-mountain-bike/1526802999,390.0,GMC Disc full suspension bike DH mountain bike,,"GMC 7000 Series bike (at a level higher than Topkick). Full Suspension DH mountain bike with 19"" aluminum frame (7005 alloy). Double wall alloy deep-V rims, Promax front and back mechanical disc ...",City of Toronto,28/09/2020,2020-10-07 00:28:14.426641
