,url,price,title,distance,description,location,time_offset,retreived
1524500496,/v-renovation-electrical/city-of-toronto/plug-in-led-shop-lights:-4ft-40w-4690-lumens-linkable-up-to-10/1524500496,39.0,PLUG IN LED SHOP LIGHTS: 4ft 40w 4690 lumens LINKABLE (up to 10,,"PLUG IN LED SHOP LIGHTS: 4ft 40w 4690 lumens LINKABLE (up to 10 lights in 1 Line) 6000k, 5000k, 4000k 120V Top Quality Ceiling/Wall Hanged/Flush Mount Light Fixture (Canada ETL Certified) (IF YOU SEE ...",City of Toronto,17/09/2020,2020-10-07 16:44:42.160903
1524482982,/v-renovation-electrical/city-of-toronto/brand-new-heavy-duty-all-purpose-canopy-tent-for-sale/1524482982,289.0,Brand new heavy duty All purpose Canopy Tent for sale.,,Brand New heavy duty All purpose Canopy Tent 10 feet x 20 Feet for sale. Contact me 647 269 0193 Thank you.,City of Toronto,16/09/2020,2020-10-07 16:44:42.161393
1286471679,/v-renovation-electrical/city-of-toronto/brand-new-ridgid-25-generator-cable-10-4-250v-30amp-7500-watts/1286471679,115.0,Brand New Ridgid 25' Generator Cable 10/4 250V 30Amp 7500 Watts,,"Brand New Ridgid 25' Generator Cable 10-Gauge 30 Amps 7500 Watts 250 Volts. Firm Price. No offers accepted. Indoor/Outdoor flexible for winter use. Comes with heavy-duty 30 Amp plugs. Never Used, in ...",City of Toronto,16/09/2020,2020-10-07 16:44:42.161942
1524434677,/v-renovation-electrical/city-of-toronto/very-thin-copper-wire/1524434677,60.0,Very thin copper wire,,Areound 8 lb The wire is as thin as the hair,City of Toronto,16/09/2020,2020-10-07 16:44:42.162632
1524395847,/v-renovation-electrical/city-of-toronto/4-led-slim-panel/1524395847,10.0,"4"" LED SLIM PANEL",,"Features:  Super Low Profile  High Performance  Easy Installation Specs: • Wattage: 12 • Input: 100-125V AC, 60Hz, 0.09A • Bean Angle: 110° Lumens: 850",City of Toronto,16/09/2020,2020-10-07 16:44:42.163118
1524377580,/v-renovation-electrical/city-of-toronto/2x2-led-flat-panel-light/1524377580,50.0,2x2 LED FLAT PANEL LIGHT,,Features: • 100%-10% dimming capability (This fixture is compatible with industry-standard 0-10V dimmers) • Bright LED modules • DLC Approved and ETL rated Specs: • Wattage: 40 • Input: 100-347V AC • ...,City of Toronto,16/09/2020,2020-10-07 16:44:42.163613
1524371298,/v-renovation-electrical/city-of-toronto/2x4-led-flat-panel-lights/1524371298,80.0,2X4 LED FLAT PANEL LIGHTS,,"Features: • 100%-10% dimming capability • Bright LED modules • DLC Approved and ETL rated Specs: • Wattage: 50 • Input: 100-347V AC • Lumens: 5,300 • CCT: 3000K,4000K & 5000K",City of Toronto,16/09/2020,2020-10-07 16:44:42.164094
1513842142,/v-renovation-electrical/city-of-toronto/coaxial-cable-on-reel-ec4-50-1-2-standard-foam-coax-cable/1513842142,500.0,"COAXIAL CABLE ON REEL - EC4-50 1/2"" Standard Foam Coax Cable",,"COAXIAL CABLE ON REEL - EC4-50 1/2"" Standard Foam Coax Cable, Eupen BRAND NEW!!! PROTECTED BY TECK CABLE EUPEN 1/2"" COAX CABLE SPOOL EC4-50 46/19 Made in Belgium ON REEL Approx 350 Ft. EC4-50 1/2"" ...",City of Toronto,16/09/2020,2020-10-07 16:44:42.164577
1524294847,/v-renovation-electrical/city-of-toronto/temporary-construction-electical-post-and-panel/1524294847,1300.0,Temporary Construction Electical Post and Panel,,"100 amp temporary constuction post and panel. all new components, used just once for this build box is large and shingled available after scheduled disconnection morning of sept 16 west end - ...",City of Toronto,15/09/2020,2020-10-07 16:44:42.165058
1513745879,/v-renovation-electrical/city-of-toronto/8-gauge-direct-burial-75-ft-underground-wire-durable-pvc-encasmt/1513745879,280.0,8 Gauge Direct Burial 75 ft Underground Wire Durable PVC Encasmt,,8 - Gauge Direct Burial 75 ft Underground Wire Durable PVC Encasement. Never used. Good quality. Perfect condition still in original packaging. Please text or email.,City of Toronto,15/09/2020,2020-10-07 16:44:42.165539
1524286513,/v-renovation-electrical/city-of-toronto/ballasts/1524286513,30.0,Ballasts,,"Ballasts electronic 120- 277 Volts , for 4 fluorescent tubes 4 feet long  , new. $30 each I live Dufferin x Finch",City of Toronto,15/09/2020,2020-10-07 16:44:42.166025
1466233403,/v-renovation-electrical/city-of-toronto/diva-fan-speed-controls-3-way-2-available/1466233403,20.0,Diva Fan-Speed Controls — 3-way (2 available),,"In excellent shape, rarely used - less than 50% cost of new Lutron DVFSQ-F-WH Diva 1.5 A 3-Way Single Pole 3-Speed Fan Control, White The designer fan-speed control that matches your paddle switches. ...",City of Toronto,15/09/2020,2020-10-07 16:44:42.166509
1524260777,/v-renovation-electrical/city-of-toronto/florescent-light-housing/1524260777,100.0,Florescent light housing,,Had them in my kitchen but recently put in pot lights and have no use for these. Good for a garage/shop. I have the cover for each of them little cracked on the sides but still intact. Comes as is in ...,City of Toronto,15/09/2020,2020-10-07 16:44:42.167001
1524248500,/v-renovation-electrical/city-of-toronto/tamper-resistant-self-test-gfci/1524248500,15.0,Tamper Resistant  Self Test GFCI,,5 new in box 15 amp GFCI. $15 each,City of Toronto,15/09/2020,2020-10-07 16:44:42.167497
1473751362,/v-renovation-electrical/city-of-toronto/f25t8-841-3-foot-t8-fluorescent-lamps-brand-new-25pcs-for-25/1473751362,25.0,F25T8/841 3 Foot T8 Fluorescent lamps brand new - 25pcs for $25,,Brand new 3 footers - Cool White. 1 box (25 lamps for $25). Bathurst/Wilson area.,City of Toronto,15/09/2020,2020-10-07 16:44:42.167988
1473745903,/v-renovation-electrical/city-of-toronto/3-foot-t8-lamps-daylight-brand-new-25pcs-for-25/1473745903,1.0,3 foot T8 lamps Daylight - brand new - 25pcs for $25,,Brand new box (25pcs) of 3 foot Daylight T8 lamps. 25pcs for $25. These are daylight color - super bright white light.,City of Toronto,15/09/2020,2020-10-07 16:44:42.168489
1513507350,/v-renovation-electrical/city-of-toronto/federal-pioneer-stab-lok-20-amp-gfi-breaker/1513507350,75.0,Federal Pioneer Stab-lok 20 Amp GFI Breaker,,Single Pole 20Amp GFI Breaker. Brand new in box; never used.,City of Toronto,15/09/2020,2020-10-07 16:44:42.168971
1404874319,/v-renovation-electrical/city-of-toronto/cartridge-fuse-30a/1404874319,30.0,Cartridge fuse 30a,,For sale Cartridge fuse 30a. Price $30.00 for all Local Pick Location or I can deliver it if you wish at extra cost in Toronto or GTA Thank you for looking.,City of Toronto,15/09/2020,2020-10-07 16:44:42.169839
1426664015,/v-renovation-electrical/city-of-toronto/cutler-hammer-safety-switch-gpi21n-30amp-120-240-volt-3hp/1426664015,30.0,CUTLER-HAMMER SAFETY SWITCH #GPI21N 30AMP. 120/240 VOLT 3hp.,,"NEVER USED SAFETY SWITCH, 30 AMP. MAX 120/240 VOLT, SINGLE PHASE, GOOD FOR UP TO 3hp. (CV) MAX. 240 VOLTS A.C. TEXT @ 905-706-6481",City of Toronto,14/09/2020,2020-10-07 16:44:42.170517
1524046807,/v-renovation-electrical/city-of-toronto/lutron-wireless-wall-dimmer-switch/1524046807,30.0,LUTRON Wireless wall dimmer switch,,Brand New. Never installed. Wireless RF Dimmer MRF2-600M-WH,City of Toronto,14/09/2020,2020-10-07 16:44:42.171000
1524039552,/v-renovation-electrical/city-of-toronto/antique-light/1524039552,19.99,Antique light,,Ceiling mounted painted off white bamboo and flower unique fixture. (rewired),City of Toronto,14/09/2020,2020-10-07 16:44:42.171492
1524034851,/v-renovation-electrical/city-of-toronto/assorted-lighting/1524034851,75.0,Assorted lighting,,"19"" Tiffany pendent light for sale. Brass finish in great condition. 5 light fixture with LED bulbs included.",City of Toronto,14/09/2020,2020-10-07 16:44:42.172033
1524020284,/v-renovation-electrical/city-of-toronto/caseta-wireless-smart-lighting-dimmer-switch-with-remote/1524020284,55.0,caseta wireless smart lighting dimmer switch with remote,,Brand new in box. Market price $ 80 Offer price $55 NO NEGOTIATION PRICE IS FIRM PICK UP ONLY.,City of Toronto,14/09/2020,2020-10-07 16:44:42.172522
1513332431,/v-renovation-electrical/city-of-toronto/12-recess-lamp-pot-lights/1513332431,10.0,12 recess lamp pot lights,,"12 pot lights available, used in working condition. $10 for the lot",City of Toronto,14/09/2020,2020-10-07 16:44:42.173014
1524001354,/v-renovation-electrical/city-of-toronto/4-t-8-fluorescent-light-fixtures/1524001354,120.0,4 T-8 Fluorescent Light Fixtures,,"I have 4 T8 light fixtures for sale, 9 bulbs included, the are in excellent condition, perfect for laundry room, work shop, basement or garage. $120 East gta area Send a number I call or text when ...",City of Toronto,14/09/2020,2020-10-07 16:44:42.173507
1309593213,/v-renovation-electrical/city-of-toronto/commander-100a-breaker-panel/1309593213,50.0,Commander 100A breaker panel,,Commander - Sylvania Disconnect 100A Max 240V Max Breaker is not included but available separately Used but in great condition Have over 60 pieces available Thank You,City of Toronto,14/09/2020,2020-10-07 16:44:42.174002
1325478000,/v-renovation-electrical/city-of-toronto/t5-high-bay-347v-4-light-fixtures/1325478000,75.0,T5 High Bay 347V 4 light fixtures,,"Used T5 347V High Bay fixtures 4 light Have about 24PC's They have been removed from a warehouse, in working condition Bulbs not included White body with silver reflector Hanging hooks on the back ...",City of Toronto,14/09/2020,2020-10-07 16:44:42.174499
1523983833,/v-renovation-electrical/city-of-toronto/save-x20-white-clampable-multidirectional-lights/1523983833,5.0,SAVE! (x20) White clampable multidirectional lights,,"They all work great, they have built in clamps and adjustable steel protected necks. Works great anywhere: garage, ceiling rails, desk, etc. I have about 20 or so of these, price is per unit. Cut me ...",City of Toronto,14/09/2020,2020-10-07 16:44:42.174987
1416124515,/v-renovation-electrical/city-of-toronto/siemens-15amp-double-pole-type-qp-breaker/1416124515,8.0,Siemens 15amp Double Pole Type QP Breaker,,Siemens 15amp Double Pole Type QP Breaker Brand new/unused (Note: item available if still posted),City of Toronto,14/09/2020,2020-10-07 16:44:42.175481
1513364228,/v-renovation-electrical/city-of-toronto/range-receptacle-4-wires/1513364228,15.0,Range receptacle 4 wires,,"Brand New for only$15 range receptacle 4 wires, location Donmills and Steele.",City of Toronto,14/09/2020,2020-10-07 16:44:42.175966
1523890474,/v-renovation-electrical/city-of-toronto/broan-hlb6-600-cfm-in-line-blower-new-in-box/1523890474,500.0,BROAN  HLB6 600 CFM IN-LINE BLOWER NEW IN BOX,,Purchased from builder for home renovation but went with a different design and no longer using this one. Paid $900 asking $500,City of Toronto,13/09/2020,2020-10-07 16:44:42.176448
1512699433,/v-renovation-electrical/city-of-toronto/galaxy-flushmount-ceiling-lights-12-25-inches/1512699433,30.0,Galaxy Flushmount ceiling lights 12.25 inches,,Three Galaxy Flushmount ceiling light fixtures (light bulbs not included). Retails for $30 each at Lowe's. All three sold together).,City of Toronto,13/09/2020,2020-10-07 16:44:44.380792
1523795863,/v-renovation-electrical/city-of-toronto/electrical-or-telephone-wire-cable/1523795863,50.0,Electrical or Telephone Wire Cable,,"50 ft Steel Fish Tape with Illuminated End Power Fist brand, 8067944 Threads electrical or telephone wire and cable",City of Toronto,13/09/2020,2020-10-07 16:44:44.381671
1523779712,/v-renovation-electrical/city-of-toronto/ideal-brand-yellow-77-wire-pulling-lubricant/1523779712,10.0,Ideal brand Yellow 77 wire pulling lubricant,,Open - I used less than 3 tablespoons.,City of Toronto,13/09/2020,2020-10-07 16:44:44.382153
1523759501,/v-renovation-electrical/city-of-toronto/cooper-grounding-duplex-receptacles-7x-with-wall-plates/1523759501,20.0,"Cooper Grounding Duplex Receptacles 7x, with wall plates",,Left over from a recent renovation. $20 takes all 7 receptacles and wall plates.,City of Toronto,13/09/2020,2020-10-07 16:44:44.382637
1523755929,/v-renovation-electrical/city-of-toronto/new-40-amp-double-breaker/1523755929,35.0,New 40 amp double breaker,,"New, unused Schneider Electric Federal Pioneer 40 amp double pole breaker. Model number NC0240CP. Went to 60amps for my project and didn’t keep the receipt so I can’t return it.",City of Toronto,13/09/2020,2020-10-07 16:44:44.383164
1501937040,/v-renovation-electrical/city-of-toronto/alpine-class-2-transformer/1501937040,35.0,Alpine Class 2 Transformer,,Transformer comes with Power Head. Lightly used,City of Toronto,13/09/2020,2020-10-07 16:44:44.383657
1523651686,/v-renovation-electrical/city-of-toronto/stab-lok-panel-100a-with-breakers/1523651686,100.0,Stab-lok panel 100A with breakers,,"CSA certified in very good condition, filled up with all breakers you may need, 40A, 30A, 20A and 15A. $100 for the whole panel. client upgrade the electric service from 100A to 200A. obo.",City of Toronto,12/09/2020,2020-10-07 16:44:44.384142
1523651185,/v-renovation-electrical/city-of-toronto/ceramic-unicorn-switch-wall-plates/1523651185,10.0,Ceramic Unicorn Switch Wall Plates,,These ceramic unicorn wall plate for a single toggle switch would be adorable for any unicorn lover. Hand painted and made in Ontario. I have 5 plates available. Screws included. Note one has some ...,City of Toronto,12/09/2020,2020-10-07 16:44:44.384626
1503024700,/v-renovation-electrical/city-of-toronto/4-inch-ipex-electrical-conduit-pipe/1503024700,30.0,4 inch IPEX electrical conduit pipe,,Approx. 8.5- 9 foot length,City of Toronto,12/09/2020,2020-10-07 16:44:44.385110
1523615345,/v-renovation-electrical/city-of-toronto/100amp-electrical-panel/1523615345,60.0,100amp electrical panel,,l100amp electrical panel in great shape,City of Toronto,12/09/2020,2020-10-07 16:44:44.385639
1523578267,/v-renovation-electrical/city-of-toronto/track-lights/1523578267,5.0,Track Lights,,Selling 15 large Juno track lights and 4 small track lights. Priced to sell $30 for the set or $5 each. Any questions let me know.,City of Toronto,12/09/2020,2020-10-07 16:44:44.386132
1523560384,/v-renovation-electrical/city-of-toronto/f32t8-lamps-4/1523560384,100.0,F32T8 lamps 4',,For sale 25 T8 F32 4' florescent lamps 32 watt made by Phillip's,City of Toronto,12/09/2020,2020-10-07 16:44:44.386615
1523514931,/v-renovation-electrical/city-of-toronto/new-8-foot-fluorescent-tubes-96-t12-daylight-price-drop/1523514931,50.0,"NEW 8 Foot Fluorescent Tubes - 96"" T12, Daylight PRICE DROP!",,"8 Foot Fluorescent Tubes - 96"" T12, Daylight Deluxe Single Pin, 75w. 15 tubes - new box, never used. All for $50.00 OBO. FYI Home Depot price is $181.90 - my cost to you is less than half price. ...",City of Toronto,12/09/2020,2020-10-07 16:44:44.387101
1509779847,/v-renovation-electrical/city-of-toronto/breaker-panel/1509779847,180.0,Breaker panel,,Federal Pioneer breaker panel with breakers 2 @ 30 amp 5 @ 20 amp 1 double 20 amp 17 @ 15 amp,City of Toronto,12/09/2020,2020-10-07 16:44:44.387597
1523479060,/v-renovation-electrical/city-of-toronto/double-pole-30a-breakers-stab-lok-federal-pioneer/1523479060,15.0,double pole 30A breakers stab-lok federal pioneer,,I have a few 30A federal pioneer stab-lok breakers for sale. CSA certified in perfect condition. $15 each.,City of Toronto,11/09/2020,2020-10-07 16:44:44.388279
1512941166,/v-renovation-electrical/city-of-toronto/curved-frosted-glass-light-with-leds/1512941166,20.0,Curved frosted glass light with LEDs,,"Curved frosted glass light, uses halogen (which have been replaced with LEDs). LEDs alone are worth about $40. Fixture is approximately 25x7 inches with a depth of 5 inches. Was previously used in a ...",City of Toronto,11/09/2020,2020-10-07 16:44:44.388832
1523454199,/v-renovation-electrical/city-of-toronto/electrical-metallic-tubing/1523454199,7.0,Electrical Metallic Tubing,,Electrical Metallic Tubing Unused conduit in 10 foot lengths -1/2 inch: $7.00 each -3/4 inch: $11.00 each -1 inch: $13.00 each -1.5 inch: $19.00 each -2.0 inch: $23.00 each,City of Toronto,11/09/2020,2020-10-07 16:44:44.389325
1523450717,/v-renovation-electrical/city-of-toronto/square-d-30-amp-2-pole-bolt-on-circuit-breaker-qob230-qob-230/1523450717,20.0,Square D 30 Amp 2 Pole Bolt On Circuit Breaker QOB230 QOB 230,,Square D 30 Amp 2 Pole Bolt On Circuit Breaker QOB230 QOB 230 Brand: Square D Current Rating: 30 A Mounting Style: Bolt On Mounting MPN: QOB230 Number of Poles: 2 $20.00 each,City of Toronto,11/09/2020,2020-10-07 16:44:44.389809
1512335004,/v-renovation-electrical/city-of-toronto/electrical-boxes-welded-gangable-octagn-utility:from-1-10/1512335004,1.1,"ELECTRICAL BOXES, WELDED, GANGABLE, OCTAGN, UTILITY:FROM $1.10",,Non-Gangable (Welded) 2104-LLE (1 Gang): $ 1.10 2104-LLE2 (2 Gang): $ 2.25 2104-LLE3 (3 Gang): $ 3.99 2104-LLE4 (4 Gang): $ 5.50 Gangable 1104-LH (single): $ 1.10 1104-L (F-Clips): $ 1.95 1004-LH ...,City of Toronto,11/09/2020,2020-10-07 16:44:44.390295
1512334418,/v-renovation-electrical/city-of-toronto/under-cabinet-led-tubes-puck-lights:-from-9-99/1512334418,9.99,UNDER CABINET LED TUBES & PUCK LIGHTS: From $9.99,,"T5 LED TUBES: easy to install (snap in clips) 120v line voltage (NO Driver), dimmable, direct link straightly and linkable by jumper in corners and sections: 1ft: $ 16.30 2ft: $23.80 3ft: $ 28.90 ...",City of Toronto,11/09/2020,2020-10-07 16:44:44.390778
1512333418,/v-renovation-electrical/city-of-toronto/leviton-switch-receptacle-gfci-dimmer-timer:-from-1-65/1512333418,1.65,"LEVITON SWITCH, RECEPTACLE, GFCI, DIMMER, TIMER: From $1.65",,Decora Switch single pole: $ 1.65 Decora Switch 3-Way: $ 2.35 Decora Switch 4-Way: $ 13.75 TR Decora Receptacle 15A: $ 1.65 TR Decora Receptacle 20A: $ 4.85 Range & Dryer Receptacle: $ 4.25 Slim TR ...,City of Toronto,11/09/2020,2020-10-07 16:44:44.391309
1512332499,/v-renovation-electrical/city-of-toronto/siemens-panels-breakers-and-arc-faults:-from-184-99/1512332499,184.99,"SIEMENS PANELS, BREAKERS and ARC FAULTS: From $184.99",,"ARC FAULT 15A: $59.99 (new code) Buy 5 pcs , Each $ 54.99 Only Panel 200A Combo : $269.99 (no Arc fault) / $544.99 (5 Arc Faults) SAVE $25.00 Panel 100A Combo : $184.99 (no Arc fault) / 459.99 (5 Arc ...",City of Toronto,11/09/2020,2020-10-07 16:44:44.391799
1512329700,/v-renovation-electrical/city-of-toronto/kidde-smoke-alarms:-from-14-99/1512329700,14.99,KIDDE SMOKE ALARMS: From $14.99,,KIDDE 2 IN 1 (Smoke+Strobe): $99.99 KIDDE 3 IN 1 (Smoke + CO+ Strobe): $119.99 www.amhomielectric.com Please visit our website to see all products and click on DEALS to see this month special offers ...,City of Toronto,11/09/2020,2020-10-07 16:44:44.392281
1512597236,/v-renovation-electrical/city-of-toronto/light-receptical-cover-plates/1512597236,60.0,Light/receptical cover plates,,Beautiful light switch and plug cover plates. Downsizing and don’t have room. 60. OBO,City of Toronto,11/09/2020,2020-10-07 16:44:44.392767
1501805607,/v-renovation-electrical/city-of-toronto/lamp/1501805607,15.0,Lamp,,"Lamp. Posted in home renovation materials, electrical in City of Toronto. May 19, 2020",City of Toronto,11/09/2020,2020-10-07 16:44:44.393250
1500076402,/v-renovation-electrical/city-of-toronto/gfci-ground-fault-circuit-interrupter-breaker-50a-2pole-type-br/1500076402,150.0,GFCI -Ground Fault Circuit Interrupter/Breaker 50A 2Pole Type BR,,Please see link below: https://www.homedepot.ca/en/home/p.50a-2-pole-120240v-type-q-gfci-breaker.1000436972.html For sale at Home Depot for $267+Tax= $300 price is firm.,City of Toronto,10/09/2020,2020-10-07 16:44:44.393737
1523193620,/v-renovation-electrical/city-of-toronto/electrical-pvc-conduit/1523193620,500.0,Electrical PVC Conduit,,"Construction left over new pvc electrical conduit. 1/2 "" D x 10' lengths x 10 pieces = 100' 3/4"" D x 10' lengths x 10 pieces = 100' 3/4"" D x 5' lengths x 78 pieces = 390' 1"" D x 10' lengths x 4 ...",City of Toronto,10/09/2020,2020-10-07 16:44:44.394222
1417919594,/v-renovation-electrical/city-of-toronto/voltage-tester/1417919594,25.0,VOLTAGE TESTER,,GB VOLTAGE TESTER,City of Toronto,09/09/2020,2020-10-07 16:44:44.394708
1523104282,/v-renovation-electrical/city-of-toronto/bnib-lutron-diva-dvcl-153ph-dimmer-switch/1523104282,30.0,BNIB Lutron Diva DVCL-153PH dimmer switch,,"BNIB Lutron Diva DVCL-153PH dimmer switch I have 2 Brand new sealed in retail box lutron dimmer switches Bought the wrong kind. Retail for $40+ Willing to sell for $30 each, or $55 for 2",City of Toronto,09/09/2020,2020-10-07 16:44:44.395188
1473034374,/v-renovation-electrical/city-of-toronto/sylvania-t12-bulbs-tube-light-2-pack/1473034374,10.0,Sylvania T12 bulbs tube light 2 pack,,Sylvania T12 bulbs tube light 2 pack. Brand new unused. Asking $10,City of Toronto,09/09/2020,2020-10-07 16:44:44.395893
1508256634,/v-renovation-electrical/city-of-toronto/bnib-4-feet-shop-light-with-5-feet-cord/1508256634,15.0,BNIB 4 Feet Shop light with 5 feet cord,,brand new in box 3Xshop light with 5 foot cord 1Xshoplight with 4 feet cord $15 each tak all 4 for $45,City of Toronto,09/09/2020,2020-10-07 16:44:44.396376
1508255132,/v-renovation-electrical/city-of-toronto/bnib-4-feet-shop-light-with-5-feet-cord/1508255132,15.0,BNIB 4 Feet Shop light with 5 feet cord,,Brand new in box 3X Shop light with 5 feet cord 1X Shop light with 4 feet cord. $15 each $45 take all.,City of Toronto,09/09/2020,2020-10-07 16:44:44.396859
1521453959,/v-renovation-electrical/city-of-toronto/mounting-plate-for-recessed-lights/1521453959,20.0,Mounting Plate for recessed lights,,"Mounting Plate for Round Recessed Lights, Galvanized Steel Measurements 13"" x 6.5"" The pre-mounting plate acts as a guide for end-users to identify lighting arrangement and cut hole locations Brand ...",City of Toronto,09/09/2020,2020-10-07 16:44:50.024579
1522990733,/v-renovation-electrical/city-of-toronto/new-led-bulbs-for-1-each-picture-is-just-sample/1522990733,1.0,New Led bulbs for 1 $ each (picture is just sample),,"Par 16, par 20, Gu10, Mr16 led bulbs COB chips for 1$ each! Blow out sale! Comes in 3000K and 5000K. For inquiries, please call: Markham: 9056040143 Mississauga: 6478877403 Woodbridge: 9058560903",City of Toronto,09/09/2020,2020-10-07 16:44:50.025075
1414627863,/v-renovation-electrical/city-of-toronto/programable-thermostat-electrical-cover-plates-etc/1414627863,25.0,"Programable thermostat, electrical cover plates, etc",,1 programmable thermostat 1 manual thermostat 1 double toggle switch plate 1 ceiling fixture cover plate. 1 quad outlet cover plate 2 duplex outlet cover plates 1 duplex outlet 1 round metal cover ...,City of Toronto,09/09/2020,2020-10-07 16:44:50.025569
1392144184,/v-renovation-electrical/city-of-toronto/1-x-10-foot-lengths-flexible-pvc-ent-conduit-for-concrete/1392144184,10.0,"1 "" X 10 foot lengths flexible PVC, ENT Conduit for Concrete",,Ipex Cor-Line 24 ten foot lengths available $10 ea or $200 for all CSA Rated for use in concrete walls floors slabs intended to be used with Ipex Kwikon fittings Product code 012007 Interested text ...,City of Toronto,09/09/2020,2020-10-07 16:44:50.026050
1329417122,/v-renovation-electrical/city-of-toronto/mastercraft-smoke-detector-alarm/1329417122,50.0,MASTERCRAFT  SMOKE  DETECTOR & ALARM,,"Brand new smoke detector & amp; alarm in box with plug-in power connector for easy installation. Included in the photos is a full description of its features. IF THIS AD IS POSTED, IT MEANS THE ITEM ...",City of Toronto,09/09/2020,2020-10-07 16:44:50.026533
1522929580,/v-renovation-electrical/city-of-toronto/wallplates-outlet-and-switch/1522929580,4.0,Wallplates outlet and switch,,"Nylon wallplate, decora 1-gang wallplate Pickup at queen and dufferin 2$ each or take all 3 for 5$",City of Toronto,08/09/2020,2020-10-07 16:44:50.027016
1493939823,/v-renovation-electrical/city-of-toronto/led-light-fp22-4-g2/1493939823,80.0,LED light FP22-4-G2,,"LED light 40w, nice and bright and energy saving. 2' x 2'（23-5/8” x 23-5/8”）square light for 100 - 277 Vac 50/60Hz power",City of Toronto,08/09/2020,2020-10-07 16:44:50.027512
1522925283,/v-renovation-electrical/city-of-toronto/3-potlights-new-2/1522925283,10.0,"3"" Potlights - new (2)",,"Brand new - 2 left out of the original set of 6. Hole cutout size: 3 1/8 in, GU10 bulbs included",City of Toronto,08/09/2020,2020-10-07 16:44:50.027999
1522804278,/v-renovation-electrical/city-of-toronto/wanted-fluorescent-light-fixture-for-parts/1522804278,0.0,"Wanted:
                            Wanted Fluorescent Light Fixture, For Parts",,"Wanted Used Fluorescent Light Fixture For Parts....I am repairing a 2 light, 4 feet, Fluorescent Fixture for our church....need a workable ballast for the fixture....please contact me....thanks",City of Toronto,08/09/2020,2020-10-07 16:44:50.028457
1512086713,/v-renovation-electrical/city-of-toronto/halo-flush-mount-gimbal-trim-chrome/1512086713,12.0,Halo Flush Mount Gimbal Trim Chrome,,"Halo Flush Mount Gimbal Trims, 4"" Aperture. We decided to go for a different style, and these are now surplus. Brand new still in boxes. Would like to sell as a lot. $12 Each (Which is less than 1/2 ...",City of Toronto,08/09/2020,2020-10-07 16:44:50.028944
1522741717,/v-renovation-electrical/city-of-toronto/4-inch-par16-trims/1522741717,5.0,4 INCH PAR16 TRIMS,,"BRAND NEW, PURCHASED TOO MANY, HAVE 16 IN TOTAL, SELLING $5 EACH, $75 FOR LOT, CALL OR TEXT 4165261677",City of Toronto,08/09/2020,2020-10-07 16:44:50.029403
1393945955,/v-renovation-electrical/city-of-toronto/coaxial-cable-f-connector-grounding-blocks/1393945955,3.0,Coaxial Cable F Connector Grounding Blocks,,"Single, dual and quad F connector grounding blocks. Ideal for CATV, Satellite, Dish, OTA connections. Keep your receiver protected by properly grounding the antenna / source inputs. They're old stock ...",City of Toronto,07/09/2020,2020-10-07 16:44:50.029887
