,url,price,title,distance,description,location,time_offset,retreived
1507391588,/v-printers-scanners-fax/city-of-toronto/protective-barriers-desktop-acrylic-sneeze-guard-plexiglass/1507391588,49.99,PROTECTIVE Barriers Desktop Acrylic Sneeze Guard Plexiglass,,"*** CALL OR TEXT SHAI 647-998-6637 *** LARGEST COPIERS SHOWROOM *** Canadian Made - Support Canadian Business' Add a clear physical barrier to tabletops, desks and counters to help reduce the ...
                        
                            
                            
                                
                            
                            
                        

                        
                            
                                WE'RE HIRING!! JOIN OUR PROFESSIONAL TEAM !!! 905-326-2790",City of Toronto,30/08/2020,2020-10-06 12:29:08.651188
1492913142,/v-printers-scanners-fax/city-of-toronto/65-mo-ricoh-mp-c4504-colour-multifunction-printer-color-copier/1492913142,65.0,$65/Mo Ricoh MP C4504 Colour Multifunction Printer Color Copier,,"Lease for only $65/month Newer Model. Copy, Print, Scan, Scan to Email, 11x17, 12x18, 4-Trays, 300gsm Optional - Stapler, Fax and Finisher Black toner yield 33,000 pages Colour toner yield 22,500 ...
                        
                            
                            
                                
                            
                            
                        

                        
                            
                                WE'RE HIRING!! JOIN OUR PROFESSIONAL TEAM !!! 905-326-2790",City of Toronto,30/08/2020,2020-10-06 12:29:08.651736
1521041871,/v-printers-scanners-fax/city-of-toronto/brother-all-in-one-print-copy-scan-fax/1521041871,280.0,Brother all-in-one (print/copy/scan/fax),,"Brother MFC-9330CDW Digital Colour Multifunction. Fast, reliable Digital Colour All-in-One (Print/Copy/Scan/Fax). Very good condition. Has toner cartridges. Wireless printing from mobile device or ...",City of Toronto,30/08/2020,2020-10-06 12:29:08.652225
1521040281,/v-printers-scanners-fax/city-of-toronto/blue-usb-2-0-type-a-male-to-b-male-power-data-printer-scanner/1521040281,5.0,Blue USB 2.0 Type A Male to B Male Power Data Printer Scanner,,"Brand New This is 1.5 Meters Size Standard: Hi-Speed USB 2.0 Connectors: Male USB 2.0A To Mini Male USB B Compatible for UNO R3 MEGA 2560 Easy to connect printers, scanners device and other with USB ...",City of Toronto,30/08/2020,2020-10-06 12:29:08.652721
1500289095,/v-printers-scanners-fax/city-of-toronto/toner-cartridge-for-xerox-phaser-6600-6605c-work-centre/1500289095,40.0,Toner Cartridge  for Xerox Phaser 6600/6605C Work Centre,,"Aftermarket, Brand new in box. Picture shows a ""6600/6605K"" but they are very similar.",City of Toronto,30/08/2020,2020-10-06 12:29:08.653213
1521029514,/v-printers-scanners-fax/city-of-toronto/hp-deskjet-3050a-incl-extra-black-and-colour-cartridges/1521029514,40.0,HP Deskjet 3050A incl. extra black and colour cartridges!,,"Comes with brand new black ink cartridge and brand new colour ink cartridge! Printer, scanner and copier. Works very well. Wireless capabilities.",City of Toronto,30/08/2020,2020-10-06 12:29:08.653702
1521025347,/v-printers-scanners-fax/city-of-toronto/hp-wireless-4500-all-in-one-printer-fax-scanner-colour/1521025347,5.0,HP Wireless 4500 All in One Printer Fax Scanner Colour,,Up for sale is an excellent and reliable printer. I put it into storage a few months ago and have lost the power cord. Too lazy to get a new one so my loss is your gain Get this amazing printer at a ...,City of Toronto,30/08/2020,2020-10-06 12:29:08.654190
1482178820,/v-printers-scanners-fax/city-of-toronto/hp-envy-4520:-print-scan-copy-web-photo/1482178820,80.0,"HP ENVY 4520: PRINT, SCAN, COPY, WEB, PHOTO",,"HP ENVY 4520: PRINT, SCAN, COPY, WEB, PHOTO PICK UP IN MARKHAM OR SCARBOROUGH VERY GOOD CONDITION INK AND PAPERS WILL NOT BE INCLUDED",City of Toronto,30/08/2020,2020-10-06 12:29:08.654684
1510463004,/v-printers-scanners-fax/city-of-toronto/lightly-used-xerox-phaser-7750-color-laser-printer/1510463004,599.0,Lightly Used Xerox Phaser 7750 Color Laser Printer,,LIghtly Used Xerox Phaser 7750 Color Laser Printer,City of Toronto,30/08/2020,2020-10-06 12:29:08.655174
1469325364,/v-printers-scanners-fax/city-of-toronto/lexmark-51b1h00-ms-mx-417-517-617-high-yield-catridge-toner/1469325364,75.0,"Lexmark 51B1H00 MS/Mx 417,517, 617 High Yield Catridge Toner",,*toner black *compatible printers: Lexmark - MS Series MS417dn MS517dn MS617 Lexmark - mx Series MX417de MX517de MX617de,City of Toronto,30/08/2020,2020-10-06 12:29:08.655665
1520972423,/v-printers-scanners-fax/city-of-toronto/hp-envy-7640-all-in-1-printer-colour-touch-screen/1520972423,90.0,HP Envy 7640 all in 1 printer (colour touch screen ),,"Pick up at our store location Scarborough Good working condition, no issue (tested) Comes with power cable and box No ink cartridge include Price is firm !! Will not accept any offers Spec : All in ...",City of Toronto,30/08/2020,2020-10-06 12:29:08.656162
1520971564,/v-printers-scanners-fax/city-of-toronto/canon-pixma-ts5020-all-in-one-printer/1520971564,30.0,Canon pixma TS5020 all in one printer,,"Pick up at our store location Scarborough Good working condition, no issue (tested) Air print and wireless printing available Comes with ink cartridge but not sure how much ink level left (yellow is ...",City of Toronto,30/08/2020,2020-10-06 12:29:08.656899
1520970165,/v-printers-scanners-fax/city-of-toronto/epson-workforce-wf-250-printer/1520970165,40.0,Epson WorkForce WF-250 printer,,"Pick up at our store location Scarborough Good working condition, no issue (tested) Does not come with ink cartridge Price is firm !! Will not accept any offers Spec : All in one Black and Colour ...",City of Toronto,30/08/2020,2020-10-06 12:29:08.657396
1520957898,/v-printers-scanners-fax/city-of-toronto/ho-officejet-4500-printer-colour-print-scan-copy-fax/1520957898,20.0,"HO Officejet 4500 Printer (Colour Print, scan, copy, fax)",,Used printer but looks like new. Ink cartridges needs to refill. Quality refill available with $20 from any Costco store.,City of Toronto,29/08/2020,2020-10-06 12:29:08.658363
1520955428,/v-printers-scanners-fax/city-of-toronto/hp-desk-jet-f4280-printer-colour-print-scan-and-copy/1520955428,20.0,"HP Desk jet F4280 Printer (Colour Print, Scan and Copy)",,Used but like new. Need to refill ink cartridge. Quality refill with $20 from any Costco store.,City of Toronto,29/08/2020,2020-10-06 12:29:08.658898
1499512370,/v-printers-scanners-fax/city-of-toronto/epson-200xl-black-printer-cartridge-new/1499512370,10.0,"Epson 200XL black printer cartridge, new",,"Brand new Epson 200XL printer cartridge, bought at Staples today. Didn't realize that I purchased the wrong one until I opened the vacuum sealed bag it's in :-(. Paid over $50, willing to sell for ...",City of Toronto,29/08/2020,2020-10-06 12:29:08.659366
1363032076,/v-printers-scanners-fax/city-of-toronto/brother-pc-410-fax-cartridge-brand-new-genuine/1363032076,15.0,Brother PC-410 fax cartridge - brand new genuine,,Brand new sealed in the box. no longer have the fax machine. no longer need the cartridge. https://www.staples.ca/brother+pc+401/directory_brother%2520pc-401_20051_1_20001 sells at staples $30.79 + ...,City of Toronto,29/08/2020,2020-10-06 12:29:08.660051
1362810128,/v-printers-scanners-fax/city-of-toronto/samsung-108-black-toner-cartridge/1362810128,40.0,Samsung 108 black toner cartridge,,There are two of these brand new never opened in the box. They retail for $99.99 plus tax at staples https://www.staples.ca/en/Samsung-MLT-D108S-Black-Toner-Cartridge/product_802160_1-CA_1_20001 You ...,City of Toronto,29/08/2020,2020-10-06 12:29:08.660568
1510165786,/v-printers-scanners-fax/city-of-toronto/hp-deskjet-f4280-all-in-one-printer-scanner-copier-new/1510165786,100.0,HP Deskjet F4280 ALL-IN-ONE Printer scanner copier new,,new never used,City of Toronto,29/08/2020,2020-10-06 12:29:08.661058
1455849717,/v-printers-scanners-fax/city-of-toronto/3-printers-brother-hp/1455849717,45.0,"3 Printers- Brother, HP",,"3 Printers- Brother, HP Brother MFC-495CW $45 Inkjet Color Multifunction Center with Wireless Networking for the Small Office/Home Office Flexible wireless (802.11b/g) or wired (Ethernet) network ...",City of Toronto,29/08/2020,2020-10-06 12:29:08.661560
1520836304,/v-printers-scanners-fax/city-of-toronto/brother-ql-800-label-printer/1520836304,100.0,Brother QL-800 Label Printer,,I am selling brand new QL-800 LABEL Printer: https://www.staples.ca/products/2494427-en-brother-ql-800-high-speed-professional-label-printer Staples is selling for $161.57 including tax. I am selling ...,City of Toronto,29/08/2020,2020-10-06 12:29:08.662050
1520834533,/v-printers-scanners-fax/city-of-toronto/canon-pixma-ts3100-printer-works-fine-15-firm/1520834533,15.0,canon pixma TS3100 printer. works fine $15 firm,,"WE ARE TAKING EVERY PRECAUTION FOR THE SAFETY OF EVERYONE. STAY SAFE. comes with power cord, inks are 1/2 full. install CD. missing printer cord. i found it very complexed. i'm from the old school. ...",City of Toronto,29/08/2020,2020-10-06 12:29:08.662536
1520779743,/v-printers-scanners-fax/city-of-toronto/printer-with-scanner-and-fax-service-canon/1520779743,70.0,PRINTER WITH SCANNER AND FAX SERVICE  CANON,,An energy star Canon printer and fax service in very good condition. Still in box.,City of Toronto,29/08/2020,2020-10-06 12:29:08.663030
1520751414,/v-printers-scanners-fax/city-of-toronto/uninet-icolor-600-digital-colour-white-transfer-media-printer/1520751414,7000.0,Uninet IColor 600 Digital Colour + White Transfer Media Printer,,"Uninet IColor 600 Digital Colour + White Transfer Media Printer IColor 600 is a Color sheet label and apparel printer with white toner and IColor PRORIP Software. Print Garments, Hard Surfaces(ex. ...",City of Toronto,28/08/2020,2020-10-06 12:29:08.663518
1520749636,/v-printers-scanners-fax/city-of-toronto/panasonic-kx-p2023-parallel-dot-matrix-printer-works-great/1520749636,70.0,"Panasonic KX-P2023 Parallel Dot Matrix printer, Works great",,"*If you see the ad, the printer is still available, No need to ask!* Great shape overall, just been checked out and works without issues. The paper in the photo is a printout that has just been made ...",City of Toronto,28/08/2020,2020-10-06 12:29:08.664318
1510247104,/v-printers-scanners-fax/city-of-toronto/epson-stylus-r2000-ink-jet-printer/1510247104,700.0,Epson stylus r2000 ink jet printer,,Barely used high quality printer Serious buyers only,City of Toronto,28/08/2020,2020-10-06 12:29:08.664913
1520737010,/v-printers-scanners-fax/city-of-toronto/new-in-box-brother-toner-cartridges-brother-tn-450-toner/1520737010,52.0,NEW in box Brother toner cartridges/Brother TN-450 toner,,"NEW in box Brother toner cartridges/Brother TN-450 toner still sealed, 69.99 plus tax at Costco or Amazon 52.00 Alex@647-261-8975",City of Toronto,28/08/2020,2020-10-06 12:29:14.798718
1510244396,/v-printers-scanners-fax/city-of-toronto/canon-pixma-ts9520-all-in-one-wireless-inkjet-printer/1510244396,150.0,Canon PIXMA TS9520 All-In-One Wireless Inkjet Printer,,Excellent working condition Canon PIXMA TS9520 All-In-One Wireless Inkjet Printer. Comes with new ink cartridges installed. Product Details What kind of printer do you need to help you do what you do ...,City of Toronto,28/08/2020,2020-10-06 12:29:14.799225
1451049698,/v-printers-scanners-fax/city-of-toronto/plustek-d30-duplex-sheetfed-scanner-open-box-like-new/1451049698,150.0,Plustek D30 Duplex Sheetfed Scanner (Open Box - like new),,Plustek MobileOffice D30 Duplex Sheetfed Scanner (Open Box - like new) Ideal for Pharmacy Point Of Sale systems. Was used with Fillware POS software. Upgraded systems and purchased a newer model. In ...,City of Toronto,28/08/2020,2020-10-06 12:29:14.799913
1226582995,/v-printers-scanners-fax/city-of-toronto/samsung-toner-cartridges-mlt-d101s-mlt-d103l-mlt-d105l/1226582995,18.99,"Samsung  Toner Cartridges. MLT-D101S,MLT-D103L,MLT-D105L",,Compatible for MLT-D101S $18.99 MLT-D103L $25.99 MLT-D104S $20.99 MLT-D105L $20.99 MLT-D108S $20.99 MLT-D109S $21.99 MLT-D111S 21.99 MLT-D115L $35.99 MLT-D116L $23.99 MLT-R116L $29.99 MLT-D118L ...,City of Toronto,28/08/2020,2020-10-06 12:29:14.800403
1226579924,/v-printers-scanners-fax/city-of-toronto/brother-tn-450-dr420-tn660-tn360-tn350-tn580-tn850-dr820-dr620/1226579924,14.5,"Brother TN-450 DR420,TN660,TN360,TN350,TN580,TN850,DR820,DR620",,TN450 $14.50 DR420 $22.99 TN660 $14.50 DR630 $22.99 TN360 $14.50 DR360 $22.99 TN350 $14.50 DR350 $22.99 TN580 $16.99 DR620 $25.99 TN620 $16.99 TN750 $18.9 DR720 $25.99 TN850 22.99 DR820 $30.99 TN1030 ...,City of Toronto,28/08/2020,2020-10-06 12:29:14.800902
1380885430,/v-printers-scanners-fax/city-of-toronto/ink-cartridges/1380885430,2.99,INK cartridges,,"Compatible for Brother. 4pack set LC51 (K,C,M,Y) set 9.99 LC61 (K,C,M,Y) 9.99 LC71/75/79 LC61 (K,C,M,Y) 9.99 LC103XL (K,C,M,Y) 9.99 LC105/107XL (K,C,M,Y) 10.99 LC203XL (K,C,M,Y) 13.99 LC3029XL ...",City of Toronto,28/08/2020,2020-10-06 12:29:14.801395
1520721874,/v-printers-scanners-fax/city-of-toronto/hp-laserjet-enterprise-mfp-m632h/1520721874,1500.0,HP LaserJet Enterprise MFP M632h,,I am.selling brand new HP LaserJet Enterprise MFP M632h - multifunction printer. Please see the link below: https://m.cdw.ca/product/hp-laserjet-enterprise-mfp-m632h-multifunction-printer-b-w/4783826 ...,City of Toronto,28/08/2020,2020-10-06 12:29:14.802131
1520671969,/v-printers-scanners-fax/city-of-toronto/epson-tm-c7500/1520671969,7500.0,Epson TM-C7500,,Brand new Epson TM-C7500 Printer - Used once to test labels - Comes with label holder attachment,City of Toronto,28/08/2020,2020-10-06 12:29:14.802629
1510048462,/v-printers-scanners-fax/city-of-toronto/lexmark-prospect-se-pro208-use-for-part/1510048462,5.0,Lexmark Prospect SE Pro208 use for part,,Printer can only be used for part.,City of Toronto,28/08/2020,2020-10-06 12:29:14.803094
1208127952,/v-printers-scanners-fax/city-of-toronto/hewlett-packard-1600-color-laserjet-printer/1208127952,40.0,Hewlett Packard 1600 Color LaserJet Printer,,This is a barely used Hewlett Packard Color LaserJet 1600 printer. It looks like there is a fair amount of color streaking during printing of test page and this will require cleaning. Manufactured in ...,City of Toronto,28/08/2020,2020-10-06 12:29:14.803732
1520631401,/v-printers-scanners-fax/city-of-toronto/multipurpose-copy-printer-paper-1500-pages-a4-size-brand-new/1520631401,20.0,Multipurpose Copy Printer Paper 1500 pages A4 size brand new,,AmazonBasics 30% Recycled Multipurpose Copy Printer Paper. Brand new unopened box. 3 packs/reams of 500 pages A4 size paper i.e total of 1500 pages (3 reams) for $25. Bought it for $34 on amazon. I ...,City of Toronto,28/08/2020,2020-10-06 12:29:14.804317
1520630287,/v-printers-scanners-fax/city-of-toronto/hp-officejet-wireless-printer-brand-new/1520630287,70.0,HP Officejet wireless printer brand new,,"Selling my HP OfficeJet Pro 6230 Wireless Printer, Amazon Dash Replenishment Ready (E3E03A) printer. Bought it on amazon.ca for CAD$145 but do not need it. It is brand new unopened box. Reason for ...",City of Toronto,28/08/2020,2020-10-06 12:29:14.804838
1520629648,/v-printers-scanners-fax/city-of-toronto/hp-laser-jet-color-flow-mfp-m575/1520629648,400.0,HP laser jet color flow MFP m575,,used printer working condition too big for us comes with an extra try,City of Toronto,28/08/2020,2020-10-06 12:29:14.805348
1472383811,/v-printers-scanners-fax/city-of-toronto/best-price-50-off-newcompatible-lasertoner-brothertn-350-4-sale/1472383811,9.99,Best Price 50%off NewCompatible LaserToner BrotherTN-350 4 sale!,,50% off of best Price new compatible Brother TN -350. Only 1 left at this price. Brother TN - 350 toner (Yield: 2500 pages) Price: $ 9.99/each - (After 10% off. Reg. price: $19.99/each) Only 1 left ...,City of Toronto,28/08/2020,2020-10-06 12:29:14.805844
1520615571,/v-printers-scanners-fax/city-of-toronto/brand-new-printer/1520615571,180.0,Brand New Printer,,Never opened or used. Message if you are interested,City of Toronto,28/08/2020,2020-10-06 12:29:14.806328
1520604809,/v-printers-scanners-fax/city-of-toronto/door-dash-bluetooth-printer-by-star-micronics-tsp654/1520604809,539.0,Door Dash Bluetooth Printer by STAR MICRONICS TSP654,,Star Micronics TSP654 Bluetooth Printer for DOOR DASH BRAND NEW! Same day pick-up in GTA. This printer is also compatible with Uber Eats.,City of Toronto,28/08/2020,2020-10-06 12:29:14.806831
1520604388,/v-printers-scanners-fax/city-of-toronto/syncotek-sp-pos58v-bluetooth-printer-for-skip-the-dishes/1520604388,199.0,SYNCOTEK SP-POS58V Bluetooth Printer for Skip The Dishes,,SYNCOTEK SP-POS58V Bluetooth printer for SKIP The Dishes This is a must have printer to help read online orders and eliminate order errors for any restaurants. We also carry Uber Eats and Door Dash ...,City of Toronto,28/08/2020,2020-10-06 12:29:14.807322
1509906859,/v-printers-scanners-fax/city-of-toronto/uber-eats-printer-by-star-tsp654-bluetooth/1509906859,530.0,UBER Eats Printer by STAR TSP654 Bluetooth,,Brand NEW! This is a must have STAR Micronics Bluetooth printer for any restaurant using Uber EATS tablet. Eliminate order errors and improve efficiency for your staff. Same day pick up in GTA.,City of Toronto,28/08/2020,2020-10-06 12:29:14.807822
1520598301,/v-printers-scanners-fax/city-of-toronto/printer-scanner-all-in-1-brother-mfc-j430w-works-great/1520598301,20.0,"Printer, Scanner All in 1 Brother MFC J430W works great",,"Printer, Scanner All in 1 Brother MFC J430W wifi works great & HP office jet 6500 wireless printer for sale. May need ink fill. $20 each. Also have Sony monitor 4 video input model that power up but ...",City of Toronto,28/08/2020,2020-10-06 12:29:14.808369
1520592973,/v-printers-scanners-fax/city-of-toronto/tp-link-archer-c9-ac1900-wireless-dual-band-gigabit-router/1520592973,80.0,TP-Link (Archer C9) AC1900 Wireless Dual Band Gigabit Router,,"CAD$80/USD$65+Shipping. Pricing is Final. Selling an Archer C9 AC1900 Wireless Dual Band Gigabit Router with Beamforming from TP-Link. Built by a market leader in Wi-Fi and home networking equipment, ...",City of Toronto,28/08/2020,2020-10-06 12:29:14.808869
1294224599,/v-printers-scanners-fax/city-of-toronto/brand-new-updated-direct-to-garment-dtg-flat-bed-printer/1294224599,5499.0,Brand NEW Updated Direct to Garment (DTG) Flat Bed Printer,,"Direct To Garment (DTG) 6-Color Printer Machine. Printing Technology: Epson 6-color advanced MicroPiezo inkjet technology (Japan) - Super high resolution 5760 x 1440 dpi - Printing area 13"" x 19"" ...",City of Toronto,28/08/2020,2020-10-06 12:29:14.809478
1216152401,/v-printers-scanners-fax/city-of-toronto/new-sublimation-printer-ciss-400-ml-sublimation-ink/1216152401,379.0,New Sublimation printer +CISS+ 400 ml sublimation ink,,"Sublimation Printer, Ink, Bulk Ink System We sell two models of sublimation printer bundles including CISS and 400 ml ink. The printers are 4-color printers with perfect colour match. There are two ...",City of Toronto,28/08/2020,2020-10-06 12:29:14.810360
1295517817,/v-printers-scanners-fax/city-of-toronto/dye-sublimation-printer-bundles-regular-size-and-13-x19-size/1295517817,379.0,"Dye-Sublimation Printer Bundles (Regular size and 13""x19"" size)",,"Dye-Sublimation Bundles (different Models and different sizes) for T-shirt transfers (polyesters), Mugs and phone cases transfers. We also carry printer bundles for cotton T-shirts. Please call or ...",City of Toronto,28/08/2020,2020-10-06 12:29:14.811038
1295517266,/v-printers-scanners-fax/city-of-toronto/bulk-ink-refillable-cartridges-ciss-cis-for-epson-canon-hp/1295517266,6.99,"Bulk Ink, Refillable Cartridges / CISS, CIS for Epson Canon HP",,"Bulk ink (dye, pigment, sublimation, eco-solvent inks) for desktop and large format printers: Epson / Canon / HP / Brother. We also carry Refillable Cartridges and Continuous INK System (CISS, CIS) ...",City of Toronto,28/08/2020,2020-10-06 12:29:14.811908
1277911837,/v-printers-scanners-fax/city-of-toronto/epson-t220-ciss-wf-2630-wf-2750-xp-320-bulk-ink/1277911837,84.0,"Epson T220 CISS   WF-2630 WF-2750 XP-320....., Bulk Ink",,"New Continuous Ink Supply System CISS for EPSON T220 T220XL Printers with Latest Autoreset Chip! Suitable with using BULK Dye INK, SUBLIMATION INK, and Pigment Inks. Compatible Printer models: ...",City of Toronto,28/08/2020,2020-10-06 12:29:14.812408
1215933161,/v-printers-scanners-fax/city-of-toronto/epson-artisan-1430-1400-continuous-ink-system-bulk-ink-t079/1215933161,65.0,"Epson Artisan 1430, 1400, Continuous Ink System, Bulk Ink, T079",,Continuous Ink Supply System CISS for EPSON Printer Compatible with: Epson Stylus Photo 1400 Inkjet Printer Epson Artisan 1430 Inkjet Printer Cartridge Number(s): T0791 Black Refillable Cartridge ...,City of Toronto,28/08/2020,2020-10-06 12:29:14.812995
1289740698,/v-printers-scanners-fax/city-of-toronto/eco-solvent-ink-for-epson-printhead-ciss-bulk-ink/1289740698,19.0,"Eco-Solvent Ink for Epson Printhead, CISS, Bulk Ink",,"If you want to print on plastics or vinyls or solvent T-shirt, they can only be printed with a solvent printer, such as the Roland, Mimaki, Mutoh...The Eco-solvent ink in desktop printers can print ...",City of Toronto,28/08/2020,2020-10-06 12:29:14.813518
1215954567,/v-printers-scanners-fax/city-of-toronto/epson-r3000-continuous-ink-system-ciss-refillable-bulk-ink/1215954567,89.0,"Epson R3000 Continuous Ink System, CISS, Refillable, Bulk Ink",,Continuous Ink Supply System CISS for EPSON Printer. Compatible with: R3000 Cartridge Number(s): T1571 X1 PHOTO BLACK T1572 X1 CYAN T1573 X1 MAGENTA (vivid) T1574 X1 YELLOW T1575 X1 LIGHT CYAN T1576 ...,City of Toronto,28/08/2020,2020-10-06 12:29:14.814109
1476983935,/v-printers-scanners-fax/city-of-toronto/dye-sublimation-ink-ciss-system-kit-for-epson-c88-c88/1476983935,129.99,Dye Sublimation Ink CISS System Kit for Epson C88+ C88,,"The CISS kit is prefilled with 400ml dye-sublimation ink, 100ml for each color. Works for polyester fabrics (at least 50% polyester), Hard Sublimation Blanks: Ceramic Mugs, Cups, Glasses, Tiles, ...",City of Toronto,28/08/2020,2020-10-06 12:29:14.814669
1487271918,/v-printers-scanners-fax/city-of-toronto/brother-ink-cartridges-lc-75c-lc-75y-yellow-cyan-xl-lc-75m/1487271918,14.0,Brother Ink Cartridges LC 75c / LC 75Y Yellow / Cyan XL / LC 75M,,"Two ink cartridges packages of Brother LC 75c XL Cyan color, one of the 2 packages foil has been opened but ink cartridge has never been used, asking $ 5.00 for unopened and $4.00 for open. Expiry ...",City of Toronto,28/08/2020,2020-10-06 12:29:14.815235
1520580475,/v-printers-scanners-fax/city-of-toronto/epson-ink-free/1520580475,0.0,Epson ink free,,Pls see the pictures They are expired not sure if they r still good. Giving out for FREE!!! If you need them get them.,City of Toronto,28/08/2020,2020-10-06 12:29:14.815978
1501302580,/v-printers-scanners-fax/city-of-toronto/canon-cartridge-a30-black/1501302580,30.0,Canon Cartridge A30 Black,,"New never open the box Canon A30 Cartridge Black ,this is GENUINE from Canon . Asking $30",City of Toronto,28/08/2020,2020-10-06 12:29:14.817375
1499935279,/v-printers-scanners-fax/city-of-toronto/hp-laserjet-cartridge-98a/1499935279,35.0,HP Laserjet Cartridge 98A,,Open Box unused toner cartridge. Brand new,City of Toronto,27/08/2020,2020-10-06 12:29:14.818208
1499969043,/v-printers-scanners-fax/city-of-toronto/nec-p7-dot-matrix-printer/1499969043,25.0,NEC P7 dot matrix printer.,,NEC P7 Dot Matrix Printer. Cannot confirm if it works or not. So selling as is. Include 2 original ribbons.,City of Toronto,27/08/2020,2020-10-06 12:29:14.818779
1499622085,/v-printers-scanners-fax/city-of-toronto/brother-tn-250-toner-cartridge/1499622085,50.0,Brother TN - 250   Toner Cartridge,,"For use with FAX-2800, FAX-2900, FAX-3800 as well as MFC-4800, MFC-6800, & DCP-1000 Regular retail price is $65. Firm asking price of $50. Convenient central location for your pickup",City of Toronto,27/08/2020,2020-10-06 12:29:14.819547
1520531036,/v-printers-scanners-fax/city-of-toronto/printer/1520531036,80.0,Printer,,"Epson XP-4100 all in one ink jet printer . 80 $ or best offer. Located downtown. Bought few months ago, comes with colour inks(new) except black ink you will have to purchase.",City of Toronto,27/08/2020,2020-10-06 12:29:16.540619
1520503431,/v-printers-scanners-fax/city-of-toronto/black-hp-ink-cartridge/1520503431,10.0,Black HP ink cartridge,,I had to give my printer away but had extra black ink that was unused.,City of Toronto,27/08/2020,2020-10-06 12:29:16.541122
1450605348,/v-printers-scanners-fax/city-of-toronto/pixma-canon-mx432/1450605348,80.0,pixma canon MX432,,Works perfectly. only needs ink. You will get your money back if anything wrong. COPY FAX SCAN and PRINTER all at once,City of Toronto,27/08/2020,2020-10-06 12:29:16.541623
1520497397,/v-printers-scanners-fax/city-of-toronto/hp-color-laserjet-1600-printer-in-excellence-condition-working/1520497397,120.0,"HP Color Laserjet 1600 Printer, in excellence condition working",,"HP Color Laserjet 1600 Printer, in excellence condition working condition,. The printer is installed with all 4r cartridges. used only a few time good for student or small business $120 or best offer",City of Toronto,27/08/2020,2020-10-06 12:29:16.542212
1520459163,/v-printers-scanners-fax/city-of-toronto/hp-laserjet-1320-laser-printer-original-hp-toner/1520459163,100.0,HP LaserJet 1320 Laser Printer + Original HP Toner,,"-Rarely used HP Laser jet printer. (No scratches or bend) -Comes with brand new black & white ink cartage. -For more details, please visit our store at 2700 kipling avenue, unit 4,Etobicoke or call ...",City of Toronto,27/08/2020,2020-10-06 12:29:16.542814
