,url,price,title,distance,description,location,time_offset,retreived
1525456418,/v-laptops/city-of-toronto/selling:-microsoft-surface-book-2-13/1525456418,1600.0,"Selling: Microsoft Surface Book 2 13""",,"Selling new unopened Microsoft Surface Book 2! Specs: 13"", 8GB Intel Core i5 Processor, 256GB HD, Go RAM 8GB",City of Toronto,21/09/2020,2020-10-07 17:44:12.781771
1525450525,/v-laptops/city-of-toronto/surface-pro-4-i5-cpu-4gb-ram-128gb-ssd-with-alcantara-kb/1525450525,550.0,"Surface Pro 4 - i5 CPU, 4GB RAM, 128GB SSD with Alcantara KB",,Surface Pro 4 in very good condition i5-6300 CPU 4GB RAM 128GB SSD Alcantara Signature Type Cover in Platinum Battery remains in excellent health with only a cycle count of 182. Includes Windows 10 ...,City of Toronto,21/09/2020,2020-10-07 17:44:12.782352
1525443052,/v-laptops/city-of-toronto/microsoft-surface-go-128gb-8gb-ram/1525443052,600.0,Microsoft Surface Go 128GB / 8GB RAM,,"Selling a Microsoft Surface Go Tablet with 128GB / 8GB RAM / Intel 4415Y / Wifi I use my apple products more often so I just don't need this. Perfect condition, no scratches or dents. Used maybe 5 ...",City of Toronto,21/09/2020,2020-10-07 17:44:12.782873
1525344822,/v-laptops/city-of-toronto/early-2014-macbook-air-13-inch/1525344822,400.0,Early 2014 MacBook Air 13 Inch,,"MacBook Air (13-inch, Early 2014) Processor: 1.4 GHz Intel Core i5 Memory: 4 GB 1600 MHz DDR3 Works well, minor scratching, already wiped. Also includes the laptop charger.",City of Toronto,21/09/2020,2020-10-07 17:44:12.783412
1525435769,/v-laptops/city-of-toronto/toshiba-15-hd-laptop-intel-quad-2-10ghz-8gbram-500hd-windows-10/1525435769,375.0,"Toshiba 15"" HD laptop Intel Quad 2.10ghz 8gbRam 500hd Windows 10",,"Toshiba 15.6inch LED High Definition Laptop, Intel Quad Core 2.16ghz N3530 64bit, 8gbram DDR3 - 12800s, 500 gig hard drive sata - 5400rpm, Full size qwerty keyboard, HD Webcam, WiFi ready, Bluetooth ...",City of Toronto,21/09/2020,2020-10-07 17:44:12.783936
1525429788,/v-laptops/city-of-toronto/macbook-pro-retina-13-2015-super-clean/1525429788,950.0,MacBook Pro Retina 13” 2015 - Super Clean!,,"I am selling my super clean MacBook Pro (Retina, 13 inch, 2015) for $950. Following is the specs: - processor: 2.7 GHz Dual-Core Intel i5 - memory: 8GB DDR3 - graphics: Intel iris 6100 - Macintosh ...",City of Toronto,21/09/2020,2020-10-07 17:44:12.784427
1525422252,/v-laptops/city-of-toronto/15-case-macbook-pro-2015-brand-new/1525422252,20.0,"15"" case macbook pro 2015 brand new.",,"15"" case macbook pro 2015 brand new. . Posted in computers, laptops in City of Toronto. September 21, 2020",City of Toronto,21/09/2020,2020-10-07 17:44:12.784916
1525419416,/v-laptops/city-of-toronto/toshiba-satellite-l510/1525419416,150.0,Toshiba Satellite L510,,I have a laptop in excellent working condition. Looking to get rid of it asap for about $150. Please call or text at 6475631343,City of Toronto,21/09/2020,2020-10-07 17:44:12.785402
1525406178,/v-laptops/city-of-toronto/lenovo-y700-gaming-laptop-i7-2-6ghz-16gb-ram-gtx-960m/1525406178,795.0,Lenovo Y700 Gaming Laptop i7 2.6GHz 16GB Ram GTX 960M,,Lenovo Y700 Gaming Laptop i7 2.6GHz 16GB Ram 128GB SSD hard drive 500GB HDD(storage) Nvidia GTX 960M 2GB Video Card 15.5” Screen Small Faint white spot/streak in middle of screen Item #1267924 See ...,City of Toronto,21/09/2020,2020-10-07 17:44:12.785935
1525402104,/v-laptops/city-of-toronto/2017-macbook-pro-15-2-9ghz-16gb-512ssd-apple-care/1525402104,2300.0,"2017 MacBook Pro 15"", 2.9Ghz, 16GB, 512SSD + Apple Care",,"MacBook Pro (15-inch, 2017) 512GB SSD 2.9 GHz Quad-Core Intel Core i7 16 GB 2133 MHz LPDDR3 Radeon Pro 560 4 GB Intel HD Graphics 630 1536 MB + Apple Care until February 2021 (any problem, they fix ...",City of Toronto,21/09/2020,2020-10-07 17:44:14.786020
1525399755,/v-laptops/city-of-toronto/np-n145-plus-netbook-10-screen/1525399755,80.0,"NP N145 plus netbook 10"" screen",,Works fine or your money back. Specs as seen here: https://www.cnet.com/products/samsung-n145-plus-10-1-atom-n455-1-gb-ram-250-gb-hdd/,City of Toronto,21/09/2020,2020-10-07 17:44:14.786599
1513511354,/v-laptops/city-of-toronto/quality-performing-laptop-for-sale/1513511354,130.0,Quality performing laptop for sale,,"(Price is negotiable) Gateway windows 7 laptop, with features: - Intel Pentium processor T4500 - 15.6"" 16:9 HD LED LCD - 320 GB HDD - 3 GB DDR3 Memory - DVD Super Multi DL drive - webcam - Multi-in-1 ...",City of Toronto,21/09/2020,2020-10-07 17:44:14.787155
1525395036,/v-laptops/city-of-toronto/surface-book-15-inch-i7/1525395036,2000.0,Surface Book 15 inch i7,,"RETAILED AT $4649 New Microsoft Surface Book i7- 8650 CPU 15 Inches NVIDIA 1060GTX 16GB Ram 512GB SSD Buying a gaming PC so looking to recoup as much funds back as possible, have the receipt and ...",City of Toronto,21/09/2020,2020-10-07 17:44:14.787702
1494610383,/v-laptops/city-of-toronto/dell-inspiron-700m/1494610383,55.0,Dell Inspiron 700m,,Dell Inspiron 700m computer. Working with power cod. Battery is dead so have to use with power or you can change battery ( it's approx $25 - 40 ) 416 230 9881,City of Toronto,21/09/2020,2020-10-07 17:44:14.788321
1525381105,/v-laptops/city-of-toronto/hp-g60-laptop-amd-athlon-ql-60-4gb-ram-windows-10/1525381105,80.0,HP G60 laptop AMD Athlon QL-60 4GB RAM Windows 10,,Selling HP laptop- HP G60 AMD Athlon QL-60 Dual core processor 4GB RAM 160GB Hard drive Nvidia GeForce 8200 M Windows 10 Pro DVD-RW drive Wifi N HDMI and VGA ports BATTERY DOES NOT HOLD A CHARGE,City of Toronto,21/09/2020,2020-10-07 17:44:14.788872
1525380714,/v-laptops/city-of-toronto/hp-envy-13-2020-model-macos-read/1525380714,1500.0,HP Envy 13 (2020 Model) macOS *READ*,,"GPU: MX250 CPU: I7 10510U storage: 256GB SSD Ram: 16GB DDR4 Display: 4K Please contact for more information. This is an excellent but I'm more interested in getting a mac. However, I have installed ...",City of Toronto,21/09/2020,2020-10-07 17:44:14.789369
1525377201,/v-laptops/city-of-toronto/macbook-pro-13-2015/1525377201,800.0,MacBook Pro 13’ 2015,,"MacBook Pro retina, 13 inch early 2015. 2.7 GHz Intel i5. 8 GB ram. 256G. Good condition but little scratches.",City of Toronto,21/09/2020,2020-10-07 17:44:14.789888
1525376933,/v-laptops/city-of-toronto/computer/1525376933,110.0,Computer,,Thosiba computer works great for school and no scratches almost brand new comes with a computer case all of the information is the pictures of the laptop,City of Toronto,21/09/2020,2020-10-07 17:44:14.790498
1525376819,/v-laptops/city-of-toronto/macbook-pro-retina-15-inch-intel-core-i7-16gb-ram-256gb-ssd/1525376819,899.0,MacBook Pro Retina 15-inch Intel Core i7/16GB RAM/256GB SSD,,"MacBook Pro Retina 15-inch Intel Core i7/16GB RAM/256GB SSD Used / 30 Days Warranty For question please call 647 762 2610 SOS Computers Sales and Repairs Center 785 Lakeshore Road East, Mississauga, ...",City of Toronto,21/09/2020,2020-10-07 17:44:14.791090
1525375965,/v-laptops/city-of-toronto/apple-macbook-air-2014-intel-core-i7-8-0gb-ram-256gb-ssd/1525375965,650.0,Apple MacBook Air 2014 Intel Core i7/8.0GB RAM/256GB SSD,,"Apple MacBook Air 2014 Intel Core i7/8.0GB RAM/256GB SSD Used / 30 Days Warranty For question please call 647 762 2610 SOS Computers Sales and Repairs Center 785 Lakeshore Road East, Mississauga, ON, ...",City of Toronto,21/09/2020,2020-10-07 17:44:14.791612
1525369419,/v-laptops/city-of-toronto/mac-book-pro-for-sale/1525369419,500.0,Mac Book Pro For sale,,"MacBook Pro (13-inch, Mid 2012) (NO trades NO shipping) MacOS Catalina Processor 2.9 GHz Dual Core intel core i7 Memory 8 GB 1600 MHz DDR3 750 SSD Graphics intel HD graphics 4000 1536 MB Smart card ...",City of Toronto,21/09/2020,2020-10-07 17:44:14.792110
1525372015,/v-laptops/city-of-toronto/on-hold-msi-gs43vr-7re-14-gaming-laptop-gtx-1060-6gb/1525372015,900.0,"ON HOLD -- MSI GS43VR 7RE 14"" Gaming Laptop GTX 1060 6GB",,Recently serviced by official MSI repair center. Works flawlessly. Message me for pictures or to answer your questions. Price negotiable. See here for specs: ...,City of Toronto,21/09/2020,2020-10-07 17:44:14.792680
1524556394,/v-laptops/city-of-toronto/macbook-pro-retina-15-inch-mid-2014-256gb/1524556394,850.0,"Macbook Pro (Retina 15 inch, Mid-2014 - 256gb",,"Great condition. Fast and no lag. Completly reset to factory setting. OS Catalina installed. One dead pixel on the screen but it goes unnoticed. Comes with charger. Located near Spadina and Front st, ...",City of Toronto,21/09/2020,2020-10-07 17:44:14.793178
1525364957,/v-laptops/city-of-toronto/new-in-warranty-lenovo-thinkpad-t480s-14-laptop-for-sale/1525364957,800.0,"New in Warranty Lenovo ThinkPad T480s (14"") Laptop for sale",,"ThinkPad T480s (14"") Laptop 2 Years Warranty Microsoft Office 2016 Activated Adobe Full Suite Activated Intel Core i5-8250U CPU 64 bit Windows 10 Professional 8 GB RAM",City of Toronto,21/09/2020,2020-10-07 17:44:14.793673
1525364773,/v-laptops/city-of-toronto/razer-blade-15-rtx2070-240hz-model/1525364773,2650.0,Razer Blade 15 Rtx2070/240hz model,,Full specs on photos 10/10 condition Purchased in april 2020 Dbrand skin protected since day 1,City of Toronto,21/09/2020,2020-10-07 17:44:14.794233
1525356388,/v-laptops/city-of-toronto/15-inch-macbook-pro-2019-save-800-compared-to-new/1525356388,2900.0,15-inch MacBook Pro 2019 - Save $800 compared to new!,,Lightly used .. Comes with blue/gold marble protective decal cover which can be peeled off if desired. Comes with AppleCare which expires September 2022. Includes original box.,City of Toronto,21/09/2020,2020-10-07 17:44:14.794735
1525349119,/v-laptops/city-of-toronto/lenovo-laptop/1525349119,200.0,Lenovo Laptop,,B50 Lenovo Laptop works perfectly fine Good condition Will come cleaned and (Stickers are covering logo sorry) Comes with charger and laptop bag,City of Toronto,21/09/2020,2020-10-07 17:44:14.795224
1525332434,/v-laptops/city-of-toronto/early-2015-macbook-pro-retina-display/1525332434,1000.0,Early 2015 MacBook Pro Retina Display,,MacBook Pro Retina Display 13” Early 2015 Processor: 2.7 GHz Intel Core i5 Memory: 8GB DDR3 Storage: 256GB Great condition - getting rid of it because I got a new laptop from work. Operating System ...,City of Toronto,21/09/2020,2020-10-07 17:44:14.795759
1525332404,/v-laptops/city-of-toronto/macbook-pro-15-inch-retina-display/1525332404,950.0,Macbook pro 15 inch retina display,,Macbook pro 15 inch Inter i7 2.3 Ghz 8GB memory 256 SSD Graphic nVidia GeForce GT 650M Asking $950,City of Toronto,21/09/2020,2020-10-07 17:44:14.796412
1525325162,/v-laptops/city-of-toronto/selling-a-lenovo-thinkpad-w520-core-i7-laptop/1525325162,500.0,"Selling a Lenovo ThinkPad W520 core
 i7 Laptop",,"I'm selling a 15 inch Lenovo ThinkPad W520 in good condition. Core i7 16GB Ram 500GB Hard drive Windows 7 Asking $500.00 firm. For an extra $20 I can put Windows 10, and Office 2019. Comes with ...",City of Toronto,21/09/2020,2020-10-07 17:44:14.797348
1525321982,/v-laptops/city-of-toronto/macbook-pro-2012/1525321982,500.0,Macbook Pro 2012,,Selling Macbook Pro Mid 2012 Model A1398 Perfect for surfing the web and watching movies It is working fine but there is a damage on the screen (shown in the picture) Has some scratches which is ...,City of Toronto,21/09/2020,2020-10-07 17:44:14.797918
1525319985,/v-laptops/city-of-toronto/hp-15-laptop-phenom-ii-red-laptop-4gbram-250hdd-hdmi-webcam-10/1525319985,269.0,"hp 15"" laptop Phenom II Red laptop 4gbRam 250hdd HDMI Webcam 10",,"hp 15.6"" HD Laptop, Phenom II 960 Quad Core 1.80ghz 64bit processor, 4gb Ram 250 hdd, HDMI ready, HD Webcam ready, DVD writer ready, SD card reader ready, Dark red laptop Windows 10 64bit / Google ...",City of Toronto,21/09/2020,2020-10-07 17:44:14.798416
1525319395,/v-laptops/city-of-toronto/asus-15-6-hd-laptop-intel-core-i5-5th-12gbram-256ssd-windows-10/1525319395,499.0,"ASUS 15.6"" HD laptop Intel Core i5 5th 12gbRam 256ssd Windows 10",,"ASUS 15.6"" HD Laptop Intel Core i5 2.20ghz / 2.70ghz 12 gb Ram 256 SSD HDMI USB 3.0 ports ready 15.6"" HD screen 1366 x 768 resolution, Intel HD graphics 5500, HD camera, Realtek WiFi Laptop is in ...",City of Toronto,21/09/2020,2020-10-07 17:44:14.798903
1525318565,/v-laptops/city-of-toronto/asus-15-hd-laptop-amd-64bit-4gbram-250hdd-windows-10-64bit/1525318565,275.0,"ASUS 15"" HD laptop AMD 64bit 4gbRam 250hdd Windows 10 64bit",,"ASUS 15.6"" HD Laptop, E-450 1.65ghz 64bit processor 4gbram 250HDD, HDMI, VGA, WiFi Full size keyboard, Dvdwriter dual layer, Brand new Battery ASUS model # K53U AMD E-350 1.65GHZ 64bit processor 4 ...",City of Toronto,21/09/2020,2020-10-07 17:44:14.799408
1525313421,/v-laptops/city-of-toronto/macbook-pro-in-neat-condition/1525313421,1200.0,Macbook pro in neat condition,,"I have a neat condition MacBook pro with 16GB Ram,512 SSD, retina display, battery charge cycle only 140 times as you can see on pictures, it works like new and no faults at all.",City of Toronto,21/09/2020,2020-10-07 17:44:14.799924
1501171792,/v-laptops/city-of-toronto/brand-new-lenovo-laptop-backpack-by-targus-bnib/1501171792,20.0,Brand new Lenovo laptop backpack by Targus- BNIB,,"Brand new padded protective laptop backpack with a nice organizer pocket. Dark green and black. If the listing is still up, the items are still available. I delete my postings once an item has been ...",City of Toronto,21/09/2020,2020-10-07 17:44:14.800440
1397485941,/v-laptops/city-of-toronto/hp-elitebook-2540p-combo/1397485941,499.0,Hp Elitebook 2540p combo,,Selling very well maintained Laptop with accessories and extra's SPECS: HP Elitebook 2540p Intel Core i7 CPU L640 @2.13GHz 6GB RAM 160GB HDD 12.1-inch WXGA anti-glare (1280 x 800) DVD+/-RW optical ...,City of Toronto,21/09/2020,2020-10-07 17:44:14.800934
1510954947,/v-laptops/city-of-toronto/lenovo-t440s-laptop-256-ssd-touch-screen-1920x1080/1510954947,415.0,"Lenovo T440S laptop 256 SSD, Touch Screen,1920x1080",,Lenovo T440S laptop for sale Screen size 14-inch Intel Core i5-4300u CPU 4GB DDR3 RAM 256 SSD Asking $425,City of Toronto,21/09/2020,2020-10-07 17:44:14.801425
1525247620,/v-laptops/city-of-toronto/asus-tuf-gaming-laptop-ryzen-7-4800h-512gb-ssd-16gb-gtx-1660ti/1525247620,1200.0,ASUS TUF Gaming Laptop (Ryzen 7 4800H/512GB SSD/16GB/GTX 1660Ti),,"Bought this laptop about a month ago and I've used it a total of (3 times) Instead of letting it sit in the box being wasted I might as well let someone else enjoy it, this things a gaming beast, ...",City of Toronto,21/09/2020,2020-10-07 17:44:14.801919
1525295372,/v-laptops/city-of-toronto/dell-xps-15-9560/1525295372,1400.0,Dell XPS 15 9560,,"DELL XPS 15 9560 I7-7700 16GB RAM 512GB SSD Nvidia GTX 1050 dedicated graphics card Perfect condition, new battery https://www.dell.com/en-us/shop/cty/pdp/spd/xps-15-9560-laptop Selling because I ...",City of Toronto,21/09/2020,2020-10-07 17:44:14.802419
1267666137,/v-laptops/city-of-toronto/quad-core-chromebook-with-free-extras/1267666137,170.0,quad core Chromebook with free extras,,"Used quad core 11.6"" Chromebook for for sale. It's in excellent physical and working condition. Comes with a carrying case, power adapter AC cord, and even a new wireless mouse for free to help you ...",City of Toronto,21/09/2020,2020-10-07 17:44:14.802990
1525275128,/v-laptops/city-of-toronto/asus-ultrabook-laptop-with-a-detachable-battery/1525275128,370.0,ASUS ultrabook laptop with a detachable battery,,ASUS ultrabook laptop with a detachable battery Excellent condition Rarely used Comes with everything that came with the laptop including the box,City of Toronto,21/09/2020,2020-10-07 17:44:14.803533
1525272059,/v-laptops/city-of-toronto/dell-laptop/1525272059,500.0,Dell laptop,,Selling dell laptop message for details,City of Toronto,21/09/2020,2020-10-07 17:44:14.804394
1525262440,/v-laptops/city-of-toronto/looking-for-brand-new-sealed-macbook-pro-and-macbook-air/1525262440,9999.0,"Wanted:
                            Looking for brand new sealed MacBook Pro and MacBook Air!",,"Looking to buy brand new in sealed box only MacBook Pro and MacBook Air any model, I would pay cash for it right away! Please contact me by text message or email only if you have one for sale!",City of Toronto,20/09/2020,2020-10-07 17:44:18.736047
1525262206,/v-laptops/city-of-toronto/huawei-matebook-13-2k-screen-i5-512-ssd/1525262206,880.0,Huawei Matebook 13 (2K screen/i5/512 SSD),,"Huawei MateBook 13 2019, Dark Grey (mint condition). 13in 2K screen/ GeForce MX150 / i5 / 8GB RAM / 512GB SSD / Win 10 Home Laptop. With a 13-inch 2K FullView Display,1 the HUAWEI MateBook 13 ...",City of Toronto,20/09/2020,2020-10-07 17:44:18.736579
1443210598,/v-laptops/city-of-toronto/asus-vivobook-pro-n850_i7-8750h-6-core_16gb-256gb_gtx-1050-4k/1443210598,1500.0,"Asus VivoBook Pro N850_i7 8750H 6 core_16gb, 256gb_GTX 1050 4K",,"Asus VivoBook Pro N580VD; https://www.asus.com/ca-en/Laptops/ASUS-VivoBook-Pro-15-N580VD/ i7 8570H 8th generation 6 core cpu; 16gb ram, 256gb SSD + 1 TB hard drive; Nvida GTX 1050 video; 4K touch ...",City of Toronto,20/09/2020,2020-10-07 17:44:18.737070
1525256825,/v-laptops/city-of-toronto/alienware-15-r2/1525256825,650.0,Alienware 15 R2,,"Alienware 15 R2, i7-6700HQ-16G DDR4 RAM 2133MHz - 256G PCIe SDD+1TB - NVIDIA GTX 970M 3G - Win10 Home 64-bit (English) With Razer mouse.",City of Toronto,20/09/2020,2020-10-07 17:44:18.737599
1504033212,/v-laptops/city-of-toronto/swissgear-laptop-bag-light-classic-black/1504033212,10.0,swissgear laptop bag light classic black,,"16"" width x 13 tall x 7 depth Made of Neoprene Holds a 15 inch laptop Quick-access, front slip pocket for frequently needed items long strap for over the shoulder and short straps for carrying In ...",City of Toronto,20/09/2020,2020-10-07 17:44:18.738087
1525249181,/v-laptops/city-of-toronto/macbook-pro-15-mid-2014-i7-16gb-512-750m-iris-pro/1525249181,1100.0,"Macbook Pro 15""(Mid 2014) - i7/16GB/512/750m & Iris Pro",,"Selling my Macbook Pro, bought it off a friend about 2 years ago. Comes with 85W Charger w/ extension cord. The laptop is running Mac OS Mojave (new OS doesn't support 32-bit apps/plugins). Still a ...",City of Toronto,20/09/2020,2020-10-07 17:44:18.738571
1525242188,/v-laptops/city-of-toronto/msi-gl75-9sfk-gaming-laptop-rtx-2070/1525242188,1750.0,Msi GL75 9SFK Gaming laptop (rtx 2070),,Laptop is few months old. Reason for selling is I don't use it anymore. Model: GL75 9SFK-1228CA Specs are... Graphics card: Nvidia GeForce RTX 2070 Processor: intel(R) Core(TM) i7-9750H CPU: 2.60GHz ...,City of Toronto,20/09/2020,2020-10-07 17:44:18.739053
1384467239,/v-laptops/city-of-toronto/sony-vaio-15-5-inch-touchscreen-laptop/1384467239,600.0,Sony Vaio 15.5-Inch Touchscreen Laptop,,Sony VAIO SVF15A16CXB 15.5-Inch Touchscreen Laptop (Black) -2.0 GHz Intel Core i7-3537U Processor -8 GB DDR3L SDRAM -1600 MHz Memory Speed -1000 GB Hybrid Hard Drive -Intel HD Graphics 4000 -Windows ...,City of Toronto,20/09/2020,2020-10-07 17:44:18.739549
1525221953,/v-laptops/city-of-toronto/2006-macbook/1525221953,100.0,2006 MacBook,,Recently wiped and unable to download OS software as I think it’s locked to someone’s Apple ID. Could take it to a store to get new software or could be used for parts. No problems otherwise.,City of Toronto,20/09/2020,2020-10-07 17:44:18.740042
1525220325,/v-laptops/city-of-toronto/laptop/1525220325,200.0,Laptop,,"Mint condition, brand new",City of Toronto,20/09/2020,2020-10-07 17:44:18.740527
1525139494,/v-laptops/city-of-toronto/thinkpad-lenovo-t520-i7-8gb-ram/1525139494,350.0,ThinkPad Lenovo T520 i7 8Gb Ram,,"Perfect conditions, windows 10 activated. Include charger.",City of Toronto,20/09/2020,2020-10-07 17:44:18.741010
1525161088,/v-laptops/city-of-toronto/macbook-air-13/1525161088,500.0,MacBook Air 13”,,MacBook Air 13” - Mid 2013 - 1.3GHz Core i5 - 4G 1600 MHz DDR3 - 256G SSD - Comes with original charger/ battery - In good shape / no scratches,City of Toronto,20/09/2020,2020-10-07 17:44:18.741495
1525215105,/v-laptops/city-of-toronto/computer/1525215105,700.0,Computer,,It is a great colour laptop it is a 2gb ram laptop Operating system is windows 10,City of Toronto,20/09/2020,2020-10-07 17:44:18.741977
1525211970,/v-laptops/city-of-toronto/computer/1525211970,700.0,Computer,,It is a used latptop. With an internal memory of 2gb RAM IT IS A GREY LAPTOP WIth AN OPERATING SYSTEM Windows 10 in good working condition,City of Toronto,20/09/2020,2020-10-07 17:44:18.742462
1525208908,/v-laptops/city-of-toronto/laptop/1525208908,250.0,Laptop,,Mint Asus laptop 2 year old laptop has never been used.,City of Toronto,20/09/2020,2020-10-07 17:44:18.742943
1525208740,/v-laptops/city-of-toronto/apple-macbook-pro-late-2011-500gb/1525208740,330.0,Apple MacBook Pro late 2011 500gb,,Selling my MacBook Pro as I have gotten a desktop and their is no need for it anymore. Physical condition is in great condition and the laptop works as it should and gets everything done. It was only ...,City of Toronto,20/09/2020,2020-10-07 17:44:18.743429
1512202363,/v-laptops/city-of-toronto/ibm-thinkpad-385ed-with-port-replicator-dock/1512202363,160.0,IBM Thinkpad 385ED with Port Replicator Dock,,"I'm selling an IBM Thinkpad 385ED from my collection. It's more powerful than the 380D and 380ED, good for retro gaming and VCD video. The computer is in excellent condition. There are very few flaws ...",City of Toronto,20/09/2020,2020-10-07 17:44:18.743912
1512201435,/v-laptops/city-of-toronto/ibm-thinkpad-380d-mint-condition/1512201435,140.0,IBM Thinkpad 380D (Mint Condition),,"I am selling an IBM Thinkpad 380D, this one from my collection is in the best condition. It is nearly completely flawless except for a scratch on the top cover. The computer functions perfectly. The ...",City of Toronto,20/09/2020,2020-10-07 17:44:18.744390
1512200308,/v-laptops/city-of-toronto/ibm-thinkpad-380d-pair/1512200308,100.0,IBM Thinkpad 380D (Pair),,I am selling a pair of IBM Thinkpad 380D from my collection. They are in good but somewhat damaged condition. The first one includes a DSTN screen and the CD drive tab is slightly bent. Other than ...,City of Toronto,20/09/2020,2020-10-07 17:44:18.744868
1512205628,/v-laptops/city-of-toronto/ibm-thinkpad-380ed/1512205628,120.0,IBM Thinkpad 380ED,,"I'm selling an IBM Thinkpad 380ED from my collection. This one is in excellent condition overall with a minor flaw on the screen. The screen is TFT. It is also capable of playing VCD-quality video, ...",City of Toronto,20/09/2020,2020-10-07 17:44:18.745348
1431227765,/v-laptops/city-of-toronto/lenovo-think-pad-x201/1431227765,1.0,Lenovo Think Pad X201,,"Lenovo Think Pad X201 Intel Core i5 - 540M CPU 4 GB RAM Screen: 12.1-inch Hard drive 300GB Windows 7 pro 64 bit Comes with power cord, the docking station port replicator. Asking $230 OBO Cash only. ...",City of Toronto,20/09/2020,2020-10-07 17:44:18.745827
1525197273,/v-laptops/city-of-toronto/acer-laptop-approx-5-yrs-old-with-17-inch-screen/1525197273,250.0,ACER LAPTOP  APPROX 5 YRS OLD WITH 17 INCH SCREEN,,works fine but need external keyboards works fine 4373459368 call dont text no late calls no bargaining if you want new go to a store not techy come see specs,City of Toronto,20/09/2020,2020-10-07 17:44:18.746282
1525191104,/v-laptops/city-of-toronto/smartphone-powered-laptop-anyware-phonebook/1525191104,250.0,Smartphone Powered Laptop - Anyware Phonebook,,"https://www.kickstarter.com/projects/johnsheng/phonebook-turn-any-smartphone-into-a-laptop-computer/description PhoneBook, a plug-in-and-play device that can turn ANY smartphone into a 15.6"" ...",City of Toronto,20/09/2020,2020-10-07 17:44:18.746767
1525189261,/v-laptops/city-of-toronto/lenovo-y50-gaming-laptop-i7-500gb-ssd-16gb-ram-good-battery/1525189261,525.0,Lenovo Y50 Gaming Laptop i7/500GB SSD/16GB RAM/Good Battery,,"PRICE IS FIRM, HAGGLERS WILL BE IMMEDIATELY BLOCKED. NO HOLDS, FIRST COME FIRST SERVE. Clean install of Win 10 Pro Activated (updates and graphics drivers installed), charger included. CPU: i7 4710HQ ...",City of Toronto,20/09/2020,2020-10-07 17:44:18.747251
1512206726,/v-laptops/city-of-toronto/thinkpad-advanced-dock-for-t60-t61-t400-t500-w500-etc/1512206726,200.0,"Thinkpad Advanced Dock (For T60, T61, T400, T500, W500 etc.)",,"Thinkpad Advanced Dock (Model # 250310U, For T60, T400, T500, W500, other Z and R series Thinkpads) PCI-Express slot is in the dock so you can insert a PCI-express graphics card, like an eGPU! (I ...",City of Toronto,20/09/2020,2020-10-07 17:44:18.747791
1525180978,/v-laptops/city-of-toronto/dell-p75f0001-intel-core-i3-8th-gen-8gbram-256ssd-touch-laptop/1525180978,425.0,Dell P75F0001 Intel Core i3 8th gen 8gbRam 256ssd touch laptop,,"Dell 15.6"" HD laptop Touchscreen laptop Intel Core i3 8th gen 8gbRam 256ssd touch laptop ****please note the laptop cover has scratches, bottom of the laptop has infused pad due to a decal**** laptop ...",City of Toronto,20/09/2020,2020-10-07 17:44:18.748281
1491208982,/v-laptops/city-of-toronto/dell-inspiron-3531-intel-cpu-500gb-hd-4gb-ram-2-16ghz-laptop/1491208982,280.0,"DELL Inspiron 3531 Intel CPU 500gb HD, 4Gb RAM 2.16Ghz Laptop",,"DELL Inspiron 3531 Intel CPU 500gb HD, 4Gb RAM 2.16Ghz Laptop Fresh Windows 10 installed , runs smooth 15inch, Like New condition suitable for students & individuals to work from home remotely Has a ...",City of Toronto,20/09/2020,2020-10-07 17:44:18.748766
1525170980,/v-laptops/city-of-toronto/acer-15-6-touchscreen-laptop/1525170980,549.0,"Acer 15.6"" touchscreen laptop",,"1 GB HDD with Window 10 Home Intel I5 7th Gen. 12 GB RAM, FULL TOUCH SCREEN Best Battery life. NO SCRACH 1.2 YEARS OLD.",City of Toronto,20/09/2020,2020-10-07 17:44:18.749249
