,url,price,title,distance,description,location,time_offset,retreived
1528472679,/v-stereo-systems-home-theatre/city-of-toronto/1971-vintage-pioneer-amplifier/1528472679,275.0,1971 VINTAGE PIONEER AMPLIFIER,,Beautiful Classic “Champagne face”Pioneer SA-600 Amplifier. 70 watts ch. Great condition. All switches Works perfect. Sounds perfect. $275 Firm Firm Price Will remove when sold.,City of Toronto,< 58 minutes ago,2020-10-07 17:36:37.269438
1528470358,/v-stereo-systems-home-theatre/city-of-toronto/sony-5-1-dolby-surround-receiver/1528470358,60.0,Sony 5.1 Dolby surround receiver,,Selling an excellent condition Sony 5.1 Dolby surround pro logic receiver. Perfect physical and working condition. No remote. Price is $60,City of Toronto,< 2 hours ago,2020-10-07 17:36:37.269939
1528465723,/v-stereo-systems-home-theatre/city-of-toronto/rca-home-theater-projector-new-rpj136/1528465723,80.0,RCA HOME THEATER PROJECTOR (NEW)(RPJ136),,RCA HOME THEATER PROJECTOR (NEW) (RPJ136) Check Out Our Other Listings We Are A Liquidation Warehouse Store Open Monday To Friday 11AM to 8PM CLOSED Weekends Contact Peter (416) 821-6222 FACEBOOK ...,City of Toronto,< 2 hours ago,2020-10-07 17:36:37.270486
1528463056,/v-stereo-systems-home-theatre/city-of-toronto/car-amplifier/1528463056,200.0,Car amplifier,,JBL grand touring mono amp Kenwood 640 watts for highs Runs excellent,City of Toronto,< 2 hours ago,2020-10-07 17:36:37.270976
1528458939,/v-stereo-systems-home-theatre/city-of-toronto/polk-audio-signa-s2-ultra-slim-soundbar-subwoofer-warranty/1528458939,119.0,Polk Audio Signa S2 Ultra-Slim Soundbar Subwoofer *Warranty,,Refurbished item with 30 days replacement warranty *Shipping is available via Purolator 2.1 channel sound bar gives you the in-home theatre experience you can't get from your TV's built-in speakers ...,City of Toronto,< 3 hours ago,2020-10-07 17:36:37.271484
1528458784,/v-stereo-systems-home-theatre/city-of-toronto/pioneer-sx-315-audio-channel-receiver-with-5-1-speakers/1528458784,100.0,Pioneer SX-315 Audio Channel Receiver with 5.1 speakers,,"100W Pioneer SX-315 Remote Control Audio Multi Channel Receiver with 5.1 speaker and subwoofer setup. Includes remote. Working, but the wire connections should be resetup",City of Toronto,< 3 hours ago,2020-10-07 17:36:37.271977
1528456961,/v-stereo-systems-home-theatre/city-of-toronto/polk-audio-true-surround-soundbar-subwoofer-rear-speakers-l-r/1528456961,139.0,Polk Audio True Surround Soundbar Subwoofer Rear speakers(L & R),,"Refurbished condition with 30 days warranty *Shipping via Purolator is available!!! The only 5.1 Channel Wireless Home Theatre System in this Incredible Price Range! Soundbar, Subwoofer & 2 pcs of ...",City of Toronto,< 3 hours ago,2020-10-07 17:36:37.272465
1528456262,/v-stereo-systems-home-theatre/city-of-toronto/technics-cassette-deck/1528456262,80.0,Technics cassette deck,,Model rs-m205 mint condition 2 heads playback/record very clean will take B/O,City of Toronto,< 3 hours ago,2020-10-07 17:36:37.273018
1528455499,/v-stereo-systems-home-theatre/city-of-toronto/polk-audio-magnifi-mini-soundbar-subwoofer-bluetooth-warranty/1528455499,159.0,Polk Audio Magnifi Mini Soundbar Subwoofer Bluetooth *Warranty,,Refurbished condition & 30 days replacement warranty *Shipping via Purolator is available!!! Room filling sound in an extremely compact size Bluetooth for Wireless Music Streaming Perfect for Bedroom ...,City of Toronto,< 3 hours ago,2020-10-07 17:36:37.273513
1528450341,/v-stereo-systems-home-theatre/city-of-toronto/akai-aa-1030-am-fm-receiver/1528450341,150.0,AKAI AA-1030 AM/FM receiver,,"AKAI AA-1030 AM/FM receiver with phono for $150 or best offer. Cosmetic and functions are in mint conditions. Tuning range: FM, MW Power output: 30 watts per channel into 8Ω (stereo) Frequency ...",City of Toronto,< 3 hours ago,2020-10-07 17:36:37.274111
1528444998,/v-stereo-systems-home-theatre/city-of-toronto/crosley-cruiser-record-player/1528444998,50.0,Crosley Cruiser Record player,,Used two times. Comes without a box. Bluetooth-compatible + portable vintage-inspired turntable housed in a UO-exclusive light grey faux leather briefcase from the experts at Crosley. This ...,City of Toronto,< 4 hours ago,2020-10-07 17:36:37.274605
1528443477,/v-stereo-systems-home-theatre/city-of-toronto/theater-solutions-cs43c-flush-mount-in-ceiling-3-way-speakers/1528443477,65.0,Theater Solutions CS43C Flush Mount In Ceiling  3-Way Speakers,,$60: FIRM This is brand new in box. 8 pairs available: $60 per Pair. Theater Solutions by Goldwood CS43C Flush Mount In Ceiling 2 Speaker Set Wide Sound Dispersion Designed Speakers easily integrate ...,City of Toronto,< 4 hours ago,2020-10-07 17:36:37.275093
1517604787,/v-stereo-systems-home-theatre/city-of-toronto/entertainment-system/1517604787,200.0,Entertainment System,,"Sony DVD Home Theatre System for wireless surround sound. 6 speakers total with remote to operate DVD / Compact Disc and TV. Excellent condition Located in Fenelon Falls, Ont.",City of Toronto,< 4 hours ago,2020-10-07 17:36:37.275627
1528436942,/v-stereo-systems-home-theatre/city-of-toronto/pioneer-pl-300-turntable/1528436942,200.0,PIONEER PL-300 TURNTABLE,,"PLEASE GIVE US A CALL FOR QUICK ANSWERS . WE DO NOT REGULARLY CHECK OUR MAILS SO CALLING IS YOUR BEST OPTION . Item is in good working condition . Come and see hundreds of items ( Vintage audio , led ...",City of Toronto,< 4 hours ago,2020-10-07 17:36:37.276118
1528435858,/v-stereo-systems-home-theatre/city-of-toronto/bose-lifestyle-v25-very-very-new/1528435858,899.0,Bose Lifestyle V25 (VERY VERY NEW),,Condition: basically brand new Wad a gift for my father years ago but we have not used it before,City of Toronto,< 5 hours ago,2020-10-07 17:36:37.276606
1528432302,/v-stereo-systems-home-theatre/city-of-toronto/yamaha-rx-v657-a-v-natural-sound-receiver-remote/1528432302,70.0,Yamaha RX-V657 A/V Natural Sound Receiver  + Remote,,Yamaha RX-V657 A/V Natural Sound Receiver original Remote plus Audio Tuning Mic. The unit is in overall good condition Works great,City of Toronto,< 5 hours ago,2020-10-07 17:36:37.277094
1528430706,/v-stereo-systems-home-theatre/city-of-toronto/audio-marantz/1528430706,1000.0,Audio Marantz,,Marantz 3800 preamp.Used but still pretty good and everything work good.please contact: 416.358.3785,City of Toronto,< 5 hours ago,2020-10-07 17:36:37.277642
1528429806,/v-stereo-systems-home-theatre/city-of-toronto/sonos-playbase/1528429806,600.0,Sonos Playbase,,Great condition Sonos playbase in black. No longer need the functionality of a playbase and looking for a smaller sound bar. Available for pick in midtown Toronto. $600 OBO,City of Toronto,< 5 hours ago,2020-10-07 17:36:37.278140
1528400629,/v-stereo-systems-home-theatre/city-of-toronto/awesome-klipsch-home-entertainment-system/1528400629,800.0,AWESOME ! Klipsch home entertainment system,,Awesome !! Klipsch home entertainment system. 1 - KSW 200 Sub woofer 1 - KV 1 center channel speaker 2 - KG 2.5 speakers 2 - KSF - 10.5 Floor standing speakers It works amazing but due to downsizing ...,City of Toronto,< 7 hours ago,2020-10-07 17:36:37.278838
1528397446,/v-stereo-systems-home-theatre/city-of-toronto/como-audio-solo-wireless-music-system-with-internet-radio/1528397446,250.0,COMO Audio - SOLO - wireless music system with internet radio,,This is a COMO Audio brand internet radio system in “Piano Black”. It is in excellent and fully working condition. It was used for a very short time. Comes with remote. Wireless music Internet radio ...,City of Toronto,< 8 hours ago,2020-10-07 17:36:37.279344
1528381784,/v-stereo-systems-home-theatre/city-of-toronto/collection-rare-vintage-stereo-audiophile-equipment-hi-fi-audio/1528381784,25.0,COLLECTION RARE VINTAGE STEREO AUDIOPHILE EQUIPMENT HI FI AUDIO,,8 track pioneer turntable pioneer amp speaker antique receiver akai kenwood sansui marantz mcintosh tuner lloyds amplifier garrard heathkit toshiba thorens Sony Philco radio vinyl telefunken Harman ...,City of Toronto,< 9 hours ago,2020-10-07 17:36:37.279836
1528374028,/v-stereo-systems-home-theatre/city-of-toronto/made-in-japan-technics-su-8077-stereo-integrated-amplifier/1528374028,165.0,Made in Japan TECHNICS SU-8077 Stereo Integrated Amplifier,,Made in Japan TECHNICS SU-8077 Stereo Integrated Amplifier Tested with a tuner Working Unit is in overall good condition,City of Toronto,< 10 hours ago,2020-10-07 17:36:37.280326
1528373655,/v-stereo-systems-home-theatre/city-of-toronto/pioneer-tx-6800-vintage-am-fm-stereo-tuner/1528373655,100.0,PIONEER TX-6800 VINTAGE AM/FM STEREO TUNER,,PIONEER TX-6800 VINTAGE AM/FM STEREO TUNER Overall good condition clean unit Tested working,City of Toronto,< 10 hours ago,2020-10-07 17:36:37.280816
1528372923,/v-stereo-systems-home-theatre/city-of-toronto/jensen-am-fm-turntable/1528372923,30.0,Jensen AM/FM Turntable,,Details in photos Located at Church and Adelaide,City of Toronto,< 10 hours ago,2020-10-07 17:36:37.281306
1528368775,/v-stereo-systems-home-theatre/city-of-toronto/arcam-alpha-ii-british-made-2x30w-audiophile-amplifier/1528368775,180.0,"ARCAM ALPHA II, BRITISH MADE 2X30W AUDIOPHILE AMPLIFIER",,"Great sounding British designed & made amplifier in very good working condition including a nice Phono stage to connect your turntable. No non sense, easy to use and with 4ohm impedance capability. ...",City of Toronto,< 10 hours ago,2020-10-07 17:36:37.281795
1528368510,/v-stereo-systems-home-theatre/city-of-toronto/marantz-1152-dc-legendary-2x80w-integrated-amplifier/1528368510,620.0,MARANTZ 1152 DC LEGENDARY 2X80W INTEGRATED AMPLIFIER,,"Up for sale is the legendary 1152DC from MARANTZ. It’s a rare and collectible model thanks to its unique look, great sound and famous Marantz battleship-like construction, conservatively rated at ...",City of Toronto,< 10 hours ago,2020-10-07 17:36:37.282286
1528366558,/v-stereo-systems-home-theatre/city-of-toronto/denon-rcd-m39-micro-hi-fi-system/1528366558,500.0,Denon RCD-M39 Micro Hi-Fi System,,Denon RCD-M39 Micro Hi-Fi System in mint condition hardly used $500 or b/o,City of Toronto,< 11 hours ago,2020-10-07 17:36:37.282816
1528364173,/v-stereo-systems-home-theatre/city-of-toronto/rare-vintage-heathkit-ss-1-stereo-box-speaker-audiophile-hi-fi/1528364173,275.0,RARE VINTAGE HEATHKIT SS-1 STEREO BOX SPEAKER AUDIOPHILE HI FI,,Audio mid century modern equipment 8 track pioneer amp mcm akai kenwood sansui marantz mcintosh tuner speaker lloyds amplifier garrard heathkit toshiba turntable Sony Philco radio vinyl telefunken ...,City of Toronto,< 11 hours ago,2020-10-07 17:36:37.283322
1528363580,/v-stereo-systems-home-theatre/city-of-toronto/dahlquist-pdq-a120-powered-subwoofer-12-front-10-down-mint/1528363580,550.0,"Dahlquist - PDQ-A120 - Powered Subwoofer 12""front + 10""down MINT",,Dahlquist is a high end speaker company - TOP OF THE LINE this subwoofer has two drivers and will fill any room with high end tight clean bass 100 Watts RMS in 8 ohms(400 Watt peak power). Adjustable ...,City of Toronto,< 11 hours ago,2020-10-07 17:36:37.283810
1528362389,/v-stereo-systems-home-theatre/city-of-toronto/polk-audio-home-theatre-speakers/1528362389,1200.0,Polk audio home theatre speakers,,Polk Rtia7 pair 300 watt seperate $400 Polk Rti4 book shelf 125 watt seperate $150 Polk Rtai 3 Bookshelf 150 watt seperate $200 Polk CSIA6 center 200 watt seperate $300 Polk subwoofer Psw10 100 watt ...,City of Toronto,< 11 hours ago,2020-10-07 17:36:37.284299
1528361434,/v-stereo-systems-home-theatre/city-of-toronto/jensen-vertical-sound-system-cd-tuner-cassette-remote-new/1528361434,150.0,Jensen Vertical Sound System CD Tuner Cassette. Remote NEW,,"Like new - can be mounted on the wall - comes with wall brackets/mounts and 2 different colour sets of speaker covers and remote control - awesome sound system Can also plug in your cellphone, MP3 ...",City of Toronto,< 12 hours ago,2020-10-07 17:36:37.284790
1507168592,/v-stereo-systems-home-theatre/city-of-toronto/satellite-blue-tooth-radio/1507168592,15.0,"Wanted:
                            Satellite blue tooth radio",,"Satellite blue tooth radio . Posted in audio, stereo systems, home theatre in City of Toronto. June 17, 2020",City of Toronto,< 14 hours ago,2020-10-07 17:36:37.285276
1528344226,/v-stereo-systems-home-theatre/city-of-toronto/toshiba-aurex-sc-335mkii-stereo-power-amplifier/1528344226,125.0,Toshiba Aurex  Sc-335mkii Stereo Power Amplifier,,I have a Toshiba Aurex power amp for sale model sc-335mkii It is in excellent condition if consider buying call or txt 647-409-4325,City of Toronto,< 19 hours ago,2020-10-07 17:36:37.285765
1528472679,/v-stereo-systems-home-theatre/city-of-toronto/1971-vintage-pioneer-amplifier/1528472679,275.0,1971 VINTAGE PIONEER AMPLIFIER,,Beautiful Classic “Champagne face”Pioneer SA-600 Amplifier. 70 watts ch. Great condition. All switches Works perfect. Sounds perfect. $275 Firm Firm Price Will remove when sold.,City of Toronto,< 58 minutes ago,2020-10-07 17:36:40.315472
1528470358,/v-stereo-systems-home-theatre/city-of-toronto/sony-5-1-dolby-surround-receiver/1528470358,60.0,Sony 5.1 Dolby surround receiver,,Selling an excellent condition Sony 5.1 Dolby surround pro logic receiver. Perfect physical and working condition. No remote. Price is $60,City of Toronto,< 2 hours ago,2020-10-07 17:36:40.315972
1528465723,/v-stereo-systems-home-theatre/city-of-toronto/rca-home-theater-projector-new-rpj136/1528465723,80.0,RCA HOME THEATER PROJECTOR (NEW)(RPJ136),,RCA HOME THEATER PROJECTOR (NEW) (RPJ136) Check Out Our Other Listings We Are A Liquidation Warehouse Store Open Monday To Friday 11AM to 8PM CLOSED Weekends Contact Peter (416) 821-6222 FACEBOOK ...,City of Toronto,< 2 hours ago,2020-10-07 17:36:40.316522
1528463056,/v-stereo-systems-home-theatre/city-of-toronto/car-amplifier/1528463056,200.0,Car amplifier,,JBL grand touring mono amp Kenwood 640 watts for highs Runs excellent,City of Toronto,< 2 hours ago,2020-10-07 17:36:40.317010
1528458939,/v-stereo-systems-home-theatre/city-of-toronto/polk-audio-signa-s2-ultra-slim-soundbar-subwoofer-warranty/1528458939,119.0,Polk Audio Signa S2 Ultra-Slim Soundbar Subwoofer *Warranty,,Refurbished item with 30 days replacement warranty *Shipping is available via Purolator 2.1 channel sound bar gives you the in-home theatre experience you can't get from your TV's built-in speakers ...,City of Toronto,< 3 hours ago,2020-10-07 17:36:40.317505
1528458784,/v-stereo-systems-home-theatre/city-of-toronto/pioneer-sx-315-audio-channel-receiver-with-5-1-speakers/1528458784,100.0,Pioneer SX-315 Audio Channel Receiver with 5.1 speakers,,"100W Pioneer SX-315 Remote Control Audio Multi Channel Receiver with 5.1 speaker and subwoofer setup. Includes remote. Working, but the wire connections should be resetup",City of Toronto,< 3 hours ago,2020-10-07 17:36:40.317994
1528456961,/v-stereo-systems-home-theatre/city-of-toronto/polk-audio-true-surround-soundbar-subwoofer-rear-speakers-l-r/1528456961,139.0,Polk Audio True Surround Soundbar Subwoofer Rear speakers(L & R),,"Refurbished condition with 30 days warranty *Shipping via Purolator is available!!! The only 5.1 Channel Wireless Home Theatre System in this Incredible Price Range! Soundbar, Subwoofer & 2 pcs of ...",City of Toronto,< 3 hours ago,2020-10-07 17:36:40.318482
1528456262,/v-stereo-systems-home-theatre/city-of-toronto/technics-cassette-deck/1528456262,80.0,Technics cassette deck,,Model rs-m205 mint condition 2 heads playback/record very clean will take B/O,City of Toronto,< 3 hours ago,2020-10-07 17:36:40.318967
1528455499,/v-stereo-systems-home-theatre/city-of-toronto/polk-audio-magnifi-mini-soundbar-subwoofer-bluetooth-warranty/1528455499,159.0,Polk Audio Magnifi Mini Soundbar Subwoofer Bluetooth *Warranty,,Refurbished condition & 30 days replacement warranty *Shipping via Purolator is available!!! Room filling sound in an extremely compact size Bluetooth for Wireless Music Streaming Perfect for Bedroom ...,City of Toronto,< 3 hours ago,2020-10-07 17:36:40.319469
1528450341,/v-stereo-systems-home-theatre/city-of-toronto/akai-aa-1030-am-fm-receiver/1528450341,150.0,AKAI AA-1030 AM/FM receiver,,"AKAI AA-1030 AM/FM receiver with phono for $150 or best offer. Cosmetic and functions are in mint conditions. Tuning range: FM, MW Power output: 30 watts per channel into 8Ω (stereo) Frequency ...",City of Toronto,< 3 hours ago,2020-10-07 17:36:40.319957
1528444998,/v-stereo-systems-home-theatre/city-of-toronto/crosley-cruiser-record-player/1528444998,50.0,Crosley Cruiser Record player,,Used two times. Comes without a box. Bluetooth-compatible + portable vintage-inspired turntable housed in a UO-exclusive light grey faux leather briefcase from the experts at Crosley. This ...,City of Toronto,< 4 hours ago,2020-10-07 17:36:40.320447
1528443477,/v-stereo-systems-home-theatre/city-of-toronto/theater-solutions-cs43c-flush-mount-in-ceiling-3-way-speakers/1528443477,65.0,Theater Solutions CS43C Flush Mount In Ceiling  3-Way Speakers,,$60: FIRM This is brand new in box. 8 pairs available: $60 per Pair. Theater Solutions by Goldwood CS43C Flush Mount In Ceiling 2 Speaker Set Wide Sound Dispersion Designed Speakers easily integrate ...,City of Toronto,< 4 hours ago,2020-10-07 17:36:40.320930
1517604787,/v-stereo-systems-home-theatre/city-of-toronto/entertainment-system/1517604787,200.0,Entertainment System,,"Sony DVD Home Theatre System for wireless surround sound. 6 speakers total with remote to operate DVD / Compact Disc and TV. Excellent condition Located in Fenelon Falls, Ont.",City of Toronto,< 4 hours ago,2020-10-07 17:36:40.321413
1528436942,/v-stereo-systems-home-theatre/city-of-toronto/pioneer-pl-300-turntable/1528436942,200.0,PIONEER PL-300 TURNTABLE,,"PLEASE GIVE US A CALL FOR QUICK ANSWERS . WE DO NOT REGULARLY CHECK OUR MAILS SO CALLING IS YOUR BEST OPTION . Item is in good working condition . Come and see hundreds of items ( Vintage audio , led ...",City of Toronto,< 4 hours ago,2020-10-07 17:36:40.321898
1528435858,/v-stereo-systems-home-theatre/city-of-toronto/bose-lifestyle-v25-very-very-new/1528435858,899.0,Bose Lifestyle V25 (VERY VERY NEW),,Condition: basically brand new Wad a gift for my father years ago but we have not used it before,City of Toronto,< 5 hours ago,2020-10-07 17:36:40.322381
1528432302,/v-stereo-systems-home-theatre/city-of-toronto/yamaha-rx-v657-a-v-natural-sound-receiver-remote/1528432302,70.0,Yamaha RX-V657 A/V Natural Sound Receiver  + Remote,,Yamaha RX-V657 A/V Natural Sound Receiver original Remote plus Audio Tuning Mic. The unit is in overall good condition Works great,City of Toronto,< 5 hours ago,2020-10-07 17:36:40.322896
1528430706,/v-stereo-systems-home-theatre/city-of-toronto/audio-marantz/1528430706,1000.0,Audio Marantz,,Marantz 3800 preamp.Used but still pretty good and everything work good.please contact: 416.358.3785,City of Toronto,< 5 hours ago,2020-10-07 17:36:40.323400
1528429806,/v-stereo-systems-home-theatre/city-of-toronto/sonos-playbase/1528429806,600.0,Sonos Playbase,,Great condition Sonos playbase in black. No longer need the functionality of a playbase and looking for a smaller sound bar. Available for pick in midtown Toronto. $600 OBO,City of Toronto,< 5 hours ago,2020-10-07 17:36:40.323898
1528400629,/v-stereo-systems-home-theatre/city-of-toronto/awesome-klipsch-home-entertainment-system/1528400629,800.0,AWESOME ! Klipsch home entertainment system,,Awesome !! Klipsch home entertainment system. 1 - KSW 200 Sub woofer 1 - KV 1 center channel speaker 2 - KG 2.5 speakers 2 - KSF - 10.5 Floor standing speakers It works amazing but due to downsizing ...,City of Toronto,< 7 hours ago,2020-10-07 17:36:40.324582
1528397446,/v-stereo-systems-home-theatre/city-of-toronto/como-audio-solo-wireless-music-system-with-internet-radio/1528397446,250.0,COMO Audio - SOLO - wireless music system with internet radio,,This is a COMO Audio brand internet radio system in “Piano Black”. It is in excellent and fully working condition. It was used for a very short time. Comes with remote. Wireless music Internet radio ...,City of Toronto,< 8 hours ago,2020-10-07 17:36:40.325072
1528381784,/v-stereo-systems-home-theatre/city-of-toronto/collection-rare-vintage-stereo-audiophile-equipment-hi-fi-audio/1528381784,25.0,COLLECTION RARE VINTAGE STEREO AUDIOPHILE EQUIPMENT HI FI AUDIO,,8 track pioneer turntable pioneer amp speaker antique receiver akai kenwood sansui marantz mcintosh tuner lloyds amplifier garrard heathkit toshiba thorens Sony Philco radio vinyl telefunken Harman ...,City of Toronto,< 9 hours ago,2020-10-07 17:36:40.325619
1528374028,/v-stereo-systems-home-theatre/city-of-toronto/made-in-japan-technics-su-8077-stereo-integrated-amplifier/1528374028,165.0,Made in Japan TECHNICS SU-8077 Stereo Integrated Amplifier,,Made in Japan TECHNICS SU-8077 Stereo Integrated Amplifier Tested with a tuner Working Unit is in overall good condition,City of Toronto,< 10 hours ago,2020-10-07 17:36:40.326110
1528373655,/v-stereo-systems-home-theatre/city-of-toronto/pioneer-tx-6800-vintage-am-fm-stereo-tuner/1528373655,100.0,PIONEER TX-6800 VINTAGE AM/FM STEREO TUNER,,PIONEER TX-6800 VINTAGE AM/FM STEREO TUNER Overall good condition clean unit Tested working,City of Toronto,< 10 hours ago,2020-10-07 17:36:40.326600
1528372923,/v-stereo-systems-home-theatre/city-of-toronto/jensen-am-fm-turntable/1528372923,30.0,Jensen AM/FM Turntable,,Details in photos Located at Church and Adelaide,City of Toronto,< 10 hours ago,2020-10-07 17:36:40.327303
1528368775,/v-stereo-systems-home-theatre/city-of-toronto/arcam-alpha-ii-british-made-2x30w-audiophile-amplifier/1528368775,180.0,"ARCAM ALPHA II, BRITISH MADE 2X30W AUDIOPHILE AMPLIFIER",,"Great sounding British designed & made amplifier in very good working condition including a nice Phono stage to connect your turntable. No non sense, easy to use and with 4ohm impedance capability. ...",City of Toronto,< 10 hours ago,2020-10-07 17:36:40.327815
1528368510,/v-stereo-systems-home-theatre/city-of-toronto/marantz-1152-dc-legendary-2x80w-integrated-amplifier/1528368510,620.0,MARANTZ 1152 DC LEGENDARY 2X80W INTEGRATED AMPLIFIER,,"Up for sale is the legendary 1152DC from MARANTZ. It’s a rare and collectible model thanks to its unique look, great sound and famous Marantz battleship-like construction, conservatively rated at ...",City of Toronto,< 10 hours ago,2020-10-07 17:36:40.328318
1528366558,/v-stereo-systems-home-theatre/city-of-toronto/denon-rcd-m39-micro-hi-fi-system/1528366558,500.0,Denon RCD-M39 Micro Hi-Fi System,,Denon RCD-M39 Micro Hi-Fi System in mint condition hardly used $500 or b/o,City of Toronto,< 11 hours ago,2020-10-07 17:36:40.328866
1528364173,/v-stereo-systems-home-theatre/city-of-toronto/rare-vintage-heathkit-ss-1-stereo-box-speaker-audiophile-hi-fi/1528364173,275.0,RARE VINTAGE HEATHKIT SS-1 STEREO BOX SPEAKER AUDIOPHILE HI FI,,Audio mid century modern equipment 8 track pioneer amp mcm akai kenwood sansui marantz mcintosh tuner speaker lloyds amplifier garrard heathkit toshiba turntable Sony Philco radio vinyl telefunken ...,City of Toronto,< 11 hours ago,2020-10-07 17:36:40.329368
1528363580,/v-stereo-systems-home-theatre/city-of-toronto/dahlquist-pdq-a120-powered-subwoofer-12-front-10-down-mint/1528363580,550.0,"Dahlquist - PDQ-A120 - Powered Subwoofer 12""front + 10""down MINT",,Dahlquist is a high end speaker company - TOP OF THE LINE this subwoofer has two drivers and will fill any room with high end tight clean bass 100 Watts RMS in 8 ohms(400 Watt peak power). Adjustable ...,City of Toronto,< 11 hours ago,2020-10-07 17:36:40.329871
1528362389,/v-stereo-systems-home-theatre/city-of-toronto/polk-audio-home-theatre-speakers/1528362389,1200.0,Polk audio home theatre speakers,,Polk Rtia7 pair 300 watt seperate $400 Polk Rti4 book shelf 125 watt seperate $150 Polk Rtai 3 Bookshelf 150 watt seperate $200 Polk CSIA6 center 200 watt seperate $300 Polk subwoofer Psw10 100 watt ...,City of Toronto,< 11 hours ago,2020-10-07 17:36:40.330365
1528361434,/v-stereo-systems-home-theatre/city-of-toronto/jensen-vertical-sound-system-cd-tuner-cassette-remote-new/1528361434,150.0,Jensen Vertical Sound System CD Tuner Cassette. Remote NEW,,"Like new - can be mounted on the wall - comes with wall brackets/mounts and 2 different colour sets of speaker covers and remote control - awesome sound system Can also plug in your cellphone, MP3 ...",City of Toronto,< 12 hours ago,2020-10-07 17:36:40.330865
1507168592,/v-stereo-systems-home-theatre/city-of-toronto/satellite-blue-tooth-radio/1507168592,15.0,"Wanted:
                            Satellite blue tooth radio",,"Satellite blue tooth radio . Posted in audio, stereo systems, home theatre in City of Toronto. June 17, 2020",City of Toronto,< 14 hours ago,2020-10-07 17:36:40.331367
1528344226,/v-stereo-systems-home-theatre/city-of-toronto/toshiba-aurex-sc-335mkii-stereo-power-amplifier/1528344226,125.0,Toshiba Aurex  Sc-335mkii Stereo Power Amplifier,,I have a Toshiba Aurex power amp for sale model sc-335mkii It is in excellent condition if consider buying call or txt 647-409-4325,City of Toronto,< 19 hours ago,2020-10-07 17:36:40.331864
1528344214,/v-stereo-systems-home-theatre/city-of-toronto/samsung-ah59-02631j-ah5902631j-remote-control-sound-bar-soundbar/1528344214,25.0,Samsung AH59-02631J AH5902631J Remote Control Sound bar Soundbar,,Samsung genuine AH59-02631J AH5902631J Soundbar Remote Control NEW Genuine Samsung AH59-02631J / AH5902631J Soundbar Remote Control i'm selling brand new Genuine Samsung original remote control Model ...,City of Toronto,< 19 hours ago,2020-10-07 17:36:43.170956
1528343849,/v-stereo-systems-home-theatre/city-of-toronto/atlas-sound-mixer-amplifier/1528343849,175.0,Atlas Sound Mixer Amplifier,,I have an Atlas Sound mixer amplifier model AA120 If consider buying call or txt 647-409-4325,City of Toronto,< 19 hours ago,2020-10-07 17:36:43.171449
