,url,price,title,distance,description,location,time_offset,retreived
1524907495,/v-baby-crib-bassinet/city-of-toronto/sturdy-wooden-crib-like-new/1524907495,175.0,"Sturdy, wooden crib, like new",,Only 5 pieces + matress,City of Toronto,19/09/2020,2020-10-06 11:38:11.734882
1524894058,/v-baby-crib-bassinet/city-of-toronto/gray-pottery-barn-crib/1524894058,460.0,Gray Pottery Barn Crib,,"Overall dimensions - 27.5” wide, 52” long For further details, please check last few photos",City of Toronto,19/09/2020,2020-10-06 11:38:11.735380
1524881569,/v-baby-crib-bassinet/city-of-toronto/crib-for-baby/1524881569,250.0,Crib for baby,,Sturdy and stylish crib for sale. The mattress and bedding is included in the sale (if the buyer wants).,City of Toronto,19/09/2020,2020-10-06 11:38:11.735875
1524871893,/v-baby-crib-bassinet/city-of-toronto/crib-with-conversion-kit-to-bed/1524871893,300.0,Crib - with conversion kit - to bed,,Oeuf brand crib with conversion kit that turns into toddler bed. Mattress available if wanted,City of Toronto,19/09/2020,2020-10-06 11:38:11.736367
1503647020,/v-baby-crib-bassinet/city-of-toronto/4-in-1-crib-mattress-great-condition/1503647020,100.0,4 in 1 crib & mattress - great condition,,"Crib and mattress in excellent condition. Pet free, non smoking household. Disassembled and ready for curbside pick up. Price is firm - not negotiable. ...",City of Toronto,19/09/2020,2020-10-06 11:38:13.246236
1524853474,/v-baby-crib-bassinet/city-of-toronto/pottery-barn-crib-guardrail-mattress-dvp-lawrence/1524853474,450.0,Pottery Barn Crib & Guardrail + Mattress (DVP / Lawrence),,"Selling our Pottery Barn Crib and Guardrail Conversion Kit in Simply White, Simmons Tencel Infant/Toddler Mattress and 5 Covers! Save over $1,000 off the retail price! All included items in pristine ...",City of Toronto,19/09/2020,2020-10-06 11:38:13.246787
1514249326,/v-baby-crib-bassinet/city-of-toronto/crib-bumber-toyland/1514249326,0.0,Crib bumber - Toyland,,"Cute Toyland crib bumper with matching diaper stacker, crib skirt, wall decorations and wall decals. Washed. All for FREE. Too nice to just throw it. Pet and smoke free house.",City of Toronto,18/09/2020,2020-10-06 11:38:13.247336
1486484274,/v-baby-crib-bassinet/city-of-toronto/baby-bassinet-xxl/1486484274,280.0,Baby bassinet  XXL,,Baby bassinet for $280XXL the baby can used for more than 6 months .,City of Toronto,18/09/2020,2020-10-06 11:38:13.247865
1524824886,/v-baby-crib-bassinet/city-of-toronto/evenflo-loft-portable-bassinet-grey/1524824886,40.0,Evenflo Loft Portable Bassinet - Grey,,"Compact and great for sleeping around the home or on the go. Quick collapsable fold allows for ease of storage and transportation. Excellent condition, barely used. Smoke and pet free home.",City of Toronto,18/09/2020,2020-10-06 11:38:13.248390
1524810214,/v-baby-crib-bassinet/city-of-toronto/snuggle-me-newborn-infant-lounger-bed/1524810214,125.0,Snuggle Me - newborn infant lounger bed,,"Snuggle Me organic infant lounger bed Used about 10 times before we received another used one from a friend (baby is now too big for it, so we are selling) Very clean with no stains Made from ...",City of Toronto,18/09/2020,2020-10-06 11:38:13.248920
1514034660,/v-baby-crib-bassinet/city-of-toronto/excellent-used-condition-crib/1514034660,100.0,Excellent used condition Crib,,Excellent used condition. Barely used. Smoke free and pet free home. Retails at $189 plus tax which totals to $219. You will be saving almost $120 and will get a beautiful and almost like new crib! ...,City of Toronto,18/09/2020,2020-10-06 11:38:13.249445
1524750487,/v-baby-crib-bassinet/city-of-toronto/baby-bed/1524750487,80.0,Baby bed,,Great condition,City of Toronto,18/09/2020,2020-10-06 11:38:13.249965
1524719801,/v-baby-crib-bassinet/city-of-toronto/crib-windsor-baby-cache/1524719801,250.0,Crib Windsor Baby Cache,,"60X31.5X48.5 inches Baby Cache Windsor crib used with minor scratches at the rim. Very sturdy solid wood, completely intact, 3 levels of height adjustment, and converts to a toddler bed, and then can ...",City of Toronto,18/09/2020,2020-10-06 11:38:13.250481
1494829767,/v-baby-crib-bassinet/city-of-toronto/bedrail-swing-down/1494829767,5.0,Bedrail - swing down,,Good conditions bedrail that swings down (SFPF home). The protection could be remove for washing.,City of Toronto,18/09/2020,2020-10-06 11:38:13.251230
1524686383,/v-baby-crib-bassinet/city-of-toronto/oeuf-toddler-beds/1524686383,450.0,Oeuf Toddler Beds,,Selling 2 modern Oeuf classic toddler beds. Both are in excellent condition. One of the beds comes with a conversion crib walls kit so you can make it into a crib again. Classic crib retails for ...,City of Toronto,18/09/2020,2020-10-06 11:38:13.251837
1305925241,/v-baby-crib-bassinet/city-of-toronto/da-vinci-emily-mini-crib-organic-mattress/1305925241,390.0,Da Vinci Emily Mini Crib/Organic Mattress,,"Selling this crib, must pick it up. Brand New Mini Crib and Organic Mattress with one fitted sheet. Our baby slept in it once for about one hour, otherwise never used. Purchased from Lusso Baby ...",City of Toronto,18/09/2020,2020-10-06 11:38:13.252388
1524668928,/v-baby-crib-bassinet/city-of-toronto/convertable-crib/1524668928,85.0,Convertable Crib,,Good Condition 4 in one near by delivery available for extra charge $20. Comes with foam mattress.,City of Toronto,17/09/2020,2020-10-06 11:38:13.252927
1486388221,/v-baby-crib-bassinet/city-of-toronto/lil-angles-baby-furniture-crib-dresser-and-book-case/1486388221,1200.0,Lil angles Baby furniture crib dresser and book case,,"Lil angles Emma Baby furniture for sale, crib dresser and book case in new condition and very clean",City of Toronto,17/09/2020,2020-10-06 11:38:13.253682
1513453165,/v-baby-crib-bassinet/city-of-toronto/baby-crib-with-mattress-as-is/1513453165,150.0,Baby Crib with mattress as is,,Wooden baby crib as is. Missing hardware (nuts and bolts),City of Toronto,17/09/2020,2020-10-06 11:38:13.254211
1524599434,/v-baby-crib-bassinet/city-of-toronto/infant-or-toddler-crib-or-bed-sniglar/1524599434,35.0,INFANT OR TODDLER CRIB OR BED SNIGLAR,,Slightly used Sniglar Crib/Cot/Bed. Excellent condition. Fixed price.,City of Toronto,17/09/2020,2020-10-06 11:38:13.254748
1524596723,/v-baby-crib-bassinet/city-of-toronto/used-baby-crib/1524596723,150.0,used baby crib,,In a good condition that can be used as a day bed as well,City of Toronto,17/09/2020,2020-10-06 11:38:13.255264
1524577086,/v-baby-crib-bassinet/city-of-toronto/storkcraft-baby-crib-wooden-brown-great-condition/1524577086,30.0,Storkcraft baby crib wooden brown great condition,,Please text Michelle @647 451-2664,City of Toronto,17/09/2020,2020-10-06 11:38:13.255776
1512018659,/v-baby-crib-bassinet/city-of-toronto/10-piece-lambs-and-ivy-brand-team-safari-nursery-bedding-set/1512018659,160.0,10-piece Lambs and Ivy brand Team Safari nursery bedding set,,"Mint Condition, from pet free/smoke free home. 10-piece Lambs and Ivy brand Team Safari nursery bedding set. Includes: - 2 fitted crib sheet (one in team safari print and the other in solid sky blue) ...",City of Toronto,17/09/2020,2020-10-06 11:38:13.256289
1524565915,/v-baby-crib-bassinet/city-of-toronto/bassinet-brica-travel/1524565915,30.0,Bassinet Brica Travel,,"Still New: Durable, safe and lightweight travel bassinet Mesh panels, breathable fabric, and a locking frame provides both comfort and peace of mind Four-point Safe-T-Lock™ System for safety and ...",City of Toronto,17/09/2020,2020-10-06 11:38:13.256805
1524556894,/v-baby-crib-bassinet/city-of-toronto/convertible-portable-crib-mattress/1524556894,200.0,Convertible Portable Crib + Mattress,,1. Used it for 1 year. 2. Bought it on Amazon and selling for half price. 3. 2-in-1 CONVERTIBILITY: It easily converts to a toddler bed and daybed. ! 4. GROWS WITH BABY: 4 adjustable mattress ...,City of Toronto,17/09/2020,2020-10-06 11:38:13.257375
1337807716,/v-baby-crib-bassinet/city-of-toronto/fisher-price-discover-n-grow-twinkling-lantern-projector-mobile/1337807716,30.0,Fisher Price Discover ‘n Grow Twinkling Lantern Projector Mobile,,Fisher Price Discover ‘n Grow Twinkling Lights Projector Mobile Requires 4x C batteries (not included),City of Toronto,17/09/2020,2020-10-06 11:38:13.257922
1135279155,/v-baby-crib-bassinet/city-of-toronto/crib-bumper-pads-fitted-sheet-and-plush-change-pad-reindeer/1135279155,35.0,"Crib Bumper Pads, Fitted Sheet, and Plush Change Pad Reindeer",,"Crib Bumper Pads in White, fitted Sheet in White and Change Pad with Plush Reindeer Cover in Great Condition. See actual picture attached (note: fitted sheet is not in picture however IT IS INCLUDED ...",City of Toronto,17/09/2020,2020-10-06 11:38:13.258921
1224463366,/v-baby-crib-bassinet/city-of-toronto/blabla-animal-jungle-mobile-nursery-hand-made/1224463366,75.0,BLABLA Animal Jungle Mobile Nursery Hand Made,,"These delightful mobiles are guaranteed to delight your little babe and brighten a room instantly. Hang it over a crib or anywhere in a child's room. Handmade 13"" Diameter 22"" Mobile height 25"" ...",City of Toronto,17/09/2020,2020-10-06 11:38:13.259470
1513720254,/v-baby-crib-bassinet/city-of-toronto/graco-3-in-1-convertible-crib/1513720254,100.0,Graco 3 in 1 Convertible Crib,,"3 in 1. Crib, toddler/daybed and then it can be used as a headboard/footboard on a twin sized frame. Mattress included(never been soiled always protected) Non smoking home. There is some damage to ...",City of Toronto,17/09/2020,2020-10-06 11:38:13.260002
1494772130,/v-baby-crib-bassinet/city-of-toronto/bassinet/1494772130,55.0,Bassinet,,Babby bassinet. Wicker basket design. Excellent condition.,City of Toronto,17/09/2020,2020-10-06 11:38:13.260531
1265263543,/v-baby-crib-bassinet/city-of-toronto/crib-bumper-adorable/1265263543,65.0,"CRIB BUMPER, ADORABLE",,"FOR BOY OR GIRL ""ANIMALS ON PARADE"" CRIB BUMPER. (From Pottery Barn) HARDLY USED... HAND QUILTED with decorative stiching and appliques. 100 % cotton, 9.25"" wide. Machine washable. Cash and carry. ...",City of Toronto,17/09/2020,2020-10-06 11:38:13.261088
1513935151,/v-baby-crib-bassinet/city-of-toronto/crib-for-sale/1513935151,80.0,Crib for sale,,Sturdy crib ready for pick up!,City of Toronto,17/09/2020,2020-10-06 11:38:13.261680
1524492130,/v-baby-crib-bassinet/city-of-toronto/first-years-5-in-1-bassinet/1524492130,60.0,First years 5 in 1 bassinet,,First years 5 in 1 bassinet used for a few months and stored ever since. EUC.,City of Toronto,17/09/2020,2020-10-06 11:38:13.262222
1511395632,/v-baby-crib-bassinet/city-of-toronto/handmade-crochet-baby-blanket/1511395632,249.9,Handmade crochet baby blanket,,You can also order for diffrent colors and size.,City of Toronto,17/09/2020,2020-10-06 11:38:13.262906
1503263698,/v-baby-crib-bassinet/city-of-toronto/gorgeous-foldable-light-bassinet-with-vibration-motion-25/1503263698,25.0,Gorgeous foldable/light bassinet  with vibration motion $25,,Gorgeous foldable/light bassinet with vibration motion. Selling it for $25 only. If interested please call/text 6477073355 or email,City of Toronto,16/09/2020,2020-10-06 11:38:13.263417
1513711834,/v-baby-crib-bassinet/city-of-toronto/classic-pooh-baby-lamp/1513711834,15.0,Classic Pooh  baby lamp.,,Email me at tasiasamothrakis@icloud.com,City of Toronto,16/09/2020,2020-10-06 11:38:13.263997
1503261551,/v-baby-crib-bassinet/city-of-toronto/graco-pack-and-play-bassinet/1503261551,30.0,Graco pack and play bassinet,,In very good condition.,City of Toronto,16/09/2020,2020-10-06 11:38:13.264590
1524425020,/v-baby-crib-bassinet/city-of-toronto/baby-crib-including-spring-mattress/1524425020,30.0,Baby crib including spring mattress,,"Currently disassembled in garage, used, clean",City of Toronto,16/09/2020,2020-10-06 11:38:13.265096
1496288413,/v-baby-crib-bassinet/city-of-toronto/removable-standing-bassinet-baby-bed/1496288413,50.0,Removable Standing Bassinet - Baby bed,,Removable bassinet in perfect condition. Very spacious and soft.,City of Toronto,16/09/2020,2020-10-06 11:38:13.265598
1524416296,/v-baby-crib-bassinet/city-of-toronto/bassinet-ingenuity-fold-away-rocking-bassinet/1524416296,90.0,Bassinet - Ingenuity Fold-Away Rocking Bassinet,,Bassinet originally bought for $100. Almost BRAND NEW - used for only 2 weeks since we decided to co-sleep instead. Tags still attached. Baby did not have any accidents while in bassinet. Will ...,City of Toronto,16/09/2020,2020-10-06 11:38:13.266109
1524412157,/v-baby-crib-bassinet/city-of-toronto/baby-bjorn-travel-crib-accessories/1524412157,25.0,Baby Bjorn Travel Crib Accessories,,"Baby Bjorn Travel Crib Accessories: Bag, mattress and fabric. Metal frame not included. Our original frame broke so these are the original bag, mattress and fabric.",City of Toronto,16/09/2020,2020-10-06 11:38:13.267066
1524403970,/v-baby-crib-bassinet/city-of-toronto/baby-bassinet-euc/1524403970,40.0,Baby Bassinet - EUC,,"Selling a Bassinet in Excellent Used Condition Will require fresh batteries for the lullaby, light and vibration functions to work. Can include gender neutral bassinet fitted sheet upon request - no ...",City of Toronto,16/09/2020,2020-10-06 11:38:13.267803
1524395820,/v-baby-crib-bassinet/city-of-toronto/travel-crib/1524395820,140.0,Travel crib,,Selling a Phil & Ted travel crib. It’s super light weight. Sells new for over $200. I have the one in the first photo (where it is darker and blocks more light). Hardly used- selling for $140. ...,City of Toronto,16/09/2020,2020-10-06 11:38:13.268379
1524378525,/v-baby-crib-bassinet/city-of-toronto/crib-with-mattress-change-station-rocking-chair-for-sale/1524378525,150.0,"Crib with mattress, change station & rocking chair - for sale",,"A very well kept set of: Crib, mattress, change station, rocking chair. The crib and mattress are in a very good condition and well kept. Paid big money for the set brand new. The change station and ...",City of Toronto,16/09/2020,2020-10-06 11:38:14.832245
1524361668,/v-baby-crib-bassinet/city-of-toronto/ikea-crib-gulliver-adjustable-to-suit-infant-to-age-4/1524361668,10.0,Ikea crib (Gulliver) - adjustable to suit infant to age 4,,"Super functional and attractive crib that adjusts as your baby grows. The mattress sits high for an infant and lower for an older baby. Then, a side can be removed (as shown in the pictures) for a ...",City of Toronto,16/09/2020,2020-10-06 11:38:14.832760
1524360567,/v-baby-crib-bassinet/city-of-toronto/baby-crib-with-mattress/1524360567,100.0,Baby crib with mattress,,"Hi, I am selling a brand new baby crib with mattress for $100. If interested please contact me at 6475079110",City of Toronto,16/09/2020,2020-10-06 11:38:14.833329
1524331306,/v-baby-crib-bassinet/city-of-toronto/crib-convertible/1524331306,200.0,CRIB (Convertible),,In good condition. See pictures for conversion styles. Mattress available with it.,City of Toronto,16/09/2020,2020-10-06 11:38:14.833973
1524329756,/v-baby-crib-bassinet/city-of-toronto/baby-cribs/1524329756,40.0,Baby cribs,,"Used baby cribs, White color, wooden, With very good condition.",City of Toronto,16/09/2020,2020-10-06 11:38:14.834491
1513639172,/v-baby-crib-bassinet/city-of-toronto/baby-crib-cradle-bumper-3-sets/1513639172,15.0,Baby Crib Cradle Bumper 3 sets,,"30 * 30cm Breathable Nursery Bedding Blue One set for $15, 2 sets for $ 25, 3 sets for $30.",City of Toronto,15/09/2020,2020-10-06 11:38:14.835021
1513636081,/v-baby-crib-bassinet/city-of-toronto/jolly-jumper-soft-rail-3-pack-white/1513636081,5.0,"Jolly Jumper Soft Rail-3 Pack, White",,Sizes as attached in pic,City of Toronto,15/09/2020,2020-10-06 11:38:14.835566
1524290452,/v-baby-crib-bassinet/city-of-toronto/cribs-toddler-mattress:-55-l-x-27-w-132cm-l-x-70cm-w1-cri/1524290452,40.0,CRIBS /TODDLER MATTRESS: 55” L x 27” W 132cm L x 70cm W1)  Cri,,CRIBS /TODDLER MATTRESS: 55” L x 27” W 132cm L x 70cm W 1) Crib mattress (Made in Canada ) in excellent condition - no any stains or rips (If you see this ad – this is AVAILABLE) From smoke free and ...,City of Toronto,15/09/2020,2020-10-06 11:38:14.836086
1524289331,/v-baby-crib-bassinet/city-of-toronto/baby-crib-breathable-mesh-side-liner-protection-ai-raya-uk/1524289331,30.0,Baby crib breathable mesh side liner protection. Ai Raya (UK),,Baby crib breathable mesh side liner protection. Ai Raya (UK) design (If you see this ad – this is AVAILABLE) In new excellent condition – no any stains or rips Length is adjustable For crib: 55” L x ...,City of Toronto,15/09/2020,2020-10-06 11:38:14.836638
1523671590,/v-baby-crib-bassinet/city-of-toronto/young-america-built-to-grow-crib-and-mattress/1523671590,700.0,Young America Built to Grow Crib and Mattress,,Traditional solid wood elegant white Young America crib and accompanying organic mattress. Crib has adjustable mattress height and converts to bed (conversion kit not included).,City of Toronto,15/09/2020,2020-10-06 11:38:14.837175
1513586644,/v-baby-crib-bassinet/city-of-toronto/crib-mattress-cover/1513586644,25.0,Crib mattress cover,,Never used,City of Toronto,15/09/2020,2020-10-06 11:38:14.837740
1524274865,/v-baby-crib-bassinet/city-of-toronto/babyletto-crib-modo-3-1-colgate-mattress/1524274865,289.0,Babyletto Crib Modo 3-1 + Colgate Mattress,,"The Scoot 3-in-1 Convertible Crib is the perfect center piece to your mid-century modern nursery. Its retro-inspired features add a charming vibe for babe's new space. Modern and functional, an ...",City of Toronto,15/09/2020,2020-10-06 11:38:14.838258
1524271347,/v-baby-crib-bassinet/city-of-toronto/beautiful-pine-baby-crib-toddler-bed-for-sale/1524271347,65.0,Beautiful pine Baby crib/toddler bed for sale,,"Great used condition baby crib/toddler bed for sale. All pieces accounted for. Bite guard in place, minimal nicks and scratches. Very safe and secure. Beautiful addition to any baby or toddler room. ...",City of Toronto,15/09/2020,2020-10-06 11:38:14.838778
1524252449,/v-baby-crib-bassinet/city-of-toronto/restoration-hardware-crib-mattress-and-toddler-bed-kit/1524252449,1000.0,"Restoration Hardware Crib, Mattress and Toddler Bed Kit",,"Beautiful Restoration Hardware Collette Tufted Crib, mattress and Toddler Bed Kit will add elegance to any bedroom. Including mattress covers as well. Measures 31.25” x 56.5” x 48”. It’s used but in ...",City of Toronto,15/09/2020,2020-10-06 11:38:14.839293
1524231391,/v-baby-crib-bassinet/city-of-toronto/baby-crib/1524231391,50.0,Baby crib,,"Portable/collapsible baby crib. Clean and good conditions. Recently hosed down with detergent. Great solution to keep your baby in when in another room, traveling, or in other place other than home. ...",City of Toronto,15/09/2020,2020-10-06 11:38:14.839886
1524226773,/v-baby-crib-bassinet/city-of-toronto/wood-crib-easy-setup/1524226773,100.0,Wood Crib (Easy setup),,"Selling our sturdy, pine wood crib. Includes all hardware and instructions. Disassembled, cleaned and ready to go. Fixed sides. Converts into a toddler bed (rails included), day and full-size bed ...",City of Toronto,15/09/2020,2020-10-06 11:38:14.840419
1524213412,/v-baby-crib-bassinet/city-of-toronto/baby-cradle-bed-only-40/1524213412,40.0,BABY CRADLE / BED >> only $40!,,"BABY ROCKING CRADLE/BED, SOLID WOOD, HAND MADE in Canada ONLY $40 ! ***** COVID FREE home/Pet-free/Smoke-free!",City of Toronto,15/09/2020,2020-10-06 11:38:14.840931
1524192448,/v-baby-crib-bassinet/city-of-toronto/summer-infant-classic-bassinet/1524192448,35.0,Summer Infant Classic Bassinet,,"Barely used / almost brand new bassinet. It's portable and can be easily moved. Includes canopy, mattress, fitted sheet, and sound machine. Pick up in East York only. If you are reading this it is ...",City of Toronto,15/09/2020,2020-10-06 11:38:14.841439
1524185119,/v-baby-crib-bassinet/city-of-toronto/baby-crib/1524185119,0.0,Baby Crib,,"Baby crib with bookshelf attached. The crib is a 2-1, with a daybed attachment(We never used the attachment). The crib has been used for 2 years and is in good condition. Has a few scratches/bite ...",City of Toronto,15/09/2020,2020-10-06 11:38:14.842075
1524183908,/v-baby-crib-bassinet/city-of-toronto/toddler-bed-crib-converted/1524183908,200.0,Toddler bed (crib converted),,Selling IKEA stuva crib converted into toddler bed. Selling bed with organic chemical free mattress included. No side panel to convert back to crib.,City of Toronto,15/09/2020,2020-10-06 11:38:14.842694
1513608579,/v-baby-crib-bassinet/city-of-toronto/breathable-baby-classic-breathable-light-pink-mesh-crib-liner/1513608579,20.0,Breathable Baby Classic Breathable Light Pink Mesh Crib Liner,,"$20 The original, patented Breathable® Mesh Crib Liner with millions sold since 2002. Unlike padded crib bumpers, our mesh crib liners keep little limbs safely inside the crib without the risk of ...",City of Toronto,15/09/2020,2020-10-06 11:38:14.843204
1513478222,/v-baby-crib-bassinet/city-of-toronto/oeuf-crib/1513478222,400.0,Oeuf crib,,Beautiful clean and contemporary crib made from wood panels on a solid wood base- one of the sturdiest and safest cribs on the market (normally 1000). Made of solid birch Sustainably produced Non ...,City of Toronto,15/09/2020,2020-10-06 11:38:14.843737
1524145168,/v-baby-crib-bassinet/city-of-toronto/ikea-leksvik-baby-crib-convertible-to-toddler-bed/1524145168,35.0,IKEA Leksvik Baby Crib Convertible to Toddler Bed,,"IKEA Leksvik Baby Crib Convertible to Toddler Bed -very good condition -crib has two mattress heights, one for newborns and one for older children. -includes manual and extra parts from original IKEA ...",City of Toronto,15/09/2020,2020-10-06 11:38:14.844231
1502929441,/v-baby-crib-bassinet/city-of-toronto/new-safety-1st-grow-with-me-2-in-1-baby-mattress/1502929441,40.0,New Safety 1st Grow with Me 2-in-1 Baby Mattress,,This is a brand new never used Safety 1st Grow with Me 2-in-1 Mattress. Was bought as a combo deal with a crib but the owner changed her mind and bought a better mattress. I have put a mattress cover ...,City of Toronto,15/09/2020,2020-10-06 11:38:14.844727
1524114174,/v-baby-crib-bassinet/city-of-toronto/breathablebaby-mesh-crib-liner-brand-new/1524114174,30.0,BreathableBaby Mesh Crib Liner - Brand new,,"Prevents arms and legs from getting stuck between crib slats. Designed so baby can easily breathe through it. Endorsed by doctors. Regular price $49.99+tax. Still in package, brand new.",City of Toronto,15/09/2020,2020-10-06 11:38:14.845219
1524113936,/v-baby-crib-bassinet/city-of-toronto/5-halo-bassinet-fitted-sheets-two-included-white/1524113936,0.0,$5 - Halo Bassinet Fitted Sheets (Two included; white),,**Used less than 5x; freshly washed** The HALO Bassinest Swivel Sleeper’s uniquely shaped mattress should be covered with this custom sized Bassinest Fitted Sheet. This sheet is designed to perfectly ...,City of Toronto,15/09/2020,2020-10-06 11:38:14.845713
1524108507,/v-baby-crib-bassinet/city-of-toronto/obo-avalon-4-in-1-convertible-crib-mattresses-included/1524108507,80.0,OBO Avalon 4-in-1 Convertible Crib - MATTRESSES INCLUDED,,"With traditional Espresso and timeless style, the Storkcraft Avalon 4-in-1 Convertible Crib will grow with your child. It brings comfort, safety and style to your baby's nursery. - TODDLER MATTRESS & ...",City of Toronto,15/09/2020,2020-10-06 11:38:14.846209
1496801001,/v-baby-crib-bassinet/city-of-toronto/crib-bumper-quilt-and-nightlight/1496801001,15.0,"crib bumper, quilt and nightlight",,EUC no rips or stains Pet free smoke free home Pick up bayview and Sheppard,City of Toronto,14/09/2020,2020-10-06 11:38:14.846718
1524091232,/v-baby-crib-bassinet/city-of-toronto/solid-wood-crib/1524091232,200.0,Solid Wood Crib,,College Woodwork Solid Wood Crib (Canadian birch). Made in Canada. Brown/Slate Grey. Paid $1000. Perfect condition! Converts to toddler bed. Can also convert to double bed with conversion kit ...,City of Toronto,14/09/2020,2020-10-06 11:38:14.847218
1524089505,/v-baby-crib-bassinet/city-of-toronto/fisher-price-crib-mobile-great-condition/1524089505,15.0,Fisher Price crib mobile - GREAT CONDITION,,Fisher Price crib mobile in great condition and comes with batteries - works perfectly! This gem kept my baby entertained for longer than any other toy. I could plop her in the crib and do my makeup ...,City of Toronto,14/09/2020,2020-10-06 11:38:14.847747
1502911657,/v-baby-crib-bassinet/city-of-toronto/pottery-barn-wicker-bassinet/1502911657,200.0,Pottery barn wicker bassinet,,"Beautiful pre loved pottery barn wicker bassinet in great condition. Comes with mattress (mattress protector), bassinet sheets and a crib bumper. A few scratches but not very noticeable. Can be ...",City of Toronto,14/09/2020,2020-10-06 11:38:14.848256
1502969264,/v-baby-crib-bassinet/city-of-toronto/rh-baby-and-child-marlowe-crib-parts/1502969264,30.0,RH Baby and Child Marlowe Crib Parts,,We are selling the pieces of the Marlowe crib with the exception of the headboard. This includes 2 side panels and the front panel (with some teething marks that can be sanded out. The crib spring ...,City of Toronto,14/09/2020,2020-10-06 11:38:14.848758
1513328594,/v-baby-crib-bassinet/city-of-toronto/bily-3-piece-nursery-set-crib-dresser-and-change-table/1513328594,250.0,"Bily 3 Piece Nursery Set - Crib, Dresser and Change Table",,"Bily - 3 Piece Nursery Set includes Crib, 4 Drawer Dresser and Change Table Dark Wood, Made in Canada, In Great Condition, Have Manual",City of Toronto,14/09/2020,2020-10-06 11:38:14.849400
1524061894,/v-baby-crib-bassinet/city-of-toronto/franklin-and-ben-convertible-crib-and-sealy-mattress/1524061894,200.0,Franklin and Ben Convertible Crib and Sealy Mattress,,Franklin and Ben convertible white crib and Sealy mattress. In good condition. Used for one child.,City of Toronto,14/09/2020,2020-10-06 11:38:14.849903
