,url,price,title,distance,description,location,time_offset,retreived
1528443058,/v-hot-tub-pool/city-of-toronto/kreepy-krauly-pool-cleaner/1528443058,400.0,Kreepy Krauly Pool Cleaner,,New in box. Kreepy Krauly Pool cleaner by Pentair,City of Toronto,< 4 hours ago,2020-10-07 17:19:22.571499
1528399174,/v-hot-tub-pool/city-of-toronto/pool-cover-and-water-bags-40x20-pool/1528399174,100.0,Pool cover and water bags 40x20 pool,,Selling a pool cover tarp and water bags used to cover a 40x20 pool for the winter closing. Selling as I have bought a safety cover this year.,City of Toronto,< 7 hours ago,2020-10-07 17:19:22.572028
1528391264,/v-hot-tub-pool/city-of-toronto/leaf-mesh-net-cover-24-round-above-ground-pool-brand-new/1528391264,50.0,(LEAF MESH NET COVER) 24’ Round Above Ground Pool / BRAND NEW,,"*************** This is a leaf mesh cover, Not a solid cover to protect from rain *************** . BRAND NEW IN SEALED MFG PACKAGING / NEVER USED / NEVER INSTALLED / NEVER TAKEN OUT OF BOX ($50.00) ...",City of Toronto,< 8 hours ago,2020-10-07 17:19:22.572520
1528390873,/v-hot-tub-pool/city-of-toronto/leaf-mesh-net-cover-16x32-oval-above-ground-pool-brand-new/1528390873,60.0,LEAF MESH NET COVER 16'x32' Oval Above Ground Pool / BRAND NEW,,"*************** This is a leaf mesh cover, Not a solid cover to protect from rain *************** BRAND NEW IN SEALED MFG PACKAGING / NEVER USED / NEVER INSTALLED / NEVER TAKEN OUT OF BOX ($60.00) – ...",City of Toronto,< 8 hours ago,2020-10-07 17:19:22.573002
1528338205,/v-hot-tub-pool/city-of-toronto/swimline-li1248bso-overlap-pool-liner/1528338205,100.0,Swimline LI1248BSO Overlap Pool Liner,,"Swimline LI1248BSO Overlap Pool Liner 48-52 in Wall, 12 ft Round, 20 Gauge, Boulder Swirl PRICE : 100 CAD PAYMENT METHOD: CASH ONLY Available Quantity: 01 If you are interested, Please text us on ...",City of Toronto,< 20 hours ago,2020-10-07 17:19:22.573873
1528325427,/v-hot-tub-pool/city-of-toronto/swimming-pool-ladder-rung-step/1528325427,30.0,Swimming Pool Ladder Rung/Step,,Swimming pool rung ladder. Brand new.,City of Toronto,< 21 hours ago,2020-10-07 17:19:22.574354
1528151302,/v-hot-tub-pool/city-of-toronto/fuel-pump-and-filter/1528151302,200.0,Fuel Pump and Filter,,Both are in working condition when pulled looking for 200 for both.,City of Toronto,05/10/2020,2020-10-07 17:19:22.575621
1516862595,/v-hot-tub-pool/city-of-toronto/outdoor-indoor-pool/1516862595,30.0,Outdoor/indoor pool,,"Foldable/collapsable indoor/outdoor pool kids pool, excellent condition, like brand new. $30 or best offer",City of Toronto,05/10/2020,2020-10-07 17:19:22.576104
1514914912,/v-hot-tub-pool/city-of-toronto/intex-8ft-x-30in-easy-set-pool-round-above-ground-inflatable/1514914912,249.0,INTEX 8ft x 30in Easy Set Pool Round Above Ground Inflatable,,"Please Read Entire Ad As Is If the ad is up, the item is still for sale :) Please call me if you’re serious 647-98557 Nine Two We do not respond to messages to avoid scammers Pickup Jane and the 400 ...",City of Toronto,05/10/2020,2020-10-07 17:19:22.576591
1528098669,/v-hot-tub-pool/city-of-toronto/7-hp-hot-tub-pump/1528098669,500.0,7 HP Hot Tub Pump,,"I have two circulation pumps that are next to new. Came out of two $20,000 jacuzzi tubs. - BEST Offer",City of Toronto,05/10/2020,2020-10-07 17:19:22.577092
1528016904,/v-hot-tub-pool/city-of-toronto/5-kg-of-pool-cleaner-and-shock-chemicals/1528016904,50.0,5 Kg of pool cleaner and shock chemicals,,Tub of OMNI powdered oxygen based pool quick clear and test strips.,City of Toronto,05/10/2020,2020-10-07 17:19:22.577574
1527966271,/v-hot-tub-pool/city-of-toronto/floating-cooler/1527966271,5.0,Floating Cooler,,Big Bobber floating cooler Fits about 12 cans $5 OBO Pick up only Item not considered sold until paid in full.,City of Toronto,04/10/2020,2020-10-07 17:19:22.578057
1527733039,/v-hot-tub-pool/city-of-toronto/99-pure-copper-sulfate/1527733039,20.0,99% pure copper sulfate,,"Brand new, bought from amazon last month, paid over $35, doesn’t need it when it arrived.. So now selling it for $20.",City of Toronto,03/10/2020,2020-10-07 17:19:22.579694
1527659518,/v-hot-tub-pool/city-of-toronto/swimming-pool-cover/1527659518,50.0,Swimming pool cover,,New Swimming pool cover pool size 21” cover size 24”,City of Toronto,03/10/2020,2020-10-07 17:19:22.580371
1527614802,/v-hot-tub-pool/city-of-toronto/hayward-automatic-pool-vacuum-cleaner/1527614802,75.0,Hayward Automatic Pool Vacuum cleaner,,Dirt Devil model. Works fine but needs a new control pack. Available on Amazon.,City of Toronto,03/10/2020,2020-10-07 17:19:22.580856
1527599231,/v-hot-tub-pool/city-of-toronto/spa-hot-tub-element/1527599231,50.0,SPA HOT TUB ELEMENT,,"Spa heater element New and tested 5500 watts 240 volts Was kept as spare. Spa is now gone. Asking $50 This is a Heater Element for Protect/Hybrid Hot Tubs from 2000 to present. Flo-Thru, 5.5 KW at ...",City of Toronto,03/10/2020,2020-10-07 17:19:22.581339
1527552531,/v-hot-tub-pool/city-of-toronto/pool-chlorine-with-jugs-perfect-for-closing-your-pool/1527552531,1.0,Pool Chlorine with jugs. Perfect for closing your pool.,,Both are full with chlorine I don't have a pool anymore so getting rid of my extra stuff. Can be used where anything chlorine is needed. $30 obo for the big blue one $20 obo for the smaller yellow ...,City of Toronto,03/10/2020,2020-10-07 17:19:22.581844
1527535058,/v-hot-tub-pool/city-of-toronto/summer-wave-pool/1527535058,1500.0,SUMMER WAVE POOL,,Selling “summer wave elite pool” - 18x 52 ft Only used for a couple months. still brand new. Price negotiable! Also solar heater and pool cover available,City of Toronto,02/10/2020,2020-10-07 17:19:22.582342
1516875030,/v-hot-tub-pool/city-of-toronto/chlorine-tablets-for-swimming-pool-hot-tub/1516875030,15.0,Chlorine Tablets for Swimming Pool/Hot tub,,2 packages of Chlorine 1 package has small tablets (half full) 1 package granules (half full) *Selling as I only needed a couple of tablets,City of Toronto,02/10/2020,2020-10-07 17:19:22.582820
1372989507,/v-hot-tub-pool/city-of-toronto/pool-ionizer-system/1372989507,80.0,Pool Ionizer System,,"- Copper & Zinc electrodes are energized with a low voltage, 12 DC current supplied from Solar Panel. - Ionization is an effective and inexpensive way to keep a pool clean without algees or bacteria. ...",City of Toronto,02/10/2020,2020-10-07 17:19:22.583359
1527465128,/v-hot-tub-pool/city-of-toronto/pool-cover/1527465128,60.0,Pool Cover,,Rectangular pool cover 21 - 1/2 feet by 36 feet with eye hooks and strap anchors. North Toronto pickup.,City of Toronto,02/10/2020,2020-10-07 17:19:22.583845
1527452645,/v-hot-tub-pool/city-of-toronto/brand-new-baby-inflatable-swimming-pool-4ft-wide-11inch-height/1527452645,25.0,Brand New baby Inflatable Swimming Pool 4ft wide * 11inch height,,This amazing inflatable swimming pool is the perfect choice to give your baby. Pick up is at Vodden and Kennedy,City of Toronto,02/10/2020,2020-10-07 17:19:22.584330
1528443058,/v-hot-tub-pool/city-of-toronto/kreepy-krauly-pool-cleaner/1528443058,400.0,Kreepy Krauly Pool Cleaner,,New in box. Kreepy Krauly Pool cleaner by Pentair,City of Toronto,< 4 hours ago,2020-10-07 17:19:24.483052
1528399174,/v-hot-tub-pool/city-of-toronto/pool-cover-and-water-bags-40x20-pool/1528399174,100.0,Pool cover and water bags 40x20 pool,,Selling a pool cover tarp and water bags used to cover a 40x20 pool for the winter closing. Selling as I have bought a safety cover this year.,City of Toronto,< 7 hours ago,2020-10-07 17:19:24.483529
1528391264,/v-hot-tub-pool/city-of-toronto/leaf-mesh-net-cover-24-round-above-ground-pool-brand-new/1528391264,50.0,(LEAF MESH NET COVER) 24’ Round Above Ground Pool / BRAND NEW,,"*************** This is a leaf mesh cover, Not a solid cover to protect from rain *************** . BRAND NEW IN SEALED MFG PACKAGING / NEVER USED / NEVER INSTALLED / NEVER TAKEN OUT OF BOX ($50.00) ...",City of Toronto,< 8 hours ago,2020-10-07 17:19:24.484017
1528390873,/v-hot-tub-pool/city-of-toronto/leaf-mesh-net-cover-16x32-oval-above-ground-pool-brand-new/1528390873,60.0,LEAF MESH NET COVER 16'x32' Oval Above Ground Pool / BRAND NEW,,"*************** This is a leaf mesh cover, Not a solid cover to protect from rain *************** BRAND NEW IN SEALED MFG PACKAGING / NEVER USED / NEVER INSTALLED / NEVER TAKEN OUT OF BOX ($60.00) – ...",City of Toronto,< 8 hours ago,2020-10-07 17:19:24.484504
1528338205,/v-hot-tub-pool/city-of-toronto/swimline-li1248bso-overlap-pool-liner/1528338205,100.0,Swimline LI1248BSO Overlap Pool Liner,,"Swimline LI1248BSO Overlap Pool Liner 48-52 in Wall, 12 ft Round, 20 Gauge, Boulder Swirl PRICE : 100 CAD PAYMENT METHOD: CASH ONLY Available Quantity: 01 If you are interested, Please text us on ...",City of Toronto,< 20 hours ago,2020-10-07 17:19:24.485368
1528325427,/v-hot-tub-pool/city-of-toronto/swimming-pool-ladder-rung-step/1528325427,30.0,Swimming Pool Ladder Rung/Step,,Swimming pool rung ladder. Brand new.,City of Toronto,< 21 hours ago,2020-10-07 17:19:24.485850
1528151302,/v-hot-tub-pool/city-of-toronto/fuel-pump-and-filter/1528151302,200.0,Fuel Pump and Filter,,Both are in working condition when pulled looking for 200 for both.,City of Toronto,05/10/2020,2020-10-07 17:19:24.487103
1516862595,/v-hot-tub-pool/city-of-toronto/outdoor-indoor-pool/1516862595,30.0,Outdoor/indoor pool,,"Foldable/collapsable indoor/outdoor pool kids pool, excellent condition, like brand new. $30 or best offer",City of Toronto,05/10/2020,2020-10-07 17:19:24.487595
1514914912,/v-hot-tub-pool/city-of-toronto/intex-8ft-x-30in-easy-set-pool-round-above-ground-inflatable/1514914912,249.0,INTEX 8ft x 30in Easy Set Pool Round Above Ground Inflatable,,"Please Read Entire Ad As Is If the ad is up, the item is still for sale :) Please call me if you’re serious 647-98557 Nine Two We do not respond to messages to avoid scammers Pickup Jane and the 400 ...",City of Toronto,05/10/2020,2020-10-07 17:19:24.488077
1528098669,/v-hot-tub-pool/city-of-toronto/7-hp-hot-tub-pump/1528098669,500.0,7 HP Hot Tub Pump,,"I have two circulation pumps that are next to new. Came out of two $20,000 jacuzzi tubs. - BEST Offer",City of Toronto,05/10/2020,2020-10-07 17:19:24.488558
1528016904,/v-hot-tub-pool/city-of-toronto/5-kg-of-pool-cleaner-and-shock-chemicals/1528016904,50.0,5 Kg of pool cleaner and shock chemicals,,Tub of OMNI powdered oxygen based pool quick clear and test strips.,City of Toronto,05/10/2020,2020-10-07 17:19:24.489051
1527966271,/v-hot-tub-pool/city-of-toronto/floating-cooler/1527966271,5.0,Floating Cooler,,Big Bobber floating cooler Fits about 12 cans $5 OBO Pick up only Item not considered sold until paid in full.,City of Toronto,04/10/2020,2020-10-07 17:19:24.489533
1527733039,/v-hot-tub-pool/city-of-toronto/99-pure-copper-sulfate/1527733039,20.0,99% pure copper sulfate,,"Brand new, bought from amazon last month, paid over $35, doesn’t need it when it arrived.. So now selling it for $20.",City of Toronto,03/10/2020,2020-10-07 17:19:24.491157
1527659518,/v-hot-tub-pool/city-of-toronto/swimming-pool-cover/1527659518,50.0,Swimming pool cover,,New Swimming pool cover pool size 21” cover size 24”,City of Toronto,03/10/2020,2020-10-07 17:19:24.491843
1527614802,/v-hot-tub-pool/city-of-toronto/hayward-automatic-pool-vacuum-cleaner/1527614802,75.0,Hayward Automatic Pool Vacuum cleaner,,Dirt Devil model. Works fine but needs a new control pack. Available on Amazon.,City of Toronto,03/10/2020,2020-10-07 17:19:24.492337
1527599231,/v-hot-tub-pool/city-of-toronto/spa-hot-tub-element/1527599231,50.0,SPA HOT TUB ELEMENT,,"Spa heater element New and tested 5500 watts 240 volts Was kept as spare. Spa is now gone. Asking $50 This is a Heater Element for Protect/Hybrid Hot Tubs from 2000 to present. Flo-Thru, 5.5 KW at ...",City of Toronto,03/10/2020,2020-10-07 17:19:24.492853
1527552531,/v-hot-tub-pool/city-of-toronto/pool-chlorine-with-jugs-perfect-for-closing-your-pool/1527552531,1.0,Pool Chlorine with jugs. Perfect for closing your pool.,,Both are full with chlorine I don't have a pool anymore so getting rid of my extra stuff. Can be used where anything chlorine is needed. $30 obo for the big blue one $20 obo for the smaller yellow ...,City of Toronto,03/10/2020,2020-10-07 17:19:24.493335
1527535058,/v-hot-tub-pool/city-of-toronto/summer-wave-pool/1527535058,1500.0,SUMMER WAVE POOL,,Selling “summer wave elite pool” - 18x 52 ft Only used for a couple months. still brand new. Price negotiable! Also solar heater and pool cover available,City of Toronto,02/10/2020,2020-10-07 17:19:24.493820
1516875030,/v-hot-tub-pool/city-of-toronto/chlorine-tablets-for-swimming-pool-hot-tub/1516875030,15.0,Chlorine Tablets for Swimming Pool/Hot tub,,2 packages of Chlorine 1 package has small tablets (half full) 1 package granules (half full) *Selling as I only needed a couple of tablets,City of Toronto,02/10/2020,2020-10-07 17:19:24.494304
1372989507,/v-hot-tub-pool/city-of-toronto/pool-ionizer-system/1372989507,80.0,Pool Ionizer System,,"- Copper & Zinc electrodes are energized with a low voltage, 12 DC current supplied from Solar Panel. - Ionization is an effective and inexpensive way to keep a pool clean without algees or bacteria. ...",City of Toronto,02/10/2020,2020-10-07 17:19:24.494789
1527465128,/v-hot-tub-pool/city-of-toronto/pool-cover/1527465128,60.0,Pool Cover,,Rectangular pool cover 21 - 1/2 feet by 36 feet with eye hooks and strap anchors. North Toronto pickup.,City of Toronto,02/10/2020,2020-10-07 17:19:24.495278
1527452645,/v-hot-tub-pool/city-of-toronto/brand-new-baby-inflatable-swimming-pool-4ft-wide-11inch-height/1527452645,25.0,Brand New baby Inflatable Swimming Pool 4ft wide * 11inch height,,This amazing inflatable swimming pool is the perfect choice to give your baby. Pick up is at Vodden and Kennedy,City of Toronto,02/10/2020,2020-10-07 17:19:24.495764
1527411871,/v-hot-tub-pool/city-of-toronto/4-deep-outdoor-hot-tub-with-jets/1527411871,2500.0,4’ deep outdoor hot tub with jets.,,"We replaced our cottage hot tub with a bigger one and wanted to install this round hot tub in our city home, but unfortunately it won’t fit. It’s 7’ diameter by 4’ deep. It’s 3 years old, wood ...",City of Toronto,02/10/2020,2020-10-07 17:19:30.127585
1426648052,/v-hot-tub-pool/city-of-toronto/swimming-pool-new-backwash-hose-1-5-inch-x-50-feet-clear-blue/1426648052,10.0,SWIMMING POOL NEW BACKWASH HOSE  1.5 INCH X 50 FEET CLEAR BLUE,,PLEASE PHONE ME BETWEEN 3 P.M. AND 8 P.M. AT 647 862 7411. PLEASE DO NOT TEXT ME. LOCATED IN SCARBOROUGH ON MACKINAC CRES.,City of Toronto,02/10/2020,2020-10-07 17:19:30.128094
1527171223,/v-hot-tub-pool/city-of-toronto/5600litre-portable-water-tank-for-sale/1527171223,1350.0,5600Litre Portable Water Tank for sale,,"Used for 3 months, was inside truck all the time. Need to get rid of it fast best offer takes it. Free delivery in gta.",City of Toronto,30/09/2020,2020-10-07 17:19:30.129596
1527095941,/v-hot-tub-pool/city-of-toronto/hot-tub-jets/1527095941,45.0,Hot Tub Jets,,6 Small hot tub jets Originally paid $85 For pick-up in Markham,City of Toronto,30/09/2020,2020-10-07 17:19:30.130827
1527092565,/v-hot-tub-pool/city-of-toronto/saskatoon-12-jet-4-person-hot-tub/1527092565,4999.0,Saskatoon 12-Jet 4-Person Hot Tub,,"Saskatoon 12-Jet 4-Person Hot Tub Designed for up to 4 people with barrier-free seating, the Saskatoon has room for everyone and features different jet configurations to find your ideal set ...",City of Toronto,30/09/2020,2020-10-07 17:19:30.131399
1527029165,/v-hot-tub-pool/city-of-toronto/hot-tub-replacement-cover-made-in-canada-288-88/1527029165,288.88,HOT TUB REPLACEMENT COVER. Made in Canada. 288.88$,,**HOT TUB COVERS - Proudly made in Canada** Get ready to enjoy spa-time at home! 48h delivery all Ontario. Buy local! 500 Hot Tub Covers ready to ship. Quality Hot Tub Covers. - 4 seasons - Thermal ...,City of Toronto,30/09/2020,2020-10-07 17:19:30.131905
1527027050,/v-hot-tub-pool/city-of-toronto/hot-tub-replacement-cover-buy-from-manufacturer/1527027050,288.88,HOT TUB REPLACEMENT COVER. Buy from manufacturer.,,**HOT TUB COVERS - Proudly made in Canada** Get ready to enjoy spa-time at home! 48h delivery all Ontario. Buy local! 500 Hot Tub Covers ready to ship. Quality Hot Tub Covers. - 4 seasons - Thermal ...,City of Toronto,30/09/2020,2020-10-07 17:19:30.132612
1527021467,/v-hot-tub-pool/city-of-toronto/sundance-optima-hot-tub-pumps/1527021467,500.0,Sundance optima hot tub pumps,,"Selling pumps from a recently replaced Sundance optima hot tub (mid 2000s) 1x 1/15 HP circulation pump ~3 years old $150 1x 2.5 HP jet pump rebuilt last year - $300 1x 2.5 HP jet pump (original, may ...",City of Toronto,30/09/2020,2020-10-07 17:19:30.133119
1526941876,/v-hot-tub-pool/city-of-toronto/swimming-pool-pump/1526941876,100.0,Swimming pool pump,,Good condition,City of Toronto,29/09/2020,2020-10-07 17:19:30.133822
1526931653,/v-hot-tub-pool/city-of-toronto/kidney-shaped-solar-blanket-with-roll-up-system/1526931653,200.0,Kidney shaped Solar Blanket with roll up system,,Still works. Its used and is slightly scratchy at the ends but is still works perfectly and in good condition. This is quite large so you will need a truck to pick it up. Comes with the system to ...,City of Toronto,29/09/2020,2020-10-07 17:19:30.134340
1526930768,/v-hot-tub-pool/city-of-toronto/pool-filter-drum/1526930768,75.0,Pool Filter Drum,,There is no sand inside the drum anymore. In good condition. Comes with base holder.,City of Toronto,29/09/2020,2020-10-07 17:19:30.135706
1526930300,/v-hot-tub-pool/city-of-toronto/metal-ladder-for-pool/1526930300,100.0,Metal Ladder for Pool,,Metal ladder for sale. 3 rungs. About 20 years old but still in good condition.,City of Toronto,29/09/2020,2020-10-07 17:19:30.136438
1526886534,/v-hot-tub-pool/city-of-toronto/hot-pod-floating-spa-for-your-pool/1526886534,350.0,Hot Pod Floating Spa for your Pool,,"The secret to Hot Pod™ is that it takes hot water from your pool heater and pumps it through six hydro-engineered jets. Inside the spa it’s warm, bubbly, and incredibly relaxing. Meanwhile, the rest ...",City of Toronto,29/09/2020,2020-10-07 17:19:30.137069
1516120914,/v-hot-tub-pool/city-of-toronto/polaris-pool-pump-and-cleaner/1516120914,325.0,Polaris Pool pump and Cleaner,,Sold as a pair both the Polaris Booster pump and Polaris vacuum cleaner. This sells new from Pioneer pools for $1500.. I am asking $400 for serious buyers/offers only ...,City of Toronto,28/09/2020,2020-10-07 17:19:30.137574
1526645517,/v-hot-tub-pool/city-of-toronto/jacuzzi-pool-ladder/1526645517,150.0,Jacuzzi Pool Ladder,,Used 3 step Jacuzzi pool ladder for sale. Available for pick-up in North York.,City of Toronto,28/09/2020,2020-10-07 17:19:30.138299
1515981492,/v-hot-tub-pool/city-of-toronto/intermatic-t104m-dial-timer-mechanism-pool-ac-pump-lights-new/1515981492,65.0,INTERMATIC T104M Dial Timer Mechanism Pool AC pump lights **New,,"INTERMATIC T104M Dial Timer Mechanism - Pool, AC, Security Systems, Pump, lighting, etc **New INTERMATIC T104M Dial Timer Mechanism for Pools, Pumps, Air Conditioner, Outdoor Lights, Heater, etc. New ...",City of Toronto,27/09/2020,2020-10-07 17:19:30.138806
1526599308,/v-hot-tub-pool/city-of-toronto/pentair-340040-superflo-inground-swimming-pool-pump-2-hp-230v/1526599308,200.0,"Pentair 340040 SUPERFLO Inground Swimming Pool Pump, 2 HP, 230V",,SuperFlo by Pentair Pool Products® is a direct replacement for the Hayward® Super Pump®* Extremely quiet operation Unionized fittings (1.5 in. internal slip and 2 in. external slip) Cam and Ramp Lid ...,City of Toronto,27/09/2020,2020-10-07 17:19:30.139325
1526570031,/v-hot-tub-pool/city-of-toronto/solar-water-heater-for-above-ground-pool/1526570031,60.0,SOLAR WATER HEATER FOR ABOVE GROUND POOL,,LOCATED AT ISLINGTON & THE QUEENSWAY Summer Waves solar water heater for above ground pool. Super durable material. Mat style. Bought new for $100.,City of Toronto,27/09/2020,2020-10-07 17:19:30.139835
1526518428,/v-hot-tub-pool/city-of-toronto/pool-ladder-for-sale/1526518428,200.0,Pool Ladder for Sale,,Year old pool ladder for sale! This is for an above ground pool. Very sturdy and in great condition.,City of Toronto,27/09/2020,2020-10-07 17:19:30.140364
1526478748,/v-hot-tub-pool/city-of-toronto/15-pool/1526478748,600.0,15’ pool,,Bought it 2 months ago,City of Toronto,27/09/2020,2020-10-07 17:19:30.140874
1526438438,/v-hot-tub-pool/city-of-toronto/aqua-pro-sand-filter-and-pump-system-for-ag-pools/1526438438,325.0,Aqua Pro sand filter and pump system for AG pools,,Brand new in the box Comes with all accessories seen on the box except the sand for the pool filter Asking $325 Call or text 4166762734 if interested No emails,City of Toronto,27/09/2020,2020-10-07 17:19:30.141377
1515495280,/v-hot-tub-pool/city-of-toronto/brand-new-nautica-beach-towels/1515495280,25.0,Brand New NAUTICA Beach Towels,,"IF the add is up, IT IS AVAILABLE - please do not message asking. 2 Brand New nautica beach towels with tags. Each $25, or 2 for $45",City of Toronto,26/09/2020,2020-10-07 17:19:30.142370
1526354761,/v-hot-tub-pool/city-of-toronto/inflatable-giant-unicorn/1526354761,40.0,Inflatable Giant Unicorn,,- Inflatable Giant Unicorn,City of Toronto,26/09/2020,2020-10-07 17:19:30.144050
1526325566,/v-hot-tub-pool/city-of-toronto/robotic-pool-cleaner-by-hayward-for-parts/1526325566,100.0,Robotic pool cleaner by Hayward for parts,,Hayward Pool Vac with a stand: needs to be repaired or can be used for parts. $100,City of Toronto,26/09/2020,2020-10-07 17:19:30.144931
1526319165,/v-hot-tub-pool/city-of-toronto/swimming-pool-leaf-net/1526319165,40.0,swimming pool leaf net,,"Leaf cover net, Canadian made, approximately 20"" x 32"". Has a few tiny holes (see the pictures), but still good to use:-) $40 obo",City of Toronto,26/09/2020,2020-10-07 17:19:30.145598
1526300988,/v-hot-tub-pool/city-of-toronto/new-hot-tub-filter/1526300988,20.0,New hot tub filter,,Brand new still shrink wrapped Unicel filter for hot tub. Storage box included.,City of Toronto,26/09/2020,2020-10-07 17:19:30.146337
1526298875,/v-hot-tub-pool/city-of-toronto/hot-tub-motor/1526298875,80.0,Hot tub motor,,"Barely used 1.5 Horsepower pump for hot tub, spa or pool. Waterway brand insulated wet end pump. In perfect working order. 401/DVP area pickup.",City of Toronto,26/09/2020,2020-10-07 17:19:30.146869
1526290974,/v-hot-tub-pool/city-of-toronto/pool-equiptment-for-sale/1526290974,300.0,Pool equiptment for sale,,Hayward pro series pool filtration system in working order 8/10 condition. Hayward chlorine feeder 9/10 condition in working order. Pentair high performance pool pump 8/10 condition in working order. ...,City of Toronto,26/09/2020,2020-10-07 17:19:30.147394
1493444095,/v-hot-tub-pool/city-of-toronto/10-00-ft-removable-safety-pool-fence-lifetime-warranty/1493444095,10.0,$10.00/ft Removable Safety Pool Fence.Lifetime Warranty,,"Removable Safety Pool Fence www.safetyfenceontario.com LIFETIME WARRANTY. FREE ESTIMATE The most reliable Pool Safety Fence . Top quality ,climb resistance, strong interlock mesh complete ...",City of Toronto,26/09/2020,2020-10-07 17:19:30.148096
1526142726,/v-hot-tub-pool/city-of-toronto/hayward-chlorine-feeder/1526142726,50.0,Hayward chlorine feeder,,"Hayward Chlorine Feeder, used but in good condition.",City of Toronto,25/09/2020,2020-10-07 17:19:30.148595
1526120332,/v-hot-tub-pool/city-of-toronto/pool-stair-cover/1526120332,80.0,Pool stair cover,,"Fibreglass inground pool step cover Measures 80 inches by 52 inches $80 obo If interested, call: 416-422-5955",City of Toronto,25/09/2020,2020-10-07 17:19:30.149089
1515414675,/v-hot-tub-pool/city-of-toronto/pool-pumps-for-sale/1515414675,325.0,Pool pumps for sale,,Emerson 2hp model : T55mwcbp-1197 $325 A.O. Smith 4hp 7-187624-01 $325 Century 4hp model number PF-50-2n22c 325 Emerson 5hp pump model number R63mwena-4727 $400,City of Toronto,25/09/2020,2020-10-07 17:19:32.469575
1525968642,/v-hot-tub-pool/city-of-toronto/swimming-pool/1525968642,300.0,Swimming pool,,Over the ground round shape swimming pool,City of Toronto,24/09/2020,2020-10-07 17:19:32.470071
1525889211,/v-hot-tub-pool/city-of-toronto/intex-purespa-spa-cover-never-used/1525889211,25.0,Intex PureSpa Spa Cover - Never used.,,I have a Intex PureSpa inflatable cover (complete with both the exterior cover and the inflatable insert). It has never been used -- I received two at the time of purchase and do not need the second ...,City of Toronto,24/09/2020,2020-10-07 17:19:32.470529
1525841869,/v-hot-tub-pool/city-of-toronto/pool-heater-for-sale/1525841869,250.0,Pool heater for sale,,Raypak millivoltage pool heater in great condition.,City of Toronto,23/09/2020,2020-10-07 17:19:32.471016
1495606096,/v-hot-tub-pool/city-of-toronto/fall-and-safety-season-is-coming-are-you-ready/1495606096,1500.0,FALL and SAFETY season is coming..are you ready?,,Living for the days when we could share the pool on the patio or at the cottage with family and friends . Don’t forget to order your brand new Liner with wonderful 2020 colours..the prices are rock ...,City of Toronto,23/09/2020,2020-10-07 17:19:32.471530
1525811338,/v-hot-tub-pool/city-of-toronto/hot-tub-pool-spa-treatment/1525811338,70.0,Hot Tub/Pool/ Spa Treatment,,"Various maintenance chemicals, bromine, etc 2 floats (for chlorine + bromine pucks) Originally paid $280 For pick-up in Markham. As-is.",City of Toronto,23/09/2020,2020-10-07 17:19:32.472022
1525767901,/v-hot-tub-pool/city-of-toronto/ds-2c-rain-snow-sensor-controller/1525767901,300.0,DS-2C RAIN/SNOW SENSOR CONTROLLER,,AUTOMATED SYSTEM ENGINEERING DS-2C RAIN/SNOW SENSOR CONTROLLER • Automatic Activation means Lower Deicing Costs • Reliable Rain and Snow Detection • Full 30A @ 277VAC Control • Universal 100-277 VAC ...,City of Toronto,23/09/2020,2020-10-07 17:19:32.472510
