,url,price,title,distance,description,location,time_offset,retreived
1521467898,/v-stereo-systems-home-theatre/city-of-toronto/energy-speakers-and-polk-subwoofer/1521467898,225.0,Energy speakers and Polk subwoofer,,5 Energy bookshelf speakers and 8-inch Polk Audio subwoofer. Recently tested. Near York Mills Road,City of Toronto,01/09/2020,2020-10-07 17:38:36.176473
1521457267,/v-stereo-systems-home-theatre/city-of-toronto/sony-av-receiver/1521457267,110.0,Sony Av Receiver,,Sony STR DH-130 Unboxed Demo 200 Watt / 2 Ch.,City of Toronto,01/09/2020,2020-10-07 17:38:36.176953
1521425788,/v-stereo-systems-home-theatre/city-of-toronto/audio-turntable/1521425788,950.0,Audio turntable,,Turntable pl 530 used good condition. phone 416-358-3785,City of Toronto,01/09/2020,2020-10-07 17:38:36.177435
1392469625,/v-stereo-systems-home-theatre/city-of-toronto/panasonic-sc-hc39-compact-stereo-system-cds-bluetooth-radio/1392469625,150.0,"Panasonic SC-HC39 Compact Stereo System (CDs, Bluetooth, radio)",,"In excellent condition. Includes original packaging. Caters to all generations: Plays Bluetooth, radio, and CDs. The sound quality is excellent.",City of Toronto,01/09/2020,2020-10-07 17:38:36.177916
1521422471,/v-stereo-systems-home-theatre/city-of-toronto/technics-stereo-system-with-phono-input/1521422471,150.0,Technics Stereo system with phono input,,"Complete system with tuner, cd player, dual cassette deck, and excellent amplifier su-v98 with real old school 110 watts per channel buy everything for less than the price of the amplifier on eBay! ...",City of Toronto,01/09/2020,2020-10-07 17:38:36.178400
1521414845,/v-stereo-systems-home-theatre/city-of-toronto/pioneer-double-cassette-deck-nice/1521414845,85.0,Pioneer double cassette deck NICE!,,CT-w700r dual cassette works well and is excellent quality. Looks and works like new. Needs a new home. $85,City of Toronto,01/09/2020,2020-10-07 17:38:36.178878
1521410226,/v-stereo-systems-home-theatre/city-of-toronto/jensen-cd-560-portable-stereo-cd-player-with-am-fm-stereo-radio/1521410226,35.0,JENSEN CD-560 Portable Stereo CD Player with AM/FM Stereo Radio,,"CLOSING SALE ( we moved to new address) CLEARANCE FINAL SALE (SoldLess Clearance Center INC) all our prices are without tax (cash only ) regular price :$66 our price :$35 New , open box Final ...",City of Toronto,01/09/2020,2020-10-07 17:38:36.179366
1521406001,/v-stereo-systems-home-theatre/city-of-toronto/akai-amplifier-and-matching-turntable/1521406001,250.0,Akai amplifier and matching turntable,,Akai AM-U7 integrated amp - 1983 model in good working order. Eighty (80) watts per channel - torroidal transformer - moving coil/moving magnet phono input - binding post speaker terminals - push ...,City of Toronto,01/09/2020,2020-10-07 17:38:36.179847
1521397865,/v-stereo-systems-home-theatre/city-of-toronto/ada-audio-design-associates-cinema-reference-processor/1521397865,550.0,ADA Audio Design Associates Cinema Reference Processor,,ADA Audio Design Associates Cinema Reference Processor Mint Condition. Works Perfectly. Comes with the Processor and the remote. Asking $ 550.00 or best offer. Cash Only. No Trades. In Person Only.,City of Toronto,01/09/2020,2020-10-07 17:38:36.180328
1510650511,/v-stereo-systems-home-theatre/city-of-toronto/vintage-hitachi-da-400-stereo-cd-player/1510650511,50.0,VINTAGE HITACHI DA 400 STEREO CD PLAYER,,Specifications Disc format: CD Digital converter: 16-bit linear CD Mechanism: CD-M11 Frequency response: 5Hz to 20kHz Dynamic range: 95dB Signal to Noise Ratio: 95dB Channel separation: 92dB Total ...,City of Toronto,31/08/2020,2020-10-07 17:38:40.451927
1500597514,/v-stereo-systems-home-theatre/city-of-toronto/the-new-classical-96-3-fm-mood-by-addex-radio-speaker/1500597514,10.0,"The New Classical 96.3 FM Mood by Addex, Radio/Speaker",,"The New Classical 96.3 FM Mood by Addex Radio/Speaker 4X ""AA"" Batteries, Not Included 3.5""(9cm)X 3.5""(9cm)X 3.5""(9cm) $20",City of Toronto,31/08/2020,2020-10-07 17:38:40.452421
1521331135,/v-stereo-systems-home-theatre/city-of-toronto/technics-dual-cassette-deck/1521331135,40.0,Technics Dual  Cassette deck,,Works well and the photos will give you all the specs,City of Toronto,31/08/2020,2020-10-07 17:38:40.452905
1521330541,/v-stereo-systems-home-theatre/city-of-toronto/50-great-condition-radio/1521330541,50.0,$50 great condition radio,,Bathurst/Steeles Tina 6478016898,City of Toronto,31/08/2020,2020-10-07 17:38:40.453623
1521320760,/v-stereo-systems-home-theatre/city-of-toronto/samsung-sound-system/1521320760,15.0,Samsung sound system,,"Receiver, sub and 2 fronts $15",City of Toronto,31/08/2020,2020-10-07 17:38:40.454475
1467538578,/v-stereo-systems-home-theatre/city-of-toronto/pioneer-stereo/1467538578,50.0,Pioneer stereo,,"All in one pioneer stereo system Tape, 25 CD, remote.",City of Toronto,31/08/2020,2020-10-07 17:38:40.455018
1521293758,/v-stereo-systems-home-theatre/city-of-toronto/sony-am-fm-home-theater-sound-system/1521293758,45.0,SONY  ** AM/FM HOME THEATER SOUND SYSTEM,,"SONY ** AM/FM SOUND SYSTEM , MULTIPLE INPUT/OUTPUTS., WATCH YOUR FAVORITE SENTIMENTAL MOVIES WITH NEW SOUND.",City of Toronto,31/08/2020,2020-10-07 17:38:40.455545
1521291516,/v-stereo-systems-home-theatre/city-of-toronto/pyle-pta2-stereo-amplifier/1521291516,50.0,Pyle pta2 stereo amplifier,,2x40w pta 2 stereo amplifier,City of Toronto,31/08/2020,2020-10-07 17:38:40.456060
1510668371,/v-stereo-systems-home-theatre/city-of-toronto/ion-ttusb-turntable-needs-repair/1510668371,80.0,ION TTUSB Turntable (needs repair),,This is a turntable that allows you to transfer audio from records to a computer through a USB connection. The turntable still turns but it currently does not produce audio so it needs repair. ...,City of Toronto,31/08/2020,2020-10-07 17:38:40.456580
1510820068,/v-stereo-systems-home-theatre/city-of-toronto/thorens-td-150-ab-turntable-with-stanton-680-mkii-cartridge/1510820068,500.0,THORENS TD-150 AB TURNTABLE WITH STANTON 680 MKII  CARTRIDGE,,"PLEASE GIVE US A CALL BEFORE COMING . WE DO NOT REGULARLY CHECK OUR MAILS SO CALLING IS YOUR BEST OPTION . Item is in good working condition . Come and see hundreds of items ( Vintage audio , led TV ...",City of Toronto,31/08/2020,2020-10-07 17:38:40.457084
1510818957,/v-stereo-systems-home-theatre/city-of-toronto/pioneer-ct-f1250-3-head-cassette-deck-with-instruction-book/1510818957,1500.0,PIONEER CT-F1250 3 HEAD  CASSETTE DECK WITH INSTRUCTION BOOK,,"PLEASE GIVE US A CALL BEFORE COMING . WE DO NOT REGULARLY CHECK OUR MAILS SO CALLING IS YOUR BEST OPTION . Item is in good working condition . Come and see hundreds of items ( Vintage audio , led TV ...",City of Toronto,31/08/2020,2020-10-07 17:38:40.457575
1500693439,/v-stereo-systems-home-theatre/city-of-toronto/sima-power-amplifier-2003-preamplifier-2001/1500693439,1100.0,SIMA  POWER AMPLIFIER 2003/PREAMPLIFIER 2001,,"PLEASE GIVE US A CALL BEFORE COMING . WE DO NOT REGULARLY CHECK OUR MAILS SO CALLING IS YOUR BEST OPTION . Item is in good working condition . Come and see hundreds of items ( Vintage audio , led TV ...",City of Toronto,31/08/2020,2020-10-07 17:38:40.458100
1500693161,/v-stereo-systems-home-theatre/city-of-toronto/linn-lk85-stereo-power-amplifier/1500693161,450.0,LINN  LK85 STEREO POWER AMPLIFIER,,"PLEASE GIVE US A CALL BEFORE COMING . WE DO NOT REGULARLY CHECK OUR MAILS SO CALLING IS YOUR BEST OPTION . Item is in good working condition . Come and see hundreds of items ( Vintage audio , led TV ...",City of Toronto,31/08/2020,2020-10-07 17:38:40.458634
1474716110,/v-stereo-systems-home-theatre/city-of-toronto/harman-kardon-cd401-3-head-cassette-deck/1474716110,300.0,HARMAN/KARDON  CD401 3 HEAD CASSETTE DECK,,"PLEASE GIVE US A CALL BEFORE COMING . WE DO NOT REGULARLY CHECK OUR MAILS SO CALLING IS YOUR BEST OPTION . Item is in good working condition . Come and see hundreds of items ( Vintage audio , led TV ...",City of Toronto,31/08/2020,2020-10-07 17:38:40.459158
1492777541,/v-stereo-systems-home-theatre/city-of-toronto/arcam-t51-am-fm-tuner/1492777541,180.0,ARCAM T51 AM/FM TUNER,,"PLEASE GIVE US A CALL BEFORE COMING . WE DO NOT REGULARLY CHECK OUR MAILS SO CALLING IS YOUR BEST OPTION . Item is in good working condition . Come and see hundreds of items ( Vintage audio , led TV ...",City of Toronto,31/08/2020,2020-10-07 17:38:40.459711
1440065470,/v-stereo-systems-home-theatre/city-of-toronto/samick-smp-4000-power-amplifier/1440065470,350.0,SAMICK SMP-4000 POWER AMPLIFIER,,"PLEASE GIVE US A CALL BEFORE COMING . WE DO NOT REGULARLY CHECK OUR MAILS SO CALLING IS YOUR BEST OPTION . Item is in good working condition . Come and see hundreds of items ( Vintage audio , led TV ...",City of Toronto,31/08/2020,2020-10-07 17:38:40.460241
1427732383,/v-stereo-systems-home-theatre/city-of-toronto/jvc-home-theater-speakers-6-pcs/1427732383,20.0,JVC HOME THEATER SPEAKERS  ( 6 PCS ),,"PLEASE GIVE US A CALL BEFORE COMING . WE DO NOT REGULARLY CHECK OUR MAILS SO CALLING IS YOUR BEST OPTION . Item is in good working condition . Come and see hundreds of items ( Vintage audio , led TV ...",City of Toronto,31/08/2020,2020-10-07 17:38:40.460736
1521270593,/v-stereo-systems-home-theatre/city-of-toronto/like-new-denon-avr-x2000-reciever/1521270593,150.0,Like New Denon AVR-X2000 Reciever,,Denon AVR-X2000 Reciever Works great. Just doesn’t come with remote. Can test out before you buy if you bring speakers. Only selling because I updated my system. Works perfectly otherwise.,City of Toronto,31/08/2020,2020-10-07 17:38:40.461222
1521258066,/v-stereo-systems-home-theatre/city-of-toronto/sony-srs-d-25/1521258066,50.0,Sony SRS D-25,,Sony SRS - D-25 Computer mini system Great sound quality for such a small system.,City of Toronto,31/08/2020,2020-10-07 17:38:40.462307
1521203183,/v-stereo-systems-home-theatre/city-of-toronto/vintage-sharp-power-amplifier/1521203183,175.0,Vintage Sharp Power Amplifier,,IF AD IS UP ITEM is available Please call if interested. Any emails asking if this is available will be politely deleted. Vintage Sharp SK-8800C Power Amplifier. this ampliifer is rated at high ...,City of Toronto,31/08/2020,2020-10-07 17:38:40.463186
1501249122,/v-stereo-systems-home-theatre/city-of-toronto/vintage-koronette-stereo-record-player/1501249122,150.0,Vintage Koronette Stereo/Record Player,,"Beautiful vintage Koronette stereo console made in Germany. Has AM/FM and short wave bands radio, a turntable, with twin speakers, LP storage, bar unit and disco lights. The cabinet is in very good ...",City of Toronto,31/08/2020,2020-10-07 17:38:40.463689
1380967506,/v-stereo-systems-home-theatre/city-of-toronto/peavey-8-channel-power-amplifier/1380967506,350.0,Peavey 8 channel power amplifier,,"Brand is Media Matrix Octo power 850. PRODUCT DESCRIPTION:Peavey's MediaMatrix the Octopower 850 is a multichannel power amp featuring 8 bridgeable 50-watt channels, with rear panel connections and ...",City of Toronto,31/08/2020,2020-10-07 17:38:40.464174
1500126409,/v-stereo-systems-home-theatre/city-of-toronto/audioquest-nrg1-c7-power-cord-6-ft-2m/1500126409,70.0,AUDIOQUEST NRG1  C7 POWER CORD - 6 FT / 2M,,AUDIOQUEST NRG1 C7 POWER CORD - 6 FT / 2M AUDIOQUEST NRG1 C7 POWER CORD IN EXCELLENT COND. 6 FT / 2M LONG. GREAT UPGRADE FOR YOUR BLURAY / PLAYSTATION / AUDIOPHILE CD OR DVD PLAYER. CHECK OUT THE ...,City of Toronto,30/08/2020,2020-10-07 17:38:40.464657
1521160473,/v-stereo-systems-home-theatre/city-of-toronto/vintage-luxman-receiver-with-dual-turntable-epi-speakers/1521160473,799.0,Vintage Luxman Receiver with Dual Turntable & EPI Speakers,,Luxman model R-1030 Receiver Dual 506 belt drive turntable EPI model 100V speakers,City of Toronto,30/08/2020,2020-10-07 17:38:40.465191
1521159457,/v-stereo-systems-home-theatre/city-of-toronto/rare-vintage-scott-stereo-receiver-amplifier-cd-player-tuner-pkg/1521159457,325.0,RARE VINTAGE SCOTT STEREO RECEIVER AMPLIFIER CD PLAYER/TUNER PKG,,RARE SCOTT A1610 STEREO MONSTER RECEIVER 150W PER CHANNEL. VERY HEAVY AND WELL MADE. VINTAGE SCOTT DA980 CD PLAYER AND SCOTT T1210 AM/FM STEREO DIGITAL SYNTHESIZER TUNER. A WELL PUT TOGETHER PACKAGE. ...,City of Toronto,30/08/2020,2020-10-07 17:38:40.465892
1500437319,/v-stereo-systems-home-theatre/city-of-toronto/nikko-alpha-11-rack-mount-power-amp/1500437319,475.0,Nikko Alpha 11 Rack Mount Power Amp,,"In very good condition fully cleaned and tested all meter lamps work . , very powerful sweet sounding amp dua power supply incredibly quiet amp",City of Toronto,30/08/2020,2020-10-07 17:38:40.466383
1521153716,/v-stereo-systems-home-theatre/city-of-toronto/vintage-stereo-speaker-set/1521153716,200.0,Vintage Stereo Speaker Set,,"- Kenwood Stereo Graphic Equalizer (KE-597) - Sony Audio/Video Control Center (STR-D665) - Sony High Density Linear Converter (CDP-C365) All are tested and work perfectly, fully operational and ...",City of Toronto,30/08/2020,2020-10-07 17:38:40.466871
1510573961,/v-stereo-systems-home-theatre/city-of-toronto/curtis-sylvania-skcr2810bt-under-cabinet-clock-radio-music-syst/1510573961,25.0,"Curtis Sylvania SKCR2810BT Under Cabinet Clock Radio, Music Syst",,"Curtis Sylvania SKCR2810BT Under Cabinet Clock Radio, Music System with Bluetooth Streaming and FM Radio Brand New - No Box Please read the entire ad. Please check availability on our website, due to ...",City of Toronto,30/08/2020,2020-10-07 17:38:40.467377
1521038009,/v-stereo-systems-home-theatre/city-of-toronto/jvc-rc-m70c-stereo-radio-cassette-recorder-for-sale/1521038009,1900.0,JVC RC-M70C Stereo Radio Cassette Recorder for sale,,JVC RC-M70C Stereo 6 BAND Radio Cassette Recorder for sale VINTAGE 1980 Specifications: 6.5 inch (16cm) woofers. 2 inch (5cm) tweeters. Two AN7145K(H) amplifier chips (made by Matsushita/Panasonic) ...,City of Toronto,30/08/2020,2020-10-07 17:38:40.467868
1492813020,/v-stereo-systems-home-theatre/city-of-toronto/selling-a-used-jvc-5-1-channel-cd-dvd-receiver/1492813020,70.0,Selling a used JVC 5.1 channel CD/DVD receiver,,Introduction This complete home theater package is a 235 watt system which also includes a built in progressive scan DVD player with Dolby Digital/DTS decoders built-in. The TH-A30 also has component ...,City of Toronto,30/08/2020,2020-10-07 17:38:42.546102
1521019117,/v-stereo-systems-home-theatre/city-of-toronto/pioneer-pd-m455-6cd-changer-w-remote-vintage-obo/1521019117,110.0,Pioneer  pd-m455 6cd changer w remote. Vintage. OBO,,Higher end model for CD 6disc changer steroe for music cds. Comes with remote. Great condition Pioneer vintage pd-m455 6disc changer w remotHigher end model for CD 6disc changer steroe for music cds. ...,City of Toronto,30/08/2020,2020-10-07 17:38:42.546600
1521017861,/v-stereo-systems-home-theatre/city-of-toronto/onkyo-quartz-synthesized-tuner-amplifier/1521017861,100.0,Onkyo Quartz Synthesized Tuner Amplifier,,Onkyo Quartz Synthesized Tuner Amplifier,City of Toronto,30/08/2020,2020-10-07 17:38:42.547091
1520993450,/v-stereo-systems-home-theatre/city-of-toronto/yamaha-surround-sound-system/1520993450,300.0,Yamaha surround sound system,,"Yamaha HTR-6130 AV Receiver + Yamaha NS-P270/NS-P276 home cinema 5.1ch speaker package with subwoofer Perfect condition. Single owner. From a Pet-free, and smoke-free home. Curbside pick up only.",City of Toronto,30/08/2020,2020-10-07 17:38:42.547593
1520969170,/v-stereo-systems-home-theatre/city-of-toronto/dynaco-sca-120-stereo-integrated-amplifier-pre-main/1520969170,200.0,Dynaco SCA-120 Stereo (integrated) Amplifier (Pre+Main),,"An amp from Dynaco, a sought-after brand. This unit is in great physical and cosmetic conditions and sounds sweet. 120 Watts in total. The pre and main integrated by jumpers. I'm an Amp lover, find ...",City of Toronto,30/08/2020,2020-10-07 17:38:42.548084
1510398481,/v-stereo-systems-home-theatre/city-of-toronto/stereo-system-2-1-onkyo-ls3100/1510398481,320.0,Stereo system (2.1) ONKYO LS3100,,"In great condition and works perfectly, no scratches or drops (see the pix). Compact and easy set up in any spaces, connect to your Computer/Phone/TV through Bluetooth or Audio jack and fill up your ...",City of Toronto,29/08/2020,2020-10-07 17:38:42.548613
1520950374,/v-stereo-systems-home-theatre/city-of-toronto/no-tax-sale-samsung-sound-bar-wl-subwoofer-320w-b-t-in-box-199/1520950374,199.99,no tax sale samsung sound bar-wl subwoofer-320w-b t- IN BOX $199,,no tax sale samsung sound bar-wl subwoofer-320w-b t- IN BOX $199.99 - Soundbar -Q60R Samsung Harman Kardon Soundbar with Samsung Acoustic Beam HW-Q60R/ZA- in box with warranty-$399.99 - sound bar ...,City of Toronto,29/08/2020,2020-10-07 17:38:42.550007
1255283286,/v-stereo-systems-home-theatre/city-of-toronto/fisher-stereo/1255283286,50.0,FISHER Stereo,,Fisher RS 605 stereo. 5 band equalizer.,City of Toronto,29/08/2020,2020-10-07 17:38:42.551671
1520930223,/v-stereo-systems-home-theatre/city-of-toronto/technics-sl-b1-turntable/1520930223,80.0,Technics SL-B1 Turntable,,"Selling Technics SL-B1 Turntable. This is a manual belt-drive unit that has been recently serviced; tracking speed has been tuned, knobs and buttons have been cleaned, new headshell, new belt, ...",City of Toronto,29/08/2020,2020-10-07 17:38:42.553932
1520879172,/v-stereo-systems-home-theatre/city-of-toronto/denon-d-700-mini-stereo-mint-shape-200/1520879172,200.0,DENON D-700 MINI STEREO MINT SHAPE $200,,"Denon D-700 mini stereo. C.D. changer, 2 cassette Powerful and sounds great",City of Toronto,29/08/2020,2020-10-07 17:38:42.554666
1520853607,/v-stereo-systems-home-theatre/city-of-toronto/2-input-rca-audio-video-channel-switcher-set-of-2/1520853607,30.0,2-input RCA audio-video channel switcher (set of 2),,"This 2 channel switch lets you easily change between two RCA inputs (video and audio) with no power supply required. Set of 2, $20 each or $30 for both. Cables not included. (Cannot be reversed for 1 ...",City of Toronto,29/08/2020,2020-10-07 17:38:42.555163
1520852284,/v-stereo-systems-home-theatre/city-of-toronto/technics-sl-pd647-compact-disc-changer-player/1520852284,30.0,Technics SL-PD647 Compact Disc Changer Player,,Used Technics SL-PD647 Compact Disc Changer Player for sale. 5 Disc Rotary Changer System. Pick up only sale at my location. Any questions please ask. Thanks for looking.,City of Toronto,29/08/2020,2020-10-07 17:38:42.555674
1520841245,/v-stereo-systems-home-theatre/city-of-toronto/bnib-terk-fm-pro-amplified-antenna/1520841245,75.0,BNIB Terk FM Pro Amplified Antenna,,"If ad is up item is available. Please call if interested. Brand New in Box....... Terk FM Pro Indoor / Outdoor digital ready AMPLIFIED antenna. Retail USD was 129.99. I have two of them, one of which ...",City of Toronto,29/08/2020,2020-10-07 17:38:42.556167
1520841173,/v-stereo-systems-home-theatre/city-of-toronto/denon-avr-x4500h/1520841173,1900.0,Denon AVR-X4500H,,Brand new. Sealed unit,City of Toronto,29/08/2020,2020-10-07 17:38:42.556662
1520838319,/v-stereo-systems-home-theatre/city-of-toronto/music-with-your-yamaha-stereo-system/1520838319,200.0,Music with your Yamaha stereo system,,"Unit includes CD player, double cassette player, 5 speakers. Manual included Superb condition. Take it and go listen.",City of Toronto,29/08/2020,2020-10-07 17:38:42.557156
1520836065,/v-stereo-systems-home-theatre/city-of-toronto/sony-htst5000/1520836065,1700.0,Sony HTST5000,,Brand new. Sealed unit,City of Toronto,29/08/2020,2020-10-07 17:38:42.557652
1520835169,/v-stereo-systems-home-theatre/city-of-toronto/sony-vintage-stereo-system-from-1980s/1520835169,250.0,Sony vintage stereo system from 1980's,,"Sony audio system with Sony tape player, Technics turn table is Model SL-Q200. Comes with remote and manuals. I also have a variety of vinyls.",City of Toronto,29/08/2020,2020-10-07 17:38:42.558144
1520834618,/v-stereo-systems-home-theatre/city-of-toronto/samsung-hw-q950t-9-1-4-soundbar-with-rear-speakers/1520834618,2000.0,Samsung HW-Q950T 9.1.4 Soundbar with Rear Speakers,,Brand new. Sealed unit.,City of Toronto,29/08/2020,2020-10-07 17:38:42.558689
1520832055,/v-stereo-systems-home-theatre/city-of-toronto/sonos-in-ceiling-speakers-sonance/1520832055,750.0,Sonos In Ceiling Speakers (Sonance),,Brand new. Sealed,City of Toronto,29/08/2020,2020-10-07 17:38:42.559197
1520802811,/v-stereo-systems-home-theatre/city-of-toronto/audio-technica/1520802811,80.0,Audio technica,,"New in box cartridge and stylus...$80... Scarborough, Ontario....647-294-8280",City of Toronto,29/08/2020,2020-10-07 17:38:42.559703
1518874018,/v-stereo-systems-home-theatre/city-of-toronto/amplifier-and-speakers/1518874018,750.0,Amplifier and  Speakers,,Yorkville amplifier and 2 speakers with stands.,City of Toronto,29/08/2020,2020-10-07 17:38:42.560197
1520760947,/v-stereo-systems-home-theatre/city-of-toronto/onkyo-integra-receiver-tx-65/1520760947,120.0,Onkyo Integra Receiver TX 65,,"Onkyo Integra TX 65 Receiver It offers 60 WPC and has a phono stage as well. It has a minor issue, the sound in the left channel is muffled a bit. May be an easy fix. Priced accordingly $120.00",City of Toronto,29/08/2020,2020-10-07 17:38:42.560688
1462794048,/v-stereo-systems-home-theatre/city-of-toronto/fisher-ca-2110-studio-standard/1462794048,175.0,Fisher CA-2110 Studio Standard,,"Specifications Power output: 60 watts per channel into 8Ω (stereo) Frequency response: 20Hz to 20kHz Total harmonic distortion: 0.2% Input sensitivity: 2.5mV (MM), 150mV (DIN), 150mV (line) Signal to ...",City of Toronto,29/08/2020,2020-10-07 17:38:42.561180
1520753594,/v-stereo-systems-home-theatre/city-of-toronto/philips-bass-unit-working/1520753594,30.0,Philips Bass Unit (Working),,"A great bass for small to medium sound systems and home theaters. Good condition and works! $30 or best offer! Dimensions 6.5""x11.5""x10""",City of Toronto,28/08/2020,2020-10-07 17:38:42.562152
1520744344,/v-stereo-systems-home-theatre/city-of-toronto/yamaha-home-stereo/1520744344,750.0,Yamaha home stereo,,Brend new speakers set yamaha ns555 yamaha ns333 yamaha ns c444 and amplifer yamaha to,City of Toronto,28/08/2020,2020-10-07 17:38:42.563363
1510287731,/v-stereo-systems-home-theatre/city-of-toronto/technics-integrated-amp-class-a-great-vintage/1510287731,150.0,Technics Integrated Amp CLASS A---GREAT VINTAGE !!!,,"SU-800 MADE IN JAPAN 50 watts per channel into 8Ω THD 0.04% simply plug and play no issues Sounds fantastic, both channels strong ( no crackling) Great Phono amp !!! Hate to let it go, but I need to ...",City of Toronto,28/08/2020,2020-10-07 17:38:42.563892
1520731846,/v-stereo-systems-home-theatre/city-of-toronto/aiwa-ca-dw235-3pc-stereo-2-5-watt-cd-dual-cassette-boomboxe/1520731846,50.0,"AIWA CA-DW235 3PC. STEREO, 2.5 WATT, CD, DUAL CASSETTE BOOMBOXE",,Sellinf brand new unused AIWA CA-DW235 STEREO. Please message if you want!,City of Toronto,28/08/2020,2020-10-07 17:38:42.564561
1520722854,/v-stereo-systems-home-theatre/city-of-toronto/stereo-boom-box-system/1520722854,60.0,stereo boom box system,,set of 4- two speaker and system and head set used but all works the volume knob is off but a standard knob will work. see pictures am fm cd player tape deck and all plugs,City of Toronto,28/08/2020,2020-10-07 17:38:42.565510
1520716214,/v-stereo-systems-home-theatre/city-of-toronto/audeze-lcd-2/1520716214,1000.0,Audeze LCD-2,,"Hi, I am looking to sell my pair of Audeze LCD-2. They are in excellent condition and includes the LCD-2, the cables, the certificate of authenticity and the box with matching serial numbers ...",City of Toronto,28/08/2020,2020-10-07 17:38:42.566164
1520681954,/v-stereo-systems-home-theatre/city-of-toronto/cd-burner-record-player-tape-player-cd-player-radio/1520681954,125.0,CD burner / Record Player / Tape Player / CD Player / Radio,,"Memorex Turntable that can burn all music to CD (from record, tape or anything connected to an aux cable). Also has a CD player, tape player and radio. Perfect Condition. Can convert your tapes / CDs ...",City of Toronto,28/08/2020,2020-10-07 17:38:42.566660
1504175452,/v-stereo-systems-home-theatre/city-of-toronto/hercules-dj-control-jogvision/1504175452,380.0,"Hercules, DJ Control Jogvision",,"Hercules has put all of its experience, innovation and passion into the DJControl Jogvision, which perfectly combines performance and ease of use. Whether you’re just getting started DJing or you’ve ...",City of Toronto,28/08/2020,2020-10-07 17:38:42.567153
1499598238,/v-stereo-systems-home-theatre/city-of-toronto/sony-hcd-ec69i-mini-hi-fi-shelf-system/1499598238,30.0,Sony HCD- EC69i Mini Hi-Fi Shelf System,,"Please make arrangements to see item first. Offers, especially low ball offers prior to viewing, will be ignored. Superceded part number is MHC-EC69i. System is in excellent shape and in excellent ...",City of Toronto,28/08/2020,2020-10-07 17:38:42.567688
1520664415,/v-stereo-systems-home-theatre/city-of-toronto/randall-rrm-2-120-power-amplifier/1520664415,49.0,Randall RRM 2-120 Power Amplifier,,Randall RRM 2-120 Power Amplifier 240 watts RMS Working condition Item # 1162810 See our other ads Swap Shop 416-701-1701 BUY SELL TRADE WARRANTY ON MOST ITEMS TRADE-INS WELCOME 1448 Lawrence Ave ...,City of Toronto,28/08/2020,2020-10-07 17:38:42.568184
1520661852,/v-stereo-systems-home-theatre/city-of-toronto/toa-1000-series-dual-power-amplifier-p-1090d/1520661852,165.0,TOA 1000 Series Dual Power Amplifier P-1090D,,TOA 1000 Series Dual Power Amplifier P-1090D 450 watts per channel @ 4 ohms 900 watts total Working condition Item # 1252435 See our other ads Swap Shop 416-701-1701 BUY SELL TRADE WARRANTY ON MOST ...,City of Toronto,28/08/2020,2020-10-07 17:38:44.605537
