,url,price,title,distance,description,location,time_offset,retreived
1516294599,/v-baby-crib-bassinet/city-of-toronto/boppy-newborn-lounger-elephant-print/1516294599,30.0,Boppy Newborn Lounger- Elephant print,,Boppy Newborn Lounger- Elephant print In excellent construction No stains or rips Machine washable Smoke and pet free home Pick up location O’Connor and St Clair,City of Toronto,29/09/2020,2020-10-06 11:37:55.388910
1516278176,/v-baby-crib-bassinet/city-of-toronto/pottery-barn-baby-crib-skirt-excellent-condition/1516278176,50.0,Pottery Barn Baby Crib Skirt- excellent condition,,Grey and white Striped Pottery Barn crib skirt. Gender neutral. Looks great with any colour crib. Excellent condition. Barely used. Porch pick up!,City of Toronto,29/09/2020,2020-10-06 11:37:55.389613
1505225151,/v-baby-crib-bassinet/city-of-toronto/bassinet/1505225151,60.0,Bassinet,,Lightly used. No issues. All clothes and covers have been washed.,City of Toronto,29/09/2020,2020-10-06 11:37:55.390106
1526974149,/v-baby-crib-bassinet/city-of-toronto/portable-bassinet/1526974149,40.0,Portable bassinet,,"Baby bassinet, 22” wide, 24” long. Zip up mesh to keep the flies, bugs and dust out. Folds in half for easy storage, portable, compact, light for travel too. Great condition, no rips or tears. Clean. ...",City of Toronto,29/09/2020,2020-10-06 11:37:57.050961
1496364785,/v-baby-crib-bassinet/city-of-toronto/dry4ever-bedwetting-with-sensor-underwear/1496364785,125.0,Dry4ever (Bedwetting with sensor underwear),,"Value: 400$ . Size Medium. Treatment of nocturnal enuresis, we have developed Dry4ever®, an alarm system that is effective and easy to use. The system immediately detects even a few drops of urine ...",City of Toronto,29/09/2020,2020-10-06 11:37:57.051440
1526957349,/v-baby-crib-bassinet/city-of-toronto/baby-toddler-bed/1526957349,250.0,Baby/toddler bed,,Almost new baby crib with mattress,City of Toronto,29/09/2020,2020-10-06 11:37:57.051938
1526956218,/v-baby-crib-bassinet/city-of-toronto/3-in-one-crib-with-matress-used-for-grands-sleep-over/1526956218,160.0,"3 in one crib, with matress, used for grand's sleep over",,"3 in one crib, with matress, used for grand's sleep over",City of Toronto,29/09/2020,2020-10-06 11:37:57.052482
1526944112,/v-baby-crib-bassinet/city-of-toronto/sealy-soybean-crib-mattress-jupiter-protectors/1526944112,100.0,Sealy Soybean Crib mattress + Jupiter protectors,,"Sealy 'Soybean Plush foam core' crib mattress. Fits standard crib size. Looks brand new, no stains. Lifetime warranty. Jupiter 'The Natural Organic Cotton' crib mattress covers (x2) with dust-mite ...",City of Toronto,29/09/2020,2020-10-06 11:37:57.053001
1526939931,/v-baby-crib-bassinet/city-of-toronto/crib-babyletto-lolly/1526939931,590.0,Crib - Babyletto Lolly,,Brand New in Box (Babyletto Crib) 3-in-1 convertible crib with toddler bed conversion kit. The popular Lolly 3-in-1 Convertible Crib highlights the natural beauty of our solid New Zealand pine wood ...,City of Toronto,29/09/2020,2020-10-06 11:37:57.053501
1526909559,/v-baby-crib-bassinet/city-of-toronto/crib-with-storage-drawers/1526909559,75.0,Crib with storage drawers,,Selling a barely used crib in great condition. Has 2 storage drawers underneath. Pick up only.,City of Toronto,29/09/2020,2020-10-06 11:37:57.054013
1526905425,/v-baby-crib-bassinet/city-of-toronto/convertible-crib/1526905425,70.0,Convertible crib,,Storkcraft Avalon 4-in-1 Convertible Crib. Bought brand new 2 years ago but not get chance to use it as I temporarily moved outside of Canada. Crib is in very good condition as you can see in the ...,City of Toronto,29/09/2020,2020-10-06 11:37:57.054510
1519696556,/v-baby-crib-bassinet/city-of-toronto/ikea-sundvik-crib-toddler-bed-black/1519696556,100.0,IKEA Sundvik Crib Toddler Bed Black,,"Used for 3.5years by our son, crib is in good shape, some minor blemishes due to child being a child! Will include mattress and mattress cover for free if requested. Quick and easy to assemble. (I ...",City of Toronto,29/09/2020,2020-10-06 11:37:57.055014
1526881223,/v-baby-crib-bassinet/city-of-toronto/white-solid-wood-baby-crib-with-great-coton-organic-mattress/1526881223,160.0,White Solid Wood Baby Crib with Great Coton organic Mattress,,No rush No pet -smoke,City of Toronto,29/09/2020,2020-10-06 11:37:57.055506
1526876177,/v-baby-crib-bassinet/city-of-toronto/baby-crib-bumpers-set/1526876177,50.0,Baby Crib Bumpers Set,,"Selling this set, barely used, washable, filling inside each part, has a thin mattress, 2 longs bumpers, bed head and tail, so 5 pieces in total. Smoke and pet free home. Price is firm also if you ...",City of Toronto,29/09/2020,2020-10-06 11:37:57.056028
1526870588,/v-baby-crib-bassinet/city-of-toronto/crib-babyletto/1526870588,200.0,Crib (Babyletto),,"For sale is a beautiful Babyletto crib. This crib is solid wood, two tone (white and brown). Made in Canada. Can be used for either a baby girl or a baby boy. Can be converted to a day bed for a ...",City of Toronto,29/09/2020,2020-10-06 11:37:57.056525
1526856880,/v-baby-crib-bassinet/city-of-toronto/as-new:-jolly-jumper-rocking-basket-stand-for-infant/1526856880,50.0,As new: Jolly Jumper rocking basket stand for infant,,"For sale: Jolly Jumper rocking basket stand for infant, as depicted. Item is essentially new, having been used precisely twice for an infant's naps. Basket can be removed from the rocking cradle and ...",City of Toronto,29/09/2020,2020-10-06 11:37:57.057020
1526846885,/v-baby-crib-bassinet/city-of-toronto/infant-side-by-side-sleeper/1526846885,20.0,Infant Side by Side Sleeper,,"Side by Side Sleeper. Bought new for $80; Comes with mattress pad No delivery *pick-up at Yonge and Charles. *if post is up, it’s available* text 647-960-1793 If interested",City of Toronto,29/09/2020,2020-10-06 11:37:57.057518
1526845126,/v-baby-crib-bassinet/city-of-toronto/graco-crib/1526845126,60.0,Graco crib,,"Graco crib with mattress and mattress protector. There are a few marks on the side due to using, moving and assembling.",City of Toronto,29/09/2020,2020-10-06 11:37:57.058025
1526844716,/v-baby-crib-bassinet/city-of-toronto/serta-icomfort-infant-sleeper-bed-basinet-with-light-vibration/1526844716,45.0,"Serta iComfort Infant Sleeper Bed basinet with light, vibration",,Serta Icomfort portable bassinet/side sleeper. With sounds and nightlight. Great condition. Clean smoke-free environment. Folds in for easy storage. Very useful. Includes mattress sheet. Selling ...,City of Toronto,29/09/2020,2020-10-06 11:37:57.058582
1516128985,/v-baby-crib-bassinet/city-of-toronto/pottery-barn-luxe-crib-sheet-and-blanket/1516128985,35.0,Pottery Barn Luxe Crib Sheet and Blanket,,"Brand new Pottery Barn white chamois crib sheet with matching grey and white polar bear blanket. Got it as a gift, but we transitioned to a bed shortly after. Washed, but never used. EMT and porch ...",City of Toronto,29/09/2020,2020-10-06 11:37:57.059086
1526813639,/v-baby-crib-bassinet/city-of-toronto/selling-a-perfect-condition-pali-crib/1526813639,250.0,Selling a perfect condition Pali crib,,"Pali 9800 Enna Forever Crib Perfect condition Free waterproof mattress and side protective pads Originally $899.99 plus tax, selling for $250",City of Toronto,28/09/2020,2020-10-06 11:37:57.059623
1516117699,/v-baby-crib-bassinet/city-of-toronto/nojo-jungle-tales-musical-crib-mobile/1516117699,15.0,NoJo Jungle Tales Musical Crib Mobile,,"Works fine. Freshly laundered. My little one never took to it/slept in the crib. Smoke free pet free home. Plays Brahms' Lullaby Universal fits onto a standard size crib rail Recommended age, birth ...",City of Toronto,28/09/2020,2020-10-06 11:37:57.060123
1526701015,/v-baby-crib-bassinet/city-of-toronto/baby-crib/1526701015,30.0,baby Crib,,Used for 2 years,City of Toronto,28/09/2020,2020-10-06 11:37:57.060619
1505032687,/v-baby-crib-bassinet/city-of-toronto/bassinet/1505032687,5.0,Bassinet,,"Baby Bassinet Hardly ever used, maybe one or two times Clean without any stain Pet free home",City of Toronto,28/09/2020,2020-10-06 11:37:57.061114
1526730300,/v-baby-crib-bassinet/city-of-toronto/baby-s-crib/1526730300,10.0,Baby’s Crib,,In great condition.,City of Toronto,28/09/2020,2020-10-06 11:37:57.061612
1526726999,/v-baby-crib-bassinet/city-of-toronto/sweet-safari-collection-by-cuddletime/1526726999,30.0,Sweet safari collection by Cuddletime,,"Used as a secondary crib at grandparents house like new. Some items never used, I.e. wearable blanket tags still on. Giftable set. Comes with mobile, fitted sheet. Comforter, Dust Ruffel, Monkey ...",City of Toronto,28/09/2020,2020-10-06 11:37:57.062109
1526716499,/v-baby-crib-bassinet/city-of-toronto/kids-line-baby-crib-set-brand-new/1526716499,80.0,Kids Line baby crib set - Brand New,,Brand New 6-piece baby crib set Includes: 1. Quilt 2. Fitted sheet 3. Dust ruffle 4. Valance 5. 4-piece bumper 6. Diamond stacker *Pet and smoke free,City of Toronto,28/09/2020,2020-10-06 11:37:57.062619
1526714856,/v-baby-crib-bassinet/city-of-toronto/benjamin-metro-convertible-crib/1526714856,200.0,Benjamin Metro Convertible Crib,,"Selling a used Benjamin Metro crib in excellent condition. Includes all the original parts, mounting hardware, instruction manual, and the allen key needed to build it. The mattress support can be ...",City of Toronto,28/09/2020,2020-10-06 11:37:57.063128
1526711174,/v-baby-crib-bassinet/city-of-toronto/baby-bassinet/1526711174,450.0,Baby Bassinet,,Brand New Monte Design Bassinet in Grey,City of Toronto,28/09/2020,2020-10-06 11:37:57.063626
1526709056,/v-baby-crib-bassinet/city-of-toronto/baby-bjorn-travel-crib/1526709056,150.0,Baby Bjorn travel crib,,"super easy to set up, good mattress for a travel crib or pnp . compact for travel. Color: navy/blue $150 Great shape",City of Toronto,28/09/2020,2020-10-06 11:37:57.064123
1526698181,/v-baby-crib-bassinet/city-of-toronto/new-baby-bassinet/1526698181,49.0,New Baby bassinet,,New bassinet just open box 49$ I can drop it also.,City of Toronto,28/09/2020,2020-10-06 11:37:57.064621
1526688654,/v-baby-crib-bassinet/city-of-toronto/childcraft-3-in-1-traditional-crib-with-a-mattress-included/1526688654,180.0,CHILDCRAFT 3-in-1 Traditional Crib with a mattress included,,"I have two (2) CHILDCRAFT crib that can turn into a Day bed , Toddler bed , trail for Day bed included and also two mattress, very clean. Non smoke family, no pets. $180 each or $350 for two",City of Toronto,28/09/2020,2020-10-06 11:37:57.065131
1526679723,/v-baby-crib-bassinet/city-of-toronto/leander-danish-crib-toddler-bed/1526679723,950.0,Leander - Danish - Crib + Toddler bed,,Beautifully designed Danish brand - Leander White crib All accessories and conversion kit included -Crib -Essentia Organic Mattress + extension for toddler bed -4x Leander Organic Crib Mattress ...,City of Toronto,28/09/2020,2020-10-06 11:37:57.065631
1526664255,/v-baby-crib-bassinet/city-of-toronto/restoration-hardware-colette-tufted-crib/1526664255,1500.0,Restoration hardware Colette tufted crib,,Excellent condition restoration hardware tufted Colette crib in grey mist. Optional extra: matching restoration hardware rocking chair in grey mist,City of Toronto,28/09/2020,2020-10-06 11:37:57.066126
1526656269,/v-baby-crib-bassinet/city-of-toronto/dream-on-me-synergy-5-in-1-convertible-crib/1526656269,40.0,Dream On Me Synergy 5-in-1 Convertible Crib,,Selling a gently used Dream On Me Synergy 5-in-1 convertible crib in royal blue. Crib has been disassembled. You must pick up.,City of Toronto,28/09/2020,2020-10-06 11:37:57.066655
1526646555,/v-baby-crib-bassinet/city-of-toronto/ikea-crib-leksvik/1526646555,0.0,IKEA crib.  LEKSVIK,,"This has cycled through four kids now, so has been assembled and disassembled multiple times. For this reason, it is posted for free. Still is in decent enough shape, though. Missing a few screws ...",City of Toronto,28/09/2020,2020-10-06 11:37:57.067149
1505307541,/v-baby-crib-bassinet/city-of-toronto/mobile-for-crib-tiny-love-460-sweet-island-dreams/1505307541,30.0,Mobile for crib - Tiny Love 460 Sweet Island Dreams,,"Hi, Selling mobile for crib - Tiny Love 460 Sweet Island Dreams Mobile Perfect condition, barely used - 30$ (New at Amazon.ca - $59.99 + Tax) Let me know if interested.",City of Toronto,28/09/2020,2020-10-06 11:37:57.067651
1515919167,/v-baby-crib-bassinet/city-of-toronto/baby-pillow-new/1515919167,5.0,Baby pillow (New),,"New $5 Posted by Jin in baby items, cribs in Toronto (GTA), City of Toronto. 2020년 8월 3일",City of Toronto,28/09/2020,2020-10-06 11:37:57.068154
1487575304,/v-baby-crib-bassinet/city-of-toronto/delta-3-in-1-crib-white-includes-simmons-mattress/1487575304,125.0,Delta 3 in 1 Crib White includes Simmons Mattress,,"Delta 3 in 1 Crib in white colour. Excellent condition. Includes mattress. Converts from crib to: toddler bed, and daybed. Strong and sturdy solid wood construction. 3 Position mattress height ...",City of Toronto,28/09/2020,2020-10-06 11:37:57.068652
1526629755,/v-baby-crib-bassinet/city-of-toronto/chicco-lullago-travel-bassinet/1526629755,35.0,Chicco Lullago Travel Bassinet,,Chicco Lullago Travel Bassinet in good condition. As long as the ad is up the item is available. The item is in green colour like the first phot.,City of Toronto,28/09/2020,2020-10-06 11:37:57.069159
1445542879,/v-baby-crib-bassinet/city-of-toronto/mesh-breathable-off-white-crib-bumper/1445542879,15.0,"Mesh, breathable, off-white crib bumper",,Good condition $15 Seeking many other infant and baby items. See my other ads.,City of Toronto,27/09/2020,2020-10-06 11:37:57.069702
1526621177,/v-baby-crib-bassinet/city-of-toronto/baby-cribs/1526621177,30.0,Baby Cribs,,White-coloured baby cribs in excellent condition. Must pick up.,City of Toronto,27/09/2020,2020-10-06 11:37:57.070207
1515899535,/v-baby-crib-bassinet/city-of-toronto/halo-sleep-snoozy-pod-sound-machine-nightlight/1515899535,40.0,Halo Sleep Snoozy Pod (Sound Machine Nightlight),,NEVER USED. In great working condition. Only getting rid of because our daughter is VERY tall and when we transitioned her into her crib we had to drop the mattress ALL the way down and the SnoozyPod ...,City of Toronto,27/09/2020,2020-10-06 11:37:57.070724
1526597446,/v-baby-crib-bassinet/city-of-toronto/beautiful-crib/1526597446,180.0,Beautiful crib,,Beautiful crib in perfect condition. Solid wood. Very strong. The mattress has scratches.,City of Toronto,27/09/2020,2020-10-06 11:38:01.734410
1513132179,/v-baby-crib-bassinet/city-of-toronto/pottery-barn-4-in-1-convertible-crib/1513132179,900.0,Pottery Barn 4 in 1 Convertible Crib,,"NEW! Never Used. Rory 4-in-1 Convertible Crib, retail value is $1499 (not including taxes and shipping). Great deal! Crown and dentil molding offer classic design notes. Plus, it effortlessly ...",City of Toronto,27/09/2020,2020-10-06 11:38:01.734938
1526562166,/v-baby-crib-bassinet/city-of-toronto/solid-wood-baby-crib-with-mattress-and-organics-bedsheet/1526562166,80.0,Solid wood baby crib with mattress and organics bedsheet,,"Solid wood, height adjustable, in perfect condition. Comes with mattress and two organics bedsheets.",City of Toronto,27/09/2020,2020-10-06 11:38:01.735430
1526558526,/v-baby-crib-bassinet/city-of-toronto/super-cute-owl-crib-bedding-with-mobile-7-pieces-like-brand-new/1526558526,50.0,Super cute owl crib bedding with mobile 7 pieces Like Brand new,,"Super cute like brand new unisex owl baby crib bedding. Includes owl comforter, plush owl blanket, owl mobile plays music, breathable bumper pad, crib skirt, 2 fitted crib sheet (1 brand new in ...",City of Toronto,27/09/2020,2020-10-06 11:38:01.736089
1526553763,/v-baby-crib-bassinet/city-of-toronto/solid-wood-crib/1526553763,50.0,Solid wood crib,,Smoke/pet free environment for the last 3 years.,City of Toronto,27/09/2020,2020-10-06 11:38:01.736791
1526550051,/v-baby-crib-bassinet/city-of-toronto/ikea-baby-crib-with-mattress/1526550051,30.0,IKEA Baby crib with mattress,,Used but clean - my son still sleeps in it. The mattress is two sided for newborns as well as toddlers.,City of Toronto,27/09/2020,2020-10-06 11:38:01.737399
1526536008,/v-baby-crib-bassinet/city-of-toronto/crib-or-baby-room-calming-projector/1526536008,10.0,Crib or baby room calming projector,,Like new baby projector with music and fun beach moving scenario. $29 plus tax worth at ToysRUs. Smoke free pet free home. See my other baby related listings.,City of Toronto,27/09/2020,2020-10-06 11:38:01.738112
1526533253,/v-baby-crib-bassinet/city-of-toronto/beautiful-baby-bassinet-includes-coordinating-blanket-rattles/1526533253,80.0,Beautiful baby bassinet includes coordinating blanket & rattles,,"Beautiful espresso wood baby bassinet includes sound machine with vibrating option. Storage under bassinet and also includes coordinating baby blanket, 2 rattles, and plush toy.",City of Toronto,27/09/2020,2020-10-06 11:38:01.738620
1526530604,/v-baby-crib-bassinet/city-of-toronto/sorelle-princeton-convertible-4-in-1-crib-white-with-changer/1526530604,150.0,Sorelle princeton convertible 4-in-1 crib white with changer,,"Smoke free, pet free home, used for only one baby girl. White sorelle Princeton convertible 4-in-1 crib with side drawers and Sealy mattress. Last used as a toddler bed. Includes extra piece not ...",City of Toronto,27/09/2020,2020-10-06 11:38:01.739115
1526523805,/v-baby-crib-bassinet/city-of-toronto/bassinet/1526523805,20.0,Bassinet,,Bassinet in great condition!! Very comfortable and with a large storage underneath the bed. $20,City of Toronto,27/09/2020,2020-10-06 11:38:01.739607
1526518407,/v-baby-crib-bassinet/city-of-toronto/oeuf-nyc-sparrow-crib-change-tray-white/1526518407,650.0,Oeuf NYC Sparrow Crib & Change Tray (white),,- Great condition - Disassembled for easy pick up (assembly kit and instructions included) - Crib mattress included (adjustable height for baby and toddler) - Waterproof change pad included with ...,City of Toronto,27/09/2020,2020-10-06 11:38:01.740097
1526509773,/v-baby-crib-bassinet/city-of-toronto/naturepedic-classic-252-crib-mattress/1526509773,100.0,Naturepedic classic 252 crib mattress,,Queen/broadview The Naturepedic Classic 252 Crib Mattress is constructed from hypoallergenic organic cotton to provide comfort and premium support for your child. This firm and comfortable mattress ...,City of Toronto,27/09/2020,2020-10-06 11:38:01.740585
1368664824,/v-baby-crib-bassinet/city-of-toronto/prince-lionheart-crib-rail-protector/1368664824,10.0,Prince Lionheart Crib Rail Protector,,"Excellent condition, Prince Lionheart Crib Rail Protector",City of Toronto,27/09/2020,2020-10-06 11:38:01.741089
1526477795,/v-baby-crib-bassinet/city-of-toronto/graco-bassinet-brand-new/1526477795,75.0,Graco bassinet brand new,,Never used graco bassinet,City of Toronto,27/09/2020,2020-10-06 11:38:01.741582
1526450959,/v-baby-crib-bassinet/city-of-toronto/crib-sheets-coverlet-set-brand-new-in-packages/1526450959,80.0,Crib Sheets & Coverlet Set - Brand new in Packages,,Selling Brand new 100% Cotton Coverlet and 2 fitted Crib Sheets. They are brand new in their packages. Coverlet is made of 100% Quilted Cotton Sateen. Size: 37 inches x 44 inches. Sheets made of 100% ...,City of Toronto,27/09/2020,2020-10-06 11:38:01.742077
1526450332,/v-baby-crib-bassinet/city-of-toronto/cotton-fitted-crib-sheet-brand-new-in-package/1526450332,12.0,Cotton Fitted Crib Sheet - Brand New in Package,,Selling a brand new 100% Cotton fitted Crib Sheet. Size: 28 inches x 52 inches Asking $12.00.,City of Toronto,27/09/2020,2020-10-06 11:38:01.742578
1526441692,/v-baby-crib-bassinet/city-of-toronto/breathable-crib-liner-bumper-light-grey/1526441692,25.0,Breathable Crib Liner / Bumper - Light Grey,,Selling a breathable baby mesh crib liner. It is in great shape. No stains or rips. Comes with the original packaging. Selling for $25.00. Retails for $45.00. Liners reduces the risk of suffocation ...,City of Toronto,27/09/2020,2020-10-06 11:38:01.743215
1526441350,/v-baby-crib-bassinet/city-of-toronto/blue-flannel-fitted-crib-sheets/1526441350,5.0,Blue flannel Fitted Crib Sheets,,"Selling 2 Blue Cotton Flannel fitted crib sheets. No rips or stains. Selling both for $10.00 or $5.00 each. If the AD is up, YES the items are available.",City of Toronto,27/09/2020,2020-10-06 11:38:01.743917
1526440171,/v-baby-crib-bassinet/city-of-toronto/sealy-organic-crib-mattress-excellent-condition/1526440171,35.0,Sealy Organic Crib Mattress - excellent condition,,Selling a Sealy Soybean Natural Rest Foam-Core Organic Cotton cover mattress in perfect condition (no stains or rips) as waterproof mattress covers were used all the time. Selling mattress for ...,City of Toronto,27/09/2020,2020-10-06 11:38:01.744545
1526438863,/v-baby-crib-bassinet/city-of-toronto/delta-baby-crib-4-in-1-plus-2-toddler-rails-espresso-colour/1526438863,160.0,Delta Baby Crib 4 in 1 plus 2 toddler Rails - Espresso Colour,,Selling a Delta 4-in-1 Crib in Espresso Finish. It is in great condition. Selling for $160.00 for the crib and 2 toddler rails (they retail for $75.00 each). Comes with all hardware and original ...,City of Toronto,27/09/2020,2020-10-06 11:38:01.745037
1515644967,/v-baby-crib-bassinet/city-of-toronto/pottery-barn-bassinet-and-mattress/1515644967,200.0,Pottery Barn bassinet  and mattress,,"Excellent used condition. $200 Retails for $449 plus tax Keep your newborn nearby in this beautifully constructed bassinet, made extra cozy with the braided detail. HOW IT IS CONSTRUCTED Bassinet is ...",City of Toronto,27/09/2020,2020-10-06 11:38:01.745560
1526425022,/v-baby-crib-bassinet/city-of-toronto/graco-solano-4-in-1-convertible-crib-with-drawer-mattress-inc/1526425022,150.0,GRACO SOLANO 4-IN-1 Convertible Crib With Drawer (Mattress Inc.),,Gently used Graco 4-In-1 Convertible Crib with Drawer available (mattress included) at reasonable price. This was bought in November 2019. The crib is packed in the original box with the drawer is ...,City of Toronto,27/09/2020,2020-10-06 11:38:01.746078
1526417926,/v-baby-crib-bassinet/city-of-toronto/brand-new-hillcrest-3-in-1-convertible-crib-never-used/1526417926,200.0,"Brand new Hillcrest 3-in-1 Convertible Crib,  never used!",,Brand new unused crib. We no longer need this crib that was ordered and arrived just last week. It has not even been put together but the pieces were taken out of the box once. Available immediately ...,City of Toronto,26/09/2020,2020-10-06 11:38:01.746583
1526415611,/v-baby-crib-bassinet/city-of-toronto/infant-toddler-bed/1526415611,50.0,"Infant, toddler bed",,"We just bought bed for my 3 year old, so we dont need this bed(crib) from Ikea. Comes with everything in the picture. Its in a good condition. $50.00 Must pick up.",City of Toronto,26/09/2020,2020-10-06 11:38:01.747073
1526408580,/v-baby-crib-bassinet/city-of-toronto/the-best-travel-crib-period/1526408580,220.0,The. Best. Travel. Crib. Period.,,Purchased the Guava Family Travel Crib new in 2016 after doing too much research on different brands! It has been one of the most used and best baby items purchased. It is so easy and quick to ...,City of Toronto,26/09/2020,2020-10-06 11:38:01.747565
1505086390,/v-baby-crib-bassinet/city-of-toronto/mickey-mouse-crib-mattress-cover/1505086390,30.0,mickey mouse crib mattress cover,,never used pickup weston and 401,City of Toronto,26/09/2020,2020-10-06 11:38:01.748081
1505158496,/v-baby-crib-bassinet/city-of-toronto/skip-hop-crib-projection-mobile-moonlight-melodies/1505158496,40.0,Skip Hop Crib Projection Mobile - moonlight melodies,,Skip Hop safari crib mobile with sounds and projections. Excellent condition. https://www.amazon.ca/Mobile-Moonlight-Melodies-Projection-Safari/dp/B01FNVGK9K Located in East York.,City of Toronto,26/09/2020,2020-10-06 11:38:01.748590
1505157211,/v-baby-crib-bassinet/city-of-toronto/summer-infant-bassinet/1505157211,45.0,Summer Infant Bassinet,,"Summer Infant Swaddleme Bassinet in brand new condition. Adjustable height and comes with sound machine attached. Our baby never took to it, so it's barely used. Walmart listing for more details: ...",City of Toronto,26/09/2020,2020-10-06 11:38:01.749084
1526393607,/v-baby-crib-bassinet/city-of-toronto/baby-crib-solid-wood-plus-melody-side-guard/1526393607,160.0,"Baby crib solid wood plus melody, side guard +++",,Baby crib solid wood plus all accessories seen on pictures 6 in one ride brand new Crib side can be lower and raise Very clean and good condition. No mattress,City of Toronto,26/09/2020,2020-10-06 11:38:01.749573
1526383669,/v-baby-crib-bassinet/city-of-toronto/safety-1st-baby-crib/1526383669,10.0,Safety 1st baby crib,,God condition,City of Toronto,26/09/2020,2020-10-06 11:38:01.750126
1526373986,/v-baby-crib-bassinet/city-of-toronto/2-mini-crib-sheets/1526373986,15.0,2 mini crib sheets,,Mini Crib Sheets,City of Toronto,26/09/2020,2020-10-06 11:38:01.750826
1526373803,/v-baby-crib-bassinet/city-of-toronto/breathable-baby-mesh-crib-liner/1526373803,15.0,Breathable Baby Mesh Crib Liner,,"EUC, pet and smoke free home.",City of Toronto,26/09/2020,2020-10-06 11:38:01.751528
1526351998,/v-baby-crib-bassinet/city-of-toronto/pottery-barn-crib-bumper/1526351998,25.0,Pottery barn crib bumper,,"Pottery barn crib bumper. Posted in baby items, cribs in City of Toronto. September 26, 2020",City of Toronto,26/09/2020,2020-10-06 11:38:01.752046
1526343146,/v-baby-crib-bassinet/city-of-toronto/foldable-easy-to-store-baby-crib/1526343146,40.0,Foldable & Easy to Store Baby Crib,,"Hello, I am Offering a Foldable Crib great for travel purpose from a clean pet free and non-smoking house. Easy to store and great during travel, can be easily folded for storage purposes. Used for 4 ...",City of Toronto,26/09/2020,2020-10-06 11:38:01.752570
