,url,price,title,distance,description,location,time_offset,retreived
1500343464,/v-baby-crib-bassinet/city-of-toronto/baby-bedding-set/1500343464,50.0,Baby bedding set,,"Pottery Barn bedding set. Crib sheets, skirt and bumper.",City of Toronto,30/08/2020,2020-10-06 11:39:37.052242
1521136827,/v-baby-crib-bassinet/city-of-toronto/ikea-crib-and-mattress-used/1521136827,100.0,IKEA Crib and Mattress - Used,,"$100 Crib and can convert to toddler bed. Comes from a smoke free and pet free home. Currently it is not assembled, all pieces and instructions are included. Comes with Sundvik Crib (Grey-Brown ...",City of Toronto,30/08/2020,2020-10-06 11:39:37.052736
1521133035,/v-baby-crib-bassinet/city-of-toronto/rocking-cradle-nearly-new/1521133035,80.0,Rocking Cradle/nearly new,,"Wooden rocking cradle. Great for newborns and infants to 20lbs. Was gently used for a week then put into storage. Comes with bedding (gently used as well/like new). Comes from a smoke-free, pet-free, ...",City of Toronto,30/08/2020,2020-10-06 11:39:37.053233
1521129471,/v-baby-crib-bassinet/city-of-toronto/almost-new-white-ikea-sundvik-crib/1521129471,99.0,Almost New White IKEA Sundvik crib,,- Almost new Ikea Sundvik white crib (hardly used for 6 months) for newborn or toddler. - The bed base can be placed at two different heights. You can lower the bottom and remove one of the long ...,City of Toronto,30/08/2020,2020-10-06 11:39:37.053727
1521120209,/v-baby-crib-bassinet/city-of-toronto/crib-in-amazing-condition/1521120209,65.0,Crib In Amazing Condition!,,"AVAILABLE IMMEDIATELY! This gently used crib is in great condition. The crib includes a mattress and a crib bumper that are once again, in great condition! The mattress is 55 inches ✕ 29 inches ...",City of Toronto,30/08/2020,2020-10-06 11:39:37.054223
1521120128,/v-baby-crib-bassinet/city-of-toronto/crib-jumper-rocker-seat/1521120128,150.0,"Crib, jumper, rocker seat",,4in1 convertible crib comes with mattress. Price: $100 jumper and rocker seat for infant to toddler. Price: $50 for both. Single item $30. All 3 items $150. All items are in good condition!,City of Toronto,30/08/2020,2020-10-06 11:39:37.054728
1521117779,/v-baby-crib-bassinet/city-of-toronto/teddy-bear-crib-bedding-and-accessories-for-nursery/1521117779,110.0,"Wanted:
                            Teddy bear crib bedding and accessories for nursery",,"Quilt, bumpers, three fitted sheets, hamper, window valance, diaper holder, two canvas frames, carpet, mobile, lamp shade, cover for diaper changing mat, bed skirt. Different shades or brown, taupe ...",City of Toronto,30/08/2020,2020-10-06 11:39:37.055221
1521114236,/v-baby-crib-bassinet/city-of-toronto/baby-solid-wood-crib-with-mattress-bumpers-etc/1521114236,100.0,"Baby solid wood crib with mattress, bumpers, etc",,"Crib -good condition- Solid, natural wood color and convertible to bed. Adjustable height, side rail Comes with a mattress, and cover, baby bumper & music toy. Toy dog not for sale. Dissembled. Must ...",City of Toronto,30/08/2020,2020-10-06 11:39:37.055724
1521113128,/v-baby-crib-bassinet/city-of-toronto/crib-blanket-john-lennon-imagine-animals-pre-loved/1521113128,25.0,Crib blanket - John Lennon Imagine Animals - pre-loved,,Unique John Lennon Imagine Baby Animals Collection. Use as a crib blanket or wall hanging. From a smoke-free/pet-free home. Contactless payment via e-transfer.,City of Toronto,30/08/2020,2020-10-06 11:39:37.056223
1521088743,/v-baby-crib-bassinet/city-of-toronto/new-crib-white-3-in-1-convertible-option/1521088743,250.0,NEW Crib white 3 in 1 convertible option,,Brand NEW 3 in 1 convertible white crib in original carton - Never opened! Regular price with shipping was $395.00. Please see pictures for all the details and features.,City of Toronto,30/08/2020,2020-10-06 11:39:37.056720
1510266116,/v-baby-crib-bassinet/city-of-toronto/4-vintage-made-in-canada-baby-blankets-in-excellent-condition/1510266116,35.0,4 vintage Made in Canada baby blankets in excellent condition,,Crib size. All four made in Canada. All four in excellent clean condition. Three are Esmond brand. Pickup Yonge and Finch area.,City of Toronto,30/08/2020,2020-10-06 11:39:37.057223
1521079295,/v-baby-crib-bassinet/city-of-toronto/sundvik-ikea-baby-crib/1521079295,20.0,SUNDVIK Ikea Baby Crib,,"Used convertible SUNDVIK ikea Crib, black-brown from pet free, smoke free home (mattress is not included). There are bite marks on the rail - see pictures. They can be easily covered by bumper. ...",City of Toronto,30/08/2020,2020-10-06 11:39:37.057857
1490360551,/v-baby-crib-bassinet/city-of-toronto/toddler-bed-cover-blanket-with-decorative-pillow/1490360551,5.0,Toddler Bed Cover/ Blanket with Decorative Pillow,,"Very good condition, clean. Size 120x180 cm. or 47'' x 71'' I can meet you at Glencairn subways station.",City of Toronto,30/08/2020,2020-10-06 11:39:37.058372
1521069532,/v-baby-crib-bassinet/city-of-toronto/pottery-barn-kids-ruffle-crib-bed-skirt/1521069532,25.0,Pottery Barn Kids Ruffle Crib bed skirt,,"Excellent condition, gently used white frilly bed skirt. Just need to be ironed.",City of Toronto,30/08/2020,2020-10-06 11:39:37.058888
1521030630,/v-baby-crib-bassinet/city-of-toronto/wooden-crib/1521030630,100.0,Wooden crib,,"Beautiful solid wooden crib. Made in Canada by Morigeau Lepine. Our kids have outgrown this, so it's time for it to find a new home. Can easily be converted into a day bed and we will throw in an ...",City of Toronto,30/08/2020,2020-10-06 11:39:37.059385
1521024456,/v-baby-crib-bassinet/city-of-toronto/2-bassinette-mattress-sheets/1521024456,5.0,2 Bassinette Mattress Sheets,,"EUC SFPF home Pick up only, contactless available",City of Toronto,30/08/2020,2020-10-06 11:39:37.059884
1520944954,/v-baby-crib-bassinet/city-of-toronto/2-sets-of-breathable-baby-crib-bumpers-in-like-new-condition/1520944954,30.0,2 sets of Breathable baby crib bumpers in like new condition,,I have 2 sets of crib bumpers. Great for twins. We used them for a few months because our babies kept getting legs and arms stuck between the slats of the crib. Each retails new for $40 $15 each or ...,City of Toronto,29/08/2020,2020-10-06 11:39:37.060381
1520938597,/v-baby-crib-bassinet/city-of-toronto/new-baby-crib-for-sale-still-in-box/1520938597,150.0,New baby Crib for sale (still in box),,Retails $560. New in box. Never used. Selling for $150. W32”xL56”xH36.5”. Fits standard size mattress. Poplar solids and veneers. Solid and durable. 3 mattress height settings. Mattress not included.,City of Toronto,29/08/2020,2020-10-06 11:39:37.060925
1520914205,/v-baby-crib-bassinet/city-of-toronto/euc-uppababy-bassinet/1520914205,100.0,EUC Uppababy Bassinet,,Excellent condition Uppababy Bassinet in Jake Black purchased in 2014 (never used outside); fits 2015 and later strollers with adapters,City of Toronto,29/08/2020,2020-10-06 11:39:37.061429
1520910509,/v-baby-crib-bassinet/city-of-toronto/crib-4-in-1/1520910509,220.0,Crib (4 in 1),,Selling Crib (4 in 1) in great condition.,City of Toronto,29/08/2020,2020-10-06 11:39:37.061925
1520910230,/v-baby-crib-bassinet/city-of-toronto/coffee-table/1520910230,150.0,Coffee Table,,Selling coffee table that was originally purchased from The Bay $400. The top glass is removable for easy transportation which can fit in to a regular sedan car.,City of Toronto,29/08/2020,2020-10-06 11:39:37.062423
1520885281,/v-baby-crib-bassinet/city-of-toronto/baby-crib-mattress-made-with-real-wood-50/1520885281,50.0,BABY CRIB + Mattress - Made with real wood. $50,,"Baby crib with mattress. Made of real wood, good condition, clean mattress. Pick up only.",City of Toronto,29/08/2020,2020-10-06 11:39:37.062934
1520865623,/v-baby-crib-bassinet/city-of-toronto/crib-in-great-condition/1520865623,65.0,Crib In Great Condition!,,"AVAILABLE IMMEDIATELY! This gently used crib is in great condition. The crib includes a mattress and a crib bumper that are once again, in great condition! The mattress is 55 inches ✕ 29 inches ...",City of Toronto,29/08/2020,2020-10-06 11:39:37.063433
1520864766,/v-baby-crib-bassinet/city-of-toronto/baby-crib-luxury-mattress/1520864766,80.0,Baby Crib Luxury Mattress,,"Gently used GreenGuard Certified The Stearns & Foster Sunrise 2-Stage Luxury Crib Mattress. Smoke free and pet free home. Original price was $270+tax, asking $80. Adding 2 waterproof organic cotton ...",City of Toronto,29/08/2020,2020-10-06 11:39:37.063933
1520861878,/v-baby-crib-bassinet/city-of-toronto/fisher-price-cradle-n-swing-fun-used/1520861878,60.0,Fisher-Price Cradle 'N Swing-Fun (Used),,Fisher-Price Cradle 'N Swing-Fun - Two swinging motions to soothe baby: side to side cradle or traditional head to toe swing motion - Legs fold for storage and easy room to room portability - ...,City of Toronto,29/08/2020,2020-10-06 11:39:37.064525
1474817109,/v-baby-crib-bassinet/city-of-toronto/baby-crib-wooden/1474817109,80.0,"Baby crib, wooden",,"Solid wood baby crib Includes crib matress Pick up only Victoria park and Sheppard Email-only, please",City of Toronto,29/08/2020,2020-10-06 11:39:37.065031
1520848947,/v-baby-crib-bassinet/city-of-toronto/baby-mattress/1520848947,50.0,Baby mattress,,Used and in very good condition Pick up only Negotiable,City of Toronto,29/08/2020,2020-10-06 11:39:37.065528
1520817603,/v-baby-crib-bassinet/city-of-toronto/crib/1520817603,25.0,Crib,,Baby crib that converts to a toddler bed. Great condition. Minimal teeth marks. Comes with all screws and pieces. Comes with instructions. Can deliver for a fee. Needs to be gone by August 30th.,City of Toronto,29/08/2020,2020-10-06 11:39:37.066035
1520788060,/v-baby-crib-bassinet/city-of-toronto/summer-infant-bassinet-with-bonus-mattress-sheet/1520788060,45.0,SUMMER INFANT BASSINET WITH BONUS MATTRESS SHEET,,LOCATED @ ISLINGTON & THE QUEENSWAY Summer Infant By Your Side Sleeper / Travel Bassinet in excellent & clean condition. Bought new for $80. Bassinet is very light weight with fold-down legs that ...,City of Toronto,29/08/2020,2020-10-06 11:39:37.066534
1461985924,/v-baby-crib-bassinet/city-of-toronto/crib-good-condition-spadinaxcollege/1461985924,59.0,Crib  -good condition- spadinaXcollege,,"Crib -good condition- natural wood color, convertible adjustable height, side rail comes with a mattress, and 2 covers. Assembled Dimensions: 53Lx29Wx39H must pick up at spadinaXcollege",City of Toronto,28/08/2020,2020-10-06 11:39:37.067256
1520734712,/v-baby-crib-bassinet/city-of-toronto/organic-hypoallergenic-crib-mattress/1520734712,65.0,Organic hypoallergenic crib mattress,,Organic crib mattress in excellent condition. Baby mostly slept with me in my bed so the mattress was barely used. It is hypoallergenic. Comes with organic bamboo protective cover. Pick up only! Pet ...,City of Toronto,28/08/2020,2020-10-06 11:39:37.067751
1520717177,/v-baby-crib-bassinet/city-of-toronto/rocking-crib/1520717177,85.0,Rocking Crib,,"Rocking Crib - Sorelle Dondola Cradle, Solid Wood, good condition. This model is one of the Top 5 Best Rocking Cribs in 2020. Free mattress. Sweet and stylish, this Dondola cradle will allow your ...",City of Toronto,28/08/2020,2020-10-06 11:39:37.068246
1520695850,/v-baby-crib-bassinet/city-of-toronto/portable-bassinet-chicco-lullago-50/1520695850,50.0,Portable Bassinet - Chicco LullaGo $50,,"Chicco Lulla Go portable bassinet, only used for 4 months! Great condition! From a smoke-free home. For ultimate portability, the LullaGo® can be disassembled and folded in under a minute and ...",City of Toronto,28/08/2020,2020-10-06 11:39:37.068740
1520681827,/v-baby-crib-bassinet/city-of-toronto/baby-crib/1520681827,75.0,Baby crib,,Wooden baby crib very good condition dark oak colour mattress and papers included Please contact for more information 647-573-2706,City of Toronto,28/08/2020,2020-10-06 11:39:37.069231
1520648715,/v-baby-crib-bassinet/city-of-toronto/bassinest-swivel-bedside-sleeper-premiere-series/1520648715,60.0,BassiNest Swivel Bedside Sleeper - Premiere Series,,"Our baby loved this but outgrew it. It is recommended for newborns and babies through five months of age or 20 pounds (9.1 kg.). It includes the mattress, mattress pad and fitted sheet. All soothing ...",City of Toronto,28/08/2020,2020-10-06 11:39:37.069725
1520643533,/v-baby-crib-bassinet/city-of-toronto/baby-crib/1520643533,50.0,"Wanted:
                            Baby crib",,Good used condition Espresso/ dark brown crib. Some scratches on front rail. Adjustable height. Already dismantled. Mattress and bedding can be added for free if interested.,City of Toronto,28/08/2020,2020-10-06 11:39:38.893333
1520637463,/v-baby-crib-bassinet/city-of-toronto/crib-bumper/1520637463,12.0,Crib bumper,,"Baby bed, crib bumper has two sides with two different pattern and colors, very clean from no per no smoke home",City of Toronto,28/08/2020,2020-10-06 11:39:38.893840
1520632283,/v-baby-crib-bassinet/city-of-toronto/ikea-sundvik-crib-with-mattress-newborn-to-toddle/1520632283,160.0,Ikea SUNDVIK Crib with Mattress - Newborn to Toddle,,- Almost new Ikea Sundvik white crib (hardly used for 6 months) for newborn or toddler. -The bed base can be placed at two different heights. You can lower the bottom and remove one of the long sides ...,City of Toronto,28/08/2020,2020-10-06 11:39:38.894336
1520624126,/v-baby-crib-bassinet/city-of-toronto/gently-used-baby-crib-mattr-shts-protector-bumpers-conv-kit/1520624126,200.0,"Gently used baby crib,mattr, shts, protector, bumpers, conv kit",,We are selling our gently used New Zealand-made baby crib and conversion kit. The crib has 4 Heights and only has a few minor scratches on it. The conversion kit converts the crib into a spacious ...,City of Toronto,28/08/2020,2020-10-06 11:39:38.894839
1520619809,/v-baby-crib-bassinet/city-of-toronto/gently-used-baby-crib-and-conversion-mattress-bumpers-sheets/1520619809,250.0,"gently used baby crib and conversion, mattress, bumpers, sheets",,We are selling our gently used New Zealand-made baby crib and conversion kit. The crib has 4 Heights and only has a few minor scratches on it. The conversion kit converts the crib into a spacious ...,City of Toronto,28/08/2020,2020-10-06 11:39:38.895513
1520616862,/v-baby-crib-bassinet/city-of-toronto/lil-angels-solid-wood-dark-wood-crib/1520616862,100.0,Lil Angels Solid Wood Dark Wood crib,,Excellent used condition Convertible crib,City of Toronto,28/08/2020,2020-10-06 11:39:38.896104
1520579214,/v-baby-crib-bassinet/city-of-toronto/bloom-alma-papa-modern-folding-3-in-1-convertible-crib/1520579214,850.0,Bloom Alma Papa Modern Folding 3-in-1 Convertible Crib,,"Ideal for condos! In clean, excellent condition. - Use as bassinet, crib, and toddler bed - Small footprint - 49"" L x 25.5"" W x 39"" H - Solid wood construction - Lockable castor wheels to easily move ...",City of Toronto,28/08/2020,2020-10-06 11:39:38.896614
1520564036,/v-baby-crib-bassinet/city-of-toronto/crib-bumper/1520564036,20.0,Crib bumper,,Lambs and Ivy - Hello Kitty 4-piece bumper set. Good condition.,City of Toronto,27/08/2020,2020-10-06 11:39:38.897259
1499843737,/v-baby-crib-bassinet/city-of-toronto/moonlight-slumber-crib-mattress/1499843737,50.0,Moonlight Slumber Crib Mattress,,"Gently used, like-new crib mattress, standard size 28""; x 51"";. Comes with a yellow soft fitted sheet, super-clean.",City of Toronto,27/08/2020,2020-10-06 11:39:38.897813
1520544218,/v-baby-crib-bassinet/city-of-toronto/jonesport-convertible-crib/1520544218,300.0,Jonesport Convertible Crib,,Selling a Jonesport Convertible Crib cloud grey that we bought in 2016. Some minor scuffs but otherwise still very solid. Comes with the mattress and half rail that turns it into a toddler bed when ...,City of Toronto,27/08/2020,2020-10-06 11:39:38.898380
1520486076,/v-baby-crib-bassinet/city-of-toronto/graco-pack-n-play/1520486076,100.0,Graco pack n play,,This is a graco pack n play without the bassinet attachment,City of Toronto,27/08/2020,2020-10-06 11:39:38.898898
1520474902,/v-baby-crib-bassinet/city-of-toronto/baby-crib/1520474902,120.0,Baby crib,,Wooden white crib in a high quality. Has some minor scratches. Only mattress's condition is not very good and would be better to have changed.,City of Toronto,27/08/2020,2020-10-06 11:39:38.899465
1520472273,/v-baby-crib-bassinet/city-of-toronto/sniglar-crib-with-pelleplutt-foam-mattress/1520472273,150.0,Sniglar crib with pelleplutt foam mattress,,"Hi, I am selling a brand new baby's crib with mattress for $150. Price can be negotiable.",City of Toronto,27/08/2020,2020-10-06 11:39:38.899944
1520463077,/v-baby-crib-bassinet/city-of-toronto/bnib-lolli-living-musical-mobile/1520463077,50.0,BNIB Lolli Living Musical Mobile,,"Brand New in Box, Lolli Living Musical Mobile - Fox/Owl.",City of Toronto,27/08/2020,2020-10-06 11:39:38.900460
1520458027,/v-baby-crib-bassinet/city-of-toronto/infant-bed-with-storage-at-the-bottom/1520458027,100.0,Infant bed with storage at the bottom.,,Beautiful infant bed with storage at the bottom. Can deliver for an extra fee of$50,City of Toronto,27/08/2020,2020-10-06 11:39:38.900960
1520437464,/v-baby-crib-bassinet/city-of-toronto/babybjorn-cradle/1520437464,250.0,BabyBjorn Cradle,,"Beautiful cradle in excellent condition. Only used for about 3 months. Gentle rocking motion, and perfect for the first few months beside the bed. Can be used up to a maximum of 18 lbs. Easy to wash ...",City of Toronto,27/08/2020,2020-10-06 11:39:38.901747
1505734028,/v-baby-crib-bassinet/city-of-toronto/fisher-price-soothing-motions-bassinet-in-windmill/1505734028,65.0,Fisher-Price Soothing Motions Bassinet in Windmill,,Like New Condition Available at Twice as Nice - Children’s Consignment Store,City of Toronto,27/08/2020,2020-10-06 11:39:38.902253
1509911289,/v-baby-crib-bassinet/city-of-toronto/alvi-bassinet-includes-canopy-and-star-bedding/1509911289,95.0,Alvi Bassinet - Includes Canopy and Star Bedding,,Great Condition- Includes White canopy with grey and white bedding. Base and wicker are grey. Available at Twice as Nice - Children’s Consignment,City of Toronto,27/08/2020,2020-10-06 11:39:38.902776
1509852339,/v-baby-crib-bassinet/city-of-toronto/meubles-ragazzi-baby-crib/1509852339,300.0,Meubles Ragazzi Baby Crib,,"Beautiful and solid wood Meubles Ragazzi Baby crib with under storage. Canadian made. Colour is a distressed cream. Perfect gender neutral colour. Has a few scratches on the bar, however this ...",City of Toronto,26/08/2020,2020-10-06 11:39:38.903296
1509924683,/v-baby-crib-bassinet/city-of-toronto/crib-with-mattress/1509924683,60.0,Crib with Mattress,,This crib is in good shape. No major issues. Mattress is also included. Pick up at my location. Assembly is super easy. Ready to pick up.,City of Toronto,26/08/2020,2020-10-06 11:39:38.903842
1520364993,/v-baby-crib-bassinet/city-of-toronto/crib-mattress-2-in-1/1520364993,30.0,Crib mattress 2 in 1,,Crib mattress 2 in 1 (one side firm for infants and other side soft for toddlers). It is like new and always used with protector. In great condition. PICKUP ONLY!,City of Toronto,26/08/2020,2020-10-06 11:39:38.904351
1520348728,/v-baby-crib-bassinet/city-of-toronto/baby-bassinet-grey/1520348728,90.0,Baby bassinet - grey,,Great condition. My son did not take to sleeping in a bassinet. Batteries required for soothing sounds and mattress vibrations,City of Toronto,26/08/2020,2020-10-06 11:39:38.904915
1520305005,/v-baby-crib-bassinet/city-of-toronto/crib-baby/1520305005,110.0,Crib baby,,Lovely solid wood baby crib. Good condition and made in Canada. With mattress Pick up by in Toronto. Lawrence and Allen road .,City of Toronto,26/08/2020,2020-10-06 11:39:38.905537
1520271901,/v-baby-crib-bassinet/city-of-toronto/bily-baby-i-love-you-crib-with-sealy-mattress/1520271901,70.0,Bily (baby i love you) crib with sealy mattress,,Good condition,City of Toronto,26/08/2020,2020-10-06 11:39:38.906219
1520190572,/v-baby-crib-bassinet/city-of-toronto/white-wicker-bassinet-on-wheels-with-white-skirt-120/1520190572,1.0,White Wicker Bassinet on Wheels with White Skirt $120,,"If Ad is up, it means it is still available Wicker Bassinet on wheels. Comes with removable and washable White Lace Eyelet Skirt to go around outside in the bag pic# 6 and 7 Excellent condition, ...",City of Toronto,25/08/2020,2020-10-06 11:39:38.906749
1499476576,/v-baby-crib-bassinet/city-of-toronto/sealy-cozy-dreams-extra-firm-crib-and-toddler-mattress/1499476576,79.99,Sealy Cozy Dreams Extra Firm Crib and Toddler Mattress,,"Preowned - Good condition - Sealy Cozy Dreams Extra Firm Crib and Toddler Mattress. Highlights 150 steel coils for firmness and support Durable, easy-clean waterproof cover and binding Secure Edge ...",City of Toronto,25/08/2020,2020-10-06 11:39:38.907261
1509606492,/v-baby-crib-bassinet/city-of-toronto/ikea-crib-mattress/1509606492,15.0,Ikea crib mattress,,Like new crib mattress.,City of Toronto,25/08/2020,2020-10-06 11:39:38.907903
1520166135,/v-baby-crib-bassinet/city-of-toronto/crib-solid-wood/1520166135,90.0,Crib - solid wood,,Lovely solid wood baby crib. Brown. Good condition and made in Canada. A few scratches. Mattress height can be adjusted. Does not come with mattress. Will come disassembled for easy pick up. Pick up ...,City of Toronto,25/08/2020,2020-10-06 11:39:38.908518
1520164762,/v-baby-crib-bassinet/city-of-toronto/pottery-barn-kendall-crib/1520164762,225.0,Pottery Barn Kendall Crib,,Great condition! Comes from a very clean home (no pets/no smoking). Also offering an organic crib mattress that is also in excellent condition (mattress protector was used). Curbside pickup ...,City of Toronto,25/08/2020,2020-10-06 11:39:38.909093
1520130765,/v-baby-crib-bassinet/city-of-toronto/baby-crib-bumper/1520130765,10.0,Baby crib bumper,,Still in ok condition Selling it with mattress skirt I am selling them for $10 Pick up at Fairview mall.,City of Toronto,25/08/2020,2020-10-06 11:39:38.909601
1520126100,/v-baby-crib-bassinet/city-of-toronto/bassinet/1520126100,20.0,Bassinet,,Bassinet for sale,City of Toronto,25/08/2020,2020-10-06 11:39:38.910138
1520103986,/v-baby-crib-bassinet/city-of-toronto/dutalier-cupcake-crib/1520103986,450.0,Dutalier Cupcake Crib,,Dutalier Cupcake Crib - includes a Sealy Baby Posturepedic Plus mattress and a Breathable Baby Crib Liner White (if either or both are desired) Great condition Pick up near Fairview mall.,City of Toronto,25/08/2020,2020-10-06 11:39:38.910715
1520100155,/v-baby-crib-bassinet/city-of-toronto/baby-crib/1520100155,80.0,Baby crib,,"Baby crib, mattress, crib wrap, crib rail cover all together for sale.",City of Toronto,25/08/2020,2020-10-06 11:39:38.911260
1520057602,/v-baby-crib-bassinet/city-of-toronto/custom-modern-crib-and-dresser/1520057602,3000.0,Custom Modern Crib and Dresser,,"Custom Modern Crib Dresser 42""wide 36"" high 19"" deep Combo $3000 Mattress not included",City of Toronto,25/08/2020,2020-10-06 11:39:38.911803
1498613767,/v-baby-crib-bassinet/city-of-toronto/graco-baby-crib-4-in-1/1498613767,300.0,GRACO BABY CRIB  4-in-1,,"Selling for $350 CAD, matress incluced Pinewood, Changing Table, 3 Drawers, bottom crib drawer Currently retailing at $679 CAD and $379 USD I bought this from the Brick 1 year ago in anticipation for ...",City of Toronto,25/08/2020,2020-10-06 11:39:38.912387
1519996806,/v-baby-crib-bassinet/city-of-toronto/ikea-sniglar-crib/1519996806,60.0,IKEA Sniglar Crib,,"Brand new IKEA Sniglar crib, comes with original box. Does not come with mattress or bed linen. Can be disassembled for pick up. (Retails for 99.99) The bed base can be placed at two different ...",City of Toronto,24/08/2020,2020-10-06 11:39:38.912959
1519986845,/v-baby-crib-bassinet/city-of-toronto/ikea-gonatt-grey-crib/1519986845,150.0,Ikea Gonatt grey crib,,"Selling Gonatt crib from Ikea with drawers in good condition. Mattress included. The crib has some glow in the dark stickers on it (see picture). Pictured converted to toddler bed, but the crib side ...",City of Toronto,24/08/2020,2020-10-06 11:39:38.913499
1482373322,/v-baby-crib-bassinet/city-of-toronto/crib-mobile/1482373322,25.0,Crib mobile,,VEUC. Barely used. Lights up and plays various melodies. Music speaker part can detach from mobile when baby is older for just music and lights. Paid $70+. Pick up is in Pickering.,City of Toronto,24/08/2020,2020-10-06 11:39:38.914111
1519921116,/v-baby-crib-bassinet/city-of-toronto/convertible-crib-bed:-birth-to-about-7-years-old/1519921116,300.0,Convertible crib/bed: birth to about 7 years old,,Convertible white wood bed/crib birth to about 7 years old + bamboo mattress + conversion kit include (140cm x 70cm) . The bed base can be fixed at 3 different heights (1 height to don’t have to lean ...,City of Toronto,24/08/2020,2020-10-06 11:39:38.914666
1519900747,/v-baby-crib-bassinet/city-of-toronto/sturdy-cots-in-mint-condition/1519900747,200.0,Sturdy cots in mint condition.,,Two sturdy cots in a very good condition. Suitable for twins. Parents of single baby can also contact. Cots can be sold individually. Includes mattress of a very good quality. Selling each for $200 ...,City of Toronto,24/08/2020,2020-10-06 11:39:40.627154
1519899687,/v-baby-crib-bassinet/city-of-toronto/fitted-sheets-for-baby-cribs/1519899687,50.0,Fitted sheets for baby cribs,,4 fitted sheets for the mattress fitting in cots for kids. Very good condition.,City of Toronto,24/08/2020,2020-10-06 11:39:40.627651
1519877066,/v-baby-crib-bassinet/city-of-toronto/crib/1519877066,350.0,crib,,Still new in box,City of Toronto,24/08/2020,2020-10-06 11:39:40.628142
1519862923,/v-baby-crib-bassinet/city-of-toronto/solid-oak-crib/1519862923,140.0,Solid oak crib,,Gently used Solid oak crib. No mattress. Can be converted to a single bed with side rails(not included). Make an offer must go. Asking $140.,City of Toronto,24/08/2020,2020-10-06 11:39:40.628966
