,url,price,title,distance,description,location,time_offset,retreived
1525765481,/v-hot-tub-pool/city-of-toronto/be-resort-ready-luxurious-lounge-chair-protection-towel-cover/1525765481,39.99,Be RESORT Ready!  Luxurious Lounge Chair Protection Towel Cover,,"Get ready to travel as soon as restrictions open up. Be RESORT Ready! Go to: http://www.anolesun.shop to order. Unique gift item for birthdays, anniversaries, holidays. Luxurious, Velvety Microfibre ...",City of Toronto,23/09/2020,2020-10-07 17:19:32.472993
1525722526,/v-hot-tub-pool/city-of-toronto/canadian-cedar-wood-hot-tub-efficient-wood-burner-cover-etc/1525722526,3200.0,"Canadian Cedar wood hot tub! Efficient Wood burner, cover& etc",,"Canadian cedar wood burning hot tub! ENJOY your backyard oasis with external wood burner or internal wood burner hot tub. Package includes Wood paddles, Insulation cover with safety lock, seats and ...",City of Toronto,23/09/2020,2020-10-07 17:19:32.473478
1525633868,/v-hot-tub-pool/city-of-toronto/pool-diving-board/1525633868,80.0,Pool Diving Board,,Used Pool Diving board for sale,City of Toronto,22/09/2020,2020-10-07 17:19:32.474557
1525631001,/v-hot-tub-pool/city-of-toronto/combo:-above-the-ground-pool-solar-heater-and-accessories/1525631001,250.0,"Combo: above the ground pool, solar heater and accessories",,"Used for 1 summer selling because moving to a house with no patio Perfect for a fun kids time! Easy to install, pool perfect conditions, heater with legs broken.",City of Toronto,22/09/2020,2020-10-07 17:19:32.475043
1525550031,/v-hot-tub-pool/city-of-toronto/new-intex-77-inch-purespaplus-bubble-massage-hottub/1525550031,1450.0,NEW Intex 77 Inch PureSpaPlus+ Bubble Massage HotTub,,Intex PureSpa™ provides simple maintenance with easy-to-replace filter cartridges for lasting enjoyment. The easy-to-use control panel activates the high-performing bubble Jets surrounding the ...,City of Toronto,22/09/2020,2020-10-07 17:19:32.475536
1525450046,/v-hot-tub-pool/city-of-toronto/round-above-the-ground-intex-swimming-pool/1525450046,500.0,Round above the ground INTEX swimming pool,,"Holds 6,981 gal. Dimensions: 18 ft. Diameter x 52 in. Deep Pool Shape: Round Pool Type: Above Ground Purchased for $1200 Well maintained and cleaned pool Easy Setup Buyer must dismantle and pack ...",City of Toronto,21/09/2020,2020-10-07 17:19:32.476608
1525437964,/v-hot-tub-pool/city-of-toronto/solarpro-curve-pool-heater/1525437964,180.0,SolarPro Curve pool heater,,Pool heater in working conditions. But the legs are broken.,City of Toronto,21/09/2020,2020-10-07 17:19:32.477095
1525435270,/v-hot-tub-pool/city-of-toronto/above-the-ground-pool-with-pump/1525435270,95.0,Above the ground pool with pump,,"SUMMER WAVES 12FT X 30IN Quick Set Pool with Filter Pump. Almost new. Used just this summer, and in good working conditions.",City of Toronto,21/09/2020,2020-10-07 17:19:32.477584
1525377987,/v-hot-tub-pool/city-of-toronto/pool-filter/1525377987,25.0,Pool filter,,"Keele 401 Pool filter. Posted in home - outdoor, garden, hot tubs, pools in City of Toronto. September 21, 2020",City of Toronto,21/09/2020,2020-10-07 17:19:32.478068
1514416310,/v-hot-tub-pool/city-of-toronto/ndoor-outdoor-pool/1514416310,35.0,ndoor/outdoor pool,,"Foldable/collapsable indoor/outdoor pool kids pool, excellent condition, like brand new. $35 or best offer",City of Toronto,21/09/2020,2020-10-07 17:19:32.478574
1525295555,/v-hot-tub-pool/city-of-toronto/beachcomber-hotub-step-cover-for-single-step-pump-housing-new/1525295555,40.0,Beachcomber Hotub Step Cover for  Single Step Pump Housing - New,,"Brand new Beachcomber step cover for older style rectangular pump housing. This is the jade colour which is no longer offered, and will thus match someone's legacy jade coloured cover. Selling ...",City of Toronto,21/09/2020,2020-10-07 17:19:32.479059
1525295354,/v-hot-tub-pool/city-of-toronto/bestway-steel-pro-max-swimming-pool/1525295354,300.0,BESTWAY Steel Pro max swimming pool,,"12' pool with all accessories (cover, extra large new pump, chlorine tab dispenser, patch kit etc). Got it last year from the states for $800.00 USD. Only used it a hand full of times and are selling ...",City of Toronto,21/09/2020,2020-10-07 17:19:32.479571
1504131901,/v-hot-tub-pool/city-of-toronto/hot-tub-cover-for-jacuzzi-brand-new/1504131901,90.0,Hot tub cover for Jacuzzi Brand New,,This is the Cover only; no insulation is included. Just remove the insulation from your old cover and insert into this one. Fits Jacuzzi J365 and is 84x91. Purchased from Hot Tub Covers Canada.,City of Toronto,21/09/2020,2020-10-07 17:19:32.480092
1525205319,/v-hot-tub-pool/city-of-toronto/ceramic-tiles-free/1525205319,0.0,Ceramic tiles - FREE,,Free ceramic tiles,City of Toronto,20/09/2020,2020-10-07 17:19:32.480573
1525178748,/v-hot-tub-pool/city-of-toronto/hot-tub-cover-brand-new-400-00-with-warranty/1525178748,400.0,Hot tub cover brand new $400.00 with warranty,,"Brand new hot tub top cover just bought August 20, 2020 brown 7X 7 ready to go. Warranty for a year. It is in perfect condition.",City of Toronto,20/09/2020,2020-10-07 17:19:32.481086
1525170481,/v-hot-tub-pool/city-of-toronto/large-intex-inflatable-pool/1525170481,90.0,Large Intex inflatable pool,,"As far as inflatable pools go, this is a pretty big one. It's about 7.5 feet in diameter and 2.5 feet tall; holds a lot of water. Listed dimensions are 90' x 86' x 31' Thought it would see a lot of ...",City of Toronto,20/09/2020,2020-10-07 17:19:32.481580
1525072234,/v-hot-tub-pool/city-of-toronto/new-pool-cleaner-parts/1525072234,10.0,NEW POOL CLEANER PARTS,,2 NEW SUCTION DIAFRAMS FOR ZODIAC POOL CLEANER NEVER OPENED,City of Toronto,20/09/2020,2020-10-07 17:19:32.482070
1525072063,/v-hot-tub-pool/city-of-toronto/pool-cartridge-filter-unicel-c8311-100-sq-hayward-cc1000re-new/1525072063,40.0,Pool Cartridge Filter Unicel C8311 100 Sq’ Hayward CC1000RE /NEW,,****************** PLEASE READ THE AD BEFORE ASKING ANY QUESTIONS ****************** BRAND NEW IN SEALED MFG PLASTIC PACKAGING / NEVER EVER USED / NEVER EVER INSTALLED ($40.00) – NO NEGOTIATIONS or ...,City of Toronto,20/09/2020,2020-10-07 17:19:32.482559
1514394226,/v-hot-tub-pool/city-of-toronto/large-plastic-tub-for-horticulture/1514394226,30.0,Large plastic tub for horticulture,,44x33x13 in. has inlet and outlet ports or can be sealed.,City of Toronto,20/09/2020,2020-10-07 17:19:32.483044
1514433301,/v-hot-tub-pool/city-of-toronto/zodiac-baracuda-g2-automatic-pool-cleaner/1514433301,180.0,Zodiac Baracuda G2 Automatic Pool Cleaner,,"Ready to use. Includes head unit, hoses, adjusting weights, and manual. New price approximately $500. Asking $180.",City of Toronto,19/09/2020,2020-10-07 17:19:32.483536
1525027199,/v-hot-tub-pool/city-of-toronto/key-west-ultra-cushioned-two-person-comfort-lounge-brand-new/1525027199,60.0,Key West Ultra Cushioned Two Person Comfort Lounge / BRAND NEW,,BRAND NEW IN SEALED MFG PACKAGING / NEVER USED / NEVER INFLATED / NEVER TAKEN OUT OF BOX ($60.00 EACH) – NO NEGOTIATIONS or DISCUSSIONS - PRICE IS FIRM – NO OFFERS ACCEPTED (2 Available) PLEASE REPLY ...,City of Toronto,19/09/2020,2020-10-07 17:19:32.484020
1514229761,/v-hot-tub-pool/city-of-toronto/jacuzzi-with-electric-cover-for-sale-as-is/1514229761,2500.0,JACUZZI WITH ELECTRIC COVER FOR SALE AS IS,,Rarely used Jacuzzi for Sale. Tub in good condition but main pump stopped working and may need to be replaced. Comes with an electric cover that may need to be reupholstered. Seats six people . Check ...,City of Toronto,19/09/2020,2020-10-07 17:19:32.484501
1524941838,/v-hot-tub-pool/city-of-toronto/super-large-inflatable-unicorn/1524941838,99.0,Super large inflatable unicorn,,This large size inflatable is big enough for 2 and is in perfect condition. We are selling our home and have no pool anymore.,City of Toronto,19/09/2020,2020-10-07 17:19:32.484987
1524875278,/v-hot-tub-pool/city-of-toronto/used-enersol-solar-pool-collectors/1524875278,300.0,Used Enersol Solar Pool Collectors,,I have about 20 10 foot sections of Enersol Solar pool collectors (www.enersol.com). They are about 15 years old. They have a lifespan of 25-30 years so you should be able to get 10-15 more years out ...,City of Toronto,19/09/2020,2020-10-07 17:19:38.259749
1524709378,/v-hot-tub-pool/city-of-toronto/hot-tub/1524709378,300.0,"Wanted:
                            Hot Tub",,Needs TLC - paint - filter - a couple of jet heads - motor runs fine - buyer to remove from property,City of Toronto,18/09/2020,2020-10-07 17:19:38.260445
1513821906,/v-hot-tub-pool/city-of-toronto/beach-towels/1513821906,20.0,Beach Towels,,"Beach Towels. BRAND NEW, large, fun, whimsical, quality product distributors of NHL, NFL, CFL. 100% velour/looped cotton. 55”L x 30” W. Designed with a variety of DOGS. Two Available. Asking $20 ...",City of Toronto,17/09/2020,2020-10-07 17:19:38.260945
1513430440,/v-hot-tub-pool/city-of-toronto/wayne-waterbug-submersible-pump-with-multi-flo-technology-yellow/1513430440,80.0,"WAYNE Waterbug Submersible Pump with Multi-Flo Technology,Yellow",,"WAYNE Waterbug Submersible Pump with Multi-Flo Technology,Yellow used couple times, condition 9/10",City of Toronto,17/09/2020,2020-10-07 17:19:38.261451
1524481263,/v-hot-tub-pool/city-of-toronto/wanted-swimming-pool-installer/1524481263,0.0,"Wanted:
                            (WANTED) swimming pool installer",,I have 12x24 used oval swimming pool need to install it in my backyard if you or know someone can do it please contact me on 647-773-3330. I live in Whitby ; ),City of Toronto,16/09/2020,2020-10-07 17:19:38.262136
1524415593,/v-hot-tub-pool/city-of-toronto/intex-trding-ltd-shark-play-center-with-built-in-sprayer/1524415593,15.0,Intex Trding Ltd. Shark Play Center with built in sprayer.,,"Built-in sprayer attaches to garden hose for added fun • Approximate water capacity, 22 gallons • 61.5"" x 51"" x 33"" • Ages 2+ Price: $15 Assembled Depth (in.): 33 in Assembled Length (in.): 61.5 in ...",City of Toronto,16/09/2020,2020-10-07 17:19:38.262628
1524379820,/v-hot-tub-pool/city-of-toronto/brand-new-hot-tub-8-500/1524379820,8500.0,"Brand New Hot Tub $8,500",,"Brand new hot tub includes cover, cover lifter, step, and start-up chemicals. 83” x 83” Hot tub features: Aromatherapy O-zone mixing system Waterfall Stainless steel jets Mini LED lights (16) Corner ...",City of Toronto,16/09/2020,2020-10-07 17:19:38.263143
1512535889,/v-hot-tub-pool/city-of-toronto/char-broil-hot-shot-performance-ignitor-4681-new/1512535889,10.0,Char Broil Hot Shot Performance Ignitor - 4681 - New,,"If the ad is up, item is available. Condition - Brand New. Char-Broil 4681 Hot Shot Push Button Igniter, 6 Points to spark Replaces burner ignition systems on most gas grills without a side burner ...",City of Toronto,16/09/2020,2020-10-07 17:19:38.263681
1524307652,/v-hot-tub-pool/city-of-toronto/gecko-in-touch-2-rf-interface-module-spa-transmitter-module/1524307652,100.0,Gecko  IN.TOUCH 2 RF Interface Module - Spa Transmitter Module,,"Gecko IN.TOUCH 2 RF Interface Module - Spa Transmitter module (router transmitter is not working), this will be an option if you need to replace the spa transmitter module only.",City of Toronto,16/09/2020,2020-10-07 17:19:38.264177
1480431947,/v-hot-tub-pool/city-of-toronto/inflatable-pool-mat-lounge-75inchs-20/1480431947,20.0,Inflatable Pool Mat/Lounge 75inchs $20,,"Never been used in good condition. Send message for details. Also I live in Scarborough near Bellamy and Eglinton, so I prefer to deal with people who live in a reasonable area. Unless you are ...",City of Toronto,15/09/2020,2020-10-07 17:19:38.264668
1524221753,/v-hot-tub-pool/city-of-toronto/hayward-s244t-pro-series-top-mount-24-inch-sand-filter/1524221753,200.0,Hayward S244T Pro Series Top-Mount 24-Inch Sand Filter,,Hayward S244T Pro Series Top-Mount 24-Inch Sand Filter with 1-1/2-Inch Vari-Flo Valve for In-Ground Pools Flange clamp design allows 360-degree rotation of valve to simplify plumbing * Integral top ...,City of Toronto,15/09/2020,2020-10-07 17:19:38.265162
1524196608,/v-hot-tub-pool/city-of-toronto/swimming-pool-spas-water-orp-ph-digital-controller-monitor/1524196608,600.0,Swimming Pool / SPAS Water ORP/pH Digital Controller Monitor,,Swimming Pool / SPAS Water ORP/pH Digital Controller Monitor. Ideal to use for outdoors pool.,City of Toronto,15/09/2020,2020-10-07 17:19:38.265656
1513485760,/v-hot-tub-pool/city-of-toronto/lawn-chair-lounger-elegant-high-end-lounger/1513485760,155.0,LAWN CHAIR LOUNGER - Elegant & High End Lounger,,"Selling this Lawn Chair Lounger at a Bargain Price - EXCELLENT CONDITION - Luxurious, Elegant, and High End Lounger - COLOUR = Jade/Dsrk Green & Cream - Reclines Back 4 Positions to Flat - Used ONLY ...",City of Toronto,14/09/2020,2020-10-07 17:19:38.266351
1513485078,/v-hot-tub-pool/city-of-toronto/lawn-chair-lounger-elegant-high-end-lounger/1513485078,155.0,LAWN CHAIR LOUNGER - Elegant & High End Lounger,,"Selling this Elegant & High End Lawn Chair Lounger at a Bargain Price - EXCELLENT CONDITION - Reclines Back 4 Positions to Flat - Luxurious, Elegant, and High End - COLOUR = Jade/Dark Green & Cream - ...",City of Toronto,14/09/2020,2020-10-07 17:19:38.266863
1524061948,/v-hot-tub-pool/city-of-toronto/fs:-winter-water-bags-for-pool-11pcs/1524061948,5.0,FS: Winter Water Bags for Pool (11pcs),,"For sale are 11 water bags for winter pool closing. There are single and double chamber of varying length. These haven't been used in some time and are being sold in ""as-is"" condition. Asking $5 each ...",City of Toronto,14/09/2020,2020-10-07 17:19:38.267370
1523904273,/v-hot-tub-pool/city-of-toronto/solar-blanket-reel/1523904273,110.0,Solar blanket reel,,"Selling an aluminum reel for solar blanket. The pole itself is 203 inches (17 feet) wide. It attaches to two aluminum stands and an aluminum knob for turning . The sides do come off the pole, but the ...",City of Toronto,13/09/2020,2020-10-07 17:19:38.268053
1523903145,/v-hot-tub-pool/city-of-toronto/floating-pool-chair/1523903145,50.0,floating pool chair,,"Selling a floating chair, ideal for swimming pool or cottage. $50",City of Toronto,13/09/2020,2020-10-07 17:19:38.268546
1523898705,/v-hot-tub-pool/city-of-toronto/inground-pool-ladder/1523898705,75.0,Inground Pool Ladder,,"Brand new, never used/installed inground pool ladder. It has been in storage for 10 years. Thanks for looking.",City of Toronto,13/09/2020,2020-10-07 17:19:38.269036
1523827241,/v-hot-tub-pool/city-of-toronto/quick-tech-towable-water-saddle-floats-4-pack/1523827241,90.0,Quick Tech towable Water Saddle Floats 4 pack,,Extra thick Saddle floats user afloat in a comfortable and stable sitting position. Great condition and purchased in USA. Retails $45 each.,City of Toronto,13/09/2020,2020-10-07 17:19:38.269530
1523745739,/v-hot-tub-pool/city-of-toronto/8x16-rectangular-above-ground-pool/1523745739,1000.0,8x16 rectangular above ground pool,,"looking to sell my pool as i upgrade to a bigger one , asking $ 1000 u can see it before dismantling i'll add some pics soon....",City of Toronto,13/09/2020,2020-10-07 17:19:38.270219
1523687921,/v-hot-tub-pool/city-of-toronto/banzai-big-blast-inflatable-water-park-bnib/1523687921,450.0,Banzai Big Blast Inflatable Water Park BNIB,,Up for sale is a brand new in the box Banzai Big Blast Inflatable Water Park Prepare to make waves with the Big Blast Water Park! Climb up to the top and launch down the slippery slide before landing ...,City of Toronto,12/09/2020,2020-10-07 17:19:38.270711
1523668991,/v-hot-tub-pool/city-of-toronto/spa-motor-and-pump/1523668991,125.0,Spa motor and pump,,"Used, 115V, 3/4HP pump and waterside from Century Pool. No air switch. Message me with any questions, I will do my best to answer them.",City of Toronto,12/09/2020,2020-10-07 17:19:38.271201
1523668951,/v-hot-tub-pool/city-of-toronto/flowxtreme-pro-ii-2hp-in-ground-pool-pump/1523668951,270.0,FlowXtreme Pro II 2HP In Ground Pool Pump,,Brand New Open Box FlowXtreme Pro II 2HP In Ground Pool Pump 2-Speed 2880-6300 GPH 230V Overview Model # NE4522 Store SKU # 1001391540 The FlowXtreme Pro II is the perfect replacement pump for your ...,City of Toronto,12/09/2020,2020-10-07 17:19:38.271700
1501669707,/v-hot-tub-pool/city-of-toronto/brand-new-rainbow-arch-sprinkler-splash-pad/1501669707,99.99,Brand New- Rainbow Arch Sprinkler splash pad.,,"Brand New- Rainbow Arch Sprinkler Built-in water sprayers to give a splash pad. Run around the yard and cool off with this Rainbow Arch Sprinkler. Standing over six feet tall, this sprinkler connects ...",City of Toronto,12/09/2020,2020-10-07 17:19:38.272385
1523589154,/v-hot-tub-pool/city-of-toronto/pool-solar-blanket-roller/1523589154,90.0,Pool solar blanket roller,,Pool solar blanket and roller available.,City of Toronto,12/09/2020,2020-10-07 17:19:38.272934
1523531952,/v-hot-tub-pool/city-of-toronto/new-never-open-bestway-flowclear-chlorinator-pool-cleaner/1523531952,355.0,New Never Open Bestway Flowclear Chlorinator Pool Cleaner,,"Every pool needs to be sanitized. It helps to keep the pool hygienic and ensure that all harmful bacteria and algae are eliminated. Using common table salt, the Flowclear Chlorinator makes pool ...",City of Toronto,12/09/2020,2020-10-07 17:19:38.273479
1396892726,/v-hot-tub-pool/city-of-toronto/new-disney-store-pixar-finding-nemo-crushs-cool-pool/1396892726,25.0,NEW! - Disney Store Pixar Finding Nemo Crush's Cool Pool,,"Why wait? Be ready when the hot weather arrives! What could be more splish, splashy fun than Crush's Cool Pool? So get ready for some maxin' and relaxin' with the awesome Giant Sea-Turtle from ...",City of Toronto,11/09/2020,2020-10-07 17:19:38.273972
1523434390,/v-hot-tub-pool/city-of-toronto/skim-mor-skimmer-sock-filters/1523434390,15.0,Skim Mor skimmer sock filters,,"Skim Mor skimmer sock filters for swimming pools. Brand new, 5 in a pack. I have 19 packs...$15 each.",City of Toronto,11/09/2020,2020-10-07 17:19:38.274470
1523349200,/v-hot-tub-pool/city-of-toronto/hayward-250-ed2-pool-heater-for-sale/1523349200,2850.0,HAYWARD 250 ED2 POOL HEATER FOR SALE `<>,,BRAND NEW WITH 1 YEAR MANUFACTURER WARRANTY H250 ED2... HAYWARD 250 ED2 POOL HEATER FOR SALE! - ENERGY EFFICIENT - 250 BTU/H - NATURAL GAS POOL HEATER - COPPER NICKEL HEAT EXCHANGER - ELECTRONIC ...,City of Toronto,11/09/2020,2020-10-07 17:19:38.274967
1512661684,/v-hot-tub-pool/city-of-toronto/hayward-glx-pcb-pro-pro-logic-pcb-r4-46-pool/1512661684,350.0,Hayward GLX-PCB-PRO Pro Logic PCB r4.46 pool,,Hayward GLX-PCB-PRO prologic (Hayward Pro Logic) PCB r4.46 refurbished and fully tested (price is valid in exchange for your old defective card). We send by Canada Posts Express. Shipping is around ...,City of Toronto,10/09/2020,2020-10-07 17:19:38.275482
1512661807,/v-hot-tub-pool/city-of-toronto/hayward-glx-pcb-main-aqua-logic-main-pcb-2-87-pool/1512661807,280.0,Hayward GLX-PCB-MAIN Aqua Logic main pcb 2.87 pool,,"Hayward GLX-PCB-MAIN Aqualogic main pcb refurbished, fully tested and with warranty. Latest firmware (2.87) compatible with variable speed pump. Price with exchange of your old defective card. We ...",City of Toronto,10/09/2020,2020-10-07 17:19:40.792389
1523265960,/v-hot-tub-pool/city-of-toronto/intex-auto-pool-cleaner-28001e/1523265960,50.0,Intex Auto Pool Cleaner 28001E,,Condition: Excellent. Stored in storage. Can take pictures upon request. Item model number: 28001E Requires a filter pump with a flow rate between 1200 - 3500gph. The sprayer can be used with all ...,City of Toronto,10/09/2020,2020-10-07 17:19:40.792876
1523066699,/v-hot-tub-pool/city-of-toronto/veranda-rectangular-hot-tub-cover-large/1523066699,30.0,"Veranda Rectangular Hot Tub Cover, Large",,Condition: Good. Stored in storage. Can take pictures upon request. Manufacturer : Classic Accessories ASIN : B019NTE2TI Item model number : 55-588-011501-00 THE CLASSIC ACCESSORIES DIFFERENCE: CA ...,City of Toronto,09/09/2020,2020-10-07 17:19:40.793359
1523049560,/v-hot-tub-pool/city-of-toronto/intex-above-ground-pool/1523049560,500.0,Intex above ground pool,,"Bought this summer model B 14*42 intex above ground pool ,extras are skimmer and pod puck, will drain soon $500",City of Toronto,09/09/2020,2020-10-07 17:19:40.793847
1512391598,/v-hot-tub-pool/city-of-toronto/a-pair-of-remcon-1-tier-rust-proof-sloped-top-plastic-locker/1512391598,30.0,A Pair of Remcon 1-Tier Rust-Proof Sloped Top Plastic Locker,,"PLZ READ THE AD. Up for sell a PAIR of PREOWNED lockers (prefer to sell as a pair). They are sloped tops made by Famous Remcon Plastics. Square part dimension 12"" x 12"" x 15 "". Sloped top is 22.5"" ...",City of Toronto,09/09/2020,2020-10-07 17:19:40.794525
1522916681,/v-hot-tub-pool/city-of-toronto/pool-filter/1522916681,100.0,Pool Filter,,Pool filter good condition. Jacuzzi laser 225 If the listing is still up then it is still available,City of Toronto,08/09/2020,2020-10-07 17:19:40.795008
1371999573,/v-hot-tub-pool/city-of-toronto/above-ground-pool-16-x-25/1371999573,999.0,above ground pool 16 x  25,,above ground pool The pool just comes with a frame that needs to be taken apart there is no liner or pool equipment,City of Toronto,08/09/2020,2020-10-07 17:19:40.795547
1522845227,/v-hot-tub-pool/city-of-toronto/intex-8ft-easy-set-pool-with-pump-and-filter-350/1522845227,350.0,INTEX 8FT EASY SET POOL WITH PUMP AND FILTER - $350,,I am selling a INTEX 8FT EASY SET POOL WITH PUMP AND FILTER. This pool was used for 4 times total. I am asking $350 for the pool. The pool would have to be picked up at my home near Canada's ...,City of Toronto,08/09/2020,2020-10-07 17:19:40.796037
1522610086,/v-hot-tub-pool/city-of-toronto/intex-pool/1522610086,400.0,Intex pool,,"-Above ground pool only used for a month before switching over to semi-I ground -Comes with floor cover, pool cover, pump and a ladder -Retail price: $650, selling for $400 or best offer, selling as ...",City of Toronto,07/09/2020,2020-10-07 17:19:40.796719
1439728609,/v-hot-tub-pool/city-of-toronto/swimming-pool-ladder/1439728609,155.0,Swimming Pool Ladder,,Universal Swimming Pool Ladder. Excellent condition.,City of Toronto,07/09/2020,2020-10-07 17:19:40.797210
1501608873,/v-hot-tub-pool/city-of-toronto/pool-clorinator/1501608873,45.0,Pool Clorinator,,Pool Clorinator. In line. Works with pucks. Good condition.,City of Toronto,07/09/2020,2020-10-07 17:19:40.797698
1522362693,/v-hot-tub-pool/city-of-toronto/above-ground-swimming-pool/1522362693,100.0,Above ground swimming pool,,Selling our swimming pool that guarantees tons of fun for the kids in your very own backyard. Has a few patches but we taped it up with very strong gorilla plastic tape so there are no leaks or ...,City of Toronto,06/09/2020,2020-10-07 17:19:40.798185
1522293523,/v-hot-tub-pool/city-of-toronto/pool-pump/1522293523,20.0,Pool pump,,3/4 HP pump. Working condition. Used as booster for robotic vacuum.,City of Toronto,05/09/2020,2020-10-07 17:19:40.798669
1522292906,/v-hot-tub-pool/city-of-toronto/pool-vacuum/1522292906,50.0,Pool vacuum,,Booster pump vacuum. Good condition. Covers 16 x 32 foot pool. In Etobicoke.,City of Toronto,05/09/2020,2020-10-07 17:19:40.799151
1522227772,/v-hot-tub-pool/city-of-toronto/controlomatic-chlormaker-salt-water-system/1522227772,400.0,Controlomatic chlormaker salt water system,,"Plug and play salt water system for your hot tub! Sold out online but I have one left, brand new in box. Check it out on the manufacturers website. ...",City of Toronto,05/09/2020,2020-10-07 17:19:40.799643
1522273906,/v-hot-tub-pool/city-of-toronto/diy-cedar-hot-tub-pending-sale/1522273906,800.0,DIY Cedar Hot Tub - Pending Sale,,"BRAND NEW DIY kit with clear cedar planks, aluminum stove, bands and base.",City of Toronto,05/09/2020,2020-10-07 17:19:40.800183
1522203697,/v-hot-tub-pool/city-of-toronto/wanted-softub-cover-lifter/1522203697,100.0,"Wanted:
                            Wanted-Softub cover lifter",,I'm looking for a Softub cover lifter.,City of Toronto,05/09/2020,2020-10-07 17:19:40.800645
1521993469,/v-hot-tub-pool/city-of-toronto/hayward-250-mv-pool-heater/1521993469,2650.0,"HAYWARD 250 MV POOL HEATER ""`",,BRAND NEW WITH 1 YEAR MANUFACTURER WARRANTY H250 MV HAYWARD 250 MV POOL HEATER FOR SALE! - ENERGY EFFICIENT - 250 BTU/H - NATURAL GAS POOL HEATER - COPPER NICKEL HEAT EXCHANGER CALL ME ASAP 416 520 ...,City of Toronto,04/09/2020,2020-10-07 17:19:40.801129
1521917311,/v-hot-tub-pool/city-of-toronto/seaway-pool-ladder/1521917311,90.0,Seaway Pool Ladder,,"The best pool manufacturer in the business ... brand new, never used, 48 - 52"" resin ladder. Extremely sturdy, this is not a cheap flimsy ladder. Came with the pool but we needed something different ...",City of Toronto,03/09/2020,2020-10-07 17:19:40.801608
1521759373,/v-hot-tub-pool/city-of-toronto/bestway-hydroforce-steel-max-pro-pool-30ft/1521759373,500.0,Bestway  Hydroforce Steel Max Pro Pool 30ft,,BRAND NEW IN SEALED BOX - NEVER OPENED Stay safe at home and enjoy your own pool in your own backyard! No need to inflate a ring with air and worry about it - just set up the frame and fill :). Happy ...,City of Toronto,02/09/2020,2020-10-07 17:19:40.802085
1521685612,/v-hot-tub-pool/city-of-toronto/splash-pools-scv-1812-solar-blanket-for-oval-pools-18-by-12/1521685612,30.0,"Splash Pools SCV 1812 Solar Blanket for Oval Pools, 18' by 12'",,"Condition: Excellent. Can take pictures upon request. Stored in storage. Reduces water evaporation by up to 95% Prevents heat loss Takes advantage of the sun's ""free heat"" for a 15° temperature rise, ...",City of Toronto,02/09/2020,2020-10-07 17:19:40.802564
1521679739,/v-hot-tub-pool/city-of-toronto/flexible-gas-pipe-1-1-4/1521679739,300.0,Flexible gas pipe 1 1/4,,Selling 50 feet of flexible gas pipe 1 1/4 thick. Comes with 2 adapters $(65 each) plus some other connections. Asking $300 Thanks,City of Toronto,02/09/2020,2020-10-07 17:19:40.803042
