,url,price,title,distance,description,location,time_offset,retreived
1527294878,/v-stereo-systems-home-theatre/city-of-toronto/vintage-sony-ta-ax530-integrated-stereo-amplifier-160w-video-in/1527294878,25.0,"Vintage SONY TA-AX530 Integrated Stereo Amplifier 160W, video-in",,Up for bid is a Sony TA-AX530 Intergrated Amplifier.....a beautiful black face unit......all lights light up.....all inputs and functions work well and there are no electronic or mechanical issues ...,City of Toronto,01/10/2020,2020-10-07 17:37:07.427614
1527291190,/v-stereo-systems-home-theatre/city-of-toronto/polk-audio-sb6500bt-soundbar-subwoofer-bluetooth-warranty/1527291190,149.0,Polk Audio SB6500BT Soundbar Subwoofer Bluetooth *Warranty,,Refurbished item with 30 days replacement warranty Great Mid and Bass performance for moderately sized living rooms Unbeatable Sound at this Price Range Sound bar with Wireless Subwoofer built-in ...,City of Toronto,01/10/2020,2020-10-07 17:37:07.428122
1527290279,/v-stereo-systems-home-theatre/city-of-toronto/logitech-x-240-multimedia-speakers-for-pc-laptops-and-phones/1527290279,25.0,"Logitech X-240 Multimedia Speakers for PC, Laptops and Phones",,"If the ad is up, the item is still available. Selling my Logitech X240 Surround Sound 2.1 Computer Speaker System with Subwoofer, good working condition. More description here: ...",City of Toronto,01/10/2020,2020-10-07 17:37:07.428621
1527284072,/v-stereo-systems-home-theatre/city-of-toronto/vintage-electrohome-console-stereo-made-in-canada/1527284072,1000.0,Vintage Electrohome Console Stereo.  Made in Canada,,"Vintage 1960's Electrohome ""The Monterrey"" Console Stereo. Cabinet made by Deilcraft. Made in Kitchener, ON. All documentation. Satellite speakers included. Pick-up only.",City of Toronto,01/10/2020,2020-10-07 17:37:07.429193
1527275763,/v-stereo-systems-home-theatre/city-of-toronto/line-6-xd-v75-wireless-handheld-microphone/1527275763,450.0,LINE 6 XD-V75 WIRELESS HANDHELD MICROPHONE,,SELLING LINE 6 XD-V75 WIRELESS HANDHELD MICROPHONE ONLY 11 MONTHS OLD. I ALREADY HAVE 4 MICS BUT BOUGHT THIS ONE FOR A EVENT I NEEDED 5 MICS FOR AND NOW ONLY USED A COUPLE TIMES AS A BACKUP MIC JUST ...,City of Toronto,01/10/2020,2020-10-07 17:37:07.429923
1527273455,/v-stereo-systems-home-theatre/city-of-toronto/stereo-yamaha/1527273455,195.0,stereo yamaha,,"3 yamaha speakers +2 rear polk audio speakers + amp yamaha they are good condition perfect sound for music, 6475688286",City of Toronto,01/10/2020,2020-10-07 17:37:07.430424
1527266120,/v-stereo-systems-home-theatre/city-of-toronto/pioneer-sc-1227-home-theatre-receiver/1527266120,200.0,Pioneer SC-1227 Home Theatre Receiver,,Looking to sell our pioneer home theatre audio receiver. It has done well and has handled all of our audio needs for our TV and the sound system installed in our home. We inherited the speaker from a ...,City of Toronto,01/10/2020,2020-10-07 17:37:07.430922
1527265731,/v-stereo-systems-home-theatre/city-of-toronto/home-theater-with-pioneer-amplifier/1527265731,500.0,Home theater with Pioneer Amplifier,,Selling Pionner Receiver with home theater stand. Center channel with 2 book shelf Athena speakers and subwoofer. With 2 Klarity tower. Asking 500,City of Toronto,01/10/2020,2020-10-07 17:37:07.431474
1527262681,/v-stereo-systems-home-theatre/city-of-toronto/kamson-concert-288-dual-handheld-ks288-true-diversity-wireless/1527262681,70.0,Kamson Concert 288 Dual-Handheld KS288 True Diversity Wireless,,"Kamson Concert 288 Dual-Handheld KS288 True Diversity Wireless System VHF DUAL CHANNEL WTRELESS MICROPHONE RECEIVER $70 In good condition. works perfect If you see this ad, it`s still available for ...",City of Toronto,01/10/2020,2020-10-07 17:37:07.431968
1489064787,/v-stereo-systems-home-theatre/city-of-toronto/centrios-vertical-cd-player-alarm-clock-radio-am-fm-remote/1489064787,85.0,Centrios Vertical CD Player/Alarm Clock/Radio AM/FM+Remote,,"Centrios Vertical CD Player/Alarm Clock/Radio AM/FM With Original Remote Control You can plug it in or have it run on batteries. Comes off the stand. Fantastic design. Excellent sound. Measures 17"" ...",City of Toronto,01/10/2020,2020-10-07 17:37:07.432463
1527232165,/v-stereo-systems-home-theatre/city-of-toronto/ion-audio-vinyl-motion-portable-3-speed-as-is/1527232165,10.0,ION Audio Vinyl Motion | Portable 3-Speed ( as -is ),,"CLOSING SALE ( we moved to new address) CLEARANCE FINAL SALE (SoldLess Clearance Center INC) all our prices are without tax (cash only ) regular price :$125 our price :$10 New , open box , as-is ...",City of Toronto,01/10/2020,2020-10-07 17:37:07.432957
1527227111,/v-stereo-systems-home-theatre/city-of-toronto/vintage-rca-suitcase-stereo-record-player/1527227111,125.0,VINTAGE RCA Suitcase Stereo Record Player.,,IF AD IS UP ITEM IS AVAILABLE. For prompt service please call if interested. This piece is the coolest item at your next birthday party. Or your kid's. He or she would be the coolest kid in the ...,City of Toronto,01/10/2020,2020-10-07 17:37:07.433448
1527223758,/v-stereo-systems-home-theatre/city-of-toronto/logitech-surround-sound-speaker-z506-system/1527223758,40.0,logitech surround sound speaker z506 system,,40$ for everything. It's missing 2 of the speakers but everything is in working condition . Brand new like 300$ For fastest response please text me at +14379726441,City of Toronto,01/10/2020,2020-10-07 17:37:07.433945
1527223524,/v-stereo-systems-home-theatre/city-of-toronto/phillips-console-stereo/1527223524,50.0,Phillips Console Stereo,,Phillips 8 track/am/fm turntable combo console stereo for sale. 8 track and stereo work fine with good sound but turntable may need some work. In great shape just no room to keep. Priced to sell. ...,City of Toronto,01/10/2020,2020-10-07 17:37:07.434444
1527217782,/v-stereo-systems-home-theatre/city-of-toronto/stereo-stand-and-speakers/1527217782,120.0,Stereo stand and speakers,,"Stereo stand and speakers . Posted in audio, stereo systems, home theatre in City of Toronto. October 1, 2020",City of Toronto,01/10/2020,2020-10-07 17:37:07.434941
1527215833,/v-stereo-systems-home-theatre/city-of-toronto/denon-s-102-receiver-and-sub-remote/1527215833,150.0,"DENON S-102 Receiver and Sub ,Remote",,"DENON S-102 Receiver and Sub ,Remote ... just $150(cables including. 2 side speakers missing",City of Toronto,01/10/2020,2020-10-07 17:37:10.403332
1506068136,/v-stereo-systems-home-theatre/city-of-toronto/mackie-srm450-self-powered-loudspeakers-and-system-controller/1506068136,750.0,Mackie SRM450 Self-powered Loudspeakers and System Controller,,"Good condition, v1, sound great. 450W, Carry bags included. Full package $750. Packaged with a community dcs42 Controller Link to Community manual and specs: ...",City of Toronto,01/10/2020,2020-10-07 17:37:10.403819
1423604704,/v-stereo-systems-home-theatre/city-of-toronto/vintage-bose-550-am-fm-equalizer-stereo-receiver/1423604704,875.0,VINTAGE BOSE 550 AM/FM Equalizer/Stereo Receiver,,As titled. Great condition,City of Toronto,01/10/2020,2020-10-07 17:37:10.404303
1423601550,/v-stereo-systems-home-theatre/city-of-toronto/vintage-luxman-t-240-stereo-tuner/1423601550,175.0,Vintage Luxman T-240 Stereo Tuner,,Vintage Luxman Model T-240 Frequency Synthesized AM/FM Stereo Tuner.,City of Toronto,01/10/2020,2020-10-07 17:37:10.404783
1527199438,/v-stereo-systems-home-theatre/city-of-toronto/sonos-boost-running-latest-sonos-app-s2-software/1527199438,100.0,Sonos Boost running latest Sonos App S2 Software,,"Sonos Boost running latest Sonos App S2 Software in perfect shape. Dramatically extend the range of your Sonos system, updated to the latest software and works perfect, retails for $150 plus tax, ...",City of Toronto,01/10/2020,2020-10-07 17:37:10.405264
1527199334,/v-stereo-systems-home-theatre/city-of-toronto/proconnect-av-rack-cabinet-with-active-cooling-fan-built-in/1527199334,400.0,Proconnect AV Rack Cabinet with Active Cooling Fan Built In,,"Proconnect AV Rack Cabinet with Active Cooling Fan Built In. Really nice professional AV rack to house AV and Home Theater equipment. Front door is reversible and glass, front and rear doors both ...",City of Toronto,01/10/2020,2020-10-07 17:37:10.405739
1527186556,/v-stereo-systems-home-theatre/city-of-toronto/bsr-belt-drive-turntable-electronic-speed-control-anti-skate/1527186556,100.0,BSR belt drive turntable electronic speed control anti skate,,Works like new. Missing dust cover. Made in England.,City of Toronto,01/10/2020,2020-10-07 17:37:10.406217
1527182939,/v-stereo-systems-home-theatre/city-of-toronto/fisher-turntable-model-mt-855/1527182939,175.0,Fisher Turntable Model MT-855,,Fisher Turntable Model MT-855 . Good condition.,City of Toronto,01/10/2020,2020-10-07 17:37:10.406698
1506110266,/v-stereo-systems-home-theatre/city-of-toronto/powerful-fisher-rs-737-surround-receiver-120-wpc-like-new/1506110266,125.0,Powerful Fisher RS-737 surround receiver 120 WPC like new,,Heavy and powerful 120WPC dates from the 90's ZERO issues. Weighs almost 30lbs (rough estimate). I am happy to answer any questions you may have regarding this amp! Price is negotiable.,City of Toronto,30/09/2020,2020-10-07 17:37:10.407217
1496590750,/v-stereo-systems-home-theatre/city-of-toronto/realistic-32-1100a-stereo-4-channel-dj-mixer-tape-deck-mic/1496590750,75.0,"REALISTIC 32-1100A Stereo 4 Channel DJ Mixer, Tape Deck, Mic",,"REALISTIC Model 32-1100A Stereo 4 Channel DJ Tape Deck, Microphone or Turntables Mixer Mixes a tape deck, a Microphone or Turntables like Pro. VU Meters. Ecler Smac-32 Pro DJ Mixer. In great ...",City of Toronto,30/09/2020,2020-10-07 17:37:10.407712
1514844648,/v-stereo-systems-home-theatre/city-of-toronto/pioneer-soundbar/1514844648,30.0,pioneer soundbar,,2x. 18 w 2 speakers,City of Toronto,30/09/2020,2020-10-07 17:37:10.408189
1494694635,/v-stereo-systems-home-theatre/city-of-toronto/sony-cd-boombox-cfd-f10-model-new-in-box/1494694635,100.0,Sony CD boombox CFD-F10 model (new in box),,NEW IN BOX This Sony CD boom box's low profile design takes up very little space on a tabletop or kitchen counter. Features 4.5 watts of power per channel; 2-way mid/tweeter speaker system; digital ...,City of Toronto,30/09/2020,2020-10-07 17:37:10.408672
1496568815,/v-stereo-systems-home-theatre/city-of-toronto/audiosource-tv-sound-bar-s3d40-100w-brand-new-in-box/1496568815,100.0,AudioSource TV Sound-bar (S3D40) (100W) (Brand New in Box),,Brand New w/ box Pickup at Avenue Rd & Eglinton SPECS GENERAL Type Sound bar speaker system Manufacturer AudioSource SPEAKER SYSTEM System Components 1 x Sound bar Amplification Type active Nominal ...,City of Toronto,30/09/2020,2020-10-07 17:37:10.409151
1527136268,/v-stereo-systems-home-theatre/city-of-toronto/mpow-soundhot-b4-bluetooth-speaker-for-pc/1527136268,0.0,MPOW Soundhot B4 Bluetooth Speaker for PC,,POWERFUL 6 SPEAKERS: Mpow Soundbar built-in 6 x 2-inch full range speakers and 2 bass reflex tubes deliver powerful and richer bass. Sound bar output up to 105dB of loud audio to upgrade your TV ...,City of Toronto,30/09/2020,2020-10-07 17:37:10.409836
1527132991,/v-stereo-systems-home-theatre/city-of-toronto/dgm-5-1ch-home-theatre-speaker-system/1527132991,10.0,DGM 5.1CH HOME THEATRE SPEAKER SYSTEM,,Working good,City of Toronto,30/09/2020,2020-10-07 17:37:10.410320
1527124694,/v-stereo-systems-home-theatre/city-of-toronto/new-energy-connoisseur-audio-cables/1527124694,45.0,NEW ENERGY CONNOISSEUR  AUDIO CABLES,,NEW Energy audio cables - 5m in length 25k gold-plated interlock High silver-content soldered connections,City of Toronto,30/09/2020,2020-10-07 17:37:10.410892
1527117356,/v-stereo-systems-home-theatre/city-of-toronto/marantz-speakers-as-is/1527117356,85.0,Marantz speakers as is,,Need reform . Or fix rubble around . Yes. Still for sale.Please make a call me or text me 6477618001  for pick up. I am location at Sheppard warden Scarborough,City of Toronto,30/09/2020,2020-10-07 17:37:10.411400
1400540954,/v-stereo-systems-home-theatre/city-of-toronto/precision-acoustic-ceiling-in-wall-speakers/1400540954,50.0,Precision acoustic ceiling/in-wall speakers,,"6.5 “ 50Wx2(100W), 8 Ohm. 90 dB eff. Brand new in the box. Pair of 2. No covers. If you see the add, it is available.",City of Toronto,30/09/2020,2020-10-07 17:37:10.411890
1450284317,/v-stereo-systems-home-theatre/city-of-toronto/sony-home-theatre-50/1450284317,50.0,Sony Home Theatre-50$,,"Sony DAV-SB100. Dolby surround 5 speaker system. If you see the add, it is available.",City of Toronto,30/09/2020,2020-10-07 17:37:10.412373
1527096236,/v-stereo-systems-home-theatre/city-of-toronto/audion-sterling-etse-el34-tube-integrated-amplifier-with-remote/1527096236,1100.0,AUDION STERLING ETSE EL34 TUBE INTEGRATED AMPLIFIER WITH REMOTE,,"PLEASE GIVE US A CALL FOR QUICK ANSWERS . WE DO NOT REGULARLY CHECK OUR MAILS SO CALLING IS YOUR BEST OPTION . Item is in good working condition . Come and see hundreds of items ( Vintage audio , led ...",City of Toronto,30/09/2020,2020-10-07 17:37:10.412860
1527092426,/v-stereo-systems-home-theatre/city-of-toronto/pioneer-pl-120-stereo-turntable/1527092426,115.0,Pioneer PL-120 Stereo Turntable,,Turntable is in excellent working condition and ready to be appreciated with all your vinyl records. Please message or text me if you are interested.,City of Toronto,30/09/2020,2020-10-07 17:37:10.413345
1506037139,/v-stereo-systems-home-theatre/city-of-toronto/harman-kardon-hk705-ultrawideband-metal-cassette-deck/1506037139,250.0,HARMAN/KARDON HK705 ULTRAWIDEBAND  METAL CASSETTE DECK,,"PLEASE GIVE US A CALL FOR QUICK ANSWERS . WE DO NOT REGULARLY CHECK OUR MAILS SO CALLING IS YOUR BEST OPTION . Item is in good working condition . Come and see hundreds of items ( Vintage audio , led ...",City of Toronto,30/09/2020,2020-10-07 17:37:10.413828
1527091469,/v-stereo-systems-home-theatre/city-of-toronto/us-audio-p-40-stereo-amplifier/1527091469,45.0,US Audio P-40 Stereo Amplifier,,40 watt amplifier in great condition. Goes for $68 online but asking for $45.,City of Toronto,30/09/2020,2020-10-07 17:37:10.414311
1479465655,/v-stereo-systems-home-theatre/city-of-toronto/rare-vintage-jvc-vr-5511-stereo-reciver/1479465655,200.0,RARE VINTAGE JVC  VR-5511 STEREO RECIVER,,"PLEASE GIVE US A CALL FOR QUICK ANSWERS . WE DO NOT REGULARLY CHECK OUR MAILS SO CALLING IS YOUR BEST OPTION . Item is in good working condition . Come and see hundreds of items ( Vintage audio , led ...",City of Toronto,30/09/2020,2020-10-07 17:37:10.414794
1479465105,/v-stereo-systems-home-theatre/city-of-toronto/luxman-r-1030-receiver/1479465105,150.0,LUXMAN R-1030 RECEIVER,,"PLEASE GIVE US A CALL FOR QUICK ANSWERS . WE DO NOT REGULARLY CHECK OUR MAILS SO CALLING IS YOUR BEST OPTION . Item is in good working condition . Come and see hundreds of items ( Vintage audio , led ...",City of Toronto,30/09/2020,2020-10-07 17:37:10.415290
1527082650,/v-stereo-systems-home-theatre/city-of-toronto/bose-lifestyle-48/1527082650,690.0,Bose Lifestyle 48,,Bose Lifestyle 48 Home Theater System. Elegant tiny speaker package that produces fantastic award winning sound. Comes with Bose Media Centre with Built in DVD player and Hard Drive for Music ...,City of Toronto,30/09/2020,2020-10-07 17:37:10.415778
1527077560,/v-stereo-systems-home-theatre/city-of-toronto/vintage-steiner-stereo-equipment/1527077560,50.0,Vintage Steiner Stereo Equipment,,For sale Steiner stereo equipment for parts or repair. Model A-3000 power amp. Model T-3000 tuner. Model D-3000S cassette deck. Good physical condition. $50,City of Toronto,30/09/2020,2020-10-07 17:37:10.416263
1527077517,/v-stereo-systems-home-theatre/city-of-toronto/vintage-sony-tc-w3/1527077517,5.0,Vintage Sony TC-W3,,Selling rare vintage Sony TC-W3. Two cassette decks not working. Probably needs new belts. First deck keeps spinning (as if it is playing a cassette) and I cannot stop it unless I switch Power off. ...,City of Toronto,30/09/2020,2020-10-07 17:37:10.416747
1527075062,/v-stereo-systems-home-theatre/city-of-toronto/vintage-adc-equalizer/1527075062,50.0,Vintage ADC Equalizer,,"Vintage ADC equalizer. Model SS1 Mark 2. Dual 5 band EQ. With original box and hookup cables. Works well. Has a crack on the top of front face plate, see pic. $50",City of Toronto,30/09/2020,2020-10-07 17:37:10.417289
1516007401,/v-stereo-systems-home-theatre/city-of-toronto/technics-sa-gx390-av-control-stereo-receiver-ful-l-details-below/1516007401,40.0,Technics SA-GX390 AV Control Stereo Receiver FUL]L Details Below,,Technics SA-GX390 AV Control Stereo Receiver & Technics SL-PC33 Multi Compact CD/Disc Player The Technics Receiver has issues. However it does power up. Technics Disc Player works fine with no ...,City of Toronto,30/09/2020,2020-10-07 17:37:10.417774
1527063112,/v-stereo-systems-home-theatre/city-of-toronto/zenith-record-player-and-speakers/1527063112,150.0,Zenith record player and speakers,,We have an old zenith record player system and speakers. The needle needs replacing. Great deal!,City of Toronto,30/09/2020,2020-10-07 17:37:10.418254
1527046262,/v-stereo-systems-home-theatre/city-of-toronto/insignia-ns-str514-receiver/1527046262,80.0,INSIGNIA NS-STR514 Receiver,,INSIGNIA NS-STR514 Receiver -In a great condition. -About a couple of years old. -Wireless Bluetooth capability. For more details: ...,City of Toronto,30/09/2020,2020-10-07 17:37:10.418738
1527043621,/v-stereo-systems-home-theatre/city-of-toronto/sony-de485-audio-video-receiver/1527043621,120.0,Sony DE485 Audio/Video Receiver,,Sony Digital Audio/Video Control Center. Surround sound 5.1 with subwoofer and optical ports. Perfect working order.,City of Toronto,30/09/2020,2020-10-07 17:37:10.419218
1527037401,/v-stereo-systems-home-theatre/city-of-toronto/pioneer-vsx-1020-k/1527037401,150.0,Pioneer VSX-1020-K,,Receiver is approx. 7 years old but in good working order.,City of Toronto,30/09/2020,2020-10-07 17:37:10.419706
1516277252,/v-stereo-systems-home-theatre/city-of-toronto/crosley-vintage-inspired-stereo-turntable-radio/1516277252,100.0,"Crosley Vintage Inspired stereo, turntable, radio",,"Like new Crosley stereo, turntable, cassette, radio. Vintage inspired NEW and excellent shape - works",City of Toronto,30/09/2020,2020-10-07 17:37:10.420191
1423409972,/v-stereo-systems-home-theatre/city-of-toronto/vintage-sony-record-player/1423409972,75.0,Vintage Sony Record Player,,Vintage Sony record player model #PS-LX310. Good working condition but missing one of the hinges for the cover at the back.,City of Toronto,30/09/2020,2020-10-07 17:37:14.476232
1423410927,/v-stereo-systems-home-theatre/city-of-toronto/vintage-sanyo-stereo-tuner-dcx-6000ka/1423410927,160.0,Vintage Sanyo Stereo Tuner DCX 6000KA,,Good looking vintage stereo receiver,City of Toronto,30/09/2020,2020-10-07 17:37:14.476720
1423414614,/v-stereo-systems-home-theatre/city-of-toronto/vintage-electrohome-stereo-record-player-in-deilcraft-cabinet/1423414614,135.0,Vintage Electrohome Stereo Record Player in Deilcraft Cabinet,,"As titled. Works but needs a cleaning and handles replaced. 17.5 inches deep, 44.5 wide, 28.5 high. Pick up only.",City of Toronto,30/09/2020,2020-10-07 17:37:14.477205
1516319582,/v-stereo-systems-home-theatre/city-of-toronto/yamaha-rx-v530-home-theatre-receiver/1516319582,75.0,Yamaha RX-V530 home theatre receiver,,"One YAMAHA (RX-V530) 5.1 Channel Home Theater Receiver is in excellent condition. All tested , everything works as it should. Pet and Smoke free home. Specifications: Tuning range: FM, AM Power ...",City of Toronto,29/09/2020,2020-10-07 17:37:14.477693
1431010902,/v-stereo-systems-home-theatre/city-of-toronto/harman-kardon-cd191-ultrawideband-linear-phase-cassette-deck/1431010902,155.0,Harman Kardon CD191 Ultrawideband Linear Phase Cassette Deck,,"From an era when HK made excellent gear. These decks were widely known for high quality playback sound with extended bass, good quality mids and detailed highs. Sendust head Feather-touch controls A ...",City of Toronto,29/09/2020,2020-10-07 17:37:14.478177
1469288496,/v-stereo-systems-home-theatre/city-of-toronto/zorloo-zuperdac-portable-hifi-dac/1469288496,100.0,Zorloo ZuperDAC - Portable HiFi DAC,,"Like new condition, used for 2 minutes, For pickup and cash only.... https://www.zorloo.com/zuperdac",City of Toronto,29/09/2020,2020-10-07 17:37:14.478662
1496360606,/v-stereo-systems-home-theatre/city-of-toronto/original-sonos-optical-audio-adapter-to-hdmi-25-firm/1496360606,25.0,"Original Sonos Optical Audio Adapter to HDMI 
$ 25 Firm",,Allows to connect your Sonos Beam or Sonos amp using TV optical out to HDMI in on your soundbar or amp.,City of Toronto,29/09/2020,2020-10-07 17:37:14.479147
1526983756,/v-stereo-systems-home-theatre/city-of-toronto/cheap-bluetooth-speakers-home-theatre/1526983756,100.0,"Cheap Bluetooth speakers, HOME THEATRE!!",,Free delivery anywhere in gta,City of Toronto,29/09/2020,2020-10-07 17:37:14.479634
1526977979,/v-stereo-systems-home-theatre/city-of-toronto/pioneer-stereo-system-cx-4000-m-5000-amplifier-ct-w205r-pd-f907/1526977979,400.0,PIONEER STEREO SYSTEM CX-4000 M-5000 AMPLIFIER CT-W205R PD-F907,,ENTIRE PIONEER SURROUND SOUND SYSTEM CX-4000 M-5000 AMPLIFIER CT-W205R CASSETTE PD-F907 CD FILE 101 DISC. FULL SYSTEM FOR HOME THEATRE WITH PIONEER CABINET WITH GLASS DOORS. PAID OVER $2000. In ...,City of Toronto,29/09/2020,2020-10-07 17:37:14.480117
1526977934,/v-stereo-systems-home-theatre/city-of-toronto/nad-c338-3x-weeks-old-750-00/1526977934,750.0,NAD C338 3x weeks old $750.00,,NAD C 338 three weeks old $750.00,City of Toronto,29/09/2020,2020-10-07 17:37:14.480602
1221199375,/v-stereo-systems-home-theatre/city-of-toronto/clarion-cd-deck-stereo-model-dxz755mc/1221199375,100.0,Clarion cd deck stereo model DXZ755MC,,Clarion cd car stereo dxz755mc with digital record music catcher feature. Comes with remote and steering button volume control switch.,City of Toronto,29/09/2020,2020-10-07 17:37:14.481085
1526957865,/v-stereo-systems-home-theatre/city-of-toronto/fleetwood-stereo/1526957865,500.0,Fleetwood stereo,,"This unit is in working condition. Made in Canada. It measures 64"" L x 27.25"" H x 17.5"" W. Pickup only. Locates in North York. Asking for $500 or OBO",City of Toronto,29/09/2020,2020-10-07 17:37:14.481567
1526956299,/v-stereo-systems-home-theatre/city-of-toronto/pioneer-yamaha-speaker-set-with-sony-receiver/1526956299,120.0,PIONEER / yamaha speaker set with sony receiver,,6 speakers in total PIONEER / yamaha speaker set with sony receiver,City of Toronto,29/09/2020,2020-10-07 17:37:14.482051
1526944686,/v-stereo-systems-home-theatre/city-of-toronto/samsung-giga-sound/1526944686,30.0,Samsung giga sound,,CLOSING SALE ( we moved to new address) CLEARANCE FINAL SALE (SoldLess Clearance Center INC) all our prices are without tax (cash only ) our price :$30 Final CLEARANCE ITEMS With 3 days for testing ...,City of Toronto,29/09/2020,2020-10-07 17:37:14.482534
1526937868,/v-stereo-systems-home-theatre/city-of-toronto/sonance-power-amplifier-for-sale-or-trade/1526937868,125.0,Sonance Power Amplifier (For Sale or Trade),,"Sonance Sonamp 260 X 3 in good condition. Will sell or could trade for a decent budget integrated (Adcom, NAD, Rotel, Arcam). Pick up at Coxwell & Danforth. Please contact if interested.",City of Toronto,29/09/2020,2020-10-07 17:37:14.483017
1526926166,/v-stereo-systems-home-theatre/city-of-toronto/studio-lab-speakers/1526926166,650.0,Studio Lab Speakers,,I have a pair of vintage top of the line STUDIO LAB speakers with peerless drivers and solid oak wood in mint shape .These Labs were made from 1978 too 1982 THE REAL DEAL price back then was 1800 ...,City of Toronto,29/09/2020,2020-10-07 17:37:14.483582
1526922749,/v-stereo-systems-home-theatre/city-of-toronto/onkyo-av-receiver-tx-sr313/1526922749,200.0,Onkyo AV Receiver TX-SR313,,Selling my onkyo receiver which is in mint condition and it comes with remote. Its negotiable.,City of Toronto,29/09/2020,2020-10-07 17:37:14.484070
1503894052,/v-stereo-systems-home-theatre/city-of-toronto/bose-soundbar-universal-remote-the-one-remote-that-does-it-all/1503894052,69.99,Bose Soundbar Universal Remote THE ONE REMOTE THAT DOES IT ALL !,,"NEW! Looks good. Feels better. You know quality when you see it, so ditch the scientific calculator look, because this is a remote that you’ll be proud to display. Designed to be sleek with a premium ...",City of Toronto,29/09/2020,2020-10-07 17:37:14.484585
1526912819,/v-stereo-systems-home-theatre/city-of-toronto/sound-system/1526912819,150.0,Sound System,,"Turntable not included. Posted by Nadia in audio, stereo systems, home theatre in Toronto (GTA), City of Toronto. September 29, 2020",City of Toronto,29/09/2020,2020-10-07 17:37:14.485071
1526908601,/v-stereo-systems-home-theatre/city-of-toronto/philips-hts6500-subwoofer-only-speaker-surround-sound-sw6500e/1526908601,30.0,Philips HTS6500 Subwoofer Only  Speaker Surround Sound SW6500E,,"Philips HTS6500 Subwoofer Only Speaker Surround Sound SW 6500 E 4 OHM Impedance In good condition, working fine.",City of Toronto,29/09/2020,2020-10-07 17:37:14.485556
1526908381,/v-stereo-systems-home-theatre/city-of-toronto/vintage-dual-cs-508-turntable/1526908381,100.0,VINTAGE Dual CS-508 Turntable,,"IF AD IS UP ITEM IS AVAILABLE. Please call if interested. PLEASE do not send any generic ""please contact me if this is available"" emails UNLESS you include a phone number. See above. Dual CS-508 ...",City of Toronto,29/09/2020,2020-10-07 17:37:14.486041
1526904395,/v-stereo-systems-home-theatre/city-of-toronto/teac-turntable-double-cassette-tuner-eq-cd-dc-d888/1526904395,59.0,"TEAC TURNTABLE, DOUBLE CASSETTE, TUNER, EQ, CD DC-D888",,"TEAC TURNTABLE, DOUBLE CASSETTE, TUNER, EQ, CD DC-D888 All working as it should. All controls clean and static free. I do not have the speakers but all you need is the 3.5 ich jacks for left and ...",City of Toronto,29/09/2020,2020-10-07 17:37:14.486572
